IEI,iShares 3-7 Year Treasury Bond ETF,,XNMS,USD,Intermediate Government,standard,18490460160,0.0015,0.0362,3.48,9.686,92,AA,"iShares 3-7 Year Treasury Bond ETF est un fonds négocié en bourse à revenu fixe qui cherche à suivre les résultats d'investissement de l'ICE US Treasury 3-7 Year Bond Index. Le fonds offre une exposition aux obligations du Trésor américain avec des maturités restantes comprises entre trois et sept ans, offrant aux investisseurs un portefeuille diversifié de titres de créance gouvernementaux. Composé presque entièrement d'obligations du Trésor américain, le fonds distribue des revenus mensuellem…",0.204,-1.27,-0.77,0.28,0.06,4.16,3y,4.16,0.05,117.81,2026-06-26T00:00:00.000Z,,,United States,,[],"[{""c"":""United States"",""w"":null}]",,[],82,DATA_MISSING,0.3,0,
IGBH,iShares Interest Rate Hedged Long-Term Corporate Bond ETF,,ARCX,USD,Ultrashort Bond,standard,189428720,0.0014,0.0575,,,70,A,L'iShares Interest Rate Hedged est un fonds négocié en bourse (ETF) conçu pour offrir aux investisseurs une exposition aux obligations d'entreprise tout en atténuant les effets des fluctuations des taux d'intérêt. Ce fonds suit principalement la performance des obligations d'entreprise de qualité investissement en compensant l'exposition aux taux d'intérêt à l'aide d'une combinaison d'actifs. Il vise à fournir des rendements similaires à ceux des obligations sans l'impact direct de la hausse ou…,-0.183,-0.34,2.85,-0.67,2.37,5.34,3y,5.34,0.21,24.57,2026-06-26T00:00:00.000Z,,,United States,,[],"[{""c"":""United States"",""w"":null}]",IGLB (iShares 10+ Year Investment Grade Corporate Bond ETF),"[{""t"":""IGLB"",""n"":""iShares 10+ Year Investment Grade Corporate Bond ETF"",""w"":92.33},{""t"":""XTSLA"",""n"":""BlackRock Cash Funds Treasury SL Agency"",""w"":7.19}]",97,DATA_MISSING,0.3,0,
IGEB,iShares Investment Grade Corporate Bond ETF,,BATS,USD,Corporate Bond,standard,1363297536,0.0018,0.0501,5.21,9.787,64,BBB,L'ETF iShares Investment Grade Corporate Bond est un fonds négocié en bourse qui investit principalement dans un portefeuille diversifié d'obligations d'entreprises de qualité investissement. Son objectif principal est de fournir aux investisseurs une exposition au marché du crédit via des dettes d'entreprises de haute qualité émises par des sociétés bien établies avec de solides notations de crédit. Cet ETF se concentre sur des obligations qui ont généralement un risque de défaut plus faible p…,0.122,-0.85,0.15,0.4,1.23,5.81,3y,5.81,0.15,45.24,2026-06-26T00:00:00.000Z,,,United States,,[],"[{""c"":""United States"",""w"":null}]",XTSLA (BlackRock Cash Funds Treasury SL Agency),"[{""t"":""XTSLA"",""n"":""BlackRock Cash Funds Treasury SL Agency"",""w"":0.95}]",97,DATA_MISSING,0.3,0,
IGHG,ProShares Investment Grade Interest Rate Hedged ETF,,BATS,USD,Nontraditional Bond,standard,309044864,0.003,0.0509,5.41,9.725,,U.S. Government,"L'ETF ProShares Investment Grade Interest Rate Hedged est un fonds négocié en bourse spécialisé conçu pour offrir une exposition aux obligations d'entreprise de qualité investissement, tout en atténuant activement le risque de taux d'intérêt qui affecte généralement les investissements obligataires. Sa fonction principale est d'offrir aux investisseurs la possibilité de détenir des instruments de dette d'entreprise de haute qualité avec une sensibilité réduite aux fluctuations des taux d'intérê…",-0.128,-0.55,0.35,-0.65,0.8,4.29,3y,4.29,0.13,78.18,2026-06-26T00:00:00.000Z,,,United States,,[],"[{""c"":""United States"",""w"":null}]",,[],82,DATA_MISSING,0.3,0,
IGIB,iShares 5-10 Year Investment Grade Corporate Bond ETF,,XNMS,USD,Corporate Bond,standard,18218496000,0.0004,0.0475,5.03,9.937,69,BBB,"iShares 5-10 Year Investment Grade Corporate Bond ETF est un fonds négocié en bourse qui cherche à suivre la performance d'un indice composé d'obligations d'entreprises de qualité investissement libellées en dollars américains, avec des maturités restantes comprises entre cinq et dix ans. Il offre aux investisseurs une exposition ciblée aux obligations de crédit à moyen terme émises par de grandes entreprises dans divers secteurs, y compris les services financiers, la technologie et les communi…",0.113,-1.02,0.66,0.36,1.08,5.73,3y,5.73,0.15,53.31,2026-06-26T00:00:00.000Z,,,United States,,[],"[{""c"":""United States"",""w"":null}]",XTSLA (BlackRock Cash Funds Treasury SL Agency),"[{""t"":""XTSLA"",""n"":""BlackRock Cash Funds Treasury SL Agency"",""w"":0.45}]",97,DATA_MISSING,0.3,0,
INMU,iShares Intermediate Muni Income Active ETF,,ARCX,USD,Muni National Interm,standard,489198208,0.003,0.0339,4.95,10.628,80,AA,"Le fonds iShares Intermediate Muni Bond est un fonds négocié en bourse (ETF) axé sur l'offre aux investisseurs d'une exposition aux obligations municipales à moyen terme. Ces obligations sont des titres de créance émis par des municipalités d'État et locales pour financer des projets publics tels que des écoles, des autoroutes et des hôpitaux. Le fonds vise principalement à offrir un revenu exonéré d'impôt en investissant dans des obligations dont les paiements d'intérêts sont exemptés d'impôts…",-0.041,0.71,3.57,0.87,1.55,3.93,3y,3.93,0.05,24.24,2026-06-26T00:00:00.000Z,,,United States,,[],"[{""c"":""United States"",""w"":null}]",MCSXX (BlackRock Liquidity Funds MuniCash - Institutional),"[{""t"":""MCSXX"",""n"":""BlackRock Liquidity Funds MuniCash - Institutional"",""w"":6.12}]",97,DATA_MISSING,0.3,0,
IQMM,ProShares GENIUS Money Market ETF,,XASE,USD,,standard,,,,,,,,"Le ProShares GENIUS Money Market ETF est un fonds négocié en bourse conservateur conçu pour fournir un revenu courant tout en préservant le capital et en maintenant la liquidité. Le fonds investit exclusivement dans des bons du Trésor américain à court terme, des obligations et des titres avec une maturité résiduelle de 93 jours ou moins, maintenant une maturité moyenne pondérée en dollars du portefeuille de 60 jours ou moins. En tant que premier ETF de marché monétaire conforme à la loi GENIUS…",0.03,0.1,0.1,0.02,0.04,0.49,SI,,0,100.14,2026-06-26T00:00:00.000Z,,,United States,,[],"[{""c"":""United States"",""w"":null}]",,[],32,DATA_MISSING,0.3,0,
ISCXF,iShares $ Corp Bond UCITS ETF USD (Acc),,PSGM,USD,,standard,7931130381,0.002,,,,,,"iShares $ Corp Bond UCITS ETF USD (Acc) est un fonds négocié en bourse qui cherche à suivre la performance de l'indice Markit iBoxx USD Liquid Investment Grade, composé d'obligations d'entreprises de qualité investissement libellées en dollars américains. Lancé le 16 mai 2003 et domicilié en Irlande, il est géré par BlackRock et utilise une méthodologie d'échantillonnage représentatif pour répliquer l'indice de référence, détenant environ 2 900 obligations à taux fixe très liquides avec une mat…",,,,,,,,,,,2026-06-29T12:24:39.131Z,Other,100,United States,62.66,"[{""s"":""Other"",""w"":100}]","[{""c"":""United States"",""w"":62.66},{""c"":""Other"",""w"":30.12},{""c"":""United Kingdom"",""w"":3.08},{""c"":""Japan"",""w"":1.43},{""c"":""Canada"",""w"":1.4}]",0P0001I429 (BlackRock ICS US Dollar Liquid Environmentally Aware Fund Agency Inc),"[{""t"":""0P0001I429"",""n"":""BlackRock ICS US Dollar Liquid Environmentally Aware Fund Agency Inc"",""w"":1.27},{""t"":null,""n"":""US03522AAJ97"",""w"":0.23},{""t"":""CVSE"",""n"":""US126650CZ11"",""w"":0.18},{""t"":""357F"",""n"":""US87264ABF12"",""w"":0.16},{""t"":null,""n"":""US097023CW33"",""w"":0.15},{""t"":""3H0B"",""n"":""3H0B"",""w"":0.14},{""t"":""US716973AG7"",""n"":""US716973AG71"",""w"":0.14},{""t"":null,""n"":""US38141GFD16"",""w"":0.14},{""t"":""SOBQ"",""n"":""US00206RKJ04"",""w"":0.14},{""t"":""US126650CY4"",""n"":""US126650CY46"",""w"":0.14}]",100,ALT_ASSET_FX,0.35,0,
ISHBF,iShares USD Treasury Bond 20+yr UCITS ETF USD (Acc),,PINX,USD,,standard,,,,,,,,"iShares USD Treasury Bond 20+yr UCITS ETF USD (Acc) est un fonds négocié en bourse qui cherche à suivre la performance de l'ICE U.S. Treasury 20+ Year Bond Index. Il fournit une exposition ciblée aux obligations gouvernementales à long terme, à taux fixe, libellées en dollars américains, émises par le Trésor américain avec des maturités restantes de 20 ans ou plus. Géré par BlackRock et domicilié en Irlande, l'ETF utilise une méthodologie de réplication physique par échantillonnage, détenant en…",,,,,,,,,,,2026-06-29T12:24:39.172Z,,,United States,,[],"[{""c"":""United States"",""w"":null}]",,[],32,ALT_ASSET_FX,0.35,0,
ISHG,iShares 3 Year International Treasury Bond ETF,,XNMS,USD,Global Bond,standard,906860544,0.0035,0.0144,2.14,,91,U.S. Government,"L'iShares 3 Year International Treasury Bond ETF est un fonds négocié en bourse axé sur l'exposition aux obligations gouvernementales internationales avec des maturités d'environ trois ans. La fonction principale de cet ETF est de suivre la performance des titres du Trésor étrangers, permettant aux investisseurs de diversifier leurs portefeuilles de revenus fixes en accédant à une dette souveraine à plus courte durée en dehors des États-Unis. Cet ETF est particulièrement pertinent pour ceux qui…",0.068,-1.42,-2.32,-2.08,0.26,7.38,3y,7.38,0.19,74.02,2026-06-26T00:00:00.000Z,,,United States,,[],"[{""c"":""United States"",""w"":null}]",,[],82,DATA_MISSING,0.3,0,
ISHUF,iShares $ Treasury Bond 0-1yr UCITS ETF USD (Acc),,PINX,USD,,inverse,22333022660,0.0007,,,,,,"iShares $ Treasury Bond 0-1yr UCITS ETF USD (Acc) est un fonds négocié en bourse qui cherche à suivre la performance de l'ICE U.S. Treasury Short Bond Index, composé d'obligations d'État libellées en dollars américains émises par le Trésor américain avec des maturités allant de 0 à 1 an. Cet ETF offre aux investisseurs une exposition aux titres du Trésor américain à très court terme, y compris les bons du Trésor et les obligations, offrant une haute qualité de crédit et un risque de taux d'inté…",,,,,,,,,,,2026-06-29T12:24:39.441Z,Other,100,Other,73.43,"[{""s"":""Other"",""w"":100}]","[{""c"":""Other"",""w"":73.43},{""c"":""United States"",""w"":26.57}]",(INSL CASH),"[{""t"":null,""n"":""INSL CASH"",""w"":9.85},{""t"":null,""n"":""0% BILL 28/10/2025 USD"",""w"":4.95},{""t"":null,""n"":""0% BILL 09/07/2026 USD"",""w"":3.77},{""t"":null,""n"":""0% BILL 30/10/2025 USD"",""w"":3.46},{""t"":null,""n"":""0% BILL 23/09/2025 USD"",""w"":3.35},{""t"":""US91282CKS9"",""n"":""T-NOTE USA FX 4.875% MAY26 USD"",""w"":3.18},{""t"":null,""n"":""0% BILL 06/08/2026 USD"",""w"":3.17},{""t"":null,""n"":""0% BILL 07/10/2025 USD"",""w"":2.96},{""t"":null,""n"":""0% BILL 28/11/2025 USD"",""w"":2.95},{""t"":""US91282CBQ3"",""n"":""USA 21/26"",""w"":2.82}]",100,ALT_ASSET_FX,0.35,0,
ISZXF,iShares USD Treasury Bond 3-7yr UCITS ETF USD (Acc),,PINX,USD,,standard,9126483633,0.0007,,,,,,"iShares USD Treasury Bond 3-7yr UCITS ETF USD (Acc) est un fonds négocié en bourse qui cherche à suivre la performance de l'ICE U.S. Treasury 3-7 Year Bond Index, composé exclusivement d'obligations d'État libellées en dollars américains émises par le Trésor américain avec des maturités comprises entre 3 et 7 ans. Cet ETF offre une exposition ciblée aux obligations du Trésor américain à moyen terme grâce à une méthodologie de réplication physique et échantillonnée, détenant 89 obligations avec …",,,,,,,,,,,2026-06-29T12:24:39.901Z,Other,100,United States,63.09,"[{""s"":""Other"",""w"":100}]","[{""c"":""United States"",""w"":63.09},{""c"":""Other"",""w"":36.91}]",(US91282CGQ87),"[{""t"":null,""n"":""US91282CGQ87"",""w"":2.25},{""t"":""US91282CFF3"",""n"":""US91282CFF32"",""w"":2.07},{""t"":""US91282CCS8"",""n"":""US91282CCS89"",""w"":2.04},{""t"":""US91282CEP2"",""n"":""US91282CEP23"",""w"":2.01},{""t"":""US91282CDJ7"",""n"":""US91282CDJ71"",""w"":2},{""t"":""US91282CAV3"",""n"":""US91282CAV37"",""w"":1.96},{""t"":null,""n"":""US91282CCB54"",""w"":1.92},{""t"":null,""n"":""US91282CDY49"",""w"":1.91},{""t"":""US91282CBL4"",""n"":""US91282CBL46"",""w"":1.91},{""t"":""US91282CAE1"",""n"":""US91282CAE12"",""w"":1.87}]",100,ALT_ASSET_FX,0.35,0,
ITM,VanEck Intermediate Muni ETF,,BATS,USD,Muni National Interm,single_stock,2183828480,0.0018,0.0294,4.65,10.57,80,AA,"Le VanEck Intermediate Muni ETF représente un véhicule d'investissement axé sur les obligations municipales avec des périodes de maturité intermédiaires. Son objectif principal est de fournir aux investisseurs un accès à un portefeuille diversifié d'obligations municipales américaines, qui sont généralement utilisées pour financer des projets publics tels que des écoles, des routes et des améliorations d'infrastructure. En ciblant des titres municipaux avec des maturités de dette allant de 6 à …",-0.064,-0.38,3.73,0.51,1.69,4.15,3y,4.15,0.07,47,2026-06-26T00:00:00.000Z,Financial Services,100,United States,100,"[{""s"":""Financial Services"",""w"":100}]","[{""c"":""United States"",""w"":100}]",V (V),"[{""t"":""V"",""n"":""V"",""w"":100}]",115,SINGLE_STOCK,0.7,1,
IUSB,iShares Core Universal USD Bond ETF,,XNMS,USD,Intermediate Core-Plus Bond,standard,39763542016,0.0006,0.0424,4.09,9.48,85,AA,"iShares Core Universal USD Bond ETF est un fonds négocié en bourse qui cherche à suivre les résultats d'investissement d'un indice composé d'obligations libellées en dollars américains émises par des gouvernements, des entreprises et des émetteurs titrisés. Il offre une large exposition au marché obligataire américain, y compris les titres du Trésor américain, les titres adossés à des créances hypothécaires provenant d'agences telles que la Federal National Mortgage Association et la Federal Ho…",0.086,-0.49,0.59,0.56,0.89,5.21,3y,5.21,0.1,46.3,2026-06-26T00:00:00.000Z,Energy,100,United States,,"[{""s"":""Energy"",""w"":100},{""s"":""Healthcare"",""w"":0},{""s"":""Financial Services"",""w"":0},{""s"":""Real Estate"",""w"":0},{""s"":""Consumer Cyclical"",""w"":0}]","[{""c"":""United States"",""w"":null}]",TMCXX (BlackRock Liquidity Funds TempCash - Institutional),"[{""t"":""TMCXX"",""n"":""BlackRock Liquidity Funds TempCash - Institutional"",""w"":3.72}]",115,STANDARD,1,1,
JAAA,Janus Henderson AAA CLO ETF,,ARCX,USD,Securitized Bond - Focused,standard,27344457728,0.002,0.0543,4.99,10.022,95,AAA,"L'ETF Janus Henderson AAA CLO est un fonds négocié en bourse qui se concentre sur l'investissement dans les tranches les mieux notées des obligations de prêt garanties (CLO). Sa fonction principale est de fournir aux investisseurs une exposition à des titres de finance structurée hautement notés, remboursables et à taux variable. Ces tranches notées AAA sont considérées comme ayant le risque de crédit le plus faible au sein de la structure CLO, qui comprend divers niveaux de séniorité et profil…",0.02,0.12,0.02,-0.1,0.18,1.99,3y,1.99,0.02,50.67,2026-06-26T00:00:00.000Z,,,United States,,[],"[{""c"":""United States"",""w"":null}]",,[],82,DATA_MISSING,0.3,0,
JAGG,JPMorgan U.S. Aggregate Bond ETF,,ARCX,USD,Intermediate Core Bond,standard,1362896256,0.0003,0.0216,6.4,8.38,80,AA,"L'indice sous-jacent couvre le marché obligataire à taux fixe de qualité investissement aux États-Unis, avec des composants d'indice pour les titres gouvernementaux et d'entreprise, les titres adossés à des créances hypothécaires et les titres adossés à des actifs. Le fonds investira au moins 80 % de ses actifs dans des titres inclus dans l'indice sous-jacent.",0.119,-0.61,0.24,0.53,0.69,5.54,3y,5.54,0.1,46.095,2026-06-26T00:00:00.000Z,Consumer Defensive,,United States,,"[{""s"":""Consumer Defensive"",""w"":0},{""s"":""Energy"",""w"":0},{""s"":""Technology"",""w"":0},{""s"":""Real Estate"",""w"":0},{""s"":""Consumer Cyclical"",""w"":0}]","[{""c"":""United States"",""w"":null}]",(United States Treasury Notes 0.25%),"[{""t"":null,""n"":""United States Treasury Notes 0.25%"",""w"":3.41},{""t"":null,""n"":""United States Treasury Notes 0.5%"",""w"":2.05},{""t"":null,""n"":""United States Treasury Notes 1.75%"",""w"":1.62},{""t"":null,""n"":""Jpmorgan Us Govt Mmkt Fund Im Shares (Restricted)"",""w"":1.62},{""t"":null,""n"":""United States Treasury Notes 2.5%"",""w"":1.61},{""t"":null,""n"":""United States Treasury Notes 1.38%"",""w"":1.4},{""t"":null,""n"":""United States Treasury Bonds 1.25%"",""w"":1.27},{""t"":null,""n"":""United States Treasury Notes 2.88%"",""w"":1.16},{""t"":null,""n"":""United States Treasury Bonds 2.5%"",""w"":1.03},{""t"":null,""n"":""United States Treasury Notes 2.38%"",""w"":0.95}]",115,STANDARD,1,1,
JBBB,Janus Henderson B-BBB CLO ETF,,BATS,USD,Securitized Bond - Focused,standard,1196930176,0.0047,0.0734,6.6,10.065,59,BBB,"Le Janus Henderson B-BBB CLO ETF est un fonds négocié en bourse qui investit principalement dans des Obligations de Prêts Securisés (CLO) avec des notations de qualité de crédit allant de B à BBB. La fonction principale de cet ETF est de fournir aux investisseurs une exposition à un portefeuille diversifié d'actifs titrisés adossés à des prêts d'entreprise. Ses investissements dans le spectre de notation de crédit B-BBB visent à équilibrer le compromis entre risque et potentiel de rendement, of…",-0.21,-0.17,-1.47,0,1.02,4.32,3y,4.32,0.13,47.54,2026-06-26T00:00:00.000Z,,,United States,,[],"[{""c"":""United States"",""w"":null}]",JAAA (Janus Henderson AAA CLO ETF),"[{""t"":""JAAA"",""n"":""Janus Henderson AAA CLO ETF"",""w"":4.14}]",97,DATA_MISSING,0.3,0,
JMHI,JPMorgan High Yield Municipal ETF,,ARCX,USD,High Yield Muni,standard,278624064,0.0035,0.0458,4.98,9.611,66,A,"Le JPMorgan High Yield Municipal Fund est un fonds commun de placement conçu pour fournir aux investisseurs un portefeuille axé sur le revenu grâce à des investissements dans des obligations municipales à haut rendement. Ces obligations, généralement émises par des gouvernements d'État et locaux, offrent des rendements plus élevés que les obligations municipales traditionnelles en raison de leur risque relativement plus élevé. Le fonds privilégie l'efficacité fiscale, car les revenus générés so…",0.133,0.43,1.85,0.69,2.04,4.59,3y,4.59,0.07,50.517,2026-06-26T00:00:00.000Z,Technology,29.04,United States,,"[{""s"":""Technology"",""w"":29.04},{""s"":""Healthcare"",""w"":14.49},{""s"":""Financial Services"",""w"":12.28},{""s"":""Consumer Cyclical"",""w"":10.57},{""s"":""Industrial"",""w"":8.95}]","[{""c"":""United States"",""w"":null}]",JOIXX (JPMorgan Institutional Tax Free Money Market Fund  - IM),"[{""t"":""JOIXX"",""n"":""JPMorgan Institutional Tax Free Money Market Fund  - IM"",""w"":9.2}]",115,STANDARD,1,1,
JMSI,JPMorgan Sustainable Municipal Income ETF,,ARCX,USD,Muni National Interm,standard,381563456,0.0018,0.0365,4.88,10.542,79,AA,"Le JPMorgan Sustainable Municipal Income Fund est un fonds commun de placement conçu pour fournir aux investisseurs un revenu exonéré d'impôt grâce à des investissements dans des titres municipaux. Axé sur la durabilité, le fonds cherche à soutenir des projets qui répondent à certains critères environnementaux, sociaux et de gouvernance (ESG), visant à offrir à la fois des rendements financiers et un impact sociétal positif. Ce fonds investit généralement dans des obligations émises par des mun…",-0.06,0.03,2.32,0.67,1.57,3.78,3y,3.78,0.07,50.38,2026-06-26T00:00:00.000Z,Technology,40.96,United States,,"[{""s"":""Technology"",""w"":40.96},{""s"":""Financial Services"",""w"":11.62},{""s"":""Healthcare"",""w"":9.13},{""s"":""Communication Services"",""w"":8.98},{""s"":""Consumer Cyclical"",""w"":8.9}]","[{""c"":""United States"",""w"":null}]",JOIXX (JPMorgan Institutional Tax Free Money Market Fund  - IM),"[{""t"":""JOIXX"",""n"":""JPMorgan Institutional Tax Free Money Market Fund  - IM"",""w"":8.8}]",115,STANDARD,1,1,
JMST,JPMorgan Ultra-Short Municipal Income Fund,,BATS,USD,Muni National Short,inverse,6362158592,0.0018,0.0269,3.96,10.197,80,AA,"Le JPMorgan Ultra-Short Municipal Income Fund est un type de fonds commun de placement qui investit principalement dans des obligations municipales à court terme. L'objectif principal de ce fonds est de fournir aux investisseurs un niveau élevé de revenu courant généralement exonéré d'impôts fédéraux, ce qui en fait une option attrayante pour les investisseurs sensibles à la fiscalité. Le fonds se concentre sur l'investissement dans des titres municipaux de haute qualité et de courte durée, qui…",-0.006,0.09,0.18,0.11,0.04,1.13,3y,1.13,0.01,50.977,2026-06-26T00:00:00.000Z,,,United States,,[],"[{""c"":""United States"",""w"":null}]",JOIXX (JPMorgan Institutional Tax Free Money Market Fund  - IM),"[{""t"":""JOIXX"",""n"":""JPMorgan Institutional Tax Free Money Market Fund  - IM"",""w"":6.83}]",97,NON_STANDARD,0.4,0,
JMTG,JPMorgan Mortgage-Backed Securities ETF,,ARCX,USD,Securitized Bond - Diversified,standard,6918254080,0.0024,0.0385,3.67,9.148,89,AAA,"L'ETF JPMorgan Mortgage-Backed Securities est un fonds négocié en bourse géré activement, axé sur le segment des titres adossés à des créances hypothécaires (MBS) du marché des revenus fixes. L'objectif principal du fonds est de fournir une exposition diversifiée à des pools de prêts hypothécaires, qui sont regroupés et titrisés, créant des instruments d'investissement qui versent des flux réguliers d'intérêts et de principal. Il investit principalement dans des MBS résidentiels et/ou commercia…",0.138,-0.41,1.16,0.51,0.55,3.9,1y,,0.09,50.77,2026-06-26T00:00:00.000Z,,,United States,,[],"[{""c"":""United States"",""w"":null}]",JIMXX (JPMorgan Prime Money Market Fund IM),"[{""t"":""JIMXX"",""n"":""JPMorgan Prime Money Market Fund IM"",""w"":3.82}]",97,DATA_MISSING,0.3,0,
JMUB,JPMorgan Municipal Bond ETF,,BATS,USD,Muni National Interm,standard,7760870400,0.0018,0.0359,4.72,10.38,78,AA,"Le JPMorgan Municipal Bond ETF est un fonds négocié en bourse qui investit principalement dans des obligations municipales américaines. Sa fonction principale est de fournir aux investisseurs une exposition à un portefeuille diversifié de titres de créance municipaux, qui sont des obligations émises par des États, des villes, des comtés et d'autres entités gouvernementales pour financer des projets publics. Ces obligations sont souvent utilisées pour financer des développements d'infrastructure…",0.059,0.16,2.2,0.62,1.48,3.41,3y,3.41,0.05,50.62,2026-06-26T00:00:00.000Z,Real Estate,,United States,,"[{""s"":""Real Estate"",""w"":0},{""s"":""Consumer Cyclical"",""w"":0},{""s"":""Financial Services"",""w"":0},{""s"":""Utilities"",""w"":0},{""s"":""Energy"",""w"":0}]","[{""c"":""United States"",""w"":null}]",JOIXX (JPMorgan Institutional Tax Free Money Market Fund  - IM),"[{""t"":""JOIXX"",""n"":""JPMorgan Institutional Tax Free Money Market Fund  - IM"",""w"":8.08}]",115,STANDARD,1,1,
JNK,SPDR Bloomberg High Yield Bond ETF,,ARCX,USD,High Yield Bond,standard,7700293120,0.004,0.0659,7.18,10.01,36,BB,"Le SPDR Bloomberg High Yield Bond ETF est un fonds négocié en bourse qui cherche à fournir des résultats d'investissement correspondant généralement à la performance des prix et des rendements de l'indice Bloomberg High Yield Very Liquid. Cet indice mesure la performance des obligations d'entreprises à haut rendement émises publiquement en dollars américains, avec une liquidité supérieure à la moyenne, communément appelées obligations à haut rendement notées en dessous de la catégorie investiss…",-0.062,-1.05,-0.51,-0.31,1.34,5.63,3y,5.63,0.25,96.22,2026-06-26T00:00:00.000Z,Energy,100,United States,,"[{""s"":""Energy"",""w"":100},{""s"":""Industrial"",""w"":0},{""s"":""Communication Services"",""w"":0},{""s"":""Financial Services"",""w"":0},{""s"":""Consumer Defensive"",""w"":0}]","[{""c"":""United States"",""w"":null}]",,[],100,STANDARD,1,1,
JPHY,JPMorgan Active High Yield ETF,,BATS,USD,High Yield Bond,standard,2208305152,0.0045,0.0573,6.6,9.927,100,U.S. Government,"L'ETF JPMorgan Active High Yield est un fonds négocié en bourse géré activement qui investit principalement dans des obligations à haut rendement. Ces obligations, souvent appelées « obligations à risque » en raison de leurs notations de crédit inférieures, offrent généralement des taux d'intérêt plus élevés par rapport aux obligations traditionnelles de qualité investissement. Le principal objectif de cet ETF est de fournir aux investisseurs une exposition à un portefeuille diversifié d'obliga…",0.038,-0.42,0.28,-0.25,1.31,7.16,3y,7.16,0.18,50.424,2026-06-26T00:00:00.000Z,Financial Services,0.01,United States,,"[{""s"":""Financial Services"",""w"":0.01},{""s"":""Healthcare"",""w"":0},{""s"":""Real Estate"",""w"":0},{""s"":""Consumer Cyclical"",""w"":0},{""s"":""Basic Materials"",""w"":0}]","[{""c"":""United States"",""w"":null}]",MGMXX (JPMorgan U.S. Government Money Market Fund IM),"[{""t"":""MGMXX"",""n"":""JPMorgan U.S. Government Money Market Fund IM"",""w"":2.34}]",115,STANDARD,1,1,
