IBTJ,iShares iBonds Dec 2029 Term Fund,,XNMS,USD,Target Maturity,single_stock,759550144,0.0007,0.0384,"Le fonds iShares iBonds Dec 2029 Term est un fonds négocié en bourse (ETF) ciblé conçu avec une date d'échéance spécifique en tête, décembre 2029. Cette caractéristique unique combine les avantages de l'échéance des obligations individuelles avec la diversification offerte par un ETF. Le fonds se concentre principalement sur les obligations d'entreprise de qualité investissement, offrant aux investisseurs une exposition à un portefeuille de titres à revenu fixe devant arriver à échéance vers la…",0.295,3.49,1.56,5.68,3y,5.68,22.07,2025-10-16T19:15:38.231Z,Financial Services,100,United States,100,"[{""s"":""Financial Services"",""w"":100}]","[{""c"":""United States"",""w"":100}]",V (V),"[{""t"":""V"",""n"":""V"",""w"":100}]",110
IBTK,iShares iBonds Dec 2030 Treasury ETF,,XNMS,USD,Target Maturity,single_stock,538354176,0.0007,0.0382,"L'iShares iBonds Dec 2030 Treasury ETF est un fonds négocié en bourse obligataire conçu pour offrir aux investisseurs un moyen efficace d'accéder au marché des bons du Trésor américain, en particulier aux titres gouvernementaux arrivant à échéance en décembre 2030. Cet ETF fait partie de la gamme iShares iBonds Treasury, utilisant un cadre unique de ""titre à maturité ciblée"" qui fournit aux investisseurs une stratégie obligataire échelonnée. L'objectif principal de l'iShares iBonds Dec 2030 Tre…",0.326,4.22,1.78,6.69,3y,6.69,20,2025-10-16T19:15:38.601Z,Financial Services,100,United States,100,"[{""s"":""Financial Services"",""w"":100}]","[{""c"":""United States"",""w"":100}]",V (V),"[{""t"":""V"",""n"":""V"",""w"":100}]",110
IBTL,iShares iBonds Dec 2031 Term Fund,,XNMS,USD,Target Maturity,single_stock,435903232,0.0007,0.0397,Le fonds iShares iBonds Dec 2031 Term est un fonds négocié en bourse (ETF) conçu pour offrir aux investisseurs un moyen pratique d'accéder à un portefeuille diversifié d'obligations d'entreprise de qualité investissement avec une date d'échéance cible spécifique en décembre 2031. Cette structure unique offre une maturité prévisible similaire à celle de la détention d'obligations individuelles tout en bénéficiant de la diversification d'un fonds commun de placement. Le fonds investit principalem…,-91.842,-92.05,-92.28,247.67,3y,247.67,20.74,2025-10-16T19:15:39.029Z,Financial Services,100,United States,100,"[{""s"":""Financial Services"",""w"":100}]","[{""c"":""United States"",""w"":100}]",XTSLA (BlackRock Cash Funds Treasury SL Agency),"[{""t"":""XTSLA"",""n"":""BlackRock Cash Funds Treasury SL Agency"",""w"":0.16}]",110
IBTM,iShares iBonds Dec 2032 Term Treasury ETF,,XNMS,USD,Target Maturity,single_stock,452020192,0.0007,0.0387,"L'iShares iBonds Dec 2032 Term Treasury ETF est un fonds négocié en bourse à revenu fixe conçu pour suivre les obligations du Trésor américain qui arriveront à échéance en décembre 2032. La fonction principale de cet ETF est de fournir aux investisseurs un accès aux obligations du Trésor, offrant des titres garantis par le gouvernement qui combinent la sécurité du crédit du gouvernement américain avec la commodité d'une structure d'ETF. Ce produit est particulièrement attrayant pour ceux qui ch…",0.366,5.11,1.88,7.76,3y,7.76,23.35,2025-10-16T19:15:39.481Z,Financial Services,100,United States,100,"[{""s"":""Financial Services"",""w"":100}]","[{""c"":""United States"",""w"":100}]",XTSLA (BlackRock Cash Funds Treasury SL Agency),"[{""t"":""XTSLA"",""n"":""BlackRock Cash Funds Treasury SL Agency"",""w"":0.23}]",110
IBTP,iShares iBonds Dec 2034 ETF,,XNMS,USD,Target Maturity,single_stock,187735968,0.0007,0.0376,"L'iShares iBonds Dec 2034 ETF est un fonds négocié en bourse conçu pour offrir aux investisseurs une exposition ciblée à un portefeuille diversifié d'obligations d'entreprises de qualité investissement libellées en dollars américains, toutes arrivant à échéance en décembre 2034. Cet ETF appartient à la série iBonds, qui se distingue par sa stratégie de maturité définie, semblable à celle des obligations individuelles. À la date d'échéance, l'ETF distribuera les produits aux actionnaires, aligna…",0.441,5.43,1.73,6.57,1y,,26.19,2025-10-16T19:15:39.850Z,Financial Services,100,United States,100,"[{""s"":""Financial Services"",""w"":100}]","[{""c"":""United States"",""w"":100}]",XTSLA (BlackRock Cash Funds Treasury SL Agency),"[{""t"":""XTSLA"",""n"":""BlackRock Cash Funds Treasury SL Agency"",""w"":0.01}]",110
ICLO,Invesco AAA CLO Floating Rate Note ETF,,BATS,USD,Ultrashort Bond,single_stock,374793312,0.0019,0.0568,"L'Invesco AAA CLO Floating Rate Note ETF est un fonds négocié en bourse qui investit principalement dans des titres de créance à taux variable connus sous le nom d'Obligations de Prêt Securisées (CLO). Ces CLO sont adossés à un pool de prêts d'entreprise, offrant aux investisseurs une exposition aux paiements de principal et d'intérêts provenant des actifs sous-jacents, avec la sécurité supplémentaire d'une note de crédit élevée. L'ETF se concentre spécifiquement sur les tranches notées AAA, in…",0.059,-0.04,-0.25,3.19,3y,3.19,25.64,2025-10-16T19:15:40.280Z,Financial Services,100,United States,100,"[{""s"":""Financial Services"",""w"":100}]","[{""c"":""United States"",""w"":100}]",IUGXX (Invesco Premier US Government Money Portfolio Institutional Class),"[{""t"":""IUGXX"",""n"":""Invesco Premier US Government Money Portfolio Institutional Class"",""w"":3.75}]",110
ICSH,iShares Short Treasury Bond ETF,,BATS,USD,Ultrashort Bond,inverse,6378646528,0.0008,0.0475,"iShares Short Treasury Bond ETF est un fonds négocié en bourse conçu pour rechercher des revenus en investissant principalement dans des obligations du Trésor américain ayant des échéances de moins d'un an. Cet ETF se concentre sur le maintien d'un portefeuille avec un faible risque de taux d'intérêt en raison de son profil de maturité à court terme, ce qui en fait un composant stable pour la gestion de trésorerie. Il sert d'outil pour les investisseurs cherchant à accéder aux titres du Trésor …",0.02,0.5,0.22,1.4,3y,1.4,50.69,2025-10-16T19:15:40.762Z,Utilities,100,United States,,"[{""s"":""Utilities"",""w"":100},{""s"":""Real Estate"",""w"":0},{""s"":""Consumer Cyclical"",""w"":0},{""s"":""Basic Materials"",""w"":0},{""s"":""Consumer Defensive"",""w"":0}]","[{""c"":""United States"",""w"":null}]",XTSLA (BlackRock Cash Funds Treasury SL Agency),"[{""t"":""XTSLA"",""n"":""BlackRock Cash Funds Treasury SL Agency"",""w"":0.54}]",110
ICVT,iShares Convertible Bond ETF,,BATS,USD,Convertibles,single_stock,2972039936,0.002,0.0185,"iShares Convertible Bond ETF est un fonds négocié en bourse qui vise principalement à suivre la performance d'un large indice d'obligations convertibles émises par des émetteurs américains et mondiaux. Sa fonction principale est de fournir aux investisseurs une exposition aux obligations convertibles, qui sont des titres hybrides combinant des éléments de dette et d'équité. Ces obligations paient souvent des intérêts comme une obligation standard tout en offrant également la possibilité de conv…",-0.812,20.67,21.45,9.88,3y,9.88,102.59,2025-10-16T19:15:41.150Z,Communication Services,100,United States,,"[{""s"":""Communication Services"",""w"":100},{""s"":""Energy"",""w"":0},{""s"":""Healthcare"",""w"":0},{""s"":""Real Estate"",""w"":0},{""s"":""Financial Services"",""w"":0}]","[{""c"":""United States"",""w"":null}]",XTSLA (BlackRock Cash Funds Treasury SL Agency),"[{""t"":""XTSLA"",""n"":""BlackRock Cash Funds Treasury SL Agency"",""w"":0.92}]",110
IEF,iShares 7-10 Year Treasury Bond ETF,,XNMS,USD,Long Government,single_stock,38510845952,0.0015,0.0373,"L'iShares 7-10 Year Treasury Bond ETF est un fonds négocié en bourse qui se concentre sur l'offre aux investisseurs d'une exposition aux obligations du Trésor américain avec des maturités comprises entre 7 et 10 ans. Cet ETF est conçu pour suivre la performance de l'ICE U.S. Treasury 7-10 Year Bond Index, offrant ainsi un moyen d'investir dans ce segment spécifique du marché obligataire du gouvernement américain. La fonction principale de cet ETF est d'offrir un profil de risque équilibré, atti…",0.443,5.44,1.92,7.85,3y,7.85,97.53,2025-10-16T19:15:41.584Z,Financial Services,100,United States,100,"[{""s"":""Financial Services"",""w"":100}]","[{""c"":""United States"",""w"":100}]",V (V),"[{""t"":""V"",""n"":""V"",""w"":100}]",110
IEI,iShares 3-7 Year Treasury Bond ETF,,XNMS,USD,Intermediate Government,single_stock,17014183936,0.0015,0.0334,L'ETF iShares 3-7 Year Treasury Bond est un type de fonds négocié en bourse qui investit principalement dans des obligations du Trésor américain avec des maturités allant de 3 à 7 ans. Sa fonction principale est de fournir une exposition à un segment du marché des obligations du Trésor américain qui offre un équilibre entre le rendement des revenus et le risque de taux d'intérêt. Cet ETF est particulièrement notable pour ses implications dans les mouvements des taux d'intérêt et les ajustements…,0.3,4.14,2.24,4.99,3y,4.99,120.32,2025-10-16T19:15:41.944Z,Financial Services,100,United States,100,"[{""s"":""Financial Services"",""w"":100}]","[{""c"":""United States"",""w"":100}]",V (V),"[{""t"":""V"",""n"":""V"",""w"":100}]",110
IGBH,iShares Interest Rate Hedged Long-Term Corporate Bond ETF,,ARCX,USD,Ultrashort Bond,single_stock,110742912,0.0014,0.0634,L'iShares Interest Rate Hedged est un fonds négocié en bourse (ETF) conçu pour offrir aux investisseurs une exposition aux obligations d'entreprise tout en atténuant les effets des fluctuations des taux d'intérêt. Ce fonds suit principalement la performance des obligations d'entreprise de qualité investissement en compensant l'exposition aux taux d'intérêt à l'aide d'une combinaison d'actifs. Il vise à fournir des rendements similaires à ceux des obligations sans l'impact direct de la hausse ou…,0.244,1.4,0.92,5.75,3y,5.75,24.61,2025-10-16T19:15:42.360Z,Financial Services,100,United States,100,"[{""s"":""Financial Services"",""w"":100}]","[{""c"":""United States"",""w"":100}]",IGLB (iShares 10+ Year Investment Grade Corporate Bond ETF),"[{""t"":""IGLB"",""n"":""iShares 10+ Year Investment Grade Corporate Bond ETF"",""w"":92.44},{""t"":""XTSLA"",""n"":""BlackRock Cash Funds Treasury SL Agency"",""w"":7.78}]",110
IGEB,iShares Investment Grade Corporate Bond ETF,,BATS,USD,Corporate Bond,single_stock,1388554496,0.0018,0.0496,L'ETF iShares Investment Grade Corporate Bond est un fonds négocié en bourse qui investit principalement dans un portefeuille diversifié d'obligations d'entreprises de qualité investissement. Son objectif principal est de fournir aux investisseurs une exposition au marché du crédit via des dettes d'entreprises de haute qualité émises par des sociétés bien établies avec de solides notations de crédit. Cet ETF se concentre sur des obligations qui ont généralement un risque de défaut plus faible p…,0.227,4.32,1.19,6.69,3y,6.69,46.285,2025-10-16T19:15:42.694Z,Financial Services,100,United States,100,"[{""s"":""Financial Services"",""w"":100}]","[{""c"":""United States"",""w"":100}]",XTSLA (BlackRock Cash Funds Treasury SL Agency),"[{""t"":""XTSLA"",""n"":""BlackRock Cash Funds Treasury SL Agency"",""w"":0.93}]",110
IGHG,ProShares Investment Grade Interest Rate Hedged ETF,,BATS,USD,Nontraditional Bond,single_stock,266444832,0.003,0.051,"L'ETF ProShares Investment Grade Interest Rate Hedged est un fonds négocié en bourse spécialisé conçu pour offrir une exposition aux obligations d'entreprise de qualité investissement, tout en atténuant activement le risque de taux d'intérêt qui affecte généralement les investissements obligataires. Sa fonction principale est d'offrir aux investisseurs la possibilité de détenir des instruments de dette d'entreprise de haute qualité avec une sensibilité réduite aux fluctuations des taux d'intérê…",0.114,0.73,1.09,4.91,3y,4.91,78.6499,2025-10-16T19:15:43.117Z,Financial Services,100,United States,100,"[{""s"":""Financial Services"",""w"":100}]","[{""c"":""United States"",""w"":100}]",V (V),"[{""t"":""V"",""n"":""V"",""w"":100}]",110
IGIB,iShares 5-10 Year Investment Grade Corporate Bond ETF,,XNMS,USD,Corporate Bond,single_stock,16389475328,0.0004,0.0445,"L'iShares 5-10 Year Investment Grade Corporate Bond ETF est un fonds négocié en bourse qui se concentre sur l'offre d'une exposition aux obligations d'entreprise de qualité investissement avec des maturités comprises entre cinq et dix ans. La fonction principale de cet ETF est de suivre la performance de son indice de référence, qui mesure la performance des obligations d'entreprise de qualité investissement libellées en dollars américains. Cela en fait une option attrayante pour ceux qui cherc…",0.267,5.58,2.79,6.67,3y,6.67,54.405,2025-10-16T19:15:43.572Z,Financial Services,100,United States,100,"[{""s"":""Financial Services"",""w"":100}]","[{""c"":""United States"",""w"":100}]",XTSLA (BlackRock Cash Funds Treasury SL Agency),"[{""t"":""XTSLA"",""n"":""BlackRock Cash Funds Treasury SL Agency"",""w"":0.92}]",110
IGLB,iShares 10+ Year Investment Grade Corporate Bond ETF,,ARCX,USD,Long-Term Bond,single_stock,2604997632,0.0004,0.0502,"L'iShares 10+ Year Investment Grade Corporate Bond ETF est un fonds négocié en bourse qui cible principalement les obligations d'entreprise de qualité investissement à long terme. Sa fonction principale est de fournir aux investisseurs une exposition à la performance des obligations de haute qualité, spécifiquement celles ayant des échéances supérieures à dix ans. Le fonds suit un indice pondéré par le marché des obligations d'entreprise de qualité investissement libellées en dollars américains…",0.337,5.47,-0.14,12.44,3y,12.44,52.135,2025-10-16T19:15:43.937Z,Financial Services,100,United States,100,"[{""s"":""Financial Services"",""w"":100}]","[{""c"":""United States"",""w"":100}]",XTSLA (BlackRock Cash Funds Treasury SL Agency),"[{""t"":""XTSLA"",""n"":""BlackRock Cash Funds Treasury SL Agency"",""w"":1.37}]",110
IGOV,iShares International Treasury Bond ETF,,XNMS,USD,Global Bond,single_stock,1136850176,0.0035,0.0053,"L'ETF iShares International Treasury Bond est un fonds négocié en bourse conçu pour offrir aux investisseurs un accès aux obligations d'État émises par des pays non américains. Cet ETF se concentre sur les marchés développés et offre une exposition aux titres de dette souveraine de qualité investissement, fournissant un portefeuille diversifié d'obligations du Trésor internationales. En investissant dans cet actif, les participants du marché obtiennent un mécanisme d'exposition aux taux d'intér…",0.54,12.12,5.55,10.16,3y,10.16,42.82,2025-10-16T19:15:44.281Z,Financial Services,100,United States,100,"[{""s"":""Financial Services"",""w"":100}]","[{""c"":""United States"",""w"":100}]",V (V),"[{""t"":""V"",""n"":""V"",""w"":100}]",110
IGSB,iShares 1-5 Year Investment Grade Corporate Bond ETF,,XNMS,USD,Short-Term Bond,single_stock,21458319360,0.0004,0.0429,"L'iShares 1-5 Year Investment Grade Corporate Bond ETF est un fonds négocié en bourse conçu pour suivre les obligations d'entreprise de qualité investissement à court terme avec des maturités comprises entre un et cinq ans. L'ETF offre une exposition à un portefeuille diversifié d'émissions d'entreprises de qualité provenant de secteurs majeurs tels que la finance, l'industrie et les services publics. Il est destiné aux investisseurs recherchant une combinaison de revenus et de stabilité, avec …",0.132,2.73,1.72,3.07,3y,3.07,53.13,2025-10-16T19:15:44.693Z,Financial Services,100,United States,100,"[{""s"":""Financial Services"",""w"":100}]","[{""c"":""United States"",""w"":100}]",XTSLA (BlackRock Cash Funds Treasury SL Agency),"[{""t"":""XTSLA"",""n"":""BlackRock Cash Funds Treasury SL Agency"",""w"":0.16}]",110
ILTB,iShares Core 10+ Year USD Bond ETF,,ARCX,USD,Long-Term Bond,single_stock,582932288,0.0006,0.0476,"L'iShares Core 10+ Year USD Bond ETF est un fonds négocié en bourse qui vise principalement à suivre les résultats d'investissement d'un indice composé d'obligations libellées en dollars américains avec des échéances supérieures à dix ans. Son objectif principal est d'offrir aux investisseurs une exposition à des titres de créance à long terme, fournissant un outil pour atténuer le risque de taux d'intérêt sur un horizon prolongé. Cet ETF comprend des obligations gouvernementales, des obligatio…",0,4.87,-0.8,12.89,3y,12.89,51.04,2025-10-16T19:15:45.033Z,Financial Services,100,United States,100,"[{""s"":""Financial Services"",""w"":100}]","[{""c"":""United States"",""w"":100}]",XTSLA (BlackRock Cash Funds Treasury SL Agency),"[{""t"":""XTSLA"",""n"":""BlackRock Cash Funds Treasury SL Agency"",""w"":1.1}]",110
IMSI,Invesco Rochester High Yield Fund,,BATS,USD,High Yield Muni,single_stock,39386928,0.0039,0.0454,"Le fonds Invesco Rochester High Yield est un fonds négocié en bourse géré activement, axé sur la génération de revenus courants exonérés d'impôts fédéraux. En tant que fonds d'obligations municipales, il investit principalement au moins 80 % de ses actifs nets dans des titres municipaux dont les revenus sont éligibles à l'exonération fiscale fédérale. Le fonds cible des obligations municipales de qualité faible à moyenne, souvent notées BBB ou moins, et peut également utiliser des dérivés et de…",-0.028,-0.66,-1.6,3.97,3y,3.97,50.795,2025-10-16T19:15:45.402Z,Financial Services,100,United States,100,"[{""s"":""Financial Services"",""w"":100}]","[{""c"":""United States"",""w"":100}]",IUGXX (Invesco Premier US Government Money Portfolio Institutional Class),"[{""t"":""IUGXX"",""n"":""Invesco Premier US Government Money Portfolio Institutional Class"",""w"":4.43}]",110
IMTB,iShares Core 5-10 Year USD Bond ETF,,ARCX,USD,Intermediate Core-Plus Bond,single_stock,260245216,0.0006,0.0438,"L'iShares Core 5-10 Year USD Bond ETF est un fonds négocié en bourse conçu pour fournir aux investisseurs un portefeuille diversifié d'obligations de qualité investissement libellées en dollars américains. Sa fonction principale est de suivre l'indice Bloomberg U.S. 5-10 Year Credit Bond, qui se concentre sur les obligations ayant des maturités allant de cinq à dix ans. Cet ETF sert de composant stratégique dans les portefeuilles de revenu fixe, offrant une exposition à un large éventail de sec…",0.442,4.87,2.15,6.7,3y,6.7,44.58,2025-10-16T19:15:45.755Z,Financial Services,,United States,,"[{""s"":""Financial Services"",""w"":0},{""s"":""Utilities"",""w"":0},{""s"":""Industrial"",""w"":0},{""s"":""Healthcare"",""w"":0},{""s"":""Real Estate"",""w"":0}]","[{""c"":""United States"",""w"":null}]",BISXX (BlackRock Cash Funds Instl SL Agency),"[{""t"":""BISXX"",""n"":""BlackRock Cash Funds Instl SL Agency"",""w"":12.34}]",110
INMU,iShares Intermediate Muni Income Active ETF,,ARCX,USD,Muni National Interm,single_stock,162267216,0.003,0.0347,"Le fonds iShares Intermediate Muni Bond est un fonds négocié en bourse (ETF) axé sur l'offre aux investisseurs d'une exposition aux obligations municipales à moyen terme. Ces obligations sont des titres de créance émis par des municipalités d'État et locales pour financer des projets publics tels que des écoles, des autoroutes et des hôpitaux. Le fonds vise principalement à offrir un revenu exonéré d'impôt en investissant dans des obligations dont les paiements d'intérêts sont exemptés d'impôts…",0.146,1.54,0.69,4.13,3y,4.13,24.005,2025-10-16T19:15:46.193Z,Financial Services,100,United States,100,"[{""s"":""Financial Services"",""w"":100}]","[{""c"":""United States"",""w"":100}]",MCSXX (BlackRock Liquidity Funds MuniCash - Institutional),"[{""t"":""MCSXX"",""n"":""BlackRock Liquidity Funds MuniCash - Institutional"",""w"":5.79}]",110
ISCXF,iShares USD Corp Bond USD A Fund,,PSGM,USD,,single_stock,7556301571,0.002,,"Le fonds iShares USD Corp Bond USD A est un type de fonds négocié en bourse (ETF) conçu pour offrir une exposition à un éventail diversifié d'obligations d'entreprises de qualité investissement libellées en dollars américains. L'objectif principal de ce fonds est de fournir aux investisseurs un moyen pratique d'accéder à la génération de revenus par le biais d'instruments de dette d'entreprise, qui présentent généralement un risque inférieur par rapport aux actions, tout en offrant la possibili…",,,,,,,,2025-10-16T19:15:46.353Z,Other,100,United States,62.66,"[{""s"":""Other"",""w"":100}]","[{""c"":""United States"",""w"":62.66},{""c"":""Other"",""w"":30.12},{""c"":""United Kingdom"",""w"":3.08},{""c"":""Japan"",""w"":1.43},{""c"":""Canada"",""w"":1.4}]",0P0001I429 (BlackRock ICS US Dollar Liquid Environmentally Aware Fund Agency Inc),"[{""t"":""0P0001I429"",""n"":""BlackRock ICS US Dollar Liquid Environmentally Aware Fund Agency Inc"",""w"":1.27},{""t"":null,""n"":""US03522AAJ97"",""w"":0.23},{""t"":""CVSE"",""n"":""US126650CZ11"",""w"":0.18},{""t"":""357F"",""n"":""US87264ABF12"",""w"":0.16},{""t"":null,""n"":""US097023CW33"",""w"":0.15},{""t"":""US126650CY4"",""n"":""US126650CY46"",""w"":0.14},{""t"":""US716973AG7"",""n"":""US716973AG71"",""w"":0.14},{""t"":""3H0B"",""n"":""3H0B"",""w"":0.14},{""t"":""SOBQ"",""n"":""US00206RKJ04"",""w"":0.14},{""t"":null,""n"":""US38141GFD16"",""w"":0.14}]",100
ISDB,Invesco Short Duration Total Return Fund,,BATS,USD,Short-Term Bond,inverse,22557658,0.003,0.0516,"Le Fonds Invesco Short Duration Total Return est un type de fonds commun de placement conçu pour offrir aux investisseurs une exposition à un portefeuille diversifié de titres à revenu fixe à courte durée. Ce fonds cherche principalement à fournir un niveau élevé de revenu courant tout en maintenant un accent sur la préservation du capital, ce qui en fait une option attrayante pour les investisseurs averses au risque intéressés par des rendements stables. Il investit dans une large gamme d'acti…",0.06,1.08,0.3,2.46,3y,2.46,25.16,2025-10-16T19:15:46.707Z,,,United States,,[],"[{""c"":""United States"",""w"":null}]",IUGXX (Invesco Premier US Government Money Portfolio Institutional Class),"[{""t"":""IUGXX"",""n"":""Invesco Premier US Government Money Portfolio Institutional Class"",""w"":4.53}]",92
ISHG,iShares 3 Year International Treasury Bond ETF,,XNMS,USD,Global Bond,single_stock,684997760,0.0035,0.0227,"L'iShares 3 Year International Treasury Bond ETF est un fonds négocié en bourse axé sur l'exposition aux obligations gouvernementales internationales avec des maturités d'environ trois ans. La fonction principale de cet ETF est de suivre la performance des titres du Trésor étrangers, permettant aux investisseurs de diversifier leurs portefeuilles de revenus fixes en accédant à une dette souveraine à plus courte durée en dehors des États-Unis. Cet ETF est particulièrement pertinent pour ceux qui…",0.212,13.31,4.86,8.06,3y,8.06,75.78,2025-10-16T19:15:47.119Z,Financial Services,100,United States,100,"[{""s"":""Financial Services"",""w"":100}]","[{""c"":""United States"",""w"":100}]",V (V),"[{""t"":""V"",""n"":""V"",""w"":100}]",110
ISHUF,iShares U.S. Treasury 0-1 Year USD A,,PSGM,USD,,single_stock,20833336888,0.0007,,"iShares U.S. Treasury 0-1 Year USD A est un fonds d'investissement à revenu fixe qui se concentre principalement sur les titres du Trésor américain à court terme. Ces titres garantis par le gouvernement sont sélectionnés en fonction de leur échéance, spécifiquement ceux arrivant à maturité dans un an, ce qui est reflété dans le nom du fonds. Cette sélection stratégique vise à offrir aux investisseurs stabilité et liquidité, tout en minimisant le risque de taux d'intérêt en raison de la courte d…",,,,,,,,2025-10-16T19:15:47.274Z,Other,100,Other,73.43,"[{""s"":""Other"",""w"":100}]","[{""c"":""Other"",""w"":73.43},{""c"":""United States"",""w"":26.57}]",(INSL CASH),"[{""t"":null,""n"":""INSL CASH"",""w"":9.85},{""t"":null,""n"":""0% BILL 28/10/2025 USD"",""w"":4.95},{""t"":null,""n"":""0% BILL 09/07/2026 USD"",""w"":3.77},{""t"":null,""n"":""0% BILL 30/10/2025 USD"",""w"":3.46},{""t"":null,""n"":""0% BILL 23/09/2025 USD"",""w"":3.35},{""t"":""US91282CKS9"",""n"":""T-NOTE USA FX 4.875% MAY26 USD"",""w"":3.18},{""t"":null,""n"":""0% BILL 06/08/2026 USD"",""w"":3.17},{""t"":null,""n"":""0% BILL 07/10/2025 USD"",""w"":2.96},{""t"":null,""n"":""0% BILL 28/11/2025 USD"",""w"":2.95},{""t"":""US91282CBQ3"",""n"":""USA 21/26"",""w"":2.82}]",100
