symbol,name,isin,mic_code,currency,fund_type,etf_type,aum_usd,total_expense_ratio,yield_ttm,objective,daily_change_pct,ytd_return_pct,one_year_return_pct,vol_pct,vol_window,vol_3y_pct,last_close,as_of,sector_top,sector_top_weight,country_top,country_top_weight,sector_top5,country_top5,holding_top,holdings_top10,data_quality_score
AGG,iShares Core U.S. Aggregate Bond ETF,,ARCX,USD,Intermediate Core Bond,single_stock,131827171328,0.0003,0.0381,"L'iShares Core U.S. Aggregate Bond ETF est un type de fonds négocié en bourse conçu pour suivre la performance de l'indice Bloomberg Barclays U.S. Aggregate Bond, un indice de référence largement utilisé sur le marché des revenus fixes. La fonction principale de ce fonds est d'offrir aux investisseurs une large exposition aux obligations de qualité investissement américaines, y compris les bons du Trésor américain, les obligations liées au gouvernement et les obligations d'entreprise, ainsi que…",0.318,4.28,1.66,6.37,3y,6.37,101.06,2025-10-16T19:14:16.833Z,Financial Services,100,United States,100,"[{""s"":""Financial Services"",""w"":100}]","[{""c"":""United States"",""w"":100}]",BISXX (BlackRock Cash Funds Instl SL Agency),"[{""t"":""BISXX"",""n"":""BlackRock Cash Funds Instl SL Agency"",""w"":2.53}]",110
AGGH,Simplify Aggregate Bond ETF,,ARCX,USD,Intermediate Core Bond,single_stock,297784928,0.0029,0.0739,"Le Simplify Aggregate Bond ETF est un fonds négocié en bourse conçu pour suivre la performance du marché obligataire agrégé américain. Cet ETF englobe une large gamme d'obligations de qualité investissement domestiques, y compris des titres gouvernementaux, des obligations d'entreprises et des titres adossés à des hypothèques. Sa fonction principale est d'offrir aux investisseurs une exposition diversifiée au secteur des revenus fixes, visant à reproduire la performance du marché obligataire to…",0.284,1.95,-1.69,9.7,3y,9.7,20.94,2025-10-16T19:14:17.651Z,Industrial,,United States,,"[{""s"":""Industrial"",""w"":0},{""s"":""Energy"",""w"":0},{""s"":""Healthcare"",""w"":0},{""s"":""Real Estate"",""w"":0},{""s"":""Consumer Cyclical"",""w"":0}]","[{""c"":""United States"",""w"":null}]",AGG (iShares Core U.S. Aggregate Bond ETF),"[{""t"":""AGG"",""n"":""iShares Core U.S. Aggregate Bond ETF"",""w"":62.69}]",110
AGGY,WisdomTree Yield Enhanced U.S. Aggregate Bond Fund,,ARCX,USD,Intermediate Core Bond,single_stock,812943488,0.0012,0.0446,"Le WisdomTree Yield Enhanced U.S. Aggregate Bond Fund est un fonds négocié en bourse à revenu fixe conçu pour améliorer le rendement au-delà de ce qui est généralement disponible à partir des indices obligataires agrégés traditionnels. Il atteint cet objectif en investissant dans un portefeuille diversifié d'obligations américaines de qualité investissement, visant à optimiser le rendement tout en maintenant une exposition aux secteurs clés, y compris la dette gouvernementale, d'entreprise et t…",0.303,4.13,1.36,6.27,3y,6.27,44.67,2025-10-16T19:14:18.016Z,Financial Services,100,United States,100,"[{""s"":""Financial Services"",""w"":100}]","[{""c"":""United States"",""w"":100}]",V (V),"[{""t"":""V"",""n"":""V"",""w"":100}]",110
AGZ,iShares Agency Bond ETF,,ARCX,USD,Short Government,single_stock,605901440,0.002,0.0369,"L'iShares Agency Bond ETF est un fonds négocié en bourse qui se concentre principalement sur l'investissement dans des obligations d'agences américaines. Cet instrument financier est conçu pour offrir aux investisseurs une exposition au secteur des titres adossés à des agences gouvernementales. Ces obligations sont généralement émises par des agences fédérales américaines et des entreprises parrainées par le gouvernement, connues pour leur risque de crédit relativement faible en raison du souti…",-0.054,2.42,0.91,3.63,3y,3.63,110.56,2025-10-16T19:14:18.368Z,Financial Services,100,United States,100,"[{""s"":""Financial Services"",""w"":100}]","[{""c"":""United States"",""w"":100}]",V (V),"[{""t"":""V"",""n"":""V"",""w"":100}]",110
ANGL,VanEck Fallen Angel High Yield Bond ETF,,XNMS,USD,High Yield Bond,single_stock,3124779520,0.0025,0.0609,"Le VanEck Fallen Angel High Yield Bond ETF est un fonds négocié en bourse conçu pour suivre la performance des obligations d'entreprise à haut rendement qui ont été initialement émises avec des notations de qualité investissement mais qui ont depuis été dégradées au statut de ""junk"". Souvent appelées ""fallen angels"", ces obligations offrent à l'ETF son axe unique et permettent aux investisseurs d'accéder à un segment distinct du marché des revenus fixes. La fonction principale de cet ETF est de…",-0.237,2.62,1.03,7.17,3y,7.17,29.43,2025-10-16T19:14:18.709Z,Financial Services,100,United States,,"[{""s"":""Financial Services"",""w"":100},{""s"":""Utilities"",""w"":0},{""s"":""Industrial"",""w"":0},{""s"":""Real Estate"",""w"":0},{""s"":""Consumer Cyclical"",""w"":0}]","[{""c"":""United States"",""w"":null}]",37ZM (Standard Chartered PLC GDR),"[{""t"":""37ZM"",""n"":""Standard Chartered PLC GDR"",""w"":1.48}]",110
APCB,ActivePassive Core Bond ETF,,ARCX,USD,Intermediate Core-Plus Bond,single_stock,887123200,0.0037,0.0456,"L'ETF ActivePassive Core Bond est un fonds négocié en bourse conçu pour offrir aux investisseurs une approche équilibrée de l'investissement en revenu fixe en combinant des stratégies de gestion actives et passives. Sa fonction principale est de fournir une exposition à un portefeuille diversifié d'obligations, y compris des titres du gouvernement américain, des obligations d'entreprise et d'autres instruments de revenu fixe à travers différentes maturités et qualités de crédit. En s'appuyant à…",0.242,3.77,0.94,5.27,3y,5.27,30.11,2025-10-16T19:14:19.016Z,Technology,100,United States,,"[{""s"":""Technology"",""w"":100},{""s"":""Consumer Cyclical"",""w"":0},{""s"":""Basic Materials"",""w"":0},{""s"":""Consumer Defensive"",""w"":0},{""s"":""Communication Services"",""w"":0}]","[{""c"":""United States"",""w"":null}]",MBB (iShares MBS ETF),"[{""t"":""MBB"",""n"":""iShares MBS ETF"",""w"":12.86},{""t"":""BNDX"",""n"":""Vanguard Total International Bond ETF"",""w"":9.92},{""t"":""AGG"",""n"":""iShares Core U.S. Aggregate Bond ETF"",""w"":2.72},{""t"":""FGXXX"",""n"":""First American Government Obligations Fund Class X"",""w"":1.76}]",110
AVIG,Avantis Core Fixed Income ETF,,ARCX,USD,Intermediate Core Bond,leveraged,1285014528,0.0015,0.0439,"Le Fonds Avantis Core Fixed Income est un fonds commun de placement en revenu fixe conçu pour offrir aux investisseurs une large exposition au marché obligataire. Sa fonction principale est de fournir un portefeuille diversifié d'obligations de qualité investissement, cherchant à générer des revenus tout en gérant le risque associé aux fluctuations des taux d'intérêt. Le fonds se concentre sur les titres de créance américains et non américains dans divers secteurs, y compris la dette gouverneme…",0.249,4.35,1.42,6.4,3y,6.4,42.355,2025-10-16T19:14:19.452Z,,,United States,,[],"[{""c"":""United States"",""w"":null}]",,[],77
AVSF,Avantis Short-Term Fixed Income ETF,,ARCX,USD,Short-Term Bond,inverse,672566144,0.0015,0.0425,"Le Fonds Avantis de Revenu Fixe à Court Terme est un fonds d'investissement géré activement, conçu pour offrir aux investisseurs une exposition aux titres de revenu fixe à court terme. Sa fonction principale est de proposer un portefeuille diversifié d'actifs de revenu fixe avec des horizons de maturité plus courts, généralement moins sensibles aux fluctuations des taux d'intérêt par rapport aux obligations à long terme. Ce fonds se concentre particulièrement sur la préservation du capital tout…",0.148,2.48,1.23,2.81,3y,2.81,47.305,2025-10-16T19:14:19.904Z,,,United States,,[],"[{""c"":""United States"",""w"":null}]",,[],77
BAB,Invesco Taxable Municipal Bond ETF,,ARCX,USD,Muni National Long,single_stock,920809216,0.0028,0.0396,"Le fonds obligataire municipal imposable Invesco est un type de fonds négocié en bourse (ETF) conçu pour offrir aux investisseurs une exposition à une gamme diversifiée d'obligations municipales imposables. La fonction principale de ce fonds est de fournir un revenu grâce à des investissements dans des titres municipaux qui, contrairement aux obligations municipales traditionnelles, sont soumis à des impôts fédéraux. Ces obligations sont généralement émises par des entités étatiques, locales ou…",0.583,5.43,2.26,8.6,3y,8.6,27.59,2025-10-16T19:14:20.254Z,Financial Services,100,United States,100,"[{""s"":""Financial Services"",""w"":100}]","[{""c"":""United States"",""w"":100}]",AGPXX (Invesco Government & Agency Portfolio Institutional Class),"[{""t"":""AGPXX"",""n"":""Invesco Government & Agency Portfolio Institutional Class"",""w"":2.84}]",110
BBAG,JPMorgan BetaBuilders U.S. Aggregate Bond ETF,,ARCX,USD,Intermediate Core Bond,single_stock,1290813312,0.0003,0.0418,"Le JPMorgan BetaBuilders U.S. Aggregate Bond Fund est un fonds négocié en bourse (ETF) conçu pour offrir une large exposition au marché obligataire américain. Son objectif principal est de reproduire la performance de l'indice Bloomberg Barclays U.S. Aggregate Bond Index, qui sert de référence pour l'ensemble du marché obligataire domestique. Cet indice comprend une gamme diversifiée de titres de créance gouvernementaux, d'entreprises et adossés à des hypothèques, avec des maturités et des qual…",0.235,3.8,1.16,6.28,3y,6.28,46.93,2025-10-16T19:14:20.901Z,Financial Services,100,United States,100,"[{""s"":""Financial Services"",""w"":100}]","[{""c"":""United States"",""w"":100}]",JPM (JPM),"[{""t"":""JPM"",""n"":""JPM"",""w"":100}]",110
BBHY,JPMorgan BetaBuilders U.S. High Yield Fund,,BATS,USD,High Yield Bond,single_stock,644466048,0.0007,0.0742,"Le JPMorgan BetaBuilders U.S. High Yield Fund est un fonds négocié en bourse qui offre aux investisseurs une exposition à un portefeuille diversifié d'obligations d'entreprise à haut rendement. La fonction principale de ce fonds est de permettre aux investisseurs d'accéder au marché américain des obligations à haut rendement, ou ""junk bonds"", offrant des rendements potentiellement plus élevés par rapport aux obligations de qualité investissement traditionnelles, bien que cela s'accompagne de ri…",-0.236,0.89,-0.62,6.91,3y,6.91,46.59,2025-10-16T19:14:21.416Z,Financial Services,100,United States,,"[{""s"":""Financial Services"",""w"":100},{""s"":""Consumer Cyclical"",""w"":0},{""s"":""Basic Materials"",""w"":0},{""s"":""Consumer Defensive"",""w"":0},{""s"":""Technology"",""w"":0}]","[{""c"":""United States"",""w"":null}]",,[],95
BGRN,iShares USD Green Bond ETF,,XNMS,USD,Global Bond-USD Hedged,single_stock,432648224,0.002,0.0416,"L'iShares USD Green Bond ETF est un fonds négocié en bourse qui vise principalement à offrir une exposition aux obligations vertes libellées en dollars américains émises par des entreprises et des gouvernements du monde entier. Les obligations vertes sont un type d'instrument à revenu fixe qui finance des projets respectueux de l'environnement et durables. Ce fonds est particulièrement remarquable pour son accent sur la durabilité et l'impact environnemental, s'alignant sur la demande croissant…",0.187,3.65,1.17,5.43,3y,5.43,48.32,2025-10-16T19:14:21.847Z,Financial Services,100,United States,100,"[{""s"":""Financial Services"",""w"":100}]","[{""c"":""United States"",""w"":100}]",XTSLA (BlackRock Cash Funds Treasury SL Agency),"[{""t"":""XTSLA"",""n"":""BlackRock Cash Funds Treasury SL Agency"",""w"":1.42}]",110
BIL,SPDR Bloomberg 1-3 Month T-Bill ETF,,ARCX,USD,Ultrashort Bond,single_stock,42140692480,0.00136,0.0432,"L'ETF SPDR Bloomberg 1-3 Month T-Bill est un fonds négocié en bourse conçu pour suivre la performance de l'indice Bloomberg 1-3 Month U.S. Treasury Bill. Sa fonction principale est de fournir aux investisseurs une option d'investissement liquide et sécurisée qui reflète les rendements des bons du Trésor américain à court terme, spécifiquement ceux ayant des maturités allant d'un à trois mois. Cet ETF est souvent utilisé par les investisseurs cherchant à placer des fonds dans un actif à faible r…",0.005,0.16,0.01,1.32,3y,1.32,91.595,2025-10-16T19:14:22.190Z,Financial Services,100,United States,100,"[{""s"":""Financial Services"",""w"":100}]","[{""c"":""United States"",""w"":100}]",V (V),"[{""t"":""V"",""n"":""V"",""w"":100}]",110
BILS,SPDR Bloomberg 3-12 Month T-Bill ETF,,ARCX,USD,Ultrashort Bond,single_stock,3851384064,0.00136,0.0431,"Le SPDR Bloomberg 3-12 Month T-Bill ETF est un fonds négocié en bourse conçu pour offrir une exposition aux bons du Trésor américain à court terme avec des échéances comprises entre trois et douze mois. Sa fonction principale est de fournir aux investisseurs un moyen d'accéder aux titres à court terme du marché des bons du Trésor américain, qui sont considérés comme relativement peu risqués en raison de leur garantie par le gouvernement américain. Cet ETF joue un rôle significatif dans les port…",0.015,0.18,0.06,1.34,3y,1.34,99.365,2025-10-16T19:14:22.578Z,Financial Services,100,United States,100,"[{""s"":""Financial Services"",""w"":100}]","[{""c"":""United States"",""w"":100}]",V (V),"[{""t"":""V"",""n"":""V"",""w"":100}]",110
BILZ,PIMCO Ultra Short Government Active Exchange-Traded Fund,,ARCX,USD,Ultrashort Bond,inverse,910831040,0.0014,0.043,Le Pimco Ultra Short Government Active Fund est un véhicule d'investissement à revenu fixe conçu pour offrir aux investisseurs un degré élevé de liquidité et un risque de taux d'intérêt minimal grâce à un portefeuille axé sur des titres gouvernementaux à très court terme. La fonction principale de ce fonds est d'atteindre un potentiel de rendement légèrement supérieur à celui des fonds de marché monétaire traditionnels tout en maintenant des qualités robustes de préservation du capital. Il inve…,0.02,0.13,-0.05,1.24,1y,,100.965,2025-10-16T19:14:23.016Z,,,United States,,[],"[{""c"":""United States"",""w"":null}]",,[],77
BIV,Vanguard Intermediate-Term Bond ETF,,ARCX,USD,Intermediate Core Bond,single_stock,48077901824,0.0003,0.0388,"Le Vanguard Intermediate-Term Bond Fund est un fonds négocié en bourse (ETF) axé sur les obligations, conçu pour offrir une exposition diversifiée à la performance des obligations du gouvernement américain, des obligations d'entreprise et des obligations de qualité investissement à maturité intermédiaire. La fonction principale de ce fonds est d'offrir aux investisseurs un revenu stable avec un risque de taux d'intérêt relativement modéré, par rapport aux fonds d'obligations à long terme. Le fo…",0.344,5.34,2.49,6.57,3y,6.57,78.75,2025-10-16T19:14:23.447Z,Financial Services,100,United States,100,"[{""s"":""Financial Services"",""w"":100}]","[{""c"":""United States"",""w"":100}]",V (V),"[{""t"":""V"",""n"":""V"",""w"":100}]",110
BKAG,BNY Mellon Core Bond ETF,,ARCX,USD,Intermediate Core Bond,single_stock,1998568448,0,0.0411,"L'ETF BNY Mellon Core Bond est un fonds négocié en bourse conçu pour offrir aux investisseurs une exposition au marché obligataire américain. Cet ETF cherche à suivre la performance de l'indice Bloomberg U.S. Aggregate Bond en investissant principalement dans une large gamme d'obligations de qualité investissement. Cela inclut des titres du Trésor américain, des obligations liées au gouvernement et des obligations d'entreprise, des titres adossés à des hypothèques et des titres adossés à des ac…",0.327,4.02,1.37,6.31,3y,6.31,42.92,2025-10-16T19:14:23.879Z,Financial Services,100,United States,100,"[{""s"":""Financial Services"",""w"":100}]","[{""c"":""United States"",""w"":100}]",V (V),"[{""t"":""V"",""n"":""V"",""w"":100}]",110
BKHY,BNY Mellon High Yield ETF,,ARCX,USD,High Yield Bond,single_stock,384222528,0.0022,0.0718,"L'ETF BNY Mellon High Yield est un fonds négocié en bourse conçu pour offrir aux investisseurs une exposition amplifiée aux obligations d'entreprise à haut rendement et de qualité de crédit inférieure. La fonction principale de cet ETF est de suivre la performance d'un indice de référence d'obligations à haut rendement, offrant un accès à un portefeuille diversifié qui cherche à obtenir des rendements plus élevés par rapport aux obligations de qualité investissement, bien que cela implique un r…",-0.343,0.98,-0.32,7.94,3y,7.94,48.25,2025-10-16T19:14:24.390Z,Financial Services,100,United States,100,"[{""s"":""Financial Services"",""w"":100}]","[{""c"":""United States"",""w"":100}]",V (V),"[{""t"":""V"",""n"":""V"",""w"":100}]",110
BKLN,Invesco Senior Loan ETF,,ARCX,USD,Bank Loan,single_stock,6704935936,0.0065,0.0732,"L'Invesco Senior Loan ETF est un type de fonds négocié en bourse conçu pour suivre la performance de l'indice S&P/LSTA U.S. Leveraged Loan 100. Sa fonction principale est de fournir aux investisseurs une exposition au marché des prêts senior de qualité investissement. Ces prêts, généralement offerts à des entreprises présentant un risque de crédit plus élevé, se caractérisent par leur seniorité dans la structure du capital, ce qui signifie qu'ils ont la priorité sur d'autres instruments de dett…",-0.12,-1.12,-1.44,4.5,3y,4.5,20.835,2025-10-16T19:14:25.034Z,Financial Services,100,United States,100,"[{""s"":""Financial Services"",""w"":100}]","[{""c"":""United States"",""w"":100}]",IUGXX (Invesco Premier US Government Money Portfolio Institutional Class),"[{""t"":""IUGXX"",""n"":""Invesco Premier US Government Money Portfolio Institutional Class"",""w"":7.79}]",110
BKUI,BNY Mellon Ultra Short Income ETF,,ARCX,USD,Ultrashort Bond,inverse,234702032,0.0012,0.0463,"L'ETF BNY Mellon Ultra Short Income est un fonds négocié en bourse conçu pour offrir aux investisseurs une exposition à un portefeuille de titres à revenu fixe à très court terme. Son objectif principal est de fournir un niveau de revenu courant plus élevé tout en maintenant la liquidité et en préservant le capital. Cet ETF investit principalement dans une collection diversifiée de titres de créance de qualité investissement, y compris des dettes d'entreprise, des titres adossés à des créances …",0.06,0.65,0.32,1.39,3y,1.39,49.9,2025-10-16T19:14:25.403Z,,,United States,,[],"[{""c"":""United States"",""w"":null}]",,[],77
BLV,Vanguard Long-Term Bond ETF,,ARCX,USD,Long-Term Bond,single_stock,8518610432,0.0003,0.0456,"Le Vanguard Long-Term Bond ETF est un fonds négocié en bourse axé sur le suivi de la performance d'un large indice obligataire pondéré par le marché, destiné à refléter le marché obligataire américain de qualité investissement à long terme. Son objectif principal est de fournir aux investisseurs une exposition à des titres à revenu fixe à long terme, comprenant principalement des obligations du Trésor américain, des obligations d'agences gouvernementales et des obligations d'entreprises ayant d…",0.593,5.14,-0.75,13.21,3y,13.21,72.045,2025-10-16T19:14:25.973Z,Financial Services,100,United States,100,"[{""s"":""Financial Services"",""w"":100}]","[{""c"":""United States"",""w"":100}]",V (V),"[{""t"":""V"",""n"":""V"",""w"":100}]",110
BND,Vanguard Total Bond Market Index Fund,,XNMS,USD,Intermediate Core Bond,single_stock,374285697024,0.0003,0.0376,"Le Vanguard Total Bond Market Index Fund est un actif financier complet sous la forme d'un fonds négocié en bourse (ETF) qui cherche à suivre la performance de l'indice Bloomberg U.S. Aggregate Float Adjusted Index. Cet indice reflète l'ensemble du marché obligataire américain de qualité investissement, offrant aux investisseurs une large exposition aux titres à revenu fixe nationaux. Le fonds comprend une variété diversifiée d'obligations, y compris des titres gouvernementaux, des titres d'ent…",0.348,4.2,1.61,6.27,3y,6.27,74.96,2025-10-16T19:14:26.374Z,Financial Services,100,United States,100,"[{""s"":""Financial Services"",""w"":100}]","[{""c"":""United States"",""w"":100}]",V (V),"[{""t"":""V"",""n"":""V"",""w"":100}]",110
BNDW,Vanguard Total World Bond ETF,,XNMS,USD,Global Bond-USD Hedged,single_stock,1431512960,0.0005,0.0402,"Le Vanguard Total World Bond ETF est un véhicule d'investissement complet conçu pour offrir aux investisseurs une large exposition au marché mondial des obligations. La fonction principale de l'ETF est de fournir un accès diversifié aux obligations gouvernementales et d'entreprise, tant domestiques qu'internationales, englobant une gamme de qualités de crédit et de maturités. Son portefeuille comprend des obligations provenant à la fois des marchés développés et émergents, permettant une approc…",0.25,2.9,0.76,5.37,3y,5.37,70.23,2025-10-16T19:14:26.828Z,Technology,100,United States,,"[{""s"":""Technology"",""w"":100},{""s"":""Utilities"",""w"":0},{""s"":""Industrial"",""w"":0},{""s"":""Healthcare"",""w"":0},{""s"":""Real Estate"",""w"":0}]","[{""c"":""United States"",""w"":null}]",BND (Vanguard Total Bond Market Index Fund),"[{""t"":""BND"",""n"":""Vanguard Total Bond Market Index Fund"",""w"":50.42},{""t"":""BNDX"",""n"":""Vanguard Total International Bond ETF"",""w"":49.58}]",110
BNDX,Vanguard Total International Bond ETF,,XNMS,USD,Global Bond-USD Hedged,single_stock,109574127616,0.0007,0.0434,"Vanguard Total International Bond ETF est un fonds négocié en bourse qui cherche à suivre la performance d'un indice de référence mesurant le rendement des obligations de qualité investissement libellées en devises autres que le dollar américain. Il joue un rôle essentiel en offrant une exposition à un portefeuille diversifié d'obligations internationales, émis par des entités situées dans des marchés développés et émergents à travers le monde. Notable pour son mélange d'obligations gouvernemen…",0.221,1.61,-0.12,5.1,3y,5.1,49.88,2025-10-16T19:14:27.176Z,Technology,100,United States,,"[{""s"":""Technology"",""w"":100},{""s"":""Consumer Cyclical"",""w"":0},{""s"":""Basic Materials"",""w"":0},{""s"":""Communication Services"",""w"":0},{""s"":""Financial Services"",""w"":0}]","[{""c"":""United States"",""w"":null}]",,[],95
BOND,PIMCO Active Bond Exchange-Traded Fund,,ARCX,USD,Intermediate Core-Plus Bond,single_stock,5960311808,0.006,0.0504,"Le PIMCO Active Bond Exchange-Traded Fund est un véhicule d'investissement axé sur les obligations opérant sur le marché financier en tant qu'ETF géré activement. Sa fonction principale est d'offrir aux investisseurs un portefeuille diversifié de titres à revenu fixe, visant à générer des revenus tout en préservant le capital. Le fonds investit dans une large gamme d'obligations, y compris des obligations d'État et d'entreprise américaines, des titres adossés à des créances hypothécaires et des…",0.352,4.05,1.23,6.16,3y,6.16,94.12,2025-10-16T19:14:27.539Z,Financial Services,100,United States,,"[{""s"":""Financial Services"",""w"":100},{""s"":""Real Estate"",""w"":0},{""s"":""Energy"",""w"":0},{""s"":""Utilities"",""w"":0},{""s"":""Industrial"",""w"":0}]","[{""c"":""United States"",""w"":null}]",,[],95
BSCP,Invesco BulletShares 2025 Corporate Bond ETF,,XNMS,USD,Target Maturity,single_stock,2936838400,0.001,0.0415,"L'Invesco BulletShares 2025 Corporate Bond ETF est un type de fonds négocié en bourse spécifiquement conçu pour offrir une exposition aux obligations d'entreprise américaines arrivant à maturité en 2025. Cet ETF vise à offrir aux investisseurs un paiement prévisible à l'échéance, ressemblant au comportement d'une obligation individuelle. Son objectif principal est de fournir une stratégie d'investissement ciblée au sein du marché des revenus fixes, en se concentrant sur une échéance estimée qui…",0.024,0.31,0.27,2.2,3y,2.2,20.725,2025-10-16T19:14:27.958Z,Financial Services,100,United States,100,"[{""s"":""Financial Services"",""w"":100}]","[{""c"":""United States"",""w"":100}]",AGPXX (Invesco Government & Agency Portfolio Institutional Class),"[{""t"":""AGPXX"",""n"":""Invesco Government & Agency Portfolio Institutional Class"",""w"":24}]",110
BSCQ,Invesco BulletShares 2026 Corporate Bond ETF,,XNMS,USD,Target Maturity,single_stock,4232908800,0.001,0.0416,"L'Invesco BulletShares 2026 Corporate Bond ETF est un fonds négocié en bourse conçu pour offrir aux investisseurs un accès à un portefeuille diversifié d'obligations d'entreprise de qualité investissement qui arriveront à maturité en 2026. Cet ETF remplit une fonction stratégique en permettant aux investisseurs de cibler des dates de maturité spécifiques avec un niveau de prévisibilité des flux de trésorerie, semblable à la détention d'obligations individuelles. En investissant dans une large g…",0.051,0.77,0.36,3.07,3y,3.07,19.6,2025-10-16T19:14:28.629Z,Financial Services,100,United States,100,"[{""s"":""Financial Services"",""w"":100}]","[{""c"":""United States"",""w"":100}]",AGPXX (Invesco Government & Agency Portfolio Institutional Class),"[{""t"":""AGPXX"",""n"":""Invesco Government & Agency Portfolio Institutional Class"",""w"":0.64}]",110
