PFIX,Simplify Interest Rate Hedge ETF,,ARCX,USD,Inflation-Protected Bond,single_stock,165553296,0.005,0.0537,"Le Simplify Interest Rate Hedge ETF est un fonds négocié en bourse spécifiquement conçu pour offrir une protection contre la hausse des taux d'intérêt. Sa fonction principale est d'atténuer l'impact de l'augmentation des taux sur les portefeuilles des investisseurs, en faisant un outil précieux pour ceux qui recherchent une stratégie financière défensive dans un environnement de taux d'intérêt fluctuant. L'ETF est généralement composé d'une combinaison d'options sur taux d'intérêt, de contrats …",-1.132,-11.44,0.85,53.88,3y,53.88,46.3,2025-10-16T19:16:09.198Z,Financial Services,100,United States,100,"[{""s"":""Financial Services"",""w"":100}]","[{""c"":""United States"",""w"":100}]",V (V),"[{""t"":""V"",""n"":""V"",""w"":100}]",110
PFRL,PGIM Floating Rate Income ETF,,ARCX,USD,Bank Loan,single_stock,83989032,0.0072,0.0779,"Le PGIM Floating Rate Income ETF est un fonds négocié en bourse axé sur l'exposition à des instruments de dette à taux variable, principalement des prêts d'entreprise senior garantis. La fonction principale de cet ETF est de générer un revenu attractif tout en gérant le risque de taux d'intérêt grâce à des investissements ayant des taux d'intérêt variables, qui s'ajustent généralement en fonction des variations des taux du marché. Cela rend l'ETF particulièrement pertinent lors de périodes de h…",0.01,-1.44,-1.84,6.04,3y,6.04,49.66,2025-10-16T19:16:09.622Z,Communication Services,100,United States,,"[{""s"":""Communication Services"",""w"":100},{""s"":""Consumer Cyclical"",""w"":0},{""s"":""Basic Materials"",""w"":0},{""s"":""Consumer Defensive"",""w"":0},{""s"":""Technology"",""w"":0}]","[{""c"":""United States"",""w"":null}]",,[],95
PGHY,Invesco Global ex-US High Yield Corporate Bond ETF,,ARCX,USD,High Yield Bond,single_stock,189943184,0.0035,0.0724,"Le Fonds Invesco Global Ex-US High Yield est un fonds commun de placement axé sur l'investissement dans des obligations à haut rendement émises par des entreprises situées en dehors des États-Unis. Son objectif principal est d'offrir aux investisseurs une exposition aux marchés de crédit internationaux, fournissant des opportunités de rendements de revenus plus élevés par rapport aux fonds obligataires traditionnels. Ce fonds est particulièrement remarquable pour son portefeuille diversifié qui…",0.252,1.32,-1.14,5.76,3y,5.76,19.92,2025-10-16T19:16:10.111Z,Energy,96.14,United States,,"[{""s"":""Energy"",""w"":96.14},{""s"":""Consumer Cyclical"",""w"":3.86},{""s"":""Consumer Defensive"",""w"":0},{""s"":""Technology"",""w"":0},{""s"":""Communication Services"",""w"":0}]","[{""c"":""United States"",""w"":null}]",AGPXX (Invesco Government & Agency Portfolio Institutional Class),"[{""t"":""AGPXX"",""n"":""Invesco Government & Agency Portfolio Institutional Class"",""w"":0.88}]",110
PHB,Invesco Fundamental High Yield Corporate Bond ETF,,ARCX,USD,High Yield Bond,leveraged,352841824,0.005,0.0555,"Le Fonds Invesco Fundamental High Yield est un fonds négocié en bourse (ETF) spécialisé, conçu pour offrir aux investisseurs une exposition aux obligations d'entreprise à haut rendement. Sa fonction principale est de rechercher un rendement total favorable, en mettant l'accent à la fois sur la génération de revenus et sur l'appréciation potentielle du capital. Ce fonds investit dans un portefeuille diversifié d'obligations à haut rendement, ou ""junk"", qui sont en dessous de la note d'investisse…",-0.054,2.6,0.98,6.13,3y,6.13,18.58,2025-10-16T19:16:10.689Z,,,United States,,[],"[{""c"":""United States"",""w"":null}]",AGPXX (Invesco Government & Agency Portfolio Institutional Class),"[{""t"":""AGPXX"",""n"":""Invesco Government & Agency Portfolio Institutional Class"",""w"":1.08}]",92
PHYL,PGIM Active High Yield Bond ETF,,ARCX,USD,High Yield Bond,single_stock,467040736,0.0039,0.0755,"Le PGIM Active High Yield Bond Fund est un type de fonds commun de placement conçu pour générer des revenus plus élevés grâce à des investissements dans des titres de créance non notés. La fonction principale de ce fonds est de fournir aux investisseurs un portefeuille diversifié d'obligations à haut rendement, communément appelées ""junk bonds"", qui offrent des rendements plus élevés en échange d'un risque de crédit accru. Ce fonds recherche activement des opportunités dans le secteur des oblig…",-0.127,1.9,0.28,5.84,3y,5.84,35.46,2025-10-16T19:16:11.160Z,Basic Materials,57.28,United States,,"[{""s"":""Basic Materials"",""w"":57.28},{""s"":""Energy"",""w"":42.72},{""s"":""Utilities"",""w"":0},{""s"":""Industrial"",""w"":0},{""s"":""Healthcare"",""w"":0}]","[{""c"":""United States"",""w"":null}]",PAAA (PGIM AAA CLO ETF),"[{""t"":""PAAA"",""n"":""PGIM AAA CLO ETF"",""w"":3.58}]",110
PICB,Invesco International Corporate Bond ETF,,ARCX,USD,Global Bond,single_stock,209145488,0.005,0.0301,"Le Fonds Obligataire International Invesco est un fonds commun de placement qui se concentre principalement sur l'investissement dans un portefeuille diversifié d'obligations d'entreprises de qualité investissement émises par des sociétés en dehors des États-Unis. Son objectif principal est de fournir aux investisseurs une exposition au marché obligataire mondial, en visant un équilibre entre la génération de revenus et l'appréciation du capital. Ce fonds investit principalement dans une large …",0.524,11.67,4.97,9.58,3y,9.58,23.965,2025-10-16T19:16:11.762Z,Financial Services,100,United States,,"[{""s"":""Financial Services"",""w"":100},{""s"":""Utilities"",""w"":0},{""s"":""Basic Materials"",""w"":0},{""s"":""Consumer Defensive"",""w"":0},{""s"":""Technology"",""w"":0}]","[{""c"":""United States"",""w"":null}]",AGPXX (Invesco Government & Agency Portfolio Institutional Class),"[{""t"":""AGPXX"",""n"":""Invesco Government & Agency Portfolio Institutional Class"",""w"":0.69}]",110
PLW,Invesco Exchange-Traded Fund Trust II - Invesco 1-30 Laddered Treasury ETF,,XNMS,USD,Long Government,single_stock,653424320,0.0015,0.024,"Le fonds investira généralement au moins 80 % de ses actifs totaux dans les composants de l'indice. Le fournisseur de l'indice compile, maintient et calcule l'indice sous-jacent, qui est conçu pour suivre la performance de jusqu'à 30 bons du Trésor américain ou obligations représentant l'échelle de maturité annuelle de février à travers la courbe des rendements.",0.267,4.14,-0.6,10.22,3y,10.22,28.16,2025-10-16T19:16:12.315Z,Financial Services,100,United States,100,"[{""s"":""Financial Services"",""w"":100}]","[{""c"":""United States"",""w"":100}]",V (V),"[{""t"":""V"",""n"":""V"",""w"":100}]",110
PMBS,PIMCO Mortgage-Backed Securities Active ETF,,XNMS,USD,Intermediate Core-Plus Bond,single_stock,761007488,0.0088,0.0458,"L'ETF actif PIMCO Mortgage-Backed Securities est un type de fonds négocié en bourse axé sur les titres adossés à des créances hypothécaires. Son objectif principal est de fournir aux investisseurs une exposition à un portefeuille diversifié d'obligations hypothécaires résidentielles et commerciales. Cet ETF investit activement dans des titres adossés à des créances hypothécaires d'agence et non d'agence, qui sont des pools de prêts regroupés sous forme d'obligations, offrant un mélange de reven…",0.362,4.4,1.55,5.5,1y,,49.97,2025-10-16T19:16:12.658Z,Financial Services,100,United States,100,"[{""s"":""Financial Services"",""w"":100}]","[{""c"":""United States"",""w"":100}]",BAC (BAC),"[{""t"":""BAC"",""n"":""BAC"",""w"":100}]",110
PMMF,iShares Prime Money Market ETF,,ARCX,USD,Prime Money Market,single_stock,343824448,0.002,,"L'iShares Prime Money Market ETF est un type de fonds négocié en bourse conçu pour offrir aux investisseurs un moyen pratique de gérer leur trésorerie tout en visant à préserver le capital. Ce fonds investit principalement dans des titres de créance de haute qualité et à court terme qui sont très liquides, ce qui en fait une option attrayante pour ceux qui recherchent des options d'investissement à valeur stable avec un risque minimal. Il sert principalement à la gestion de trésorerie pour les …",0.011,0.35,0.35,1.12,SI,,100.386,2025-10-16T19:16:13.065Z,Financial Services,100,United States,100,"[{""s"":""Financial Services"",""w"":100}]","[{""c"":""United States"",""w"":100}]",MA (MA),"[{""t"":""MA"",""n"":""MA"",""w"":100}]",100
PSH,PGIM Short Duration High Yield Fund,,BATS,USD,High Yield Bond,inverse,84806928,0.0045,0.0717,Le PGIM Short Duration High Yield Fund est un fonds commun de placement conçu pour générer un revenu substantiel en investissant principalement dans des obligations à haut rendement et à haut risque avec des durées plus courtes. La fonction principale de ce fonds est d'offrir aux investisseurs un potentiel de rendement attractif tout en minimisant le risque de taux d'intérêt grâce à des investissements dans des obligations ayant des dates d'échéance plus courtes. Cette approche aide à stabilise…,-0.026,0.82,-0.21,4.39,1y,,50.59,2025-10-16T19:16:13.580Z,Energy,100,United States,,"[{""s"":""Energy"",""w"":100},{""s"":""Consumer Cyclical"",""w"":0},{""s"":""Basic Materials"",""w"":0},{""s"":""Consumer Defensive"",""w"":0},{""s"":""Technology"",""w"":0}]","[{""c"":""United States"",""w"":null}]",PAAA (PGIM AAA CLO ETF),"[{""t"":""PAAA"",""n"":""PGIM AAA CLO ETF"",""w"":2.94}]",110
PSQA,Palmer Square CLO Senior Debt ETF,,ARCX,USD,Ultrashort Bond,inverse,46716872,0.002,0.0477,"L'ETF Plmr Sq Senior Debt est un fonds négocié en bourse axé sur l'investissement dans des instruments de dette senior. Sa fonction principale est de fournir une exposition à un portefeuille diversifié de prêts seniors émis par des entreprises de divers secteurs. Les instruments de dette senior sont connus pour avoir une priorité plus élevée sur les actifs et les bénéfices que la dette subordonnée, ce qui les rend relativement plus sécurisés dans la hiérarchie des obligations. Cet ETF joue un r…",0,1.15,1.25,3.17,1y,,20.367,2025-10-16T19:16:13.921Z,,,United States,,[],"[{""c"":""United States"",""w"":null}]",,[],77
PTRB,PGIM Total Return Bond ETF,,ARCX,USD,Intermediate Core-Plus Bond,single_stock,579516928,0.0049,0.0475,"Le PGIM Total Return Bond ETF est un fonds négocié en bourse conçu pour offrir aux investisseurs une exposition à un portefeuille diversifié de titres à revenu fixe. Sa fonction principale est de rechercher un rendement total par le biais d'une combinaison de revenus et d'appréciation du capital. Le fonds investit dans une large gamme d'obligations, y compris des titres du gouvernement et des agences américaines, des obligations d'entreprises de qualité investissement et des produits titrisés c…",0.343,3.89,1.22,6.47,3y,6.47,42.565,2025-10-16T19:16:14.343Z,Consumer Defensive,100,United States,100,"[{""s"":""Consumer Defensive"",""w"":100}]","[{""c"":""United States"",""w"":100}]",PAAA (PGIM AAA CLO ETF),"[{""t"":""PAAA"",""n"":""PGIM AAA CLO ETF"",""w"":3.73}]",110
PULS,PGIM Ultra Short Bond ETF,,ARCX,USD,Ultrashort Bond,inverse,12669407232,0.0015,0.0495,"L'ETF PGIM Ultra Short Bond est un véhicule d'investissement collectif qui sert principalement à offrir aux investisseurs une exposition à un portefeuille diversifié d'obligations à très courte durée. Sa fonction principale est de fournir un niveau de revenu élevé tout en maintenant un très faible degré de risque de taux d'intérêt, ce qui en fait une option attrayante pour ceux qui cherchent à préserver leur capital. Le fonds investit généralement dans une gamme d'obligations d'entreprise, de t…",0.01,0.35,0.17,1.65,3y,1.65,49.735,2025-10-16T19:16:14.800Z,,,United States,,[],"[{""c"":""United States"",""w"":null}]",PAAA (PGIM AAA CLO ETF),"[{""t"":""PAAA"",""n"":""PGIM AAA CLO ETF"",""w"":0.97}]",92
PWZ,Invesco California AMT-Free Municipal Bond ETF,,ARCX,USD,Muni California Long,single_stock,1098925184,0.0028,0.0335,"Le Fonds Obligataire Municipal Exempt d'AMT d'Invesco Californie est un type de fonds commun de placement à revenu fixe qui investit principalement dans des obligations municipales émises par les gouvernements d'État et locaux de Californie. Son objectif principal est de fournir un revenu courant exempt d'impôts fédéraux et d'impôts sur le revenu de l'État de Californie, ce qui en fait une option attrayante pour les investisseurs résidant en Californie qui recherchent une efficacité fiscale. Le…",0.289,-1.34,-2.53,7.04,3y,7.04,24.3,2025-10-16T19:16:15.355Z,Financial Services,100,United States,100,"[{""s"":""Financial Services"",""w"":100}]","[{""c"":""United States"",""w"":100}]",V (V),"[{""t"":""V"",""n"":""V"",""w"":100}]",110
PZA,Invesco National AMT-Free Municipal Bond ETF,,ARCX,USD,Muni National Long,single_stock,3285822208,0.0028,0.0344,"Le fonds obligataire Invesco National AMT-Free Municipal Bond Fund est un fonds obligataire diversifié qui investit principalement dans des titres municipaux, bénéficiant de l'avantage attrayant d'être exonérés d'impôts fédéraux sur le revenu. La fonction principale de ce fonds est de fournir aux investisseurs un flux de revenus constant et fiscalement avantageux, ciblant ceux qui cherchent à maximiser leurs rendements après impôts. Le fonds se concentre sur des obligations émises par divers go…",0.279,-1.37,-2.36,6.72,3y,6.72,23.385,2025-10-16T19:16:15.881Z,Financial Services,100,United States,100,"[{""s"":""Financial Services"",""w"":100}]","[{""c"":""United States"",""w"":100}]",V (V),"[{""t"":""V"",""n"":""V"",""w"":100}]",110
QABA,First Trust NASDAQ ABA Community Bank ETF,,XNMS,USD,Financial,leveraged,106623528,0.006,0.0227,"Le First Trust NASDAQ ABA Community Bank ETF est un fonds négocié en bourse conçu pour suivre la performance des institutions bancaires à petite capitalisation principalement aux États-Unis. L'ETF se concentre sur les banques qui sont généralement membres de l'American Bankers Association (ABA), mettant en avant son rôle dans la réflexion du paysage des banques communautaires et régionales. En se concentrant sur ce segment, l'ETF offre une exposition unique aux institutions qui sont directement…",-3.968,-3.16,-2.02,28.39,3y,28.39,53,2025-10-16T19:16:16.339Z,Financial Services,99.72,United States,,"[{""s"":""Financial Services"",""w"":99.72},{""s"":""Industrial"",""w"":0.28},{""s"":""Basic Materials"",""w"":0},{""s"":""Utilities"",""w"":0},{""s"":""Energy"",""w"":0}]","[{""c"":""United States"",""w"":null}]",WTFC (Wintrust Financial Corporation),"[{""t"":""WTFC"",""n"":""Wintrust Financial Corporation"",""w"":4.52},{""t"":""CBSH"",""n"":""Commerce Bancshares, Inc."",""w"":4.31},{""t"":""OZK"",""n"":""Bank OZK"",""w"":2.93},{""t"":""HWC"",""n"":""Hancock Whitney Corporation"",""w"":2.7},{""t"":""UBSI"",""n"":""United Bankshares, Inc."",""w"":2.67},{""t"":""FFIN"",""n"":""First Financial Bankshares Inc."",""w"":2.62},{""t"":""IBOC"",""n"":""International Bancshares Corporation"",""w"":2.24},{""t"":""BANF"",""n"":""BancFirst Corporation"",""w"":2.19},{""t"":""TCBI"",""n"":""Texas Capital Bancshares Inc."",""w"":2.04},{""t"":""TFSL"",""n"":""TFS Financial Corp."",""w"":1.94}]",110
QLTA,iShares AAA - A Rated Corporate Bond ETF,,ARCX,USD,Corporate Bond,single_stock,1792930944,0.0015,0.0425,"L'iShares AAA - A Rated Corporate Bond ETF est un type de fonds négocié en bourse qui investit dans des obligations d'entreprise de haute qualité avec de fortes notations de crédit. Sa fonction principale est de fournir aux investisseurs une exposition à des revenus fixes d'entreprise à faible risque, garantissant un niveau de sécurité de crédit grâce à un investissement exclusif dans des obligations notées de AAA à A par les principales agences de notation de crédit. Ce fonds est particulièrem…",0.216,4.37,1.07,7.05,3y,7.05,48.825,2025-10-16T19:16:16.882Z,Financial Services,100,United States,100,"[{""s"":""Financial Services"",""w"":100}]","[{""c"":""United States"",""w"":100}]",XTSLA (BlackRock Cash Funds Treasury SL Agency),"[{""t"":""XTSLA"",""n"":""BlackRock Cash Funds Treasury SL Agency"",""w"":0.59}]",110
RAVI,FlexShares Ultra-Short Income Fund,,ARCX,USD,Ultrashort Bond,inverse,1379510272,0.0025,0.0479,"Le FlexShares Trust Ultra-Short Income Fund est un fonds négocié en bourse (ETF) dont le but principal est de fournir aux investisseurs un revenu, tout en minimisant le risque de taux d'intérêt en maintenant un portefeuille de revenus fixes à courte durée. Le fonds atteint cet objectif en investissant dans un mélange diversifié d'obligations de haute qualité et à court terme libellées en dollars américains, ainsi que dans des instruments du marché monétaire. Il se concentre principalement sur d…",0.02,0.41,0.09,1.41,3y,1.41,75.505,2025-10-16T19:16:17.290Z,,,United States,,[],"[{""c"":""United States"",""w"":null}]",,[],77
REM,iShares Mortgage Real Estate ETF,,BATS,USD,Real Estate,single_stock,594820224,0.0048,0.0905,"iShares Mortgage Real Estate ETF est un fonds négocié en bourse qui offre aux investisseurs une exposition au secteur immobilier américain, en se concentrant spécifiquement sur les sociétés de placement immobilier (REIT) résidentielles et commerciales. Sa fonction principale est de répliquer la performance de l'indice FTSE NAREIT All Mortgage Capped, fournissant un portefeuille diversifié de titres adossés à des hypothèques. L'ETF se compose principalement d'entreprises impliquées dans le finan…",-1.4,1.72,-5.37,23.98,3y,23.98,21.83,2025-10-16T19:16:17.794Z,Real Estate,100,United States,,"[{""s"":""Real Estate"",""w"":100},{""s"":""Basic Materials"",""w"":0},{""s"":""Consumer Defensive"",""w"":0},{""s"":""Technology"",""w"":0},{""s"":""Communication Services"",""w"":0}]","[{""c"":""United States"",""w"":null}]","NLY (Annaly Capital Management, Inc.)","[{""t"":""NLY"",""n"":""Annaly Capital Management, Inc."",""w"":20.21},{""t"":""AGNC"",""n"":""AGNC Investment Corp."",""w"":14.86},{""t"":""STWD"",""n"":""Starwood Property Trust Inc."",""w"":11.07},{""t"":""RITM"",""n"":""Rithm Capital Corp."",""w"":4.67},{""t"":""ABR"",""n"":""Arbor Realty Trust Inc."",""w"":4.63},{""t"":""BXMT"",""n"":""Blackstone Mortgage Trust Inc."",""w"":4.28},{""t"":""ARR"",""n"":""Armour Residential REIT Inc."",""w"":3.02},{""t"":""ARI"",""n"":""Apollo Commercial Real Estate Finance Inc."",""w"":3.02},{""t"":""DX"",""n"":""Dynex Capital Inc."",""w"":2.94},{""t"":""LADR"",""n"":""Ladder Capital Corp."",""w"":2.8}]",110
RMOP,Rockefeller Opportunistic Municipal Bond ETF,,ARCX,USD,High Yield Muni,single_stock,199024160,0.0055,0.0489,"L'ETF Rockefeller Opportunistic Municipal Bond est un fonds négocié en bourse qui se concentre principalement sur l'investissement dans des obligations municipales. Le principal objectif de cet ETF est de fournir aux investisseurs une exposition à un portefeuille diversifié de titres municipaux, qui sont des obligations de dette émises par des gouvernements d'État et locaux, souvent dans le but de financer des projets publics. Cet ETF met l'accent sur une stratégie opportuniste, recherchant des…",-0.02,-1.1,-2.15,6.95,1y,,25.17,2025-10-16T19:16:18.212Z,Financial Services,100,United States,100,"[{""s"":""Financial Services"",""w"":100}]","[{""c"":""United States"",""w"":100}]",V (V),"[{""t"":""V"",""n"":""V"",""w"":100}]",110
SCCR,Schwab Core Bond ETF,,ARCX,USD,Intermediate Core Bond,single_stock,955248384,0.0016,,"L'ETF Schwab Core Bond est un fonds négocié en bourse conçu pour offrir aux investisseurs une large exposition au marché obligataire américain de qualité investissement. Sa fonction principale est de proposer un portefeuille diversifié d'actifs à revenu fixe, permettant aux investisseurs d'obtenir un revenu régulier tout en gérant le risque. L'ETF investit principalement dans des obligations de différentes maturités, y compris des émissions gouvernementales, des obligations d'entreprise et des …",0.346,3.67,3.67,5.05,SI,,26.135,2025-10-16T19:16:18.532Z,Financial Services,100,United States,100,"[{""s"":""Financial Services"",""w"":100}]","[{""c"":""United States"",""w"":100}]",V (V),"[{""t"":""V"",""n"":""V"",""w"":100}]",100
SCHI,Schwab 5-10 Year Corporate Bond ETF,,ARCX,USD,Corporate Bond,single_stock,9408214016,0.0003,0.0493,"L'ETF Schwab 5-10 Year Corporate Bond est un fonds négocié en bourse qui se concentre sur la fourniture aux investisseurs en revenu fixe d'une exposition aux obligations d'entreprise de qualité investment-grade avec des échéances allant de cinq à dix ans. Son objectif principal est de suivre la performance d'un indice qui mesure le rendement des obligations d'entreprise à moyen terme. Cet ETF comprend principalement des obligations émises par des entreprises financièrement stables, ce qui en fa…",0.238,5.1,2.13,6.78,3y,6.78,23.205,2025-10-16T19:16:18.986Z,Financial Services,100,United States,100,"[{""s"":""Financial Services"",""w"":100}]","[{""c"":""United States"",""w"":100}]",V (V),"[{""t"":""V"",""n"":""V"",""w"":100}]",110
SCHJ,Schwab 1-5 Year Corporate Bond ETF,,ARCX,USD,Short-Term Bond,single_stock,606133248,0.0003,0.043,"L'ETF Schwab 1-5 Year Corporate Bond est un fonds négocié en bourse conçu pour offrir une exposition aux obligations d'entreprise de qualité investissement avec des échéances allant d'un à cinq ans. Son objectif principal est de fournir aux investisseurs un moyen d'obtenir un revenu stable tout en se concentrant sur la préservation du capital, en équilibrant rendement et risque. Cet ETF investit dans un portefeuille diversifié de dettes d'entreprise à courte durée émises par des entreprises de …",0.14,2.46,1.55,3.02,3y,3.02,24.99,2025-10-16T19:16:19.366Z,Financial Services,100,United States,100,"[{""s"":""Financial Services"",""w"":100}]","[{""c"":""United States"",""w"":100}]",V (V),"[{""t"":""V"",""n"":""V"",""w"":100}]",110
SCHO,Schwab Short-Term U.S. Treasury ETF,,ARCX,USD,Short Government,inverse,11798136832,0.0003,0.0414,Le Schwab Short-Term U.S. Treasury Fund est un fonds négocié en bourse qui investit principalement dans des obligations du Trésor américain à court terme. L'objectif principal du fonds est de fournir aux investisseurs une exposition à des obligations émises par le gouvernement qui ont généralement des échéances comprises entre un et trois ans. Ce focus sur les échéances à court terme signifie que le fonds est moins sensible aux variations des taux d'intérêt par rapport aux fonds obligataires à …,0.123,1.28,0.66,2.38,3y,2.38,24.45,2025-10-16T19:16:19.743Z,,,United States,,[],"[{""c"":""United States"",""w"":null}]",,[],77
SCHP,Schwab U.S. TIPS ETF,,ARCX,USD,Inflation-Protected Bond,single_stock,14430226432,0.0003,0.0316,"L'ETF Schwab U.S. TIPS est un fonds négocié en bourse qui investit dans des titres du Trésor américain protégés contre l'inflation (TIPS). Conçu pour offrir une protection contre l'inflation, les TIPS fournissent des paiements d'intérêts qui s'ajustent en fonction des variations de l'indice des prix à la consommation (CPI). En tant que fonction principale, l'ETF vise à fournir des résultats d'investissement qui correspondent à la performance des prix et des rendements de l'indice Bloomberg Barc…",0.222,4.84,1.92,5.87,3y,5.87,27.06,2025-10-16T19:16:20.125Z,Financial Services,100,United States,100,"[{""s"":""Financial Services"",""w"":100}]","[{""c"":""United States"",""w"":100}]",V (V),"[{""t"":""V"",""n"":""V"",""w"":100}]",110
SCHQ,Schwab Long-Term U.S. Treasury ETF,,ARCX,USD,Long Government,single_stock,815709760,0.0003,0.0447,"Le Schwab Long-Term U.S. Treasury est un fonds négocié en bourse (ETF) qui investit principalement dans des obligations du Trésor américain à long terme. Cet actif financier vise à offrir aux investisseurs une exposition au marché des obligations du gouvernement américain, en ciblant spécifiquement des titres à maturités prolongées. L'objectif d'un tel ETF est de proposer un investissement relativement stable qui peut agir comme un contrepoids à des actifs plus volatils au sein d'un portefeuill…",0.719,4.49,-1.83,14.65,3y,14.65,32.925,2025-10-16T19:16:20.533Z,Financial Services,100,United States,100,"[{""s"":""Financial Services"",""w"":100}]","[{""c"":""United States"",""w"":100}]",V (V),"[{""t"":""V"",""n"":""V"",""w"":100}]",110
SCHR,Schwab Intermediate-Term U.S. Treasury ETF,,ARCX,USD,Intermediate Government,single_stock,11943763968,0.0003,0.038,"L'ETF Schwab Intermediate-Term U.S. Treasury est un fonds négocié en bourse axé sur l'exposition aux obligations du Trésor américain à moyen terme. La fonction principale de cet ETF est d'offrir aux investisseurs un moyen d'investir dans des titres de créance du gouvernement américain avec des échéances généralement comprises entre 3 et 10 ans. Ce véhicule fournit un portefeuille obligataire diversifié, ce qui aide à stabiliser les rendements grâce à un risque de taux d'intérêt modéré. L'ETF vi…",0.317,4.28,1.97,5.59,3y,5.59,25.32,2025-10-16T19:16:20.933Z,Financial Services,100,United States,100,"[{""s"":""Financial Services"",""w"":100}]","[{""c"":""United States"",""w"":100}]",V (V),"[{""t"":""V"",""n"":""V"",""w"":100}]",110
