EVSD,Eaton Vance Short Duration Income Fund,,XNMS,USD,Short-Term Bond,inverse,1253967104,0.0024,0.0462,4.64,9.922,79,AA,"Le Fonds d'Income à Durée Courte d'Eaton Vance est un fonds commun de placement qui se concentre sur la génération de revenus tout en gérant la volatilité dans l'espace des revenus fixes. Ce fonds est conçu pour fournir aux investisseurs un revenu régulier en investissant principalement dans un portefeuille diversifié d'obligations à courte durée. Ces instruments incluent généralement des obligations d'entreprises, des titres de créance d'État et des titres adossés à des créances hypothécaires,…",0.118,-0.67,-0.19,0.02,0.35,1.93,1y,,0.04,51.085,2026-06-26T00:00:00.000Z,,,United States,,[],"[{""c"":""United States"",""w"":null}]","MVRXX (Morgan Stanley Insti Liquidity Fds, Government Portf Insti Class)","[{""t"":""MVRXX"",""n"":""Morgan Stanley Insti Liquidity Fds, Government Portf Insti Class"",""w"":2.61},{""t"":""EVLN"",""n"":""Eaton Vance Floating-Rate ETF"",""w"":1.66}]",97,NON_STANDARD,0.4,0,
FAAA,Fidelity AAA CLO ETF,,XNMS,USD,Securitized Bond - Focused,standard,45038536,,,4.8,10.009,94,AAA,"Le Fidelity AAA CLO ETF est un fonds négocié en bourse géré activement qui offre aux investisseurs une exposition ciblée au marché des obligations de prêt garanties (CLO) en investissant au moins 80 % de ses actifs dans des titres CLO notés AAA. Ces CLO regroupent des portefeuilles diversifiés de prêts d'entreprise à taux variable, généralement émis à des entreprises de qualité inférieure à celle d'investissement dans divers secteurs, offrant des droits de priorité senior sur les flux de trésor…",0,0.68,0.68,0.08,0.6,1.31,SI,,0,50.34,2026-06-26T00:00:00.000Z,,,United States,,[],"[{""c"":""United States"",""w"":null}]",,[],57,DATA_MISSING,0.3,0,
FALN,iShares Fallen Angels USD Bond ETF,,XNMS,USD,High Yield Bond,standard,1655630208,0.0025,0.064,5.62,9.403,41,BB,"L'ETF iShares Fallen Angels USD Bond est un fonds négocié en bourse spécialisé qui investit principalement dans des ""fallen angels"", qui sont des obligations initialement émises comme des obligations de qualité investissement mais qui ont ensuite été dégradées au statut de haut rendement. Cet ETF est conçu pour suivre la performance de l'indice Bloomberg Barclays US High Yield Fallen Angels 3% Capped, offrant aux investisseurs une exposition à un segment unique du marché obligataire. Les fallen…",-0.11,-0.51,1.08,0.41,2.45,6.08,3y,6.08,0.28,27.19,2026-06-26T00:00:00.000Z,Real Estate,100,United States,,"[{""s"":""Real Estate"",""w"":100},{""s"":""Basic Materials"",""w"":0},{""s"":""Technology"",""w"":0},{""s"":""Communication Services"",""w"":0},{""s"":""Consumer Defensive"",""w"":0}]","[{""c"":""United States"",""w"":null}]",XTSLA (BlackRock Cash Funds Treasury SL Agency),"[{""t"":""XTSLA"",""n"":""BlackRock Cash Funds Treasury SL Agency"",""w"":1.8}]",115,STANDARD,1,1,
FBND,Fidelity Total Bond ETF,,ARCX,USD,Intermediate Core-Plus Bond,standard,26057893888,0.0036,0.047,4.21,9.638,89,AAA,"Fidelity Total Bond ETF est un fonds négocié en bourse géré activement, axé sur le vaste marché obligataire libellé en dollars américains. Son objectif principal est de fournir un niveau élevé de revenu courant en investissant principalement dans des dettes de qualité investissement, tout en allouant une plus petite portion à des obligations à haut rendement et des obligations de marchés émergents pour élargir les sources de revenus. Le fonds détient généralement un mélange diversifié de bons d…",0.131,-0.48,0.22,0.55,0.75,5.47,3y,5.47,0.1,45.82,2026-06-26T00:00:00.000Z,Industrial,68.53,United States,,"[{""s"":""Industrial"",""w"":68.53},{""s"":""Utilities"",""w"":30.46},{""s"":""Energy"",""w"":1.02},{""s"":""Consumer Defensive"",""w"":0},{""s"":""Communication Services"",""w"":0}]","[{""c"":""United States"",""w"":null}]",,[],100,STANDARD,1,1,
FCAL,First Trust California Municipal Fund,,XNMS,USD,Muni California Long,standard,219880816,0.0049,0.0333,4.78,10.514,72,AA,"Le First Trust California Municipal Fund est un fonds fermé dont l'objectif principal est de fournir un revenu courant exonéré d'impôts fédéraux et d'impôts de l'État de Californie. En tant que fonds d'obligations municipales, il investit principalement dans une variété de titres municipaux qui financent des services publics et des projets d'infrastructure en Californie, tels que des écoles, des hôpitaux et des systèmes de transport. Ces obligations sont généralement émises par des gouvernement…",0.03,0.54,3.19,0.72,1.73,4.38,3y,4.38,0.06,49.595,2026-06-26T00:00:00.000Z,,,United States,,[],"[{""c"":""United States"",""w"":null}]",,[],82,DATA_MISSING,0.3,0,
FCOR,Fidelity Corporate Bond ETF,,ARCX,USD,Corporate Bond,standard,342265920,0.0036,0.0454,4.93,9.792,69,BBB,"L'ETF Fidelity Corporate Bond est un fonds négocié en bourse conçu pour suivre la performance d'un large portefeuille diversifié d'obligations d'entreprises de qualité investissement. Sa fonction principale est de fournir aux investisseurs une exposition au secteur de la dette d'entreprise, offrant un mélange de stabilité et de potentiel de génération de revenus. Cet ETF se concentre sur des obligations provenant de divers secteurs, y compris la santé, la technologie, la finance et les biens de…",0.04,-0.67,0.44,0.36,1.13,6,3y,6,0.14,47.459,2026-06-26T00:00:00.000Z,,,United States,,[],"[{""c"":""United States"",""w"":null}]",,[],82,DATA_MISSING,0.3,0,
FDHY,Fidelity Enhanced High Yield ETF,,ARCX,USD,High Yield Bond,standard,521947392,0.0035,0.0653,6.9,10.026,37,B,"Le Fidelity Enhanced High Yield ETF est un type de fonds négocié en bourse conçu pour offrir aux investisseurs une exposition aux obligations d'entreprise à haut rendement, ou ""junk"". En général, ces obligations offrent des taux d'intérêt plus élevés pour compenser le risque accru associé à des notations de crédit plus faibles. Le fonds cherche à suivre la performance des obligations d'entreprise à rendement plus élevé qui présentent un potentiel de retour supérieur, ce qui en fait une option r…",0.02,0,0.67,-0.16,1.76,5.33,3y,5.33,0.21,49.26,2026-06-26T00:00:00.000Z,Energy,100,United States,,"[{""s"":""Energy"",""w"":100},{""s"":""Consumer Cyclical"",""w"":0},{""s"":""Basic Materials"",""w"":0},{""s"":""Healthcare"",""w"":0},{""s"":""Consumer Defensive"",""w"":0}]","[{""c"":""United States"",""w"":null}]",,[],100,STANDARD,1,1,
FEMB,First Trust Emerging Markets Local Currency Bond ETF,,XNMS,USD,Emerging-Markets Local-Currency Bond,standard,353257760,0.0085,0.0604,6.99,9.779,82,U.S. Government,"Le First Trust Emerging Markets Local Currency Bond ETF est un fonds négocié en bourse conçu pour suivre un indice d'obligations émises par des gouvernements ou des entreprises dans des marchés émergents, libellées dans leurs monnaies locales. Cet ETF vise à offrir une exposition aux marchés de la dette des pays en développement, pouvant bénéficier de rendements plus élevés par rapport à leurs homologues des marchés développés. Une caractéristique notable de cet ETF est son accent sur les oblig…",0.412,-2.11,1.92,0.05,2.08,9.97,3y,9.97,0.36,29.22,2026-06-26T00:00:00.000Z,,,United States,,[],"[{""c"":""United States"",""w"":null}]",,[],82,ALT_ASSET_FX,0.35,0,
FIBR,iShares Systematic Bond ETF,,BATS,USD,Corporate Bond,standard,89293192,0.0025,0.0513,4.59,9.41,74,U.S. Government,"iShares Systematic Bond ETF est un fonds négocié en bourse conçu pour offrir une large exposition aux actifs de revenu fixe libellés en dollars américains, englobant à la fois des obligations de qualité investissement et des obligations à haut rendement. Le fonds utilise une stratégie d'investissement systématique et multifactorielle pour sélectionner des titres, visant à équilibrer la génération de revenus et la gestion des risques en analysant des facteurs tels que la qualité de crédit, la du…",0.079,-0.84,0.71,0.51,0.77,4.56,3y,4.56,0.13,88.98,2026-06-26T00:00:00.000Z,Energy,100,United States,,"[{""s"":""Energy"",""w"":100},{""s"":""Consumer Cyclical"",""w"":0},{""s"":""Basic Materials"",""w"":0},{""s"":""Technology"",""w"":0},{""s"":""Consumer Defensive"",""w"":0}]","[{""c"":""United States"",""w"":null}]",BISXX (BlackRock Cash Funds Instl SL Agency),"[{""t"":""BISXX"",""n"":""BlackRock Cash Funds Instl SL Agency"",""w"":6.88}]",115,STANDARD,1,1,
FIGB,Fidelity Investment Grade Bond ETF,,ARCX,USD,Intermediate Core Bond,standard,498595136,0.0036,0.0411,4.19,9.69,91,AAA,"L'ETF Fidelity Investment Grade Bond est un type de fonds négocié en bourse spécifiquement conçu pour offrir aux investisseurs une exposition à un portefeuille diversifié d'obligations de qualité investissement. Ces obligations sont émises par des entreprises ou des gouvernements qui ont été évalués par des agences de notation de crédit comme ayant un risque de défaut relativement faible, recevant généralement des notations de BBB- ou supérieures. La fonction principale de cet ETF est d'offrir …",0.07,-0.53,0.26,0.56,0.64,6.05,3y,6.05,0.09,43.13,2026-06-26T00:00:00.000Z,,,United States,,[],"[{""c"":""United States"",""w"":null}]",,[],82,DATA_MISSING,0.3,0,
FIIG,First Trust Intermediate Duration Investment Grade Corporate ETF,,ARCX,USD,Corporate Bond,standard,680117632,0.0049,0.0464,5.21,9.836,67,BBB,"L'ETF FT Intermediate Duration Investment Grade Corporate est un fonds négocié en bourse conçu pour offrir aux investisseurs une exposition aux obligations d'entreprises de qualité investissement avec une durée intermédiaire. La fonction principale de cet ETF est de suivre la performance d'un indice de référence représentant des obligations d'entreprises de haute qualité à moyen terme. Il est structuré pour fournir un niveau modéré de risque de taux d'intérêt, ce qui le rend adapté aux investis…",0.096,-1.8,-0.84,0.56,1.09,6.01,3y,6.01,0.17,20.775,2026-06-26T00:00:00.000Z,,,United States,,[],"[{""c"":""United States"",""w"":null}]",,[],82,DATA_MISSING,0.3,0,
FIXD,First Trust TCW Opportunistic Fixed Income Fund,,XNMS,USD,Intermediate Core-Plus Bond,standard,3318624512,0.0065,0.0468,5.05,9.798,78,AAA,"Le First Trust TCW Opportunistic Fixed Income Fund est un fonds négocié en bourse (ETF) axé sur la fourniture aux investisseurs d'une exposition à une gamme diversifiée de titres à revenu fixe. Sa fonction principale est de gérer un portefeuille diversifié qui cherche à maximiser le rendement total grâce à une combinaison de revenus courants et d'appréciation du capital. Ce fonds investit dans une large gamme d'obligations, y compris des obligations d'entreprise, des obligations d'État, des tit…",0.112,-1.22,-0.28,0.52,0.96,6.13,3y,6.13,0.13,43.745,2026-06-26T00:00:00.000Z,Utilities,100,United States,,"[{""s"":""Utilities"",""w"":100},{""s"":""Real Estate"",""w"":0},{""s"":""Consumer Defensive"",""w"":0},{""s"":""Consumer Cyclical"",""w"":0},{""s"":""Basic Materials"",""w"":0}]","[{""c"":""United States"",""w"":null}]",,[],100,STANDARD,1,1,
FLBL,Franklin Senior Loan ETF,,BATS,USD,Bank Loan,standard,853201856,0.0045,0.0743,,,34,B,"L'ETF Franklin Senior Loan est un fonds négocié en bourse conçu pour offrir aux investisseurs un accès au marché des prêts senior. Les prêts senior, communément appelés prêts à effet de levier ou prêts bancaires, sont des titres de créance qui occupent une position senior dans la structure du capital de l'emprunteur et sont principalement émis par des entreprises. Ces prêts sont généralement garantis par des actifs et sont souvent utilisés par des sociétés ayant des notations de crédit plus fai…",-0.131,-2.56,-5.49,-0.83,-0.48,3.72,3y,3.72,0.08,22.83,2026-06-26T00:00:00.000Z,Healthcare,99.89,United States,,"[{""s"":""Healthcare"",""w"":99.89},{""s"":""Energy"",""w"":0.11},{""s"":""Real Estate"",""w"":0},{""s"":""Consumer Defensive"",""w"":0},{""s"":""Technology"",""w"":0}]","[{""c"":""United States"",""w"":null}]",INFXX (Institutional Fiduciary Trust Money Market Pt),"[{""t"":""INFXX"",""n"":""Institutional Fiduciary Trust Money Market Pt"",""w"":11.88}]",115,STANDARD,1,1,
FLCB,Franklin U.S. Core Bond ETF,,ARCX,USD,Intermediate Core Bond,standard,2915196672,0.0015,0.0428,3.85,9.335,84,AA,"Le Franklin U.S. Core Bond Fund est un type de fonds commun de placement conçu pour offrir aux investisseurs une exposition au marché obligataire américain. Son objectif principal est de fournir un revenu stable tout en préservant le capital en investissant principalement dans un portefeuille diversifié d'obligations de qualité investissement. Ces obligations peuvent inclure des bons du Trésor américain, des obligations liées au gouvernement, des titres de créance d'entreprise et des obligation…",0.047,-0.58,0.28,0.61,0.75,5.38,3y,5.38,0.09,21.49,2026-06-26T00:00:00.000Z,,,United States,,[],"[{""c"":""United States"",""w"":null}]",INFXX (Institutional Fiduciary Trust Money Market Pt),"[{""t"":""INFXX"",""n"":""Institutional Fiduciary Trust Money Market Pt"",""w"":3.52}]",97,DATA_MISSING,0.3,0,
FLCO,Franklin Investment Grade Corporate ETF,,ARCX,USD,Corporate Bond,standard,581303168,0.0035,0.0463,4.61,9.517,69,A,"Le Franklin Investment Grade Corporate Fund est un fonds commun de placement conçu pour investir principalement dans des titres de créance d'entreprise de haute qualité. Sa fonction principale est de fournir aux investisseurs un portefeuille diversifié axé sur des obligations de qualité investissement, visant un équilibre entre revenu et préservation du capital. Ce fonds cible principalement des obligations d'entreprise notées BBB ou plus, qui sont considérées comme des investissements à risque…",-0.023,-0.51,0.3,0.49,1.32,6.17,3y,6.17,0.15,21.515,2026-06-26T00:00:00.000Z,,,United States,,[],"[{""c"":""United States"",""w"":null}]",INFXX (Institutional Fiduciary Trust Money Market Pt),"[{""t"":""INFXX"",""n"":""Institutional Fiduciary Trust Money Market Pt"",""w"":1.91}]",97,DATA_MISSING,0.3,0,
FLDR,Fidelity Low Duration Bond ETF,,BATS,USD,Ultrashort Bond,standard,1615700480,0.0015,0.0443,,10.014,84,A,"L'ETF Fidelity Low Duration Bond est un fonds négocié en bourse conçu pour offrir aux investisseurs une exposition à des titres à revenu fixe de haute qualité et à court terme. La fonction principale de cet ETF est de proposer une option d'investissement relativement stable qui recherche une combinaison de revenus et de préservation du capital. Avec un accent sur les obligations à faible durée, cet actif est structuré pour atténuer le risque de taux d'intérêt, attirant ainsi les investisseurs à…",0,0.07,0.1,0.14,0.42,1.67,3y,1.67,0.02,50.27,2026-06-26T00:00:00.000Z,,,United States,,[],"[{""c"":""United States"",""w"":null}]",,[],82,DATA_MISSING,0.3,0,
FLGV,Franklin U.S. Treasury Bond ETF,,ARCX,USD,Intermediate Government,single_stock,988177408,0.0009,0.0412,3.3,9.372,92,AA,"Le Franklin U.S. Treasury Bond Fund est un véhicule d'investissement qui se concentre sur les titres du Trésor américain, offrant aux investisseurs une exposition au marché obligataire du gouvernement américain. La fonction principale de ce fonds est de fournir aux investisseurs une option d'investissement stable et sécurisée qui met l'accent sur la génération de revenus provenant des paiements d'intérêts tout en préservant le capital. Les titres du Trésor américain sont largement considérés co…",0.148,-0.78,-0.54,0.52,0.27,5.11,3y,5.11,0.06,20.355,2026-06-26T00:00:00.000Z,Financial Services,100,United States,100,"[{""s"":""Financial Services"",""w"":100}]","[{""c"":""United States"",""w"":100}]",INFXX (Institutional Fiduciary Trust Money Market Pt),"[{""t"":""INFXX"",""n"":""Institutional Fiduciary Trust Money Market Pt"",""w"":3.63}]",115,SINGLE_STOCK,0.7,1,
FLHY,Franklin High Yield Corporate Bond Fund,,BATS,USD,High Yield Bond,standard,1164373632,0.004,0.0644,7.12,10.035,37,BB,"Le Franklin High Yield Corporate Bond Fund est un fonds commun de placement qui investit principalement dans des obligations d'entreprises à haut rendement, offrant aux investisseurs une exposition à des instruments de dette émis par diverses entreprises. Ces obligations, souvent appelées ""junk bonds"", présentent un risque de défaut plus élevé par rapport aux obligations de qualité investissement, mais elles offrent également des rendements potentiels plus élevés sous forme de revenus d'intérêt…",-0.041,-0.68,0.12,-0.33,1.25,5.59,3y,5.59,0.24,24.24,2026-06-26T00:00:00.000Z,Healthcare,100,United States,,"[{""s"":""Healthcare"",""w"":100},{""s"":""Energy"",""w"":0},{""s"":""Communication Services"",""w"":0},{""s"":""Utilities"",""w"":0},{""s"":""Real Estate"",""w"":0}]","[{""c"":""United States"",""w"":null}]",INFXX (Institutional Fiduciary Trust Money Market Pt),"[{""t"":""INFXX"",""n"":""Institutional Fiduciary Trust Money Market Pt"",""w"":2.8}]",115,STANDARD,1,1,
FLIA,Franklin International Aggregate Bond Fund,,BATS,USD,Global Bond-USD Hedged,single_stock,749883072,0.0025,0.0259,2.3,9.524,86,U.S. Government,"Le Franklin International Aggregate Bond Fund est un véhicule d'investissement diversifié qui se concentre principalement sur les investissements à revenu fixe en dehors des États-Unis. Sa fonction principale est de fournir aux investisseurs une exposition aux marchés obligataires internationaux, offrant ainsi un degré de diversification géographique qui peut être crucial pour la gestion des risques et l'optimisation des rendements dans un portefeuille mondial. Le fonds vise à saisir des opport…",0.049,1.78,0,0.64,1.99,4.86,3y,4.86,0.08,20.53,2026-06-26T00:00:00.000Z,Technology,100,United States,,"[{""s"":""Technology"",""w"":100},{""s"":""Industrial"",""w"":0},{""s"":""Financial Services"",""w"":0},{""s"":""Utilities"",""w"":0},{""s"":""Real Estate"",""w"":0}]","[{""c"":""United States"",""w"":null}]",INFXX (Institutional Fiduciary Trust Money Market Pt),"[{""t"":""INFXX"",""n"":""Institutional Fiduciary Trust Money Market Pt"",""w"":7.29}]",115,SINGLE_STOCK,0.7,1,
FLMI,Franklin Dynamic Municipal Bond ETF,,ARCX,USD,High Yield Muni,standard,2098840064,0.003,0.0387,4.79,10.218,64,A,"Le Franklin Dynamic Municipal Bond Fund est un fonds commun de placement conçu pour investir principalement dans des obligations municipales émises par divers gouvernements d'État et locaux à travers les États-Unis. Sa fonction principale est de fournir un revenu exonéré d'impôt aux investisseurs, ce qui en fait une option attrayante pour les particuliers cherchant à optimiser leurs rendements après impôt. Ce fonds se distingue par son accent sur des stratégies de gestion active, visant à attei…",0.04,0.96,3.89,0.64,1.86,4.6,3y,4.6,0.06,25.13,2026-06-26T00:00:00.000Z,,,United States,,[],"[{""c"":""United States"",""w"":null}]",,[],82,DATA_MISSING,0.3,0,
FLOT,iShares Floating Rate Bond ETF,,BATS,USD,Ultrashort Bond,standard,9512147968,0.0015,0.046,4.4,10.033,85,A,"L'iShares Floating Rate Bond ETF est un type de fonds négocié en bourse axé sur l'exposition aux obligations à taux variable. Sa fonction principale est d'offrir aux investisseurs une protection contre les fluctuations des taux d'intérêt, grâce aux paiements d'intérêts ajustables liés aux mouvements des taux d'intérêt à court terme. Les obligations à taux variable réajustent leurs paiements de coupon régulièrement, généralement tous les trois mois, ce qui rend cet ETF attrayant dans un environn…",0.059,0.37,0.16,0.02,0.33,2.02,3y,2.02,0.03,51.05,2026-06-26T00:00:00.000Z,,,United States,,[],"[{""c"":""United States"",""w"":null}]",XTSLA (BlackRock Cash Funds Treasury SL Agency),"[{""t"":""XTSLA"",""n"":""BlackRock Cash Funds Treasury SL Agency"",""w"":0.8}]",97,DATA_MISSING,0.3,0,
FLRN,SPDR Bloomberg Investment Grade Floating Rate ETF,,ARCX,USD,Ultrashort Bond,single_stock,2919404288,0.0015,0.0457,4.34,10.031,85,A,"Le SPDR Bloomberg Investment Grade Floating Rate ETF est un fonds négocié en bourse qui offre aux investisseurs une exposition à un portefeuille d'obligations à taux variable. Sa fonction principale est de fournir un véhicule d'investissement diversifié et liquide qui aide à se couvrir contre les variations des taux d'intérêt, ce qui le rend particulièrement attrayant dans des environnements de taux fluctuants. Ces obligations sont généralement émises par des entreprises ayant des notations de …",0.032,0.33,0.13,0.03,0.26,1.95,3y,1.95,0.03,30.84,2026-06-26T00:00:00.000Z,Financial Services,100,United States,100,"[{""s"":""Financial Services"",""w"":100}]","[{""c"":""United States"",""w"":100}]",V (V),"[{""t"":""V"",""n"":""V"",""w"":100}]",115,SINGLE_STOCK,0.7,1,
FLRT,Pacer Pacific Asset Floating Rate High Income ETF,,ARCX,USD,Bank Loan,standard,615165568,0.006,0.0681,7.04,,,,"Le Pacer Pacific Asset Floating Rate ETF est un fonds négocié en bourse qui se concentre principalement sur l'investissement dans des prêts à taux variable et des instruments financiers similaires. Sa fonction principale est de fournir aux investisseurs une exposition à ce segment de niche du marché de la dette, qui peut offrir des avantages potentiels tels qu'une réduction du risque de taux d'intérêt. Ces types de prêts ont généralement des taux d'intérêt variables qui s'ajustent en fonction d…",-0.064,-1.29,-2.12,-0.47,0.7,3.03,3y,3.03,0.05,46.57,2026-06-26T00:00:00.000Z,Financial Services,99.22,United States,,"[{""s"":""Financial Services"",""w"":99.22},{""s"":""Communication Services"",""w"":0.78},{""s"":""Technology"",""w"":0},{""s"":""Consumer Defensive"",""w"":0},{""s"":""Basic Materials"",""w"":0}]","[{""c"":""United States"",""w"":null}]",,[],100,VERIFIED_FINANCIAL,1,1,
FLTB,Fidelity Limited Term Bond ETF,,ARCX,USD,Short-Term Bond,standard,401247840,0.0025,0.0436,4.65,10.008,75,BBB,"L'ETF Fidelity Limited Term Bond est un fonds négocié en bourse qui investit principalement dans des titres à revenu fixe à courte durée. Son objectif est de fournir aux investisseurs un revenu mensuel, ainsi qu'un potentiel d'appréciation du capital. Cet ETF se concentre sur des obligations de qualité d'investissement avec des maturités relativement courtes, généralement comprises entre 1 et 5 ans. En ciblant des obligations à terme limité, le fonds connaît généralement un risque de taux d'int…",0.099,-0.71,-0.21,0,0.52,2.61,3y,2.61,0.05,50.36,2026-06-26T00:00:00.000Z,Energy,100,United States,,"[{""s"":""Energy"",""w"":100},{""s"":""Real Estate"",""w"":0},{""s"":""Basic Materials"",""w"":0},{""s"":""Consumer Defensive"",""w"":0},{""s"":""Technology"",""w"":0}]","[{""c"":""United States"",""w"":null}]",,[],100,STANDARD,1,1,
FLTR,VanEck IG Floating Rate ETF,,ARCX,USD,Ultrashort Bond,standard,2753814016,0.0014,0.0476,4.53,10.037,74,A,"Le VanEck Investment Grade Floating Rate ETF est un fonds négocié en bourse principalement conçu pour suivre la performance des billets à taux flottant de qualité investissement émis par des émetteurs de crédit corporatif. Sa fonction principale est de fournir aux investisseurs une exposition à un portefeuille diversifié de titres à taux flottant, qui ajustent généralement leurs taux d'intérêt en fonction des conditions de marché prévalentes. Cette caractéristique aide à atténuer le risque de t…",0.039,0.39,0.47,0.08,0.51,2.13,3y,2.13,0.02,25.59,2026-06-26T00:00:00.000Z,,,United States,,[],"[{""c"":""United States"",""w"":null}]",,[],82,DATA_MISSING,0.3,0,
FLUD,Franklin Ultra Short Bond ETF,,ARCX,USD,Ultrashort Bond,inverse,395215104,0.0015,0.0435,4.57,10.022,67,A,"L'ETF Franklin Ultra Short Bond est un fonds négocié en bourse à revenu fixe conçu pour offrir aux investisseurs un portefeuille diversifié d'obligations à court terme. Cet ETF vise principalement à préserver le capital tout en se concentrant sur la génération de flux de revenus réguliers, ce qui en fait une option attrayante pour les investisseurs averses au risque cherchant à minimiser la sensibilité aux taux d'intérêt. Il investit généralement dans un mélange de titres de créance de qualité …",0.04,0.06,0.02,0.06,0.14,1.99,3y,1.99,0.02,25.025,2026-06-26T00:00:00.000Z,,,United States,,[],"[{""c"":""United States"",""w"":null}]",INFXX (Institutional Fiduciary Trust Money Market Pt),"[{""t"":""INFXX"",""n"":""Institutional Fiduciary Trust Money Market Pt"",""w"":0.7}]",97,NON_STANDARD,0.4,0,
FMB,First Trust Managed Municipal Fund,,XNMS,USD,Muni National Interm,standard,2033538048,0.0039,0.0351,4.79,10.406,75,AA,"Le First Trust Managed Municipal Fund est un type de fonds négocié en bourse (ETF) géré activement qui se spécialise dans les obligations municipales. Les obligations municipales sont des titres de créance émis par des États, des villes, des comtés et d'autres entités gouvernementales pour financer des projets publics tels que des écoles, des autoroutes et des améliorations d'infrastructure. La fonction principale de ce fonds est de fournir aux investisseurs un revenu exonéré d'impôt provenant …",0.068,0.28,3,0.68,1.82,3.95,3y,3.95,0.06,51.335,2026-06-26T00:00:00.000Z,,,United States,,[],"[{""c"":""United States"",""w"":null}]",,[],82,DATA_MISSING,0.3,0,
