FLCB,Franklin U.S. Core Bond ETF,,ARCX,USD,Intermediate Core Bond,single_stock,2732092928,0.0015,0.0407,"Le Franklin U.S. Core Bond Fund est un type de fonds commun de placement conçu pour offrir aux investisseurs une exposition au marché obligataire américain. Son objectif principal est de fournir un revenu stable tout en préservant le capital en investissant principalement dans un portefeuille diversifié d'obligations de qualité investissement. Ces obligations peuvent inclure des bons du Trésor américain, des obligations liées au gouvernement, des titres de créance d'entreprise et des obligation…",0.321,3.94,1.3,6.11,3y,6.11,21.9,2025-10-16T19:15:03.355Z,Financial Services,100,United States,100,"[{""s"":""Financial Services"",""w"":100}]","[{""c"":""United States"",""w"":100}]",INFXX (Institutional Fiduciary Trust Money Market Pt),"[{""t"":""INFXX"",""n"":""Institutional Fiduciary Trust Money Market Pt"",""w"":1.65}]",110
FLCO,Franklin Investment Grade Corporate ETF,,ARCX,USD,Corporate Bond,single_stock,612028416,0.0035,0.0443,"Le Franklin Investment Grade Corporate Fund est un fonds commun de placement conçu pour investir principalement dans des titres de créance d'entreprise de haute qualité. Sa fonction principale est de fournir aux investisseurs un portefeuille diversifié axé sur des obligations de qualité investissement, visant un équilibre entre revenu et préservation du capital. Ce fonds cible principalement des obligations d'entreprise notées BBB ou plus, qui sont considérées comme des investissements à risque…",0.274,4.27,1.15,7.06,3y,7.06,21.995,2025-10-16T19:15:03.840Z,Financial Services,100,United States,100,"[{""s"":""Financial Services"",""w"":100}]","[{""c"":""United States"",""w"":100}]",V (V),"[{""t"":""V"",""n"":""V"",""w"":100}]",110
FLDR,Fidelity Low Duration Bond ETF,,BATS,USD,Ultrashort Bond,single_stock,1043909888,0.0015,0.0482,"L'ETF Fidelity Low Duration Bond est un fonds négocié en bourse conçu pour offrir aux investisseurs une exposition à des titres à revenu fixe de haute qualité et à court terme. La fonction principale de cet ETF est de proposer une option d'investissement relativement stable qui recherche une combinaison de revenus et de préservation du capital. Avec un accent sur les obligations à faible durée, cet actif est structuré pour atténuer le risque de taux d'intérêt, attirant ainsi les investisseurs à…",0.05,0.91,0.53,1.82,3y,1.82,50.395,2025-10-16T19:15:04.289Z,Financial Services,100,United States,100,"[{""s"":""Financial Services"",""w"":100}]","[{""c"":""United States"",""w"":100}]",V (V),"[{""t"":""V"",""n"":""V"",""w"":100}]",110
FLGV,Franklin U.S. Treasury Bond ETF,,ARCX,USD,Intermediate Government,single_stock,1073914880,0.0009,0.0406,"Le Franklin U.S. Treasury Bond Fund est un véhicule d'investissement qui se concentre sur les titres du Trésor américain, offrant aux investisseurs une exposition au marché obligataire du gouvernement américain. La fonction principale de ce fonds est de fournir aux investisseurs une option d'investissement stable et sécurisée qui met l'accent sur la génération de revenus provenant des paiements d'intérêts tout en préservant le capital. Les titres du Trésor américain sont largement considérés co…",0.362,3.63,0.58,5.79,3y,5.79,20.82,2025-10-16T19:15:04.747Z,Financial Services,100,United States,100,"[{""s"":""Financial Services"",""w"":100}]","[{""c"":""United States"",""w"":100}]",INFXX (Institutional Fiduciary Trust Money Market Pt),"[{""t"":""INFXX"",""n"":""Institutional Fiduciary Trust Money Market Pt"",""w"":3.08}]",110
FLHY,Franklin High Yield Corporate Bond Fund,,BATS,USD,High Yield Bond,single_stock,634700416,0.004,0.0647,"Le Franklin High Yield Corporate Bond Fund est un fonds commun de placement qui investit principalement dans des obligations d'entreprises à haut rendement, offrant aux investisseurs une exposition à des instruments de dette émis par diverses entreprises. Ces obligations, souvent appelées ""junk bonds"", présentent un risque de défaut plus élevé par rapport aux obligations de qualité investissement, mais elles offrent également des rendements potentiels plus élevés sous forme de revenus d'intérêt…",-0.164,1.82,0.33,6.66,3y,6.66,24.345,2025-10-16T19:15:05.148Z,Healthcare,100,United States,,"[{""s"":""Healthcare"",""w"":100},{""s"":""Energy"",""w"":0},{""s"":""Real Estate"",""w"":0},{""s"":""Consumer Cyclical"",""w"":0},{""s"":""Basic Materials"",""w"":0}]","[{""c"":""United States"",""w"":null}]",,[],95
FLIA,Franklin International Aggregate Bond Fund,,BATS,USD,Global Bond-USD Hedged,single_stock,674088768,0.0025,0.0328,"Le Franklin International Aggregate Bond Fund est un véhicule d'investissement diversifié qui se concentre principalement sur les investissements à revenu fixe en dehors des États-Unis. Sa fonction principale est de fournir aux investisseurs une exposition aux marchés obligataires internationaux, offrant ainsi un degré de diversification géographique qui peut être crucial pour la gestion des risques et l'optimisation des rendements dans un portefeuille mondial. Le fonds vise à saisir des opport…",0.267,1.87,-0.05,9.31,3y,9.31,20.67,2025-10-16T19:15:05.761Z,Technology,100,United States,,"[{""s"":""Technology"",""w"":100},{""s"":""Consumer Cyclical"",""w"":0},{""s"":""Basic Materials"",""w"":0},{""s"":""Consumer Defensive"",""w"":0},{""s"":""Communication Services"",""w"":0}]","[{""c"":""United States"",""w"":null}]",,[],95
FLMI,Franklin Dynamic Municipal Bond ETF,,ARCX,USD,High Yield Muni,single_stock,983665536,0.003,0.0402,"Le Franklin Dynamic Municipal Bond Fund est un fonds commun de placement conçu pour investir principalement dans des obligations municipales émises par divers gouvernements d'État et locaux à travers les États-Unis. Sa fonction principale est de fournir un revenu exonéré d'impôt aux investisseurs, ce qui en fait une option attrayante pour les particuliers cherchant à optimiser leurs rendements après impôt. Ce fonds se distingue par son accent sur des stratégies de gestion active, visant à attei…",0.08,1.8,0.4,4.95,3y,4.95,24.91,2025-10-16T19:15:06.923Z,Financial Services,100,United States,100,"[{""s"":""Financial Services"",""w"":100}]","[{""c"":""United States"",""w"":100}]",V (V),"[{""t"":""V"",""n"":""V"",""w"":100}]",110
FLOT,iShares Floating Rate Bond ETF,,BATS,USD,Ultrashort Bond,single_stock,8918495232,0.0015,0.0506,"L'iShares Floating Rate Bond ETF est un type de fonds négocié en bourse axé sur l'exposition aux obligations à taux variable. Sa fonction principale est d'offrir aux investisseurs une protection contre les fluctuations des taux d'intérêt, grâce aux paiements d'intérêts ajustables liés aux mouvements des taux d'intérêt à court terme. Les obligations à taux variable réajustent leurs paiements de coupon régulièrement, généralement tous les trois mois, ce qui rend cet ETF attrayant dans un environn…",-0.02,0.04,0.04,2.52,3y,2.52,50.92,2025-10-16T19:15:07.290Z,Financial Services,100,United States,100,"[{""s"":""Financial Services"",""w"":100}]","[{""c"":""United States"",""w"":100}]",XTSLA (BlackRock Cash Funds Treasury SL Agency),"[{""t"":""XTSLA"",""n"":""BlackRock Cash Funds Treasury SL Agency"",""w"":1.14}]",110
FLRN,SPDR Bloomberg Investment Grade Floating Rate ETF,,ARCX,USD,Ultrashort Bond,single_stock,2688938496,0.0015,0.0505,"Le SPDR Bloomberg Investment Grade Floating Rate ETF est un fonds négocié en bourse qui offre aux investisseurs une exposition à un portefeuille d'obligations à taux variable. Sa fonction principale est de fournir un véhicule d'investissement diversifié et liquide qui aide à se couvrir contre les variations des taux d'intérêt, ce qui le rend particulièrement attrayant dans des environnements de taux fluctuants. Ces obligations sont généralement émises par des entreprises ayant des notations de …",0.016,0.11,0.02,2.46,3y,2.46,30.775,2025-10-16T19:15:07.743Z,Financial Services,100,United States,100,"[{""s"":""Financial Services"",""w"":100}]","[{""c"":""United States"",""w"":100}]",V (V),"[{""t"":""V"",""n"":""V"",""w"":100}]",110
FLRT,Pacer Pacific Asset Floating Rate High Income ETF,,ARCX,USD,Bank Loan,single_stock,572779200,0.006,0.0688,"Le Pacer Pacific Asset Floating Rate ETF est un fonds négocié en bourse qui se concentre principalement sur l'investissement dans des prêts à taux variable et des instruments financiers similaires. Sa fonction principale est de fournir aux investisseurs une exposition à ce segment de niche du marché de la dette, qui peut offrir des avantages potentiels tels qu'une réduction du risque de taux d'intérêt. Ces types de prêts ont généralement des taux d'intérêt variables qui s'ajustent en fonction d…",0,-0.57,-0.87,3.14,3y,3.14,47.28,2025-10-16T19:15:08.162Z,Financial Services,99.19,United States,,"[{""s"":""Financial Services"",""w"":99.19},{""s"":""Communication Services"",""w"":0.4},{""s"":""Technology"",""w"":0.4},{""s"":""Consumer Defensive"",""w"":0},{""s"":""Utilities"",""w"":0}]","[{""c"":""United States"",""w"":null}]",,[],95
FLTB,Fidelity Limited Term Bond ETF,,ARCX,USD,Short-Term Bond,single_stock,270457568,0.0025,0.043,"L'ETF Fidelity Limited Term Bond est un fonds négocié en bourse qui investit principalement dans des titres à revenu fixe à courte durée. Son objectif est de fournir aux investisseurs un revenu mensuel, ainsi qu'un potentiel d'appréciation du capital. Cet ETF se concentre sur des obligations de qualité d'investissement avec des maturités relativement courtes, généralement comprises entre 1 et 5 ans. En ciblant des obligations à terme limité, le fonds connaît généralement un risque de taux d'int…",0.079,2.35,1.4,3.02,3y,3.02,50.83,2025-10-16T19:15:08.566Z,Energy,100,United States,,"[{""s"":""Energy"",""w"":100},{""s"":""Consumer Cyclical"",""w"":0},{""s"":""Basic Materials"",""w"":0},{""s"":""Consumer Defensive"",""w"":0},{""s"":""Technology"",""w"":0}]","[{""c"":""United States"",""w"":null}]",,[],95
FLTR,VanEck IG Floating Rate ETF,,ARCX,USD,Ultrashort Bond,single_stock,2571290624,0.0014,0.0516,"Le VanEck Investment Grade Floating Rate ETF est un fonds négocié en bourse principalement conçu pour suivre la performance des billets à taux flottant de qualité investissement émis par des émetteurs de crédit corporatif. Sa fonction principale est de fournir aux investisseurs une exposition à un portefeuille diversifié de titres à taux flottant, qui ajustent généralement leurs taux d'intérêt en fonction des conditions de marché prévalentes. Cette caractéristique aide à atténuer le risque de t…",0.039,0.2,0.24,2.81,3y,2.81,25.5,2025-10-16T19:15:08.964Z,Financial Services,100,United States,100,"[{""s"":""Financial Services"",""w"":100}]","[{""c"":""United States"",""w"":100}]",V (V),"[{""t"":""V"",""n"":""V"",""w"":100}]",110
FMB,First Trust Managed Municipal Fund,,XNMS,USD,Muni National Interm,single_stock,1896103936,0.0065,0.0335,"Le First Trust Managed Municipal Fund est un type de fonds négocié en bourse (ETF) géré activement qui se spécialise dans les obligations municipales. Les obligations municipales sont des titres de créance émis par des États, des villes, des comtés et d'autres entités gouvernementales pour financer des projets publics tels que des écoles, des autoroutes et des améliorations d'infrastructure. La fonction principale de ce fonds est de fournir aux investisseurs un revenu exonéré d'impôt provenant …",0.254,0.27,-0.66,4.21,3y,4.21,51.24,2025-10-16T19:15:09.348Z,Financial Services,100,United States,100,"[{""s"":""Financial Services"",""w"":100}]","[{""c"":""United States"",""w"":100}]",MA (MA),"[{""t"":""MA"",""n"":""MA"",""w"":100}]",110
FMHI,First Trust Municipal High Income Fund,,XNMS,USD,High Yield Muni,single_stock,795064960,0.007,0.0416,"Le First Trust Municipal High Income Fund est un fonds négocié en bourse (ETF) géré activement, conçu pour fournir aux investisseurs un revenu courant élevé en se concentrant sur des titres municipaux exonérés d'impôts. Le fonds investit principalement dans des obligations de dette municipale émises par des gouvernements d'État et locaux pour financer des projets tels que des écoles, des autoroutes et des améliorations d'infrastructure, offrant un revenu généralement exonéré d'impôts fédéraux s…",0.334,-0.49,-1.96,5.37,3y,5.37,48.13,2025-10-16T19:15:09.705Z,Financial Services,100,United States,100,"[{""s"":""Financial Services"",""w"":100}]","[{""c"":""United States"",""w"":100}]",V (V),"[{""t"":""V"",""n"":""V"",""w"":100}]",110
FSEC,Fidelity Investment Grade Securitized ETF,,ARCX,USD,Intermediate Core Bond,single_stock,4160418304,0.0036,0.0351,"Le Fidelity Investment Grade Securitization Fund est un fonds commun de placement à revenu fixe conçu pour offrir aux investisseurs une exposition à un portefeuille diversifié d'actifs titrisés. La fonction principale du fonds est de générer un revenu stable grâce à des investissements dans des titres adossés à des actifs (ABS), des titres adossés à des hypothèques (MBS) et d'autres instruments connexes qui détiennent des notations de qualité investissement, indiquant un risque de défaut plus f…",0.202,4.9,2.71,7.94,3y,7.94,44.7,2025-10-16T19:15:10.256Z,Financial Services,100,United States,100,"[{""s"":""Financial Services"",""w"":100}]","[{""c"":""United States"",""w"":100}]",V (V),"[{""t"":""V"",""n"":""V"",""w"":100}]",110
FSMB,First Trust Short Duration Managed Municipal ETF,,ARCX,USD,Muni National Short,inverse,487614176,0.0055,0.0305,"Le First Trust Short Duration Managed Municipal Fund est un type de fonds négocié en bourse (ETF) qui se concentre sur la fourniture aux investisseurs d'une exposition à un portefeuille diversifié d'obligations municipales. Ces obligations sont des titres de créance émis par des États, des municipalités ou des comtés américains pour financer des projets publics tels que des écoles, des autoroutes et des hôpitaux. La fonction principale de ce fonds est d'offrir aux investisseurs un revenu généra…",0.249,1.33,0.65,2.27,3y,2.27,20.12,2025-10-16T19:15:10.745Z,,,United States,,[],"[{""c"":""United States"",""w"":null}]",,[],77
FSYD,Fidelity Sustainable High Yield ETF,,ARCX,USD,High Yield Bond,single_stock,62979496,0.0056,0.0658,"L'ETF Fidelity Sustainable High Yield est un fonds négocié en bourse qui se concentre sur l'investissement dans des obligations à haut rendement tout en respectant des critères de durabilité. Il vise principalement à fournir aux investisseurs un niveau de revenu élevé en investissant dans un portefeuille diversifié d'obligations de qualité inférieure émises par des entreprises qui démontrent des caractéristiques environnementales, sociales et de gouvernance (ESG) positives. Cet ETF est conçu po…",-0.226,2.13,0.73,7.17,3y,7.17,48.47,2025-10-16T19:15:11.252Z,Communication Services,36.71,United States,,"[{""s"":""Communication Services"",""w"":36.71},{""s"":""Technology"",""w"":33.31},{""s"":""Healthcare"",""w"":16.43},{""s"":""Financial Services"",""w"":8.37},{""s"":""Consumer Cyclical"",""w"":2.89}]","[{""c"":""United States"",""w"":null}]",,[],95
FTCB,First Trust Core Investment Grade ETF,,ARCX,USD,Intermediate Core Bond,single_stock,1450943488,0.0055,0.0473,"FT Core Investment Grade ETF est un fonds négocié en bourse (ETF) qui se concentre principalement sur l'investissement dans un portefeuille diversifié de titres à revenu fixe de qualité investissement. Son objectif principal est d'offrir aux investisseurs une exposition à un segment stable et de haute qualité de crédit du marché obligataire, visant à fournir des rendements ajustés au risque attrayants tout en minimisant l'exposition au risque de crédit. Cet ETF investit dans un mélange d'obliga…",0.232,4.35,1.58,5.6,1y,,21.57,2025-10-16T19:15:11.701Z,Financial Services,100,United States,100,"[{""s"":""Financial Services"",""w"":100}]","[{""c"":""United States"",""w"":100}]","MISXX (Morgan Stanley Insti Liquidity Fds, Treasury Portf Instit Class)","[{""t"":""MISXX"",""n"":""Morgan Stanley Insti Liquidity Fds, Treasury Portf Instit Class"",""w"":1.25}]",110
FTRB,Federated Hermes Total Return Bond ETF,,ARCX,USD,Intermediate Core-Plus Bond,single_stock,336781088,0.0039,0.045,"Le Fonds Obligataire Total Return de Federated Hermes est un fonds commun de placement obligataire géré activement qui vise à générer un rendement total en investissant principalement dans un portefeuille diversifié de titres à revenu fixe. La fonction principale du fonds est de fournir aux investisseurs un mélange équilibré de revenus et de potentiel d'appréciation du capital, réalisé en s'appuyant sur une expertise des marchés obligataires. Il investit principalement dans une variété d'obliga…",0.211,3.89,0.95,5.04,1y,,25.63,2025-10-16T19:15:12.047Z,Energy,82.09,United States,,"[{""s"":""Energy"",""w"":82.09},{""s"":""Consumer Defensive"",""w"":17.91},{""s"":""Basic Materials"",""w"":0},{""s"":""Technology"",""w"":0},{""s"":""Communication Services"",""w"":0}]","[{""c"":""United States"",""w"":null}]",MBB (iShares MBS ETF),"[{""t"":""MBB"",""n"":""iShares MBS ETF"",""w"":5.75},{""t"":""VMBS"",""n"":""Vanguard Mortgage-Backed Securities Fund"",""w"":2.69}]",110
FTSD,Franklin Short Duration U.S. Government ETF,,ARCX,USD,Short Government,inverse,245996192,0.0025,0.0463,"Le Franklin Short Duration U.S. Government Bond Fund est un fonds commun de placement qui se concentre sur l'offre d'une exposition aux obligations gouvernementales à court terme. Son objectif principal est de fournir un revenu relativement stable tout en préservant le capital. Ce fonds investit principalement dans des titres émis par le Trésor américain et d'autres agences gouvernementales, ce qui en fait un choix approprié pour ceux qui recherchent des rendements modérés avec un risque plus f…",0.033,0.89,0.42,2.27,3y,2.27,91.03,2025-10-16T19:15:12.396Z,,,United States,,[],"[{""c"":""United States"",""w"":null}]",INFXX (Institutional Fiduciary Trust Money Market Pt),"[{""t"":""INFXX"",""n"":""Institutional Fiduciary Trust Money Market Pt"",""w"":10.52}]",92
FTSL,First Trust Senior Loan ETF,,XNMS,USD,Bank Loan,single_stock,2409584128,0.0086,0.0685,"Le First Trust Senior Loan ETF est un type de fonds négocié en bourse offrant une exposition à un portefeuille diversifié de prêts senior. Ces instruments financiers sont communément appelés prêts à effet de levier, prêts senior garantis ou prêts bancaires à taux variable, et ils représentent une classe d'actifs distincte au sein du secteur des revenus fixes. La fonction principale de cet ETF est de générer un revenu généralement supérieur à celui des obligations traditionnelles, en raison du r…",-0.153,-1.06,-1.04,3.66,3y,3.66,45.74,2025-10-16T19:15:12.922Z,Basic Materials,100,United States,,"[{""s"":""Basic Materials"",""w"":100},{""s"":""Consumer Defensive"",""w"":0},{""s"":""Technology"",""w"":0},{""s"":""Financial Services"",""w"":0},{""s"":""Utilities"",""w"":0}]","[{""c"":""United States"",""w"":null}]","MISXX (Morgan Stanley Insti Liquidity Fds, Treasury Portf Instit Class)","[{""t"":""MISXX"",""n"":""Morgan Stanley Insti Liquidity Fds, Treasury Portf Instit Class"",""w"":5.69}]",110
FTSM,First Trust Enhanced Short Maturity Fund,,XNMS,USD,Ultrashort Bond,inverse,6173734400,0.0044,0.0444,"Le First Trust Enhanced Short Maturity Fund est un fonds négocié en bourse (ETF) géré activement qui cherche principalement à fournir un revenu courant tout en maintenant un haut degré de liquidité. Le fonds investit dans un portefeuille diversifié de titres à revenu fixe de courte durée et de haute qualité, qui comprend des instruments tels que des billets de trésorerie, des obligations d'entreprise, des obligations bancaires et des titres adossés à des actifs. Il est particulièrement conçu po…",0.058,0.44,0.19,1.36,3y,1.36,60.065,2025-10-16T19:15:13.292Z,Real Estate,100,United States,,"[{""s"":""Real Estate"",""w"":100},{""s"":""Consumer Cyclical"",""w"":0},{""s"":""Basic Materials"",""w"":0},{""s"":""Consumer Defensive"",""w"":0},{""s"":""Technology"",""w"":0}]","[{""c"":""United States"",""w"":null}]",,[],95
FUMB,First Trust Ultra Short Duration Municipal ETF,,ARCX,USD,Muni National Short,inverse,223104688,0.0045,0.0298,"Le First Trust Ultra Short Duration Bond Fund est un fonds négocié en bourse (ETF) qui se concentre sur la fourniture d'une stratégie d'investissement obligataire à faible durée. Sa fonction principale est d'offrir aux investisseurs une option de préservation du capital avec un potentiel de génération de revenus, tout en minimisant le risque de taux d'intérêt. Le fonds atteint cet objectif en investissant dans un portefeuille diversifié de titres à revenu fixe qui ont généralement des maturités…",0,0.15,0,1.5,3y,1.5,20.1,2025-10-16T19:15:13.633Z,,,United States,,[],"[{""c"":""United States"",""w"":null}]",,[],77
GBIL,Goldman Sachs Access Treasury 0-1 Year ETF,,ARCX,USD,Ultrashort Bond,single_stock,6346962432,0.0012,0.0426,"L'ETF Goldman Sachs Access Treasury est un fonds négocié en bourse qui cherche à offrir des rendements correspondant étroitement à la performance des titres du Trésor américain à courtes durées. Sa fonction principale est de fournir aux investisseurs une exposition à des obligations de haute qualité, émises par le gouvernement, généralement avec des échéances d'un an ou moins, offrant ainsi une option d'investissement relativement stable. Cet ETF intéresse particulièrement les particuliers et l…",0.03,0.22,0.05,1.52,3y,1.52,100.07,2025-10-16T19:15:14.147Z,Financial Services,100,United States,100,"[{""s"":""Financial Services"",""w"":100}]","[{""c"":""United States"",""w"":100}]",MA (MA),"[{""t"":""MA"",""n"":""MA"",""w"":100}]",110
GCOR,Goldman Sachs Access U.S. Aggregate Bond ETF,,ARCX,USD,Intermediate Core Bond,single_stock,655723520,0.0008,0.0408,"Le Goldman Sachs Access US Aggregate Bond Fund est un type de fonds négocié en bourse (ETF) qui vise principalement à offrir aux investisseurs une exposition diversifiée au marché obligataire américain. Sa fonction principale est de fournir un accès à un large éventail d'obligations de qualité investissement, englobant divers secteurs, y compris les bons du Trésor américain, les obligations liées au gouvernement, les obligations d'entreprise et les titres adossés à des créances hypothécaires. C…",0.303,4.16,1.37,6.26,3y,6.26,42.03,2025-10-16T19:15:14.516Z,Financial Services,100,United States,100,"[{""s"":""Financial Services"",""w"":100}]","[{""c"":""United States"",""w"":100}]",FGTXX (Financial Square Government Fund FST Shares),"[{""t"":""FGTXX"",""n"":""Financial Square Government Fund FST Shares"",""w"":9.3}]",110
GHYG,iShares U.S. & International High Yield Corporate Bond ETF,,BATS,USD,High Yield Bond,single_stock,194668240,0.004,0.0596,"L'iShares U.S. & International High Yield Corporate Bond ETF est un fonds négocié en bourse qui investit principalement dans des obligations d'entreprises à haut rendement ou ""junk"" provenant des États-Unis et des marchés internationaux. Cet ETF vise à suivre la performance de l'indice Markit iBoxx Global Developed Markets High Yield. Les obligations à haut rendement sont connues pour offrir un potentiel de revenu plus élevé par rapport aux obligations traditionnelles, bien qu'avec un risque ac…",0.687,4.57,2.21,7.24,3y,7.24,46.0946,2025-10-16T19:15:14.869Z,Utilities,99.47,United States,,"[{""s"":""Utilities"",""w"":99.47},{""s"":""Real Estate"",""w"":0.53},{""s"":""Basic Materials"",""w"":0},{""s"":""Consumer Defensive"",""w"":0},{""s"":""Technology"",""w"":0}]","[{""c"":""United States"",""w"":null}]",XTSLA (BlackRock Cash Funds Treasury SL Agency),"[{""t"":""XTSLA"",""n"":""BlackRock Cash Funds Treasury SL Agency"",""w"":1.08}]",110
GIGB,Goldman Sachs Access Investment Grade Corporate Bond ETF,,ARCX,USD,Corporate Bond,single_stock,683949312,0.0008,0.0461,Le Fonds d'Obligations d'Entreprises de Qualité Investment Grade de Goldman Sachs est un type de fonds commun de placement axé sur la fourniture d'une exposition aux obligations d'entreprises de qualité investissement. La fonction principale de ce fonds est d'atteindre un équilibre entre la génération de revenus et la préservation du capital en investissant dans des instruments de dette d'entreprise de haute qualité. Les obligations de qualité investissement sont celles notées BBB- ou plus par …,0.277,4.12,1.01,7.24,3y,7.24,46.98,2025-10-16T19:15:15.287Z,Financial Services,100,United States,100,"[{""s"":""Financial Services"",""w"":100}]","[{""c"":""United States"",""w"":100}]",FGTXX (Financial Square Government Fund FST Shares),"[{""t"":""FGTXX"",""n"":""Financial Square Government Fund FST Shares"",""w"":0.89}]",110
GMMF,iShares Government Money Market ETF,,ARCX,USD,,single_stock,76376656,0.002,,"L'iShares Government Money Market ETF est un type de fonds négocié en bourse qui investit principalement dans des titres gouvernementaux de haute qualité à court terme. Sa fonction principale est de fournir sécurité et liquidité aux investisseurs recherchant une option stable pour gérer leurs investissements en espèces. Notable pour son accent sur les actifs garantis par le gouvernement, cet ETF inclut généralement des bons du Trésor américain, des obligations et d'autres engagements gouverneme…",0.005,0.33,0.33,1.05,SI,,100.365,2025-10-16T19:15:15.603Z,Financial Services,100,United States,100,"[{""s"":""Financial Services"",""w"":100}]","[{""c"":""United States"",""w"":100}]",V (V),"[{""t"":""V"",""n"":""V"",""w"":100}]",100
