symbol,name,daily_change_pct,ytd_return_pct,one_year_return_pct,vol_pct,vol_window,vol_3y_pct,last_close,as_of
GEM,Goldman Sachs ActiveBeta Emerging Markets Equity ETF,-0.106,33.29,24.57,15.74,3y,15.74,42.44,2025-11-12T19:17:00.673Z
GGLL,Direxion Daily GOOGL Bull 2x Shares,-3.51,87.56,102.38,54.07,3y,54.07,85.77,2025-11-12T19:17:01.153Z
GGLS,Direxion Daily GOOGL Bear 1X Shares,1.894,-38.18,-42.78,30.6,3y,30.6,7.53,2025-11-12T19:17:01.736Z
GII,SPDR S&P Global Infrastructure ETF,0.681,18.78,15.29,13.63,3y,13.63,70.96,2025-11-12T19:17:02.834Z
GJUL,FT Vest US Equity Moderate Class B,0.044,11.61,11.26,10.31,1y,,40.88,2025-11-12T19:17:03.270Z
GLD,SPDR Gold Shares,1.664,57.36,55.75,16.17,3y,16.17,386.19,2025-11-12T19:17:04.637Z
GLDB,IDX Alternative FIAT ETF,-1.263,-2.37,-5.88,26.46,3y,26.46,23.92,2025-11-12T19:17:05.097Z
GLDM,SPDR Gold MiniShares Trust,1.859,58.04,56.49,16.1,3y,16.1,83.27,2025-11-12T19:17:05.509Z
GLL,ProShares UltraShort Gold,-3.789,-60.01,-59.12,32.4,3y,32.4,13.71,2025-11-12T19:17:05.947Z
GLOV,Goldman Sachs ActiveBeta World Low Volatility Portfolio,0.227,16.21,12.06,11.06,3y,11.06,57.445,2025-11-12T19:17:06.337Z
GLTR,abrdn Physical Precious Metals Basket Shares ETF,2.729,64.13,59.88,18.73,3y,18.73,183.3,2025-11-12T19:17:07.570Z
GNR,SPDR S&P Global Natural Resources ETF,0.81,21.71,9.83,18.04,3y,18.04,61,2025-11-12T19:17:08.669Z
GOAU,U.S. Global GO GOLD and Precious Metal Miners ETF,4.517,105.01,85.7,33.49,3y,33.49,40.49,2025-11-12T19:17:09.042Z
GOCT,FT Vest US Equity Moderate Fund,0.103,11.64,11.17,10.06,1y,,39.03,2025-11-12T19:17:09.503Z
GOEX,Global X Gold Explorers ETF,4.399,137.26,121.31,36.25,3y,36.25,73.1,2025-11-12T19:17:09.971Z
GOOX,T-Rex 2x LNG Alphabet Daily,-3.17,89.99,79.57,66.2,1y,,60.17,2025-11-12T19:17:10.380Z
GOOY,YieldMax GOOGL Option Income Strategy ETF,-1.025,-2.62,-5.29,29.01,1y,,14.49,2025-11-12T19:17:10.876Z
GOVI,Invesco Equal Weight 0-30 Yr GovI Mutual Fund,0.25,3.74,0.54,9.99,3y,9.99,28.05,2025-11-12T19:17:11.918Z
GPIQ,Nasdaq 100 Core Premium Income ETF,-0.188,8.68,7.74,21.01,1y,,53.2,2025-11-12T19:17:12.704Z
GPIX,S&P 500 Core Premium Income Fund,0,6.95,5.1,17.56,1y,,52.77,2025-11-12T19:17:13.190Z
GPTY,YieldMax AI & Tech Portfolio Option Income ETF,-1.067,-8.4,-8.4,31.1,1y,,45.88,2025-11-12T19:17:13.524Z
GREK,Global X MSCI Greece ETF,0.959,65.23,59.21,22.02,3y,22.02,64.24,2025-11-12T19:17:13.914Z
GRID,First Trust NASDAQ Clean Edge Smart Grid Infrastructure Index Fund,0.354,31.03,23.34,18.75,3y,18.75,156.12,2025-11-12T19:17:14.305Z
GRNY,Fundstrat Granny Shots US Large Cap ETF,0.039,27.98,24.41,25.19,1y,,25.48,2025-11-12T19:17:14.744Z
GRPM,Invesco S&P MidCap 400 GARP ETF,0.168,5.68,-2.36,20.58,3y,20.58,119.39,2025-11-12T19:17:15.145Z
GSEP,FT Vest US Equity Moderate B Fund,0.026,9.68,9.48,9.9,1y,,38.45,2025-11-12T19:17:16.014Z
GSEW,Goldman Sachs Equal Weight U.S. Large Cap Equity ETF,0.295,10.4,5.4,15,3y,15,85.12,2025-11-12T19:17:17.118Z
GSG,iShares S&P GSCI Commodity-Indexed Trust,-1.65,5.68,9.52,17.7,3y,17.7,23.24,2025-11-12T19:17:17.630Z
GSIE,Goldman Sachs ActiveBeta International Equity ETF,0.691,27.2,22.34,14.26,3y,14.26,42.28,2025-11-12T19:17:18.062Z
GSLC,Goldman Sachs ActiveBeta U.S. Large Cap Equity ETF,0.166,15.06,11.93,15.09,3y,15.09,132.38,2025-11-12T19:17:19.542Z
GSSC,Goldman Sachs ActiveBeta U.S. Small Cap Equity ETF,0.255,8.31,-0.03,20.62,3y,20.62,74.71,2025-11-12T19:17:20.413Z
GSUS,Goldman Sachs MarketBeta U.S.,0.074,17.52,15.05,15.4,3y,15.4,94.72,2025-11-12T19:17:21.216Z
GUNR,FlexShares Morningstar Global Upstream Natural Resources Index Fund,0.615,22.66,13.12,16.6,3y,16.6,44.955,2025-11-12T19:17:21.780Z
GUSH,Direxion Daily S&P Oil & Gas Exploration & Production Bull 2X Shares,-2.647,-15.85,-22.81,58.75,3y,58.75,24.27,2025-11-12T19:17:22.173Z
GVAL,Cambria Global Value ETF,0.533,50.44,45.37,17.53,3y,17.53,31.11,2025-11-12T19:17:22.539Z
GVIP,Goldman Sachs Hedge Industry VIP ETF,-0.783,23.32,21.93,18.73,3y,18.73,154.351,2025-11-12T19:17:22.923Z
GWX,SPDR S&P International Small Cap ETF,-0.05,28.38,21.83,14.99,3y,14.99,39.85,2025-11-12T19:17:23.305Z
GXC,SPDR S&P China ETF,-0.145,38.35,28.19,27.56,3y,27.56,103,2025-11-12T19:17:23.831Z
HACK,Amplify Cybersecurity ETF,-1.004,15.74,16.34,21.3,3y,21.3,86.275,2025-11-12T19:17:24.510Z
HAUZ,Xtrackers International Real Estate ETF,0.339,20.16,10.2,15.46,3y,15.46,23.66,2025-11-12T19:17:24.902Z
HCMT,Direxion HCM Tactical Enhanced US ETF,0.165,7.94,3.41,32.08,1y,,39.43,2025-11-12T19:17:25.256Z
HDEF,Xtrackers MSCI EAFE High Dividend Yield Equity ETF,0.361,26.29,21,13.57,3y,13.57,30.6,2025-11-12T19:17:25.685Z
HDGE,AdvisorShares Ranger Equity Bear ETF,-0.767,2.81,-2.89,23.87,3y,23.87,16.83,2025-11-12T19:17:26.112Z
HDV,iShares Core High Dividend ETF,0.23,8.59,1.85,12.15,3y,12.15,121.93,2025-11-12T19:17:26.913Z
HEDJ,WisdomTree Europe Hedged Equity Fund,0.867,20.93,21.34,15.44,3y,15.44,52.905,2025-11-12T19:17:28.310Z
HEFA,iShares Currency Hedged MSCI EAFE ETF,0.747,19.96,19.31,17.16,3y,17.16,41.83,2025-11-12T19:17:29.385Z
HEGD,Swan Hedged Equity US Large Cap Fund,0.079,13.48,11.62,8.77,3y,8.77,25.45,2025-11-12T19:17:29.838Z
HELO,JPMorgan Hedged Equity Laddered Overlay ETF,0.091,6.45,4.91,8.94,1y,,65.87,2025-11-12T19:17:30.202Z
HEQT,Simplify Hedged Equity ETF,0,8.25,7.3,8.57,3y,8.57,31.88,2025-11-12T19:17:30.604Z
HEWJ,iShares Currency Hedged MSCI Japan ETF,1.117,27.27,27.69,29.25,3y,29.25,54.32,2025-11-12T19:17:30.988Z
HEZU,iShares Currency Hedged MSCI Eurozone ETF,0.872,22.19,23.43,17.63,3y,17.63,43.94,2025-11-12T19:17:31.352Z
HFXI,New York Life Investments FTSE International Equity Currency Neutral ETF,0.584,25.46,20.96,13.34,3y,13.34,32.72,2025-11-12T19:17:33.004Z
HGER,Harbor Commodity All-Weather Fund,-0.737,20.45,18.33,13.8,3y,13.8,26.92,2025-11-12T19:17:33.484Z
HHH,Howard Hughes Holdings Inc.,-0.723,16.79,4.84,29.1,3y,29.1,88.535,2025-11-12T19:17:34.083Z
HIBL,Direxion Daily S&P 500 High Beta Bull 3X Shares,1.724,51.87,31.15,75.49,3y,75.49,63.74,2025-11-12T19:17:34.474Z
HIBS,Direxion Daily S&P 500 High Beta Bear 3X Shares,-1.913,-70.39,-67.46,77.89,3y,77.89,5.64,2025-11-12T19:17:35.724Z
HIGH,Simplify Enhanced Income ETF,-0.388,0.3,-2.07,10.18,3y,10.18,23.13,2025-11-12T19:17:37.166Z
HLAL,Wahed FTSE USA Shariah ETF,-0.315,17.24,15.84,16.21,3y,16.21,61.35,2025-11-12T19:17:37.544Z
HMOP,Hartford Municipal Opportunities ETF,-0.076,1.53,1.41,4.19,3y,4.19,39.22,2025-11-12T19:17:37.983Z
HNDL,NASDAQ 7 Handl Index ETF,0.125,5.06,1.22,10.8,3y,10.8,22.43,2025-11-12T19:17:38.368Z
HODL,VanEck Bitcoin ETF,2.168,7.75,36.77,44.28,1y,,29.69,2025-11-12T19:17:38.738Z
HSUN,Hartford Strategic Income ETF,0.056,4.09,2.69,5.34,3y,5.34,35.73,2025-11-12T19:17:39.891Z
HYBL,SPDR Blackstone High Income Fund,-0.14,0.18,-0.28,4.78,3y,4.78,28.48,2025-11-12T19:17:40.293Z
HYDR,Global X Hydrogen ETF,-1.69,77.65,98.94,43.24,3y,43.24,43.17,2025-11-12T19:17:40.669Z
HYGV,FlexShares High Yield Value-Scored Bond Index Fund,-0.159,-0.04,-1.58,6.91,3y,6.91,40.745,2025-11-12T19:17:41.030Z
HYGW,iShares High Yield Corporate Bond BuyWrite ETF,-0.133,-5.44,-7.71,5.77,3y,5.77,30.06,2025-11-12T19:17:41.411Z
IAI,iShares U.S. Broker-Dealers & Securities Exchanges ETF,1.295,24.04,22.77,19.97,3y,19.97,179.17,2025-11-12T19:17:41.766Z
IAK,iShares U.S. Insurance ETF,0.953,6.23,1.58,17.5,3y,17.5,133.54,2025-11-12T19:17:42.124Z
IAT,iShares U.S. Regional Banks ETF,0.553,1.7,-5.2,30.65,3y,30.65,50.87,2025-11-12T19:17:42.482Z
IAU,iShares Gold Trust,1.658,57.58,56,16.12,3y,16.12,79.09,2025-11-12T19:17:42.815Z
IAUM,iShares Gold Trust Micro,1.907,58.16,56.57,16.05,3y,16.05,41.945,2025-11-12T19:17:43.213Z
IBB,iShares Biotechnology ETF,0.548,24.17,10.88,19.42,3y,19.42,165.04,2025-11-12T19:17:43.606Z
IBCA,iShares iBonds Dec 2035 Term Corporate ETF,-0.15,159.81,159.81,114.8,SI,,25.981,2025-11-12T19:17:43.904Z
IBIT,iShares Bitcoin Trust,-1.525,3.77,31.52,44.88,1y,,57.46,2025-11-12T19:17:44.241Z
IBLC,iShares Blockchain and Tech ETF,-3.254,50.09,35.05,61.74,3y,61.74,52.62,2025-11-12T19:17:44.617Z
IBTO,iShares iBonds Dec 2033 Term Treasury ETF,0.081,4.56,2.65,5.93,1y,,24.75,2025-11-12T19:17:45.462Z
ICF,iShares Cohen & Steers Realty Majors ETF,-0.323,3.34,-4.46,18.23,3y,18.23,61.64,2025-11-12T19:17:45.841Z
ICLN,iShares Global Clean Energy ETF,-0.901,51.72,42.16,23.96,3y,23.96,17.6,2025-11-12T19:17:46.176Z
ICOI,Bitwise COIN Option Income Strategy ETF,-0.34,-42.55,-42.55,59.54,SI,,26.35,2025-11-12T19:17:46.469Z
ICOP,iShares Copper and Metals Mining ETF,1.954,54.61,35.37,31.97,1y,,39.92,2025-11-12T19:17:46.853Z
ICOW,Pacer Developed Markets International ETF,0.389,32.54,28.11,15.41,3y,15.41,38.74,2025-11-12T19:17:47.220Z
IDEV,iShares Core MSCI International Developed Markets ETF,0.74,28.13,22.06,14.52,3y,14.52,82.415,2025-11-12T19:17:47.609Z
IDHQ,Invesco S&P International Developed Quality ETF,-0.114,23.44,17.81,14.78,3y,14.78,34.92,2025-11-12T19:17:47.951Z
IDMO,Invesco S&P International Developed Momentum ETF,0.702,36.12,32.09,15.89,3y,15.89,55.265,2025-11-12T19:17:48.315Z
IDRV,iShares Self-Driving EV and Tech ETF,-1.267,33.49,27.52,27.29,3y,27.29,38.74,2025-11-12T19:17:48.846Z
IDU,iShares U.S. Utilities ETF,0.116,16.49,13.54,15.79,3y,15.79,112.62,2025-11-12T19:17:49.896Z
IDV,iShares International Select Dividend ETF,0.561,41.01,35.41,14.61,3y,14.61,38.565,2025-11-12T19:17:50.317Z
IDVO,Amplify CWP International Enhanced Dividend Income ETF,0.418,27.93,24.77,15.1,3y,15.1,38.43,2025-11-12T19:17:51.505Z
IEFA,iShares Core MSCI EAFE ETF,0.593,28.18,21.79,14.76,3y,14.76,89.89,2025-11-12T19:17:53.441Z
IEMG,iShares Core MSCI Emerging Markets ETF,-0.015,31.38,22.68,16.28,3y,16.28,68.49,2025-11-12T19:17:53.869Z
IEO,iShares U.S. Oil & Gas Exploration & Production ETF,-0.86,2.5,-3.69,26.56,3y,26.56,93.43,2025-11-12T19:17:54.245Z
IETC,iShares U.S. Tech Independence Fund,-0.681,21.39,23.68,22.01,3y,22.01,103.57,2025-11-12T19:17:54.588Z
IEUR,iShares Core MSCI Europe ETF,0.544,30.45,23.69,15.36,3y,15.36,70.18,2025-11-12T19:17:54.960Z
IEV,iShares Europe ETF,0.668,30.71,24.68,15.14,3y,15.14,67.8,2025-11-12T19:17:55.414Z
IEZ,iShares U.S. Oil Equipment & Services ETF,-3.124,1.64,-4.21,32.54,3y,32.54,20.47,2025-11-12T19:17:55.771Z
IFRA,iShares U.S. Infrastructure ETF,0.608,14.63,5.83,16.86,3y,16.86,52.98,2025-11-12T19:17:56.873Z
IGE,iShares North American Natural Resources ETF,0.142,14.16,6.3,19.67,3y,19.67,49.42,2025-11-12T19:17:57.233Z
IGF,iShares Global Infrastructure ETF,0.112,18.53,15.4,13.4,3y,13.4,62.43,2025-11-12T19:17:57.784Z
IGM,iShares Expanded Tech Sector ETF,-0.191,27.98,28.22,23.5,3y,23.5,130.87,2025-11-12T19:17:58.185Z
IGPT,Invesco AI and Next Gen Software ETF,0.646,31.6,25.75,24.81,3y,24.81,59.995,2025-11-12T19:17:58.579Z
IGRO,iShares International Dividend Growth ETF,0.599,19.62,14.42,12.87,3y,12.87,81.475,2025-11-12T19:17:58.938Z
IGV,iShares Expanded Tech-Software Sector ETF,-1.207,9.79,8.35,23.49,3y,23.49,109.69,2025-11-12T19:17:59.300Z
IHAK,iShares Cybersecurity and Tech ETF,-1.038,5.68,1.26,20.33,3y,20.33,51.5,2025-11-12T19:17:59.670Z
IHDG,WisdomTree International Hedged Quality Dividend Growth Fund,0.617,10.02,8.63,14.44,3y,14.44,48.145,2025-11-12T19:18:00.705Z
IHE,iShares U.S. Pharmaceuticals ETF,0.977,22.8,15.11,15.9,3y,15.9,80.58,2025-11-12T19:18:02.558Z
IHF,iShares U.S. Healthcare Providers ETF,1.861,2.99,-9.99,18.35,3y,18.35,49.27,2025-11-12T19:18:02.959Z
IHI,iShares U.S. Medical Devices ETF,0.847,8.18,4.91,17,3y,17,63.09,2025-11-12T19:18:03.366Z
IJH,iShares Core S&P Mid-Cap ETF,0.291,5.42,-0.62,18.44,3y,18.44,65.52,2025-11-12T19:18:04.550Z
IJJ,iShares S&P Mid-Cap 400 Value ETF,0.411,4.38,-1.38,18.86,3y,18.86,129.63,2025-11-12T19:18:04.942Z
IJK,iShares S&P Mid-Cap 400 Growth ETF,0.332,6.27,0.05,18.68,3y,18.68,96.77,2025-11-12T19:18:05.322Z
IJR,iShares Core S&P Small-Cap ETF,0.334,4.37,-3.43,20.89,3y,20.89,119.99,2025-11-12T19:18:06.640Z
IJS,iShares S&P Small-Cap 600 Value ETF,0.57,4.5,-1.97,22.03,3y,22.03,113.01,2025-11-12T19:18:07.056Z
IJT,iShares S&P Small-Cap 600 Growth ETF,0.298,4.25,-3.76,20.29,3y,20.29,141.34,2025-11-12T19:18:07.436Z
ILCB,iShares Morningstar U.S. Equity ETF,0.095,16.91,14.43,15.48,3y,15.48,94.77,2025-11-12T19:18:07.818Z
ILCG,iShares Morningstar Growth ETF,0.066,18.03,17.74,19.57,3y,19.57,105.78,2025-11-12T19:18:08.295Z
ILCV,iShares Morningstar Value ETF,0.897,15.63,11.31,13.12,3y,13.12,93.31,2025-11-12T19:18:09.339Z
ILDR,First Trust Innovation Leaders ETF,-0.386,30.2,28.12,22.95,3y,22.95,33.55,2025-11-12T19:18:10.426Z
ILF,iShares Latin America 40 ETF,-0.9,46.02,24.71,21.32,3y,21.32,30.84,2025-11-12T19:18:10.804Z
ILIT,iShares Lithium Miners and Producers ETF,2.126,60.29,26.17,44.02,1y,,14.17,2025-11-12T19:18:11.137Z
ILOW,AB International Low Volatility Equity ETF,0.518,25.9,20.64,14.48,1y,,42.73,2025-11-12T19:18:11.462Z
IMCB,iShares Morningstar Mid-Cap ETF,0.254,9.11,4.93,15.91,3y,15.91,83.04,2025-11-12T19:18:11.955Z
IMCG,iShares Morningstar Mid-Cap Growth ETF,0.244,8.92,5.56,17.55,3y,17.55,82.19,2025-11-12T19:18:14.227Z
IMCV,iShares Morningstar Mid-Cap ETF,0.609,9.14,3.21,15.4,3y,15.4,80.92,2025-11-12T19:18:14.600Z
IMTM,iShares MSCI International Momentum Factor ETF,0.865,31.29,25.69,15.45,3y,15.45,48.97,2025-11-12T19:18:14.985Z
INCO,Columbia India Consumer ETF,-0.624,-1.2,-3.57,15.27,3y,15.27,65.28,2025-11-12T19:18:15.406Z
INDA,iShares MSCI India ETF,-0.356,2.14,0.34,13.38,3y,13.38,54.545,2025-11-12T19:18:15.772Z
INDF,Indofood Sukses Makmur Tbk,1.773,-4.01,-3.04,23.8,3y,23.8,7175,2025-11-12T19:18:16.262Z
INDL,Direxion Daily MSCI India Bull 3X Shares,-0.811,-4.4,-8.85,26.63,3y,26.63,58.72,2025-11-12T19:18:16.711Z
INDY,iShares India 50 ETF,-0.243,3.47,1.19,12.6,3y,12.6,53.39,2025-11-12T19:18:17.347Z
INFL,Horizon Kinetics Inflation Beneficiaries ETF,-0.088,18.19,9.26,16.28,3y,16.28,45.55,2025-11-12T19:18:18.353Z
INTF,iShares International Equity Factor ETF,0.704,29.73,24.26,14.81,3y,14.81,37.18,2025-11-12T19:18:18.707Z
IOCT,Innovator International Developed Power Buffer ETF  October,0.218,17.93,15.64,7.99,3y,7.99,34.53,2025-11-12T19:18:19.089Z
IOO,iShares Global 100 ETF,0.032,25.96,25.4,15.86,3y,15.86,126.78,2025-11-12T19:18:19.422Z
IPAC,iShares Core MSCI Pacific ETF,0.605,24.27,18.4,15.99,3y,15.99,75.655,2025-11-12T19:18:19.772Z
IPKW,Invesco International Buyback Achievers ETF,0.512,37.62,31.52,15.9,3y,15.9,54.415,2025-11-12T19:18:20.123Z
IPO,Renaissance IPO ETF,-1.984,3.35,-0.99,29.52,3y,29.52,45.95,2025-11-12T19:18:20.562Z
IQDF,FlexShares International Quality Dividend Index Fund,0.639,29.23,18.96,14.5,3y,14.5,29.93,2025-11-12T19:18:20.948Z
IQDG,WisdomTree International Quality Dividend Growth Fund,0.592,19.27,12.25,15.17,3y,15.17,40.78,2025-11-12T19:18:21.364Z
IQLT,iShares MSCI International Quality Factor ETF,0.421,22.46,16.45,14.64,3y,14.64,45.37,2025-11-12T19:18:21.783Z
IQQQ,ProShares Nasdaq-100 High Income ETF,-0.347,5.38,3.27,20.7,1y,,44.85,2025-11-12T19:18:22.293Z
IRBO,iShares Future AI & Tech ETF,2.325,32.46,43.11,25.86,3y,25.86,49.3,2025-11-12T19:18:22.830Z
ISCF,iShares MSCI International Small-Cap Equity Factor ETF,0.64,27.36,21.06,15.28,3y,15.28,40.87,2025-11-12T19:18:23.190Z
ISCG,iShares Morningstar Small-Cap Growth ETF,0.255,11.42,4.33,20.7,3y,20.7,55.14,2025-11-12T19:18:23.560Z
ISCV,iShares Morningstar Small-Cap Value ETF,0.357,6.86,0.37,20.56,3y,20.56,67.43,2025-11-12T19:18:24.620Z
ISPY,ProShares S&P High Income ETF,0.044,3.53,0.46,16.13,1y,,45.76,2025-11-12T19:18:25.284Z
ISVAF,iShares Nasdaq 100 UCITS ETF USD (Acc),,,,,,,,2025-11-12T19:18:25.634Z
ISVVF,iShares MSCI ACWI Mutual Fund,,,,,,,,2025-11-12T19:18:25.898Z
ITA,iShares U.S. Aerospace & Defense ETF,-0.371,44.78,34.6,17.63,3y,17.63,209.73,2025-11-12T19:18:26.303Z
ITB,iShares U.S. Home Construction ETF,-0.401,-2.67,-17.97,26.64,3y,26.64,99.33,2025-11-12T19:18:26.660Z
ITOT,iShares Core S&P Total U.S. Stock Market ETF,0,16.06,13.13,15.77,3y,15.77,149,2025-11-12T19:18:27.238Z
IUS,Invesco RAFI Strategic US Exchange-Traded Fund,0.238,14.56,9.99,13.51,3y,13.51,56.755,2025-11-12T19:18:27.585Z
IUSA,Northern Lights Fund Trust II A,0.712,9.3,10.56,13.8,3y,13.8,5193.5,2025-11-12T19:18:27.949Z
IUSG,iShares Core S&P U.S. Growth ETF,-0.231,20.93,20.84,18.55,3y,18.55,168.38,2025-11-12T19:18:28.371Z
IUSV,iShares Core S&P U.S. Value ETF,0.47,11.27,4.68,13.74,3y,13.74,102.58,2025-11-12T19:18:28.740Z
IVE,iShares S&P 500 Value ETF,0.459,11.7,5.13,13.58,3y,13.58,212.18,2025-11-12T19:18:29.119Z
IVES,Amplify Bloomberg AI Value Chain ETF,-0.718,-31.73,-34.11,72.35,1y,,33.2,2025-11-12T19:18:29.516Z
IVLU,iShares MSCI International Value Factor ETF,0.973,38.54,32.35,15.22,3y,15.22,37.35,2025-11-12T19:18:29.980Z
IVOG,Vanguard S&P Mid-Cap 400 Growth ETF,0.324,6.88,0,18.68,3y,18.68,120.695,2025-11-12T19:18:30.468Z
IVOL,Quadratic Interest Rate Volatility and Inflation Hedge ETF,-0.338,8.04,6.36,13.7,3y,13.7,19.155,2025-11-12T19:18:30.805Z
IVOO,Vanguard S&P Mid-Cap 400 ETF,0.448,5.37,-0.55,18.45,3y,18.45,110.995,2025-11-12T19:18:31.198Z
IVOV,Vanguard S&P Mid-Cap 400 Value ETF,0.31,5.53,-1,45.09,3y,45.09,100.3,2025-11-12T19:18:31.581Z
IVV,iShares Core S&P 500 ETF,0.023,16.83,14.17,15.32,3y,15.32,686.32,2025-11-12T19:18:31.906Z
IVW,iShares S&P 500 Growth ETF,-0.339,21.65,22.1,18.77,3y,18.77,123.49,2025-11-12T19:18:32.273Z
IWB,iShares Russell 1000 ETF,0.003,16.36,13.69,15.5,3y,15.5,374.15,2025-11-12T19:18:32.614Z
IWC,iShares Micro-Cap ETF,-0.177,16.35,11.74,23.7,3y,23.7,151.87,2025-11-12T19:18:32.959Z
IWD,iShares Russell 1000 Value ETF,0.41,12.63,6.53,13.68,3y,13.68,208.1,2025-11-12T19:18:33.323Z
IWF,iShares Russell 1000 Growth ETF,-0.277,19.7,20.31,19.42,3y,19.42,479.61,2025-11-12T19:18:33.685Z
IWL,iShares Russell Top 200 ETF,0,18.23,16.38,15.66,3y,15.66,170.89,2025-11-12T19:18:34.043Z
IWLG,NYLI Winslow Large Cap Growth ETF,-0.334,16.96,14.76,20.48,3y,20.48,55.17,2025-11-12T19:18:34.728Z
IWM,iShares Russell 2000 ETF,-0.086,10.35,2.48,21.3,3y,21.3,244.03,2025-11-12T19:18:35.092Z
IWMI,Neos Russell 2000 High Income ETF,0.02,-0.43,-8.49,19.49,1y,,48.82,2025-11-12T19:18:35.399Z
IWMY,Defiance R2000 Enhanced Options & 0DTE Income ETF,0.304,-28.52,-36.66,18.93,1y,,21.465,2025-11-12T19:18:35.739Z
IWN,iShares Russell 2000 Value ETF,0.169,8.67,0.19,21.13,3y,21.13,178.13,2025-11-12T19:18:36.332Z
IWO,iShares Russell 2000 Growth ETF,-0.299,11.9,4.35,22.11,3y,22.11,323.17,2025-11-12T19:18:36.665Z
IWP,iShares Russell Mid-Cap Growth ETF,-0.028,10.25,7.75,19.53,3y,19.53,140.53,2025-11-12T19:18:38.044Z
IWR,iShares Russell Mid-Cap ETF,0.202,9.41,4.29,16.57,3y,16.57,96.605,2025-11-12T19:18:38.385Z
IWS,iShares Russell Mid-Cap Value ETF,0.4,9.1,3.04,16.09,3y,16.09,140.61,2025-11-12T19:18:38.921Z
IWV,iShares Russell 3000 ETF,0.121,16.18,13.2,15.64,3y,15.64,387.72,2025-11-12T19:18:39.320Z
IWX,iShares Russell Top 200 Value ETF,0.633,14.82,8.52,12.72,3y,12.72,90.66,2025-11-12T19:18:39.711Z
IWY,iShares Russell Top 200 Growth ETF,-0.28,19.9,20.9,19.67,3y,19.67,280.87,2025-11-12T19:18:40.071Z
IXC,iShares Global Energy ETF,-0.806,11.59,2.82,20.28,3y,20.28,43.05,2025-11-12T19:18:40.420Z
IXG,iShares Global Financials ETF,0.933,23.3,19.42,15.6,3y,15.6,117.9,2025-11-12T19:18:40.782Z
IXJ,iShares Global Healthcare ETF,1.193,11.91,2.11,13.24,3y,13.24,96.255,2025-11-12T19:18:41.126Z
IXN,iShares Global Tech ETF,0.112,27.2,26.95,23.09,3y,23.09,107.5,2025-11-12T19:18:41.584Z
IXP,iShares Global Comm Services ETF,0.991,27.05,26.46,17.24,3y,17.24,123.29,2025-11-12T19:18:41.986Z
IXUS,iShares Core International Stock ETF,0.406,29.21,22.48,14.4,3y,14.4,85.225,2025-11-12T19:18:43.085Z
IYC,iShares U.S. Consumer Discretionary ETF,0.087,8.59,10.91,18.23,3y,18.23,103.69,2025-11-12T19:18:43.452Z
IYE,iShares U.S. Energy ETF,-1.234,4.1,-2.75,22.29,3y,22.29,48.01,2025-11-12T19:18:43.860Z
IYF,iShares U.S. Financials ETF,0.976,14.25,11.24,17.72,3y,17.72,126.2,2025-11-12T19:18:44.224Z
IYG,iShares U.S. Financial Services ETF,1.085,16.36,14.85,18.55,3y,18.55,90.33,2025-11-12T19:18:44.588Z
IYH,iShares U.S. Healthcare ETF,1.435,10.23,1.42,13.79,3y,13.79,64.31,2025-11-12T19:18:46.897Z
IYJ,iShares U.S. Industrials ETF,0.363,10.34,3.67,16.24,3y,16.24,146.55,2025-11-12T19:18:47.240Z
IYK,iShares U.S. Consumer Staples ETF,0.103,4.55,-0.71,11.96,3y,11.96,68.27,2025-11-12T19:18:47.577Z
IYM,iShares U.S. Basic Materials ETF,1.619,15.22,0.17,17.93,3y,17.93,148.09,2025-11-12T19:18:47.935Z
IYR,iShares U.S. Real Estate ETF,-0.652,4.01,-3.9,18.18,3y,18.18,95.99,2025-11-12T19:18:48.320Z
IYT,iShares U.S. Transportation ETF,1.078,8.11,-0.03,21.28,3y,21.28,73.16,2025-11-12T19:18:48.670Z
IYW,iShares U.S. Technology ETF,-0.231,27.16,26.01,23.81,3y,23.81,202.88,2025-11-12T19:18:49.084Z
IYY,iShares Dow Jones U.S. ETF,-0.042,16.42,13.7,15.52,3y,15.52,166.11,2025-11-12T19:18:49.422Z
IYZ,iShares U.S. Telecommunications ETF,0.651,20.47,19.72,17.12,3y,17.12,32.48,2025-11-12T19:18:49.786Z
JAVA,JPMorgan Active Value ETF,0.61,12.09,6.05,13.35,3y,13.35,70.94,2025-11-12T19:18:50.184Z
JDST,Direxion Daily Junior Gold Miners Index Bear 2X Shares,-8.291,-86.94,-85.59,73.42,3y,73.42,3.65,2025-11-12T19:18:50.729Z
JEPI,JPMorgan Equity Premium Income Fund,0.333,-0.33,-4.55,10.48,3y,10.48,57.3,2025-11-12T19:18:51.072Z
JEPQ,JPMorgan Nasdaq Equity Premium Income ETF,-0.017,4.32,3.84,15.27,3y,15.27,58.71,2025-11-12T19:18:51.424Z
JETS,U.S. Global Jets ETF,2.669,1.93,4.64,29.1,3y,29.1,25.585,2025-11-12T19:18:51.775Z
JGLO,JPMorgan Global Select Equity ETF,0.32,14.78,8.06,16.49,1y,,68.88,2025-11-12T19:18:52.118Z
JGRO,JPMorgan Active Growth ETF,-0.348,16.46,15.9,19.44,3y,19.44,94.53,2025-11-12T19:18:52.512Z
JHMD,John Hancock Multifactor Developed International ETF,0.722,29.33,23.12,14.52,3y,14.52,41.32,2025-11-12T19:18:52.855Z
JHML,John Hancock Multifactor Large Cap ETF,0.172,14.98,10.6,14.71,3y,14.71,79.91,2025-11-12T19:18:53.212Z
JHMM,John Hancock Multifactor Mid Cap ETF,0.323,9.35,3.26,16.86,3y,16.86,65.27,2025-11-12T19:18:53.577Z
JIG,JPMorgan International Growth ETF,0.236,22.05,15.9,15.45,3y,15.45,76.355,2025-11-12T19:18:53.928Z
JIRE,JPMorgan International Research Enhanced Equity ETF,0.807,30.82,22.18,14.7,3y,14.7,76.23,2025-11-12T19:18:54.290Z
JIVE,JPMorgan International Value ETF,0.789,43.99,37.48,15.83,1y,,79.23,2025-11-12T19:18:55.254Z
JKD,iShares Morningstar Large-Cap ETF,1.483,16.57,18.36,15.53,3y,15.53,94.4906,2025-11-12T19:18:55.671Z
JKE,iShares Morningstar Large-Cap Growth ETF,2.186,18.41,23.77,19.63,3y,19.63,106.12,2025-11-12T19:18:56.031Z
JKF,iShares Morningstar Large-Cap Value ETF,0.803,14.6,13.1,13.17,3y,13.17,92.4814,2025-11-12T19:18:56.396Z
JKG,iShares Morningstar Mid-Cap ETF,0.749,8.82,7.85,15.94,3y,15.94,82.826,2025-11-12T19:18:56.774Z
JKH,iShares Morningstar Mid-Cap Growth ETF,0.861,8.65,10.25,17.59,3y,17.59,81.99,2025-11-12T19:18:58.202Z
JKI,iShares Morningstar Mid-Cap Value ETF,0.549,8.48,4.9,15.41,3y,15.41,80.4254,2025-11-12T19:18:58.558Z
JKK,iShares Morningstar Small-Cap Growth ETF,1.156,11.42,10.41,20.75,3y,20.75,55.14,2025-11-12T19:18:58.962Z
JMEE,JPMorgan Small & Mid Cap Enhanced Equity ETF,0.453,6.48,-0.65,18.94,3y,18.94,64.25,2025-11-12T19:18:59.368Z
JMOM,JPMorgan U.S. Momentum Factor ETF,0.083,17.84,13.19,16.27,3y,16.27,68.82,2025-11-12T19:18:59.727Z
JNUG,Direxion Daily Junior Gold Miners Index Bull 2X Shares,8.419,314.47,244.94,73.3,3y,73.3,164.71,2025-11-12T19:19:00.116Z
JOET,Virtus Terranova U.S. Quality Momentum ETF,0.302,13.38,8.53,16.21,3y,16.21,42.88,2025-11-12T19:19:01.222Z
JOYY,JOYY Inc. American Depositary Shares,-1.682,50.62,76.01,40.99,3y,40.99,59.915,2025-11-12T19:19:02.774Z
JPEF,JPMorgan Equity Focus ETF,-0.192,11.96,9.04,18,1y,,75.215,2025-11-12T19:19:04.216Z
JPGB,JPMorgan Global Bond Opportunities ETF,0.082,3.29,2.99,4.28,3y,4.28,48.95,2025-11-12T19:19:04.610Z
JPIE,JPMorgan Income ETF,-0.086,1.36,1.16,3.58,3y,3.58,46.26,2025-11-12T19:19:05.118Z
JPLD,JPMorgan Limited Duration ETF,-0.038,1.77,1.71,2.23,1y,,52.43,2025-11-12T19:19:07.618Z
JQUA,JPMorgan U.S. Quality Factor ETF,0.064,10.05,6.83,14.09,3y,14.09,62.85,2025-11-12T19:19:08.026Z
JSMD,Janus Small-Mid Cap Growth Alpha Fund,0.019,12.53,4.57,20.33,3y,20.33,84.36,2025-11-12T19:19:08.544Z
JSML,Janus Henderson Small Cap Growth Alpha Fund,0.166,15.09,3,21.98,3y,21.98,75.26,2025-11-12T19:19:08.945Z
JTEK,JPMorgan U.S. Tech Leaders ETF,-0.525,21.65,23.56,30.25,1y,,92.78,2025-11-12T19:19:11.604Z
JVAL,JPMorgan U.S. Value Factor ETF,0.649,12.6,7.56,16.06,3y,16.06,48.51,2025-11-12T19:19:12.098Z
JXI,iShares Global Utilities ETF,0.543,26.04,20.27,14.77,3y,14.77,81.42,2025-11-12T19:19:12.445Z
KBA,KraneShares Bosera MSCI China A 50 Connect Index ETF,0.693,33.95,21.81,26.31,3y,26.31,30.5,2025-11-12T19:19:12.894Z
KBE,SPDR S&P Bank ETF,0.225,5.68,-2.5,28.42,3y,28.42,58.03,2025-11-12T19:19:13.384Z
KBWB,Invesco KBW Bank ETF,1.028,21.21,16.88,26.51,3y,26.51,79.125,2025-11-12T19:19:13.718Z
KBWD,Invesco KBW High Dividend Yield Financial ETF,0,-7.32,-10.7,19.63,3y,19.63,13.68,2025-11-12T19:19:14.733Z
KBWP,Invesco KBW Property & Casualty Fund,0.474,6.54,2.14,17.92,3y,17.92,122.86,2025-11-12T19:19:15.973Z
KBWY,Invesco KBW Premium Yield Equity Fund,-0.384,-12.3,-23.06,22.58,3y,22.58,15.55,2025-11-12T19:19:16.411Z
KCE,SPDR S&P Capital Markets ETF,0.995,8.04,5.08,21.41,3y,21.41,149.21,2025-11-12T19:19:16.824Z
KDEF,PLUS Korea Defense Industry Index ETF,0.174,101.26,101.26,43.78,SI,,42.675,2025-11-12T19:19:17.136Z
KGRN,KraneShares MSCI China Clean Technology Index ETF,-1.613,38.43,32.57,32.39,3y,32.39,30.49,2025-11-12T19:19:17.591Z
KHPI,Kensington Hedged Premium Income ETF,-0.88,2.61,1.77,11.23,1y,,25.91,2025-11-12T19:19:17.918Z
KIE,SPDR S&P Insurance ETF,0.246,5.42,0.93,17.41,3y,17.41,59.175,2025-11-12T19:19:19.771Z
KMLM,KraneShares Mount Lucas Managed Futures Index Strategy ETF,0.593,-5.27,-4.22,13.02,3y,13.02,26.8,2025-11-12T19:19:20.365Z
KNG,Fidelity S&P 500 Dividend Aristocrats ETF,0.265,-1.44,-8.69,12.37,3y,12.37,49.2,2025-11-12T19:19:20.712Z
KOCT,Innovator U.S. Small Cap Power Buffer ETF  October,-0.151,8.51,5.35,12.08,3y,12.08,33.14,2025-11-12T19:19:22.128Z
KOLD,ProShares UltraShort Bloomberg Natural Gas,-0.588,-35.79,-67.33,108.17,3y,108.17,27.05,2025-11-12T19:19:23.922Z
