symbol,name,daily_change_pct,ytd_return_pct,one_year_return_pct,vol_pct,vol_window,vol_3y_pct,last_close,as_of
GPIX,S&P 500 Core Premium Income Fund,-0.325,5.63,7.89,17.47,1y,,52.12,2025-10-09T19:04:45.597Z
GPTY,YieldMax AI & Tech Portfolio Option Income ETF,-0.684,-3.73,-3.73,31.4,SI,,48.22,2025-10-09T19:04:46.090Z
GREK,Global X MSCI Greece ETF,0.579,69.75,58.92,22.41,3y,22.41,66,2025-10-09T19:04:46.644Z
GRID,First Trust NASDAQ Clean Edge Smart Grid Infrastructure Index Fund,-0.73,27.82,21.81,19.45,3y,19.45,152.3,2025-10-09T19:04:47.282Z
GRNY,Fundstrat Granny Shots US Large Cap ETF,-0.287,28.26,26.54,25.48,1y,,25.5365,2025-10-09T19:04:47.796Z
GSEP,FT Vest US Equity Moderate B Fund,-0.236,8.75,11.25,9.82,1y,,38.125,2025-10-09T19:04:48.341Z
GSEW,Goldman Sachs Equal Weight U.S. Large Cap Equity ETF,-0.711,10.48,10.95,15.69,3y,15.69,85.18,2025-10-09T19:04:48.869Z
GSG,iShares S&P GSCI Commodity-Indexed Trust,-0.994,4.23,2.55,17.97,3y,17.97,22.92,2025-10-09T19:04:49.468Z
GSIE,Goldman Sachs ActiveBeta International Equity ETF,-1.027,23.27,15.39,15.01,3y,15.01,40.975,2025-10-09T19:04:50.072Z
GSLC,Goldman Sachs ActiveBeta U.S. Large Cap Equity ETF,-0.451,13.25,16.49,15.71,3y,15.71,130.29,2025-10-09T19:04:50.606Z
GSSC,Goldman Sachs ActiveBeta U.S. Small Cap Equity ETF,-0.55,8.79,10.35,20.97,3y,20.97,75.04,2025-10-09T19:04:51.228Z
GSUS,Goldman Sachs MarketBeta U.S.,-0.139,15.66,19.54,16.04,3y,16.04,93.22,2025-10-09T19:04:51.804Z
GUNR,FlexShares Morningstar Global Upstream Natural Resources Index Fund,-1.237,18.73,4,17.31,3y,17.31,43.515,2025-10-09T19:04:52.423Z
GUSH,Direxion Daily S&P Oil & Gas Exploration & Production Bull 2X Shares,-4.603,-16.64,-26.35,59.67,3y,59.67,24.04,2025-10-09T19:04:53.036Z
GVAL,Cambria Global Value ETF,-1.008,40.04,28.42,17.95,3y,17.95,28.96,2025-10-09T19:04:53.561Z
GVIP,Goldman Sachs Hedge Industry VIP ETF,1.004,24.16,28.68,19.19,3y,19.19,155.403,2025-10-09T19:04:54.073Z
GWX,SPDR S&P International Small Cap ETF,0.247,30.67,20.57,15.66,3y,15.66,40.56,2025-10-09T19:04:54.640Z
GXC,SPDR S&P China ETF,-1.716,39.25,6.69,28.69,3y,28.69,103.67,2025-10-09T19:04:55.169Z
GXG,Global X MSCI Colombia ETF,0.426,41.71,40.5,22.01,3y,22.01,32.99,2025-10-09T19:04:55.789Z
HACK,Amplify Cybersecurity ETF,-0.404,19.14,30.94,21.8,3y,21.8,88.81,2025-10-09T19:04:56.396Z
HAUZ,Xtrackers International Real Estate ETF,-0.407,18.11,0.93,16.23,3y,16.23,23.255,2025-10-09T19:04:57.089Z
HCMT,Direxion HCM Tactical Enhanced US ETF,-0.933,4.6,10.91,31.53,1y,,38.21,2025-10-09T19:04:57.697Z
HDEF,Xtrackers MSCI EAFE High Dividend Yield Equity ETF,-0.758,21.63,12.18,14.23,3y,14.23,29.47,2025-10-09T19:04:58.327Z
HDGE,AdvisorShares Ranger Equity Bear ETF,1.468,1.34,-11.94,24.81,3y,24.81,16.59,2025-10-09T19:04:58.841Z
HDV,iShares Core High Dividend ETF,-0.345,8.07,2.95,12.64,3y,12.64,121.34,2025-10-09T19:04:59.431Z
HEDJ,WisdomTree Europe Hedged Equity Fund,-0.418,17.09,15.74,15.78,3y,15.78,51.225,2025-10-09T19:05:00.025Z
HEFA,iShares Currency Hedged MSCI EAFE ETF,-0.552,16.19,14.38,17.29,3y,17.29,40.515,2025-10-09T19:05:00.787Z
HEGD,Swan Hedged Equity US Large Cap Fund,0.56,12.15,12.93,9.19,3y,9.19,25.15,2025-10-09T19:05:01.431Z
HELO,JPMorgan Hedged Equity Laddered Overlay ETF,-0.123,5.09,7.15,9.06,1y,,65.03,2025-10-09T19:05:02.473Z
HEQT,Simplify Hedged Equity ETF,-0.032,6.49,9.12,8.77,3y,8.77,31.36,2025-10-09T19:05:03.127Z
HEZU,iShares Currency Hedged MSCI Eurozone ETF,-0.419,18.86,17.58,17.99,3y,17.99,42.74,2025-10-09T19:05:03.725Z
HFXI,New York Life Investments FTSE International Equity Currency Neutral ETF,-0.757,20.63,15.32,13.78,3y,13.78,31.46,2025-10-09T19:05:04.259Z
HGER,Harbor Commodity All-Weather Fund,-0.956,15.88,11.18,13.95,3y,13.95,25.9,2025-10-09T19:05:04.886Z
HHH,Howard Hughes Holdings Inc.,-1.73,7.16,7.77,29.24,3y,29.24,81.24,2025-10-09T19:05:05.479Z
HIBL,Direxion Daily S&P 500 High Beta Bull 3X Shares,-2.901,49.94,41,77.12,3y,77.12,62.93,2025-10-09T19:05:06.111Z
HIBS,Direxion Daily S&P 500 High Beta Bear 3X Shares,2.641,-68.37,-68.81,80.47,3y,80.47,6.025,2025-10-09T19:05:06.665Z
HLAL,Wahed FTSE USA Shariah ETF,-1.017,13.83,16.27,16.87,3y,16.87,59.565,2025-10-09T19:05:07.197Z
HMOP,Hartford Municipal Opportunities ETF,0.051,0.93,-0.66,4.3,3y,4.3,38.99,2025-10-09T19:05:07.828Z
HNDL,NASDAQ 7 Handl Index ETF,-0.534,4.68,2.01,11.22,3y,11.22,22.35,2025-10-09T19:05:08.384Z
HODL,VanEck Bitcoin ETF,1.104,26.26,97.17,44.6,1y,,34.79,2025-10-09T19:05:08.901Z
HSUN,Hartford Strategic Income ETF,0.112,3.77,0.77,5.46,3y,5.46,35.62,2025-10-09T19:05:09.525Z
HYBL,SPDR Blackstone High Income Fund,-0.246,-0.14,-0.25,4.94,3y,4.94,28.39,2025-10-09T19:05:10.063Z
HYGV,FlexShares High Yield Value-Scored Bond Index Fund,-0.392,-0.15,-0.93,7.32,3y,7.32,40.7,2025-10-09T19:05:10.613Z
HYGW,iShares High Yield Corporate Bond BuyWrite ETF,-0.365,-5.6,-7.22,5.97,3y,5.97,30.01,2025-10-09T19:05:11.274Z
IAI,iShares U.S. Broker-Dealers & Securities Exchanges ETF,-0.174,21.38,36.41,20.31,3y,20.31,175.335,2025-10-09T19:05:11.919Z
IAK,iShares U.S. Insurance ETF,-1.193,6.06,5.67,17.78,3y,17.78,133.33,2025-10-09T19:05:12.541Z
IAT,iShares U.S. Regional Banks ETF,-0.059,2.36,9.12,30.88,3y,30.88,51.2,2025-10-09T19:05:13.287Z
IAU,iShares Gold Trust,-2.217,48.5,49.3,15.44,3y,15.44,74.53,2025-10-09T19:05:13.787Z
IAUM,iShares Gold Trust Micro,-2.207,48.72,49.62,15.35,3y,15.35,39.44,2025-10-09T19:05:14.457Z
IBB,iShares Biotechnology ETF,0.02,14.38,6.92,19.82,3y,19.82,152.02,2025-10-09T19:05:15.072Z
IBCA,iShares iBonds Dec 2035 Term Corporate ETF,-0.292,159.14,159.14,124.43,SI,,25.914,2025-10-09T19:05:15.612Z
IBIT,iShares Bitcoin Trust,-2.241,23.7,89.93,45.26,1y,,68.49,2025-10-09T19:05:16.213Z
IBLC,iShares Blockchain and Tech ETF,0.194,83.87,120.85,61.87,3y,61.87,64.465,2025-10-09T19:05:17.003Z
IBTO,iShares iBonds Dec 2033 Term Treasury ETF,-0.061,3.93,0,6.18,1y,,24.6,2025-10-09T19:05:17.662Z
ICF,iShares Cohen & Steers Realty Majors ETF,-0.296,1.51,-5.06,19.14,3y,19.14,60.55,2025-10-09T19:05:18.201Z
ICLN,iShares Global Clean Energy ETF,0.437,38.62,13.64,24.02,3y,24.02,16.08,2025-10-09T19:05:18.773Z
ICOI,Bitwise COIN Option Income Strategy ETF,-0.275,-20.86,-20.86,59.99,SI,,36.3,2025-10-09T19:05:19.235Z
ICOP,iShares Copper and Metals Mining ETF,-0.898,49.65,21.21,31.42,1y,,38.64,2025-10-09T19:05:19.929Z
ICOW,Pacer Developed Markets International ETF,-0.542,25.49,16.89,16.15,3y,16.15,36.68,2025-10-09T19:05:20.582Z
IDEV,iShares Core MSCI International Developed Markets ETF,-1.095,24.95,15.42,15.31,3y,15.31,80.37,2025-10-09T19:05:21.135Z
IDHQ,Invesco S&P International Developed Quality ETF,0.378,21.92,10.12,15.54,3y,15.54,34.49,2025-10-09T19:05:21.691Z
IDMO,Invesco S&P International Developed Momentum ETF,-1.382,31.82,29.56,16.23,3y,16.23,53.52,2025-10-09T19:05:22.372Z
IDU,iShares U.S. Utilities ETF,-0.453,18.2,13.81,16.44,3y,16.44,114.28,2025-10-09T19:05:22.907Z
IDV,iShares International Select Dividend ETF,-0.618,32.3,22.21,15.39,3y,15.39,36.185,2025-10-09T19:05:23.525Z
IDVO,Amplify CWP International Enhanced Dividend Income ETF,-1.411,23.3,19.97,15.72,3y,15.72,37.04,2025-10-09T19:05:24.124Z
IEFA,iShares Core MSCI EAFE ETF,-1.023,24.86,14.34,15.56,3y,15.56,87.565,2025-10-09T19:05:24.744Z
IEMG,iShares Core MSCI Emerging Markets ETF,-1.086,27.57,12.88,16.62,3y,16.62,66.5,2025-10-09T19:05:25.334Z
IEO,iShares U.S. Oil & Gas Exploration & Production ETF,-1.78,-0.12,-7.59,26.98,3y,26.98,91.04,2025-10-09T19:05:26.011Z
IETC,iShares U.S. Tech Independence Fund,-0.269,21.48,32.66,22.76,3y,22.76,103.65,2025-10-09T19:05:26.522Z
IEUR,iShares Core MSCI Europe ETF,-1.302,26.84,14.71,16.31,3y,16.31,68.24,2025-10-09T19:05:27.105Z
IEV,iShares Europe ETF,-1.307,26.6,15.62,16.09,3y,16.09,65.67,2025-10-09T19:05:27.711Z
IEZ,iShares U.S. Oil Equipment & Services ETF,-2.026,-6.36,-12.03,33.04,3y,33.04,18.86,2025-10-09T19:05:28.327Z
IFRA,iShares U.S. Infrastructure ETF,-0.971,14.78,13.28,17.59,3y,17.59,53.05,2025-10-09T19:05:29.009Z
IGE,iShares North American Natural Resources ETF,0.204,13.68,7.14,20.23,3y,20.23,49.21,2025-10-09T19:05:29.594Z
IGF,iShares Global Infrastructure ETF,-0.841,16.44,12.95,14,3y,14,61.33,2025-10-09T19:05:30.168Z
IGM,iShares Expanded Tech Sector ETF,-0.348,26.16,35.15,24.27,3y,24.27,129.01,2025-10-09T19:05:30.735Z
IGPT,Invesco AI and Next Gen Software ETF,-0.815,25.44,25.75,24.87,3y,24.87,57.19,2025-10-09T19:05:31.323Z
IGRO,iShares International Dividend Growth ETF,-0.647,17.18,7.58,13.58,3y,13.58,79.81,2025-10-09T19:05:32.015Z
IGV,iShares Expanded Tech-Software Sector ETF,-0.169,15.6,30.24,24.32,3y,24.32,115.495,2025-10-09T19:05:32.588Z
IHAK,iShares Cybersecurity and Tech ETF,-0.659,8.31,10.74,20.89,3y,20.89,52.78,2025-10-09T19:05:33.184Z
IHDG,WisdomTree International Hedged Quality Dividend Growth Fund,-0.529,7.4,3.98,14.68,3y,14.68,47,2025-10-09T19:05:33.828Z
IHE,iShares U.S. Pharmaceuticals ETF,0.492,15.13,8.19,16,3y,16,75.55,2025-10-09T19:05:34.567Z
IHF,iShares U.S. Healthcare Providers ETF,-0.508,6.54,-7.01,18.29,3y,18.29,50.97,2025-10-09T19:05:35.109Z
IHI,iShares U.S. Medical Devices ETF,-0.703,2.96,4.64,17.63,3y,17.63,60.045,2025-10-09T19:05:35.739Z
IJH,iShares Core S&P Mid-Cap ETF,-1.307,4.51,5.01,18.99,3y,18.99,64.95,2025-10-09T19:05:36.376Z
IJJ,iShares S&P Mid-Cap 400 Value ETF,-1.171,3.99,5.64,19.26,3y,19.26,129.14,2025-10-09T19:05:37.024Z
IJK,iShares S&P Mid-Cap 400 Growth ETF,-1.282,4.86,4.51,19.41,3y,19.41,95.49,2025-10-09T19:05:37.593Z
IJR,iShares Core S&P Small-Cap ETF,-1.274,2.46,2.72,21.37,3y,21.37,117.8,2025-10-09T19:05:38.195Z
IJS,iShares S&P Small-Cap 600 Value ETF,-1.43,1.35,4.35,22.35,3y,22.35,109.6,2025-10-09T19:05:38.781Z
IJT,iShares S&P Small-Cap 600 Growth ETF,-1.149,3.46,2.04,20.92,3y,20.92,140.27,2025-10-09T19:05:39.312Z
ILCB,iShares Morningstar U.S. Equity ETF,0.571,15.17,17.97,16.12,3y,16.12,93.36,2025-10-09T19:05:39.948Z
ILCG,iShares Morningstar Growth ETF,-0.246,17.84,27,20.35,3y,20.35,105.61,2025-10-09T19:05:40.596Z
ILCV,iShares Morningstar Value ETF,0.044,12.14,10.15,13.64,3y,13.64,90.5,2025-10-09T19:05:41.280Z
ILDR,First Trust Innovation Leaders ETF,-0.252,30.45,38.19,23.47,3y,23.47,33.615,2025-10-09T19:05:41.921Z
ILF,iShares Latin America 40 ETF,-0.764,32.17,7.82,22.04,3y,22.04,27.915,2025-10-09T19:05:42.562Z
ILOW,AB International Low Volatility Equity ETF,-0.761,24.84,18.19,14.57,1y,,42.37,2025-10-09T19:05:43.035Z
IMCB,iShares Morningstar Mid-Cap ETF,-0.73,8.99,10.19,16.64,3y,16.64,82.95,2025-10-09T19:05:43.586Z
IMCG,iShares Morningstar Mid-Cap Growth ETF,-0.719,9.79,14.48,18.35,3y,18.35,82.85,2025-10-09T19:05:44.187Z
IMCV,iShares Morningstar Mid-Cap ETF,0.18,8.8,6.42,16.04,3y,16.04,80.665,2025-10-09T19:05:44.807Z
IMTM,iShares MSCI International Momentum Factor ETF,-1.259,27.23,20.51,15.91,3y,15.91,47.455,2025-10-09T19:05:45.416Z
INCO,Columbia India Consumer ETF,-0.108,-1.92,-11.4,15.51,3y,15.51,64.8,2025-10-09T19:05:45.941Z
INDA,iShares MSCI India ETF,0.219,-1.23,-5.93,13.62,3y,13.62,52.745,2025-10-09T19:05:46.527Z
INDF,Indofood Sukses Makmur Tbk,-1.379,-4.35,0.7,23.57,3y,23.57,7150,2025-10-09T19:05:47.345Z
INDL,Direxion Daily MSCI India Bull 3X Shares,0.708,-9.72,-19.89,27.07,3y,27.07,55.45,2025-10-09T19:05:47.853Z
INDY,iShares India 50 ETF,0.233,-0.1,-4.75,12.87,3y,12.87,51.55,2025-10-09T19:05:48.439Z
INFL,Horizon Kinetics Inflation Beneficiaries ETF,-1.801,13.87,13.11,16.68,3y,16.68,43.885,2025-10-09T19:05:48.952Z
INTF,iShares International Equity Factor ETF,-0.852,25.85,16.58,15.56,3y,15.56,36.07,2025-10-09T19:05:49.481Z
IOO,iShares Global 100 ETF,-0.541,20.47,23.79,16.47,3y,16.47,121.25,2025-10-09T19:05:50.140Z
IPAC,iShares Core MSCI Pacific ETF,-0.498,21.44,12.51,16.45,3y,16.45,73.93,2025-10-09T19:05:50.766Z
IPKW,Invesco International Buyback Achievers ETF,-1.568,31.78,20.92,16.44,3y,16.44,52.105,2025-10-09T19:05:51.417Z
IPO,Renaissance IPO ETF,0.813,17.16,23.47,30.48,3y,30.48,52.09,2025-10-09T19:05:51.929Z
IQDF,FlexShares International Quality Dividend Index Fund,-0.713,23.29,8.45,15.07,3y,15.07,28.555,2025-10-09T19:05:52.550Z
IQDG,WisdomTree International Quality Dividend Growth Fund,-0.619,17.34,5.58,16.1,3y,16.1,40.12,2025-10-09T19:05:53.114Z
IQLT,iShares MSCI International Quality Factor ETF,-1.2,20,9.1,15.5,3y,15.5,44.46,2025-10-09T19:05:53.902Z
IQQQ,ProShares Nasdaq-100 High Income ETF,-0.491,4.77,8.72,20.39,1y,,44.59,2025-10-09T19:05:54.601Z
IRBO,iShares Future AI & Tech ETF,-1.032,28.77,41.43,26.07,3y,26.07,47.93,2025-10-09T19:05:55.238Z
ISCF,iShares MSCI International Small-Cap Equity Factor ETF,0.048,28.76,19.59,16.02,3y,16.02,41.32,2025-10-09T19:05:55.899Z
ISCG,iShares Morningstar Small-Cap Growth ETF,-0.88,11.5,14.03,21.38,3y,21.38,55.18,2025-10-09T19:05:56.457Z
ISEP,Innovator International Developed Power Buffer ETF  September,-0.374,16.15,11.9,9.67,1y,,31.98,2025-10-09T19:05:56.992Z
ISMD,Inspire Small/Mid Cap ETF,-1.235,3.09,4.18,20.76,3y,20.76,38.39,2025-10-09T19:05:57.611Z
ISPY,ProShares S&P High Income ETF,-0.462,2.42,2.86,15.96,1y,,45.27,2025-10-09T19:05:58.205Z
ITA,iShares U.S. Aerospace & Defense ETF,-1.706,46,39.75,18.08,3y,18.08,211.49,2025-10-09T19:05:58.820Z
ITB,iShares U.S. Home Construction ETF,-2.765,-1.12,-18.3,27.96,3y,27.96,100.92,2025-10-09T19:05:59.393Z
ITOT,iShares Core S&P Total U.S. Stock Market ETF,-0.543,14.09,17.85,16.42,3y,16.42,146.47,2025-10-09T19:05:59.957Z
IUS,Invesco RAFI Strategic US Exchange-Traded Fund,-0.719,11.55,10.83,14.15,3y,14.15,55.26,2025-10-09T19:06:00.483Z
IUSA,Northern Lights Fund Trust II A,0.476,6,14.04,13.78,3y,13.78,5036.75,2025-10-09T19:06:01.067Z
IUSG,iShares Core S&P U.S. Growth ETF,-0.265,19.13,27.26,19.4,3y,19.4,165.87,2025-10-09T19:06:01.641Z
IUSV,iShares Core S&P U.S. Value ETF,-0.852,8.54,5.85,14.21,3y,14.21,100.06,2025-10-09T19:06:02.289Z
IVE,iShares S&P 500 Value ETF,-0.837,8.83,5.89,14.06,3y,14.06,206.725,2025-10-09T19:06:02.807Z
IVES,Amplify Bloomberg AI Value Chain ETF,-0.592,-30.91,-31.06,72,1y,,33.6,2025-10-09T19:06:03.437Z
IVLU,iShares MSCI International Value Factor ETF,-0.785,31.19,21.59,15.77,3y,15.77,35.37,2025-10-09T19:06:04.107Z
IVOG,Vanguard S&P Mid-Cap 400 Growth ETF,-1.004,5.63,4.65,19.37,3y,19.37,119.29,2025-10-09T19:06:04.772Z
IVOL,Quadratic Interest Rate Volatility and Inflation Hedge ETF,-0.103,9.19,3.86,14.06,3y,14.06,19.36,2025-10-09T19:06:05.376Z
IVOO,Vanguard S&P Mid-Cap 400 ETF,-1.128,4.45,4.98,18.98,3y,18.98,110.025,2025-10-09T19:06:05.993Z
IVOV,Vanguard S&P Mid-Cap 400 Value ETF,-1.129,5.54,5.8,45.22,3y,45.22,100.305,2025-10-09T19:06:06.575Z
IVV,iShares Core S&P 500 ETF,-0.47,14.6,18,15.98,3y,15.98,673.24,2025-10-09T19:06:07.148Z
IVW,iShares S&P 500 Growth ETF,-0.197,19.95,28.66,19.64,3y,19.64,121.76,2025-10-09T19:06:07.847Z
IWB,iShares Russell 1000 ETF,-0.509,14.32,18.11,16.16,3y,16.16,367.58,2025-10-09T19:06:08.391Z
IWC,iShares Micro-Cap ETF,-0.428,17.63,26.12,23.8,3y,23.8,153.54,2025-10-09T19:06:08.937Z
IWD,iShares Russell 1000 Value ETF,-0.798,10.04,7.95,14.25,3y,14.25,203.315,2025-10-09T19:06:09.574Z
IWF,iShares Russell 1000 Growth ETF,-0.32,18.16,27.72,20.1,3y,20.1,473.44,2025-10-09T19:06:10.247Z
IWL,iShares Russell Top 200 ETF,-0.393,15.7,20.38,16.3,3y,16.3,167.23,2025-10-09T19:06:10.904Z
IWM,iShares Russell 2000 ETF,-0.928,10.53,12.42,21.75,3y,21.75,244.43,2025-10-09T19:06:11.403Z
IWMI,Neos Russell 2000 High Income ETF,-0.628,0,-3.41,19.31,1y,,49.03,2025-10-09T19:06:11.929Z
IWMY,Defiance R2000 Enhanced Options & 0DTE Income ETF,-1.79,-24.19,-34.19,18.53,1y,,22.765,2025-10-09T19:06:12.497Z
IWN,iShares Russell 2000 Value ETF,-1.178,7.99,8.06,21.54,3y,21.54,177.02,2025-10-09T19:06:13.140Z
IWO,iShares Russell 2000 Growth ETF,-0.796,12.66,16.13,22.54,3y,22.54,325.36,2025-10-09T19:06:13.805Z
IWP,iShares Russell Mid-Cap Growth ETF,-0.451,12.58,22.35,20.18,3y,20.18,143.51,2025-10-09T19:06:14.458Z
IWR,iShares Russell Mid-Cap ETF,-0.951,9.09,10.34,17.25,3y,17.25,96.325,2025-10-09T19:06:15.104Z
IWS,iShares Russell Mid-Cap Value ETF,-1.053,7.87,6.52,16.71,3y,16.71,139.02,2025-10-09T19:06:15.852Z
IWV,iShares Russell 3000 ETF,-0.522,14.15,17.84,16.3,3y,16.3,380.94,2025-10-09T19:06:16.449Z
IWX,iShares Russell Top 200 Value ETF,-0.605,11.4,8.79,13.28,3y,13.28,87.965,2025-10-09T19:06:17.032Z
IWY,iShares Russell Top 200 Growth ETF,-0.342,18.08,27.59,20.36,3y,20.36,276.61,2025-10-09T19:06:17.612Z
IXC,iShares Global Energy ETF,-1.22,7.05,-4.09,20.77,3y,20.77,41.3,2025-10-09T19:06:18.134Z
IXG,iShares Global Financials ETF,-0.612,20.63,22.79,16.24,3y,16.24,115.35,2025-10-09T19:06:18.759Z
IXJ,iShares Global Healthcare ETF,-0.384,7.09,-4.09,13.53,3y,13.53,92.105,2025-10-09T19:06:19.387Z
IXN,iShares Global Tech ETF,-0.469,25.54,30.65,23.78,3y,23.78,106.09,2025-10-09T19:06:19.971Z
IXP,iShares Global Comm Services ETF,-0.155,25.72,29.76,17.87,3y,17.87,122,2025-10-09T19:06:20.572Z
IXUS,iShares Core International Stock ETF,-1.073,25.76,14.84,15.05,3y,15.05,82.95,2025-10-09T19:06:21.185Z
IYC,iShares U.S. Consumer Discretionary ETF,-0.445,7.72,19.66,19,3y,19,102.86,2025-10-09T19:06:21.841Z
IYE,iShares U.S. Energy ETF,-1.329,1.41,-4.96,22.81,3y,22.81,46.77,2025-10-09T19:06:22.441Z
IYF,iShares U.S. Financials ETF,-0.44,12.62,20.45,18.31,3y,18.31,124.4,2025-10-09T19:06:23.026Z
IYG,iShares U.S. Financial Services ETF,-0.356,13.62,24.35,19.26,3y,19.26,88.205,2025-10-09T19:06:23.566Z
IYH,iShares U.S. Healthcare ETF,-0.18,4.39,-4.26,14.08,3y,14.08,60.9,2025-10-09T19:06:24.259Z
IYJ,iShares U.S. Industrials ETF,-1.333,9.76,9.37,16.92,3y,16.92,145.78,2025-10-09T19:06:24.887Z
IYK,iShares U.S. Consumer Staples ETF,0.251,3.84,-1.19,12.21,3y,12.21,67.81,2025-10-09T19:06:25.543Z
IYM,iShares U.S. Basic Materials ETF,-0.97,16.78,0.66,18.69,3y,18.69,150.1,2025-10-09T19:06:26.123Z
IYR,iShares U.S. Real Estate ETF,-0.745,2.5,-3.96,19.04,3y,19.04,94.6,2025-10-09T19:06:26.729Z
IYT,iShares U.S. Transportation ETF,-1.416,5.94,6.67,21.75,3y,21.75,71.69,2025-10-09T19:06:27.398Z
IYW,iShares U.S. Technology ETF,-0.428,25.35,33.01,24.71,3y,24.71,199.99,2025-10-09T19:06:27.958Z
IYY,iShares Dow Jones U.S. ETF,-0.53,14.44,18.2,16.18,3y,16.18,163.28,2025-10-09T19:06:28.464Z
IYZ,iShares U.S. Telecommunications ETF,-0.272,22.4,30.85,17.65,3y,17.65,33,2025-10-09T19:06:29.026Z
JAVA,JPMorgan Active Value ETF,-0.954,8.3,7.51,13.81,3y,13.81,68.54,2025-10-09T19:06:29.636Z
JDST,Direxion Daily Junior Gold Miners Index Bear 2X Shares,11.811,-84.76,-84.55,74.16,3y,74.16,4.26,2025-10-09T19:06:30.257Z
JEPI,JPMorgan Equity Premium Income Fund,-0.334,-1.34,-3.6,10.81,3y,10.81,56.72,2025-10-09T19:06:30.779Z
JEPQ,JPMorgan Nasdaq Equity Premium Income ETF,-0.139,2.31,6.43,15.98,3y,15.98,57.58,2025-10-09T19:06:31.439Z
JETS,U.S. Global Jets ETF,-0.341,-1.1,20.1,28.9,3y,28.9,24.825,2025-10-09T19:06:32.075Z
JGLO,JPMorgan Global Select Equity ETF,-0.395,13.31,9.36,16.42,1y,,68,2025-10-09T19:06:32.679Z
JGRO,JPMorgan Active Growth ETF,-0.327,16.45,23.98,19.91,3y,19.91,94.52,2025-10-09T19:06:33.224Z
JHMD,John Hancock Multifactor Developed International ETF,-0.694,25.48,15.45,15.24,3y,15.24,40.09,2025-10-09T19:06:33.754Z
JHML,John Hancock Multifactor Large Cap ETF,-0.418,13.18,14.36,15.36,3y,15.36,78.66,2025-10-09T19:06:34.389Z
JHMM,John Hancock Multifactor Mid Cap ETF,-1.029,7.96,8.1,17.48,3y,17.48,64.44,2025-10-09T19:06:34.994Z
JIRE,JPMorgan International Research Enhanced Equity ETF,-0.977,27.01,13.98,15.43,3y,15.43,74.01,2025-10-09T19:06:35.668Z
JIVE,JPMorgan International Value ETF,-0.751,36.9,25.47,15.96,1y,,75.33,2025-10-09T19:06:36.391Z
JKD,iShares Morningstar Large-Cap ETF,-0.404,14.52,18.3,16.13,3y,16.13,92.8282,2025-10-09T19:06:36.959Z
JKE,iShares Morningstar Large-Cap Growth ETF,-0.49,16.79,26.09,20.36,3y,20.36,104.665,2025-10-09T19:06:37.468Z
JKF,iShares Morningstar Large-Cap Value ETF,-0.364,12.09,10.92,13.67,3y,13.67,90.46,2025-10-09T19:06:38.087Z
JKG,iShares Morningstar Mid-Cap ETF,-0.609,9.19,10.48,16.66,3y,16.66,83.1019,2025-10-09T19:06:38.768Z
JKH,iShares Morningstar Mid-Cap Growth ETF,-0.684,9.61,14.59,18.36,3y,18.36,82.71,2025-10-09T19:06:39.348Z
JKI,iShares Morningstar Mid-Cap Value ETF,-0.532,8.52,6.08,16.06,3y,16.06,80.4581,2025-10-09T19:06:39.983Z
JKK,iShares Morningstar Small-Cap Growth ETF,-1.045,10.99,13.92,21.39,3y,21.39,54.93,2025-10-09T19:06:40.686Z
JMEE,JPMorgan Small & Mid Cap Enhanced Equity ETF,-0.157,5.55,5.53,19.34,3y,19.34,63.69,2025-10-09T19:06:41.301Z
JMOM,JPMorgan U.S. Momentum Factor ETF,-0.279,16.47,19.23,16.84,3y,16.84,68.02,2025-10-09T19:06:41.812Z
JNUG,Direxion Daily Junior Gold Miners Index Bull 2X Shares,-11.782,303.98,255.89,72.97,3y,72.97,160.54,2025-10-09T19:06:42.372Z
JOYY,JOYY Inc. American Depositary Shares,-1.153,44.34,60.57,43.58,3y,43.58,57.42,2025-10-09T19:06:43.006Z
JPEF,JPMorgan Equity Focus ETF,-0.509,10.52,14.16,18.09,1y,,74.25,2025-10-09T19:06:43.559Z
JPGB,JPMorgan Global Bond Opportunities ETF,-0.041,2.95,1,4.39,3y,4.39,48.79,2025-10-09T19:06:44.147Z
JPIE,JPMorgan Income ETF,-0.087,1.16,0.5,3.75,3y,3.75,46.17,2025-10-09T19:06:44.761Z
JPLD,JPMorgan Limited Duration ETF,0.038,1.63,1.28,2.25,1y,,52.36,2025-10-09T19:06:45.345Z
JQUA,JPMorgan U.S. Quality Factor ETF,-0.634,9.79,11.74,14.74,3y,14.74,62.7,2025-10-09T19:06:45.885Z
JSMD,Janus Small-Mid Cap Growth Alpha Fund,-0.659,10.47,15.69,20.88,3y,20.88,82.82,2025-10-09T19:06:46.464Z
JTEK,JPMorgan U.S. Tech Leaders ETF,-0.358,24.07,38.27,29.64,1y,,94.63,2025-10-09T19:06:46.981Z
KARS,KraneShares Electric Vehicles and Future Mobility Index ETF,0.924,52.94,33.32,28.92,3y,28.92,31.69,2025-10-09T19:06:47.616Z
KBA,KraneShares Bosera MSCI China A 50 Connect Index ETF,-0.166,31.71,-3.04,26.95,3y,26.95,29.99,2025-10-09T19:06:48.184Z
KBE,SPDR S&P Bank ETF,-0.78,6.56,12.41,28.51,3y,28.51,58.51,2025-10-09T19:06:48.732Z
KBWB,Invesco KBW Bank ETF,-0.079,16.48,29.54,27,3y,27,76.04,2025-10-09T19:06:49.368Z
KBWD,Invesco KBW High Dividend Yield Financial ETF,-1.515,-9.72,-10.57,20.23,3y,20.23,13.325,2025-10-09T19:06:49.946Z
KBWP,Invesco KBW Property & Casualty Fund,-0.789,8.01,11.27,18.29,3y,18.29,124.56,2025-10-09T19:06:50.475Z
KBWY,Invesco KBW Premium Yield Equity Fund,-1.424,-14.1,-26.25,22.95,3y,22.95,15.23,2025-10-09T19:06:51.126Z
KCCA,KraneShares California Carbon Allowance Strategy ETF,-0.673,-9.69,-19.96,23.6,3y,23.6,17.7,2025-10-09T19:06:51.652Z
KCE,SPDR S&P Capital Markets ETF,-0.728,8.67,19.07,22.05,3y,22.05,150.08,2025-10-09T19:06:52.350Z
KDEF,PLUS Korea Defense Industry Index ETF,-1.32,129.25,129.25,43.12,SI,,48.61,2025-10-09T19:06:52.886Z
KGRN,KraneShares MSCI China Clean Technology Index ETF,-1.349,42.75,12.29,32.96,3y,32.96,31.44,2025-10-09T19:06:53.498Z
KHPI,Kensington Hedged Premium Income ETF,-0.233,1.54,1.74,11.25,1y,,25.64,2025-10-09T19:06:54.067Z
KIE,SPDR S&P Insurance ETF,-1.393,5.28,6.19,17.74,3y,17.74,59.095,2025-10-09T19:06:54.713Z
KMLM,KraneShares Mount Lucas Managed Futures Index Strategy ETF,0.074,-4.95,-2.71,13.71,3y,13.71,26.89,2025-10-09T19:06:55.372Z
KNG,Fidelity S&P 500 Dividend Aristocrats ETF,-0.809,-1.76,-8.51,13.03,3y,13.03,49.04,2025-10-09T19:06:55.968Z
KOLD,ProShares UltraShort Bloomberg Natural Gas,3.871,-17.21,-43.44,110.49,3y,110.49,34.88,2025-10-09T19:06:56.559Z
KOMP,SPDR S&P Kensho New Economies Composite ETF,-0.739,26.4,31.24,22.53,3y,22.53,64.44,2025-10-09T19:06:57.107Z
KORU,Direxion Daily South Korea Bull 3x Shares,-3.778,234.71,77.77,71.06,3y,71.06,117.15,2025-10-09T19:06:57.689Z
KRBN,KraneShares Global Carbon Strategy ETF,-0.327,13.32,8.55,26.47,3y,26.47,33.51,2025-10-09T19:06:58.278Z
KRE,SPDR S&P Regional Banking ETF,-0.656,5.27,13.01,32,3y,32,62.825,2025-10-09T19:06:58.930Z
KSA,iShares MSCI Saudi Arabia ETF,0.456,-0.55,-1.25,15.19,3y,15.19,40.735,2025-10-09T19:06:59.474Z
KSTR,KraneShares SSE STAR Market 50 Index ETF,1.371,61.26,-0.12,41.29,3y,41.29,20.335,2025-10-09T19:07:00.186Z
KURE,KraneShares MSCI All China Health Care Index ETF,-3.221,49.46,2.27,31.49,3y,31.49,20.73,2025-10-09T19:07:00.857Z
KWEB,KraneShares CSI China Internet ETF,-2.329,43.82,6.26,40.82,3y,40.82,41.305,2025-10-09T19:07:01.371Z
KXI,iShares Global Consumer Staples ETF,-0.141,6.36,0.05,11.77,3y,11.77,63.86,2025-10-09T19:07:01.985Z
LABD,Direxion Daily S&P Biotech Bear 3X Shares,-2.882,-51.23,-46.42,84.84,3y,84.84,33.7,2025-10-09T19:07:02.603Z
LABU,Direxion Daily S&P Biotech Bull 3X Shares,2.531,18.66,-5.81,83.67,3y,83.67,111.79,2025-10-09T19:07:03.210Z
LCTU,BlackRock U.S. Carbon Transition Readiness ETF,-0.586,14.14,17.42,16.23,3y,16.23,72.95,2025-10-09T19:07:03.831Z
LFGY,YieldMax Crypto Industry & Tech Portfolio Option Income ETF,-1.096,-24.2,-24.2,42.69,SI,,37.9,2025-10-09T19:07:04.376Z
LGH,HCM Defender 500 Index ETF,0.839,18.1,21.02,16.48,3y,16.48,61.27,2025-10-09T19:07:04.963Z
LGLV,SPDR SSGA US Large Cap Low Volatility Index ETF,-0.637,7.17,5.51,12.2,3y,12.2,176.36,2025-10-09T19:07:05.638Z
LGOV,First Trust Long Duration Opportunities ETF,-0.206,4.68,-0.07,9.89,3y,9.89,21.825,2025-10-09T19:07:06.275Z
LIT,Global X Lithium & Battery Tech ETF,-1.307,46.83,20.3,29.92,3y,29.92,58.91,2025-10-09T19:07:06.856Z
LLYX,Defiance Daily Target 2X Long LLY ETF,1.77,-6.28,-33.52,83.76,1y,,17.25,2025-10-09T19:07:07.503Z
LMBS,First Trust Low Duration Opportunities ETF,-0.04,2.45,1.94,3.09,3y,3.09,49.86,2025-10-09T19:07:08.059Z
LRGC,AB US Large Cap Strategic Equities ETF,0.425,15.15,16.78,18.48,1y,,77.53,2025-10-09T19:07:08.610Z
LRGF,iShares U.S. Equity Factor ETF,-0.461,14.43,18.46,16.33,3y,16.33,69.05,2025-10-09T19:07:09.144Z
LSGR,Natixis Loomis Sayles Focused Growth ETF,0.268,16.15,28.39,24.08,1y,,44.94,2025-10-09T19:07:09.812Z
LVHB,Innovator Lunt Low Vol/High Beta Tactical ETF,0.061,8.85,11.2,8.45,3y,8.45,48.94,2025-10-09T19:07:10.421Z
LVHD,Franklin U.S. Low Volatility ETF,-0.505,7.28,2.12,12.91,3y,12.91,40.96,2025-10-09T19:07:10.953Z
LVHI,Franklin International Low Volatility High Dividend ETF,0.043,15.13,13.32,11.71,3y,11.71,35.185,2025-10-09T19:07:11.543Z
MAGS,Roundhill Magnificent Seven Fund,-0.153,20.18,39.65,26.82,3y,26.82,65.09,2025-10-09T19:07:12.144Z
MAGX,Redhill Daily 2x Leveraged & Inverse ETF,-1.253,21.94,60.3,60.02,1y,,55.96,2025-10-09T19:07:12.731Z
MARO,YieldMax MARA Option Income Strategy ETF,-7.36,-51.32,-59.95,66.98,1y,,18.88,2025-10-09T19:07:13.264Z
