symbol,name,daily_change_pct,ytd_return_pct,one_year_return_pct,vol_pct,vol_window,vol_3y_pct,last_close,as_of
RWM,ProShares Short Russell2000,0.06,-10.8,-5.22,21.37,3y,21.37,16.69,2025-11-12T19:27:23.744Z
RWO,SPDR Dow Jones Global Real Estate ETF,1.007,8.44,1.18,16.44,3y,16.44,46.14,2025-11-12T19:27:24.144Z
RWR,SPDR Dow Jones REIT ETF,-0.511,2.46,-5.3,18.56,3y,18.56,100.365,2025-11-12T19:27:25.471Z
RXI,iShares Global Consumer Discretionary ETF,0.518,13.76,14.76,18.33,3y,18.33,207.62,2025-11-12T19:27:27.784Z
RYE,Invesco S&P 500 Equal Weight Energy ETF,-1.058,4.72,-0.89,24.32,3y,24.32,81.34,2025-11-12T19:27:28.283Z
RYH,Invesco S&P 500 Equal Weight Health Care ETF,1.093,7.56,0.06,14.94,3y,14.94,31.45,2025-11-12T19:27:30.826Z
RYLD,Global X Russell 2000 Covered Call ETF,0.097,-5.23,-7.71,13.4,3y,13.4,15.495,2025-11-12T19:27:31.710Z
RYT,Invesco S&P 500 Equal Weight Technology ETF,0.372,22.61,17.73,22.28,3y,22.28,45.82,2025-11-12T19:27:32.894Z
RYU,Invesco S&P 500 Equal Weight Utilities ETF,0.077,18.83,15.32,16.15,3y,16.15,78.36,2025-11-12T19:27:33.938Z
SAMT,Strategas Macro Thematic Opportunities ETF,0.159,30.03,29.05,15.04,3y,15.04,37.89,2025-11-12T19:27:35.631Z
SARK,Tuttle Capital Short Innovation ETF,1.045,-28.38,55.9,84.36,3y,84.36,29.98,2025-11-12T19:27:36.012Z
SBIT,ProShares UltraShort Bitcoin ETF,3.149,-34.97,-65.35,90.72,1y,,35.05,2025-11-12T19:27:36.335Z
SCHA,Schwab U.S. Small-Cap ETF,-0.036,8.74,1.63,20.69,3y,20.69,28.11,2025-11-12T19:27:39.587Z
SCHB,Schwab U.S. Broad Market ETF,0,15.98,13.08,15.59,3y,15.59,26.28,2025-11-12T19:27:40.481Z
SCHC,Schwab International Small-Cap Equity ETF,0.909,32.78,23.92,15.49,3y,15.49,45.53,2025-11-12T19:27:40.839Z
SCHD,Schwab U.S. Dividend Equity ETF,0.092,-0.2,-6.45,13.86,3y,13.86,27.205,2025-11-12T19:27:41.950Z
SCHE,Schwab Emerging Markets Equity ETF,-0.132,28.24,19.55,16.17,3y,16.17,34.085,2025-11-12T19:27:42.392Z
SCHF,Schwab International Equity ETF,0.602,31.43,23.9,14.49,3y,14.49,24.235,2025-11-12T19:27:42.755Z
SCHG,Schwab U.S. Large-Cap Growth ETF,-0.272,18.35,18.74,19.96,3y,19.96,32.95,2025-11-12T19:27:43.128Z
SCHH,Schwab U.S. REIT ETF,-0.51,2.78,-5.47,18.17,3y,18.17,21.44,2025-11-12T19:27:43.509Z
SCHK,Schwab 1000 Index ETF,0.061,16.42,13.65,15.61,3y,15.61,32.89,2025-11-12T19:27:43.975Z
SCHM,Schwab U.S. Mid-Cap ETF,0.269,7.77,2.12,18.07,3y,18.07,29.82,2025-11-12T19:27:44.373Z
SCHV,Schwab U.S. Large-Cap Value ETF,0.444,13.16,7.02,13.31,3y,13.31,29.41,2025-11-12T19:27:44.762Z
SCHX,Schwab U.S. Large-Cap ETF,-0.074,16.54,13.94,15.5,3y,15.5,26.98,2025-11-12T19:27:45.097Z
SCHY,Schwab International Dividend Equity ETF,0.171,26.44,19.32,12.36,3y,12.36,29.27,2025-11-12T19:27:45.772Z
SCJ,iShares MSCI Japan Small-Cap ETF,0.54,26.17,23.53,15.01,3y,15.01,92.215,2025-11-12T19:27:48.070Z
SCO,ProShares UltraShort Bloomberg Crude Oil,7.018,14.75,7.14,51.11,3y,51.11,18.91,2025-11-12T19:27:51.766Z
SCZ,iShares MSCI EAFE Small-Cap ETF,0.549,26.91,20.64,14.9,3y,14.9,76.91,2025-11-12T19:27:52.146Z
SDCI,USCF SummerHaven Dynamic Commodity Strategy No K-1 Fund,-1.337,18.48,17.88,16.63,3y,16.63,23.245,2025-11-12T19:27:52.568Z
SDIV,Global X SuperDividend ETF,0.041,17.47,10.94,15.96,3y,15.96,24.34,2025-11-12T19:27:52.930Z
SDOG,ALPS Sector Dividend Dogs ETF,0.528,6.22,0.23,14.93,3y,14.93,60.005,2025-11-12T19:27:56.132Z
SDOW,ProShares UltraPro Short Dow30,-2.021,-37.6,-31.44,40.8,3y,40.8,31.99,2025-11-12T19:27:56.580Z
SDS,ProShares UltraShort S&P500,-0.072,-29.99,-27.84,30.8,3y,30.8,13.84,2025-11-12T19:27:57.175Z
SDSI,American Century Short Duration Strategic Income ETF,0.07,1.5,0.96,2.75,3y,2.75,51.641,2025-11-12T19:28:00.032Z
SDVD,FT Vest Smid Rising Dividend Fund,0.559,0.75,-7.18,19.81,1y,,21.6,2025-11-12T19:28:00.576Z
SDVY,First Trust SMID Cap Rising Dividend Achievers ETF,0.394,6.88,-1.01,20.25,3y,20.25,38.21,2025-11-12T19:28:04.050Z
SDY,SPDR S&P Dividend ETF,0.505,6.07,-1.63,13.14,3y,13.14,139.24,2025-11-12T19:28:04.834Z
SECT,Main Sector Rotation ETF,0.351,16.95,13.08,17.01,3y,17.01,64.275,2025-11-12T19:28:06.053Z
SEIE,SEI Select International Equity Fund,0.733,33.54,29.59,16.51,1y,,31.7207,2025-11-12T19:28:08.094Z
SEIM,SEI Enhanced U.S. Large Cap Momentum Fund,0.348,19.05,16.91,17.38,3y,17.38,46.19,2025-11-12T19:28:08.840Z
SEIQ,SEI Enhanced US Large Cap Quality Mutual Fund,0.708,10.27,7,13.26,3y,13.26,38.38,2025-11-12T19:28:12.289Z
SEIS,SEI Select Small Cap ETF,0.513,7.32,-0.42,22.91,1y,,27.4993,2025-11-12T19:28:12.712Z
SEIV,SEI Enhanced U.S. Large Cap Value Fund,0.949,22.29,16.75,15.41,3y,15.41,40.43,2025-11-12T19:28:13.112Z
SETH,ProShares Short Ether Strategy ETF,1.358,-34.81,-47.87,77.27,1y,,9.7,2025-11-12T19:28:13.616Z
SETM,Sprott Critical Materials ETF,0.343,69.24,45.34,33.81,3y,33.81,26.3,2025-11-12T19:28:15.379Z
SFLO,VS Small Cap Free Cash Flow ETF,0.982,7.75,3.81,24.29,1y,,28.985,2025-11-12T19:28:15.752Z
SFLR,Innovator Equity Managed Floor ETF,-0.027,13.23,12,10.11,3y,10.11,36.88,2025-11-12T19:28:16.256Z
SFY,SoFi Select 500 ETF,-0.03,22.17,19.12,17.63,3y,17.63,133.37,2025-11-12T19:28:16.686Z
SGDJ,Sprott Junior Gold Miners ETF,4.015,121.76,101.86,38.21,3y,38.21,77.595,2025-11-12T19:28:17.101Z
SGDM,Sprott Gold Miners ETF,4.1,124.36,112.98,32.72,3y,32.72,64.75,2025-11-12T19:28:18.087Z
SGOL,abrdn Physical Gold Shares ETF,1.601,57.5,55.97,16.07,3y,16.07,39.99,2025-11-12T19:28:19.400Z
SH,ProShares Short S&P500,-0.055,-14.66,-13.52,15.36,3y,15.36,36.27,2025-11-12T19:28:20.633Z
SHLD,Global X Defense Tech ETF,-0.851,76.5,61.48,23.59,1y,,65.835,2025-11-12T19:28:21.005Z
SHNY,MicroSectors Gold 3X Leveraged ETNs,5.244,193.02,171.1,48.92,3y,48.92,126.44,2025-11-12T19:28:21.362Z
SIL,Global X Silver Miners ETF,4.834,114.76,89.07,35.59,3y,35.59,71.13,2025-11-12T19:28:21.708Z
SILJ,Amplify Junior Silver Miners ETF,5.124,129.13,83.03,40.23,3y,40.23,24.105,2025-11-12T19:28:22.104Z
SIVR,abrdn Physical Silver Shares ETF,4.306,80.26,70.42,28.26,3y,28.26,50.87,2025-11-12T19:28:24.619Z
SIXG,Defiance Connective Tech ETF,0.351,38.66,43,29.1,1y,,66.35,2025-11-12T19:28:24.930Z
SKYY,First Trust Cloud Computing ETF,-0.593,14.19,16.13,26.26,3y,26.26,136.665,2025-11-12T19:28:25.382Z
SLV,iShares Silver Trust,4.37,80.02,70.22,28.16,3y,28.16,48.48,2025-11-12T19:28:25.723Z
SLVO,UBS AG ETRACS Monthly Pay 2xLeveraged Silver Shares Covered Call Exchange Traded Note,1.287,29.68,20.93,20.01,3y,20.01,96.78,2025-11-12T19:28:26.098Z
SLVP,iShares MSCI Global Silver and Metals Miners ETF,3.984,135.52,112.04,39.32,3y,39.32,28.71,2025-11-12T19:28:26.494Z
SLX,VanEck Steel ETF,0.038,35,6.46,24.75,3y,24.75,78.46,2025-11-12T19:28:26.902Z
SLYG,SPDR S&P 600 Small Cap Growth ETF,0.234,4.21,-4.24,20.3,3y,20.3,94.14,2025-11-12T19:28:28.562Z
SLYV,SPDR S&P 600 Small Cap Value ETF,0.688,4.36,-2.4,21.97,3y,21.97,90.69,2025-11-12T19:28:29.138Z
SMCY,YieldMax SMCI Option Income Strategy ETF,-2.046,-56.76,-60.35,80.03,1y,,11.01,2025-11-12T19:28:29.426Z
SMDV,ProShares Russell 2000 Dividend Growers ETF,0.497,-0.92,-9.51,19.32,3y,19.32,66.097,2025-11-12T19:28:31.371Z
SMH,VanEck Semiconductor ETF,1.034,44.89,36.76,33.83,3y,33.83,354.68,2025-11-12T19:28:32.687Z
SMIG,Bahl & Gaynor Small/Mid Cap Income Growth ETF,0.21,-1.14,-8.12,15.15,3y,15.15,28.62,2025-11-12T19:28:33.095Z
SMIN,iShares MSCI India Small-Cap ETF,-0.311,-4.04,-9.55,18.04,3y,18.04,73.84,2025-11-12T19:28:33.496Z
SMLF,iShares U.S. Small-Cap Equity Factor ETF,0.497,10.47,4.38,20.09,3y,20.09,74.83,2025-11-12T19:28:33.948Z
SMMD,iShares Russell 2500 ETF,0.283,9.63,3.06,19.49,3y,19.49,74.37,2025-11-12T19:28:34.312Z
SNOY,YieldMax SNOW Option Income Strategy ETF,-0.768,-14.13,-6.64,49.37,1y,,15.5,2025-11-12T19:28:34.644Z
SNPE,Xtrackers S&P 500 ESG ETF,0.048,16.88,13.54,15.62,3y,15.62,62.04,2025-11-12T19:28:35.022Z
SNTH,Mrp Synthequity ETF,0.62,26.34,26.34,17.55,SI,,31.5845,2025-11-12T19:28:35.525Z
SOXL,Direxion Daily Semiconductor Bull 3X Shares,3.755,56.78,22.51,102.46,3y,102.46,43.38,2025-11-12T19:28:36.086Z
SOXQ,Invesco PHLX Semiconductor ETF,1.201,40.75,33.49,35.16,3y,35.16,55.61,2025-11-12T19:28:36.521Z
SOXS,Direxion Daily Semiconductor Bear 3X Shares,-3.581,-84.18,-81.84,109.36,3y,109.36,3.5,2025-11-12T19:28:36.836Z
SOXX,iShares Semiconductor ETF,1.284,37.87,29.21,34.53,3y,34.53,298.94,2025-11-12T19:28:37.195Z
SOYB,Teucrium Soybean Fund,0.257,8.78,5.88,15.94,3y,15.94,23.42,2025-11-12T19:28:37.524Z
SPDN,Direxion Daily S&P 500 Bear 1X Shares,0,-14.49,-12.83,15.67,3y,15.67,9.44,2025-11-12T19:28:37.910Z
SPDW,SPDR Portfolio Developed World ex-US ETF,0.636,30.13,23.81,14.49,3y,14.49,44.31,2025-11-12T19:28:38.328Z
SPEM,SPDR Portfolio Emerging Markets ETF,-0.042,25.11,18.16,15.56,3y,15.56,47.83,2025-11-12T19:28:38.728Z
SPEU,SPDR Portfolio Europe ETF,0.569,29.24,23.63,14.89,3y,14.89,51.27,2025-11-12T19:28:39.621Z
SPGM,SPDR Portfolio MSCI Global Stock Market ETF,0.143,22.01,17.81,14.42,3y,14.42,77.21,2025-11-12T19:28:40.763Z
SPGP,Invesco S&P 500 GARP ETF,0.615,7.66,2.08,17.67,3y,17.67,112.9,2025-11-12T19:28:41.135Z
SPHB,Invesco S&P 500 High Beta ETF,0.627,28.58,23.67,25,3y,25,113.96,2025-11-12T19:28:41.502Z
SPHD,Invesco S&P 500 High Dividend Low Volatility ETF,0.093,0.13,-3.98,13.75,3y,13.75,48.425,2025-11-12T19:28:41.862Z
SPHQ,Invesco S&P 500 Quality ETF,0.391,11.46,8.68,14.27,3y,14.27,74.52,2025-11-12T19:28:42.193Z
SPLG,SPDR Portfolio S&P 500 ETF,1.558,16.56,15.32,15.27,3y,15.27,80.16,2025-11-12T19:28:43.027Z
SPLV,Invesco S&P 500 Low Volatility ETF,0.111,3.67,-1.2,11.49,3y,11.49,72.27,2025-11-12T19:28:43.389Z
SPMD,SPDR Portfolio S&P 400 Mid Cap ETF,0.314,5.28,-0.71,18.37,3y,18.37,57.43,2025-11-12T19:28:45.019Z
SPMO,Invesco S&P 500 Momentum ETF,-0.125,25.74,24,18.42,3y,18.42,120.14,2025-11-12T19:28:45.446Z
SPRE,SP Funds S&P Global REIT Sharia ETF,-0.51,-0.66,-7.58,18.14,3y,18.14,19.52,2025-11-12T19:28:45.847Z
SPRX,Spear Alpha ETF,-1.651,41.84,59.35,38.26,3y,38.26,39.9,2025-11-12T19:28:46.218Z
SPSM,SPDR Portfolio S&P 600 Small Cap ETF,0.333,4.18,-3.26,20.79,3y,20.79,46.765,2025-11-12T19:28:46.564Z
SPTM,SPDR Portfolio S&P 1500 Composite Stock Market ETF,0.085,15.88,12.87,15.32,3y,15.32,82.6,2025-11-12T19:28:47.750Z
SPUS,SP Funds S&P 500 Sharia Industry Exclusions ETF,0.078,19.66,18.5,17.76,3y,17.76,51.3,2025-11-12T19:28:48.146Z
SPUU,Direxion Daily S&P 500 Bull 2X Shares,0.117,27.44,21.03,30.16,3y,30.16,187.46,2025-11-12T19:28:49.332Z
SPXL,Direxion Daily S&P 500 Bull 3X Shares,0.094,34.1,23.12,45.3,3y,45.3,224.37,2025-11-12T19:28:49.654Z
SPXS,Direxion Daily S&P 500 Bear 3X Shares,0.141,-43.93,-40.05,46.6,3y,46.6,35.49,2025-11-12T19:28:49.975Z
SPXU,ProShares UltraPro Short S&P 500 Fund,0,-44.52,-41.57,46.34,3y,46.34,12.61,2025-11-12T19:28:50.306Z
SPY,SPDR S&P 500 ETF Trust,-0.012,16.81,14.16,15.63,3y,15.63,682.915,2025-11-12T19:28:50.608Z
SPYD,SPDR Portfolio S&P 500 High Dividend ETF,0.127,0.41,-5.92,15.74,3y,15.74,43.285,2025-11-12T19:28:50.992Z
SPYG,SPDR Portfolio S&P 500 Growth ETF,-0.345,21.7,22.08,18.77,3y,18.77,106.93,2025-11-12T19:28:51.367Z
SPYI,NEOS S&P 500 High Income ETF,0.019,4.39,1.11,13.11,3y,13.11,52.99,2025-11-12T19:28:51.800Z
SPYT,Defiance S&P 500 Target Income ETF,0,-5.13,-10.21,19,1y,,18.12,2025-11-12T19:28:53.310Z
SPYU,Max S&P 500 4X Leveraged Exchange-Traded Note,0.245,24.16,8.63,73.39,1y,,57.4,2025-11-12T19:28:53.630Z
SPYV,SPDR Portfolio S&P 500 Value ETF,0.45,11.76,5.03,13.46,3y,13.46,56.865,2025-11-12T19:28:53.991Z
SPYX,SPDR S&P 500 Fossil Fuel Reserves Free ETF,0.16,17.35,14.8,15.5,3y,15.5,56.33,2025-11-12T19:28:54.350Z
SQQQ,ProShares UltraPro Short QQQ,0.662,-56.35,-56.75,62.14,3y,62.14,13.68,2025-11-12T19:28:54.698Z
SRTY,ProShares UltraPro Short Russell2000,0.354,-39.57,-27.56,64.35,3y,64.35,11.33,2025-11-12T19:28:55.014Z
SRVR,Pacer Data & Infrastructure Real Estate ETF,-1.391,0.89,-3.69,18.2,3y,18.2,30.135,2025-11-12T19:28:55.460Z
SSG,ProShares UltraShort Semiconductors,-0.768,-70.07,-69.21,80.11,3y,80.11,7.75,2025-11-12T19:28:56.040Z
SSO,ProShares Ultra S&P500,-0.047,26.92,20.3,30.44,3y,30.44,116.795,2025-11-12T19:28:56.388Z
STCE,Schwab Crypto Thematic ETF,-5.273,66.36,66.75,54.29,3y,54.29,77.24,2025-11-12T19:28:57.281Z
STLG,iShares Factors US Growth Style ETF,2.169,21.76,28.6,20.32,3y,20.32,68.31,2025-11-12T19:28:57.620Z
STRV,Strive 500 ETF,0.174,17.33,15.02,15.57,3y,15.57,44.27,2025-11-12T19:28:57.980Z
SUSA,iShares MSCI USA ESG Select ETF,0.187,15.06,12.08,15.49,3y,15.49,139.59,2025-11-12T19:28:58.326Z
SUSL,iShares ESG MSCI USA Leaders ETF,0.019,17.65,13.63,16.04,3y,16.04,120.79,2025-11-12T19:28:58.684Z
SVIX,-1X Short VIX Futures ETF,-0.025,-17.93,-28.39,71.77,3y,71.77,20.345,2025-11-12T19:28:59.070Z
SVOL,Simplify Volatility Premium ETF,0.619,-13.66,-18.24,24.63,3y,24.63,17.88,2025-11-12T19:28:59.746Z
SVXY,ProShares Short VIX Short-Term Futures ETF,-0.119,1.68,-3.17,36.39,3y,36.39,50.34,2025-11-12T19:29:00.993Z
SYLD,Cambria Shareholder Yield ETF,0.838,0.35,-7.29,18.79,3y,18.79,68.56,2025-11-12T19:29:01.339Z
TAIL,Cambria Tail Risk ETF,0.084,5.61,4.04,14.91,3y,14.91,11.86,2025-11-12T19:29:01.901Z
TAN,Invesco Solar ETF,-2.247,45.94,40.64,37.82,3y,37.82,50.685,2025-11-12T19:29:02.297Z
TARK,Tradr 2x Long Innovation ETF,-1.442,60.75,-14,89.46,3y,89.46,70.41,2025-11-12T19:29:02.705Z
TBG,TBG Dividend Focus ETF,1.365,3.6,0.46,14.83,1y,,33.132,2025-11-12T19:29:03.855Z
TBLD,Thornburg Income Builder Opportunities Trust,-0.487,25.71,19.67,13.21,3y,13.21,20.44,2025-11-12T19:29:05.419Z
TCAF,T. Rowe Price Capital Appreciation Equity ETF,0.077,17.31,13.41,14.19,3y,14.19,38.9,2025-11-12T19:29:05.852Z
TCAL,T. Rowe Price Capital Appreciation Premium Income ETF,-0.124,-3.32,-3.32,12.82,SI,,24.17,2025-11-12T19:29:06.203Z
TCHP,T. Rowe Price Blue Chip Growth ETF,-0.18,18.69,18.26,20.39,3y,20.39,49.86,2025-11-12T19:29:06.575Z
TDIV,FT NASDAQ Technology Dividend Index Fund,0.552,25.32,19.83,19.84,3y,19.84,98.38,2025-11-12T19:29:06.978Z
TDVG,T. Rowe Price Dividend Growth ETF,0.499,13.84,8.77,12.44,3y,12.44,44.92,2025-11-12T19:29:07.400Z
TDVI,FT Vest Technology Dividend Mutual Fund,0.426,17.51,11.56,23.47,1y,,28.32,2025-11-12T19:29:07.901Z
TECL,Direxion Daily Technology Bull 3x Shares,0.162,50.76,37.53,68.94,3y,68.94,135.67,2025-11-12T19:29:08.497Z
TECS,Direxion Daily Technology Bear 3X Shares,-0.059,-64.87,-62.99,71.52,3y,71.52,16.87,2025-11-12T19:29:08.857Z
TGRT,T. Rowe Price Growth ETF,-0.223,18.39,17.7,19.3,3y,19.3,44.81,2025-11-12T19:29:09.821Z
THD,iShares MSCI Thailand ETF,-1.538,0.12,-8.36,19.97,3y,19.97,59.55,2025-11-12T19:29:10.215Z
THNQ,Robo Global Artificial Intelligence ETF,-0.308,35.35,35.9,25.45,3y,25.45,66.405,2025-11-12T19:29:10.602Z
TLTW,iShares 20+ Year Treasury Bond BuyWrite Fund,0.277,-0.36,-7.31,12.22,3y,12.22,23.505,2025-11-12T19:29:10.983Z
TMFC,Motley Fool 100 Index ETF,0.055,21.22,21.34,18.25,3y,18.25,72.37,2025-11-12T19:29:11.349Z
TMSL,T. Rowe Price Small-Mid Cap ETF,0.241,9.79,3.07,18.08,3y,18.08,35.375,2025-11-12T19:29:11.710Z
TNA,Direxion Daily Small Cap Bull 3X Shares,-0.243,7.83,-16.13,63.62,3y,63.62,45.19,2025-11-12T19:29:13.127Z
TOPT,iShares Top 20 U.S. Stocks ETF,-0.16,21.14,22.32,22.01,1y,,31.4597,2025-11-12T19:29:13.443Z
TOTL,SPDR DoubleLine Total Return Tactical ETF,-0.037,2.83,1.01,6.12,3y,6.12,40.515,2025-11-12T19:29:13.835Z
TOUS,T. Rowe Price International Equity ETF,0.846,32.35,24.37,14.59,3y,14.59,34.57,2025-11-12T19:29:14.376Z
TPYP,Tortoise North American Pipeline Fund,0.056,2.19,2.9,16.14,3y,16.14,35.46,2025-11-12T19:29:14.718Z
TQQQ,ProShares UltraPro QQQ,-0.635,41.26,34.22,60.14,3y,60.14,111.07,2025-11-12T19:29:15.046Z
TRFK,Pacer Data and Digital Revolution ETF,-0.258,36.87,36.42,28.3,3y,28.3,69.64,2025-11-12T19:29:15.485Z
TSDD,Graniteshares 2x Short Tesla Daily ETF,4.264,-73.99,-84.57,137.04,1y,,9.78,2025-11-12T19:29:15.840Z
TSL,GraniteShares 1.25 Long TSLA ETF,-2.291,7.31,29.88,80.69,3y,80.69,17.91,2025-11-12T19:29:16.368Z
TSLL,Direxion Daily TSLA Bull 2X Shares,-3.606,-21.54,-0.42,112.11,3y,112.11,18.98,2025-11-12T19:29:16.695Z
TSLQ,Tradr 2x Short Tesla Daily ETF,4.067,-73.88,-85.27,105.75,3y,105.75,23.54,2025-11-12T19:29:17.810Z
TSLR,GraniteShares 1.25x Long Tesla Daily ETF,-3.904,-19.58,3.92,132.19,1y,,30.52,2025-11-12T19:29:18.212Z
TSLS,Direxion Daily TSLA Bear 1X Shares,1.692,-36.65,-49.58,62.97,3y,62.97,5.41,2025-11-12T19:29:18.610Z
TSLT,T-Rex 2X Long Tesla Daily Target,-4.266,-23.04,-1.5,131.8,1y,,25.58,2025-11-12T19:29:18.977Z
TSLY,YieldMax TSLA Option Income Strategy ETF,-1.22,-39.82,-43.71,52.57,3y,52.57,8.1,2025-11-12T19:29:19.327Z
TSLZ,T-Rex 2X Inverse Tesla Daily Fund,3.743,-75.21,-85.89,137.07,1y,,13.86,2025-11-12T19:29:19.673Z
TSME,Thrivent Small-Mid Cap ESG ETF,0.56,12.84,5.87,20.67,3y,20.67,41.3,2025-11-12T19:29:21.701Z
TSMX,Direxion Daily Taiwan Semiconductor Bull 2X Shares,-0.162,60.22,55.33,83.96,1y,,49.38,2025-11-12T19:29:22.035Z
TSMY,YieldMax TSM Option Income Strategy ETF,0.375,-16.9,-22.24,37.36,1y,,16.08,2025-11-12T19:29:22.356Z
TSPA,T. Rowe Price U.S. Equity Research ETF,0,16.37,14.12,15.3,3y,15.3,43,2025-11-12T19:29:22.792Z
TSPY,Tappalpha SPY G and D Index ETF,0.098,2.65,-1.53,18.73,1y,,25.61,2025-11-12T19:29:23.152Z
TTAC,Abacus FCF Leaders ETF,-0.303,8.69,6.91,15.47,3y,15.47,72.29,2025-11-12T19:29:23.742Z
TUA,Simplify Short Term Treasury Futures Strategy ETF,-0.136,3.34,2.09,11.41,3y,11.41,21.95,2025-11-12T19:29:24.665Z
TUR,iShares MSCI Turkey ETF,0.639,-9.3,-4.23,31.58,3y,31.58,33.06,2025-11-12T19:29:25.536Z
TVAL,T. Rowe Price Value ETF,0.694,13.05,6.64,15.53,1y,,34.83,2025-11-12T19:29:25.935Z
TWM,ProShares UltraShort Russell2000,0.06,-25.24,-15.27,42.77,3y,42.77,33.17,2025-11-12T19:29:26.366Z
TZA,Direxion Daily Small Cap Bear 3X Shares,0.253,-38.84,-25.14,64.67,3y,64.67,7.92,2025-11-12T19:29:26.721Z
UAE,iShares MSCI UAE ETF,-0.762,19.58,27.5,16.85,3y,16.85,19.54,2025-11-12T19:29:27.115Z
UCO,ProShares Ultra Bloomberg Crude Oil,-6.989,-27.85,-23.94,51.45,3y,51.45,20.36,2025-11-12T19:29:27.480Z
UDN,Invesco DB US Dollar Index Bearish Fund,-0.027,11.54,1.84,8.42,3y,8.42,18.505,2025-11-12T19:29:27.853Z
UDOW,ProShares UltraPro Dow30,2.112,27.21,12.08,40.23,3y,40.23,118.92,2025-11-12T19:29:28.245Z
UFO,Procure Space ETF,-0.202,48.48,66.96,28.1,3y,28.1,34.61,2025-11-12T19:29:28.637Z
UGA,"United States Gasoline Fund, LP",-2.349,5.78,9.16,28.74,3y,28.74,67.955,2025-11-12T19:29:28.980Z
UGL,ProShares Ultra Gold,3.229,123.25,115.76,32.56,3y,32.56,53.39,2025-11-12T19:29:29.406Z
ULTY,YieldMax Ultra Option Income Strategy ETF,-2.759,-51.27,-58.68,33.32,1y,,4.405,2025-11-12T19:29:29.721Z
UNG,"United States Natural Gas Fund, L.P.",0.275,-14.17,16.52,60.32,3y,60.32,14.6,2025-11-12T19:29:30.083Z
UOCT,Innovator U.S. Equity Ultra Fund,-0.129,9.63,9.41,6.44,3y,6.44,38.7,2025-11-12T19:29:30.556Z
UPRO,ProShares UltraPro S&P500,0.085,34.28,23.23,45.48,3y,45.48,118.03,2025-11-12T19:29:30.932Z
URA,Global X Uranium ETF,0.653,69.87,54.03,37.29,3y,37.29,47.75,2025-11-12T19:29:31.255Z
URAA,Direxion Daily Uranium Industry Bull 2X Shares,0.517,92.05,59.45,84.6,1y,,38.89,2025-11-12T19:29:31.601Z
URNJ,Sprott Junior Uranium Miners ETF,-1.172,25.43,13.5,50.7,3y,50.7,26.14,2025-11-12T19:29:32.021Z
URNM,Sprott Uranium Miners ETF,-0.413,31.34,21.94,39.72,3y,39.72,56.725,2025-11-12T19:29:32.896Z
URTH,iShares MSCI World ETF,0.207,19.94,16.43,14.51,3y,14.51,186.145,2025-11-12T19:29:33.244Z
URTY,ProShares UltraPro Russell2000,-0.057,7.48,-16.37,63.82,3y,63.82,53.01,2025-11-12T19:29:34.119Z
USD,ProShares Ultra Semiconductors,0.771,64.39,50.47,77.02,3y,77.02,111.06,2025-11-12T19:29:34.488Z
USDU,WisdomTree Bloomberg U.S. Dollar Bullish Fund,-0.093,-3.29,-2.73,8.73,3y,8.73,26.905,2025-11-12T19:29:34.886Z
USDX,SGI Enhanced Core ETF,0.039,1.49,-0.82,3.76,1y,,25.95,2025-11-12T19:29:35.180Z
USMC,Principal U.S. Mega-Cap ETF,-0.134,16.07,16.05,15.41,3y,15.41,69.165,2025-11-12T19:29:35.545Z
USMF,WisdomTree U.S. Multifactor Fund,0.593,3.44,0.59,12.98,3y,12.98,51.4,2025-11-12T19:29:35.907Z
USMV,iShares MSCI USA Min Vol Factor ETF,0.26,6.64,1.15,11.01,3y,11.01,94.545,2025-11-12T19:29:36.647Z
USO,"United States Oil Fund, LP",-4.036,-9.29,-4.57,30,3y,30,69.785,2025-11-12T19:29:36.988Z
USPX,Franklin U.S. Equity Index ETF,0.05,16.99,14.43,15.67,3y,15.67,60.03,2025-11-12T19:29:37.480Z
USRT,iShares Core U.S. REIT ETF,-0.527,3.05,-4.41,18.49,3y,18.49,58.52,2025-11-12T19:29:38.457Z
USSG,Xtrackers MSCI USA ESG Leaders Equity ETF,0.095,17.94,13.88,16.15,3y,16.15,63.5,2025-11-12T19:29:38.844Z
USVM,VictoryShares US Small Mid Cap Value Momentum ETF,0.277,7.22,-0.23,18.52,3y,18.52,90.41,2025-11-12T19:29:39.206Z
USXF,iShares ESG Aware MSCI USA ETF,0.377,16.36,11.04,18.09,3y,18.09,58.04,2025-11-12T19:29:39.600Z
UTES,Virtus Reaves Utilities ETF,-0.581,25.62,24.84,20.61,3y,20.61,82.07,2025-11-12T19:29:40.286Z
UTRN,Utron Ltd.,-0.75,-5.17,28.69,379.93,3y,379.93,502.8,2025-11-12T19:29:40.819Z
UTSL,Direxion Daily Utilities Bull 3X Shares,0.382,44.77,28.2,50.11,3y,50.11,47.24,2025-11-12T19:29:41.149Z
UUP,Invesco DB US Dollar Index Bullish Fund,0.053,-5.11,-4.62,8.31,3y,8.31,28.155,2025-11-12T19:29:41.521Z
UVIX,2x Long VIX Futures ETF,0.661,-74.11,-74.75,135.25,3y,135.25,9.14,2025-11-12T19:29:42.596Z
UVXY,ProShares Ultra VIX Short-Term Futures ETF,0.501,-53.08,-52.05,100.67,3y,100.67,10.04,2025-11-12T19:29:42.969Z
UWM,ProShares Ultra Russell2000,-0.107,11.18,-5.24,42.57,3y,42.57,46.65,2025-11-12T19:29:43.349Z
UYG,ProShares Ultra Financials,2.151,15.16,9.76,33.25,3y,33.25,97.82,2025-11-12T19:29:43.764Z
VAW,Vanguard Materials ETF,1.171,7.83,-5.1,17.68,3y,17.68,200.49,2025-11-12T19:29:44.185Z
VB,Vanguard Small-Cap ETF,0.309,6.82,1.28,19.44,3y,19.44,256.39,2025-11-12T19:29:44.565Z
VBK,Vanguard Small-Cap Growth ETF,0,7.66,4.08,21.03,3y,21.03,302.09,2025-11-12T19:29:45.173Z
VBR,Vanguard Small-Cap Value ETF,0.403,5.89,-1.18,18.81,3y,18.81,209.17,2025-11-12T19:29:46.729Z
VCR,Vanguard Consumer Discretionary ETF,-0.306,5.9,8.12,21.53,3y,21.53,393.57,2025-11-12T19:29:47.099Z
VDC,Vanguard Consumer Staples ETF,0.076,0.17,-2.29,11.79,3y,11.79,211.15,2025-11-12T19:29:47.485Z
VDE,Vanguard Energy ETF,-1.26,3.74,-2.97,22.72,3y,22.72,127.375,2025-11-12T19:29:47.874Z
VEA,Vanguard FTSE Developed Markets ETF,0.599,30.13,23.58,14.63,3y,14.63,62.1,2025-11-12T19:29:48.232Z
VEU,Vanguard FTSE All-World ex-US ETF,0.408,29.18,22.5,14.26,3y,14.26,73.89,2025-11-12T19:29:48.587Z
VFH,Vanguard Financials ETF,0.914,11.01,8.52,17.8,3y,17.8,130.805,2025-11-12T19:29:49.364Z
VFLO,VictoryShares Free Cash Flow ETF,0.756,13.48,8.14,19.57,1y,,38.64,2025-11-12T19:29:50.010Z
VFMF,Vanguard U.S. Multifactor ETF,0.591,12.07,6.33,17.12,3y,17.12,146.154,2025-11-12T19:29:50.929Z
VFMO,Vanguard U.S. Momentum Factor Fund,0.681,17.23,10.59,20.39,3y,20.39,193.62,2025-11-12T19:29:51.246Z
VFMV,Vanguard U.S. Minimum Volatility ETF,0.493,8.79,4.73,10.92,3y,10.92,131.003,2025-11-12T19:29:51.595Z
VFVA,Vanguard U.S. Value Factor Fund,1.078,7.84,0.99,19.57,3y,19.57,127.56,2025-11-12T19:29:51.934Z
VGK,Vanguard FTSE Europe ETF,0.507,30.09,23.69,15.39,3y,15.39,82.205,2025-11-12T19:29:53.276Z
VGT,Vanguard Information Technology ETF,-0.025,24.43,23.8,23.42,3y,23.42,773.11,2025-11-12T19:29:54.327Z
VHT,Vanguard Health Care ETF,1.152,11.99,2.54,13.76,3y,13.76,284.52,2025-11-12T19:29:54.700Z
VIG,Vanguard Dividend Appreciation ETF,0.553,12.9,8.36,12.75,3y,12.75,220.04,2025-11-12T19:29:55.008Z
VIGI,Vanguard International Dividend Appreciation Index Fund,0.86,14.51,8.6,13.01,3y,13.01,91.47,2025-11-12T19:29:55.345Z
VIOG,Vanguard S&P Small-Cap 600 Growth ETF,0.405,4.3,-3.7,20.29,3y,20.29,121.57,2025-11-12T19:29:56.631Z
VIOO,Vanguard S&P Small-Cap 600 ETF,0.567,5.64,-2.74,45.77,3y,45.77,111.82,2025-11-12T19:29:56.993Z
VIOV,Vanguard S&P Small-Cap 600 Value ETF,0.735,4.85,-1.93,46.24,3y,46.24,97.3,2025-11-12T19:29:58.216Z
VIS,Vanguard Industrials ETF,0.339,17.61,8.45,16.91,3y,16.91,298.54,2025-11-12T19:29:58.755Z
VIXM,ProShares VIX Mid-Term Futures ETF,-0.122,11.7,16.49,33,3y,33,16.32,2025-11-12T19:29:59.096Z
VIXY,ProShares VIX Short-Term Futures ETF,0,-30.72,-27.91,68.77,3y,68.77,31.84,2025-11-12T19:29:59.450Z
VLU,SPDR S&P 1500 Value Tilt ETF,0.601,13.01,8.68,14.13,3y,14.13,207.55,2025-11-12T19:29:59.810Z
VLUE,iShares MSCI USA Value Factor ETF,0.989,25.9,17.84,15.88,3y,15.88,132.77,2025-11-12T19:30:00.162Z
VNM,VanEck Vietnam ETF,2.953,50.78,46.22,25.68,3y,25.68,17.43,2025-11-12T19:30:00.704Z
VNQ,Vanguard Real Estate ETF,-0.411,2.86,-5.28,18.25,3y,18.25,90.815,2025-11-12T19:30:01.099Z
VNQI,Vanguard Global ex-US Real Estate Index Fund,0.25,22.3,10.46,14.91,3y,14.91,48.05,2025-11-12T19:30:01.763Z
VO,Vanguard Mid-Cap ETF,0.099,10.86,5.67,15.57,3y,15.57,292.39,2025-11-12T19:30:03.256Z
VOE,Vanguard Mid-Cap Value ETF,0.399,9.27,2.52,14.72,3y,14.72,176.17,2025-11-12T19:30:04.661Z
VONE,Vanguard Russell 1000 ETF,-0.019,16.29,13.57,15.47,3y,15.47,309.32,2025-11-12T19:30:06.958Z
VONG,Vanguard Russell 1000 Growth Fund,-0.327,19.63,20.26,19.39,3y,19.39,123.385,2025-11-12T19:30:07.704Z
VONV,Vanguard Russell 1000 Value Index Fund,0.539,12.68,6.62,13.56,3y,13.56,91.43,2025-11-12T19:30:08.359Z
VOO,Vanguard S&P 500 ETF,-0.054,16.77,14.11,15.21,3y,15.21,627.57,2025-11-12T19:30:11.647Z
VOOG,Vanguard S&P 500 Growth ETF,-0.3,21.72,22.15,18.81,3y,18.81,445.74,2025-11-12T19:30:12.354Z
VOOV,Vanguard S&P 500 Value ETF,0.529,11.71,5.07,13.57,3y,13.57,205.1,2025-11-12T19:30:15.247Z
VOT,Vanguard Mid-Cap Growth ETF,-0.17,12.7,9.45,18.3,3y,18.3,287.14,2025-11-12T19:30:18.631Z
VOTE,TCW Transform 500 ETF,-0.125,16.8,14.43,15.46,3y,15.46,80.22,2025-11-12T19:30:18.947Z
VOX,Vanguard Communication Services ETF,-0.805,18.42,19.88,19.18,3y,19.18,184.79,2025-11-12T19:30:19.289Z
VPL,Vanguard FTSE Pacific ETF,0.522,30.05,22.85,15.94,3y,15.94,92.35,2025-11-12T19:30:19.665Z
VPN,Global X Data Center REITs & Digital Infrastructure ETF,2.07,33.76,27.82,20.76,3y,20.76,22.19,2025-11-12T19:30:20.313Z
VPU,Vanguard Utilities ETF,0.072,18.27,13.92,16.46,3y,16.46,194.57,2025-11-12T19:30:21.101Z
VRP,Invesco Variable Rate Preferred ETF,0.041,1.53,0.29,7.1,3y,7.1,24.62,2025-11-12T19:30:22.709Z
VSGX,Vanguard ESG International Stock ETF,0.479,26.45,20.68,14.33,3y,14.33,71.38,2025-11-12T19:30:23.857Z
VSLU,Applied Finance Valuation Large Cap ETF,0.011,19.71,16.82,14.9,3y,14.9,43.765,2025-11-12T19:30:27.821Z
