symbol,name,daily_change_pct,ytd_return_pct,one_year_return_pct,perf_1m_pct,perf_3m_pct,vol_pct,vol_window,vol_3y_pct,beta,last_close,as_of
MSFU,Direxion Daily MSCI Consumer Discretionary Bull 2x Fund,-3.658,-37.51,-23.32,-9.24,-39.06,44.09,3y,44.09,1.72,24.76,2026-03-20T00:00:00.000Z
MSLC,Morgan Stanley Pathway Large Cap Equity ETF,-1.405,-5.37,10.23,-5.28,-3.44,18.08,1y,,0.96,51.575,2026-03-20T00:00:00.000Z
MSOS,AdvisorShares Pure US Cannabis ETF,-5.759,-24.84,30.91,-14.08,-46.19,84.49,3y,84.49,0.63,3.6,2026-03-20T00:00:00.000Z
MSOX,AdvisorShares MSOS Daily Leveraged ETF,-11.969,-50.33,-47.59,-30.49,-77.73,165.59,3y,165.59,1.3,2.28,2026-03-20T00:00:00.000Z
MSTU,T-Rex 2X Long Master Date ETF,-3.774,-42.5,-91.9,2.62,-46.29,146.37,1y,,6.39,5.1,2026-03-20T00:00:00.000Z
MSTZ,T-Rex 2x Inverse Master Ltd. ETF,3.547,-32.33,-21.23,-20.7,-30.68,163.46,1y,,-6.48,10.8,2026-03-20T00:00:00.000Z
MTUM,iShares MSCI USA Momentum Factor ETF,-2.163,-4.44,18.29,-4.65,-0.15,19.39,3y,19.39,1.33,241.52,2026-03-20T00:00:00.000Z
MUD,Dx Daily Mu Bear 1X Shares,4.797,-93.18,-98.36,-90.41,-95.27,237.57,1y,,-2.4,35.83,2026-03-20T00:00:00.000Z
MUST,Columbia Multi-Sector Municipal Income ETF,-1.014,-0.73,1.33,-2.57,-0.49,5.82,3y,5.82,0.11,20.5,2026-03-20T00:00:00.000Z
MVV,ProShares Ultra MidCap400,-4.461,-4.14,12.18,-15.75,-2.32,36.15,3y,36.15,2.12,68.54,2026-03-20T00:00:00.000Z
MXI,iShares Global Materials ETF,-2.69,-0.22,14.94,-12.96,2.67,17.72,3y,17.72,1.01,97.68,2026-03-20T00:00:00.000Z
NAIL,Direxion Daily Homebuilders & Supplies Bull 3X Shares,-8.027,-30.96,-46.1,-49.98,-36.39,80.64,3y,80.64,2.31,35.52,2026-03-20T00:00:00.000Z
NANR,SPDR S&P North American Natural Resources ETF,-1.457,13.74,40.78,-4.91,15.85,20.02,3y,20.02,0.79,78.48,2026-03-20T00:00:00.000Z
NATO,Themes Transatlantic Defense Mutual Fund,-2.96,0.38,31.75,-10.28,6.92,21.96,1y,,0.92,39.181,2026-03-20T00:00:00.000Z
NBCM,Neuberger Berman Commodity Strategy ETF,-0.713,22.98,23.88,13.76,14.23,15.65,3y,15.65,0.13,27.86,2026-03-20T00:00:00.000Z
NBCR,Neuberger Berman Core Equity ETF,-1.365,-6.21,13.07,-5.69,-4.9,18.06,1y,,0.92,29.624,2026-03-20T00:00:00.000Z
NETZ,TCW Transform Systems ETF,-3.208,-1.88,33.8,-9.25,4.22,20.91,3y,20.91,1.57,97.0337,2026-03-20T00:00:00.000Z
NFLT,Virtus Newfleet Multi-Sector Bond ETF,-1.439,-1.99,-0.18,-2.96,-2.08,4.8,3y,4.8,0.11,22.61,2026-03-20T00:00:00.000Z
NFLU,T-Rex 2x Long Netflix Daily ETF,0.548,-3.93,-27.59,37.56,-12.25,68.24,1y,,0.73,29.37,2026-03-20T00:00:00.000Z
NFRA,FlexShares STOXX Global Broad Infrastructure Index Fund,-2.443,2.4,7.95,-5.61,0.02,11.9,3y,11.9,0.41,62.3,2026-03-20T00:00:00.000Z
NFTY,First Trust India Nifty 50 Equal Weight ETF,-1.532,-12.4,-5.93,-10.39,-9.49,14.65,3y,14.65,0.48,51.41,2026-03-20T00:00:00.000Z
NFXL,Direxion Daily Netflix Bull 2X Shares,-0.072,-3.71,-31.69,37.68,-12.31,68.9,1y,,0.73,27.77,2026-03-20T00:00:00.000Z
NFXS,Direxion Daily Netflix Bear 1X Shares,-0.075,-3.24,-3.95,-17.97,0.12,34.61,1y,,-0.38,17.241,2026-03-20T00:00:00.000Z
NIKL,Sprott Nickel Miners ETF,-3.642,-12.45,52.36,-24.53,4.64,32.39,3y,32.39,1.75,14.55,2026-03-20T00:00:00.000Z
NLR,VanEck Uranium and Nuclear ETF,-4.341,-3.92,60.5,-13.58,5.05,32.93,3y,32.93,1.96,127.82,2026-03-20T00:00:00.000Z
NOBL,ProShares S&P 500 Dividend Aristocrats ETF,-1.298,-0.3,2.17,-7.98,-1.2,12.79,3y,12.79,0.39,104.15,2026-03-20T00:00:00.000Z
NORW,Global X MSCI Norway ETF,-2.416,20.88,33.67,5.09,25.59,19.86,3y,19.86,0.76,36.76,2026-03-20T00:00:00.000Z
NTSX,WisdomTree U.S. Efficient Core Fund,-2.467,-6.26,12.33,-6.72,-5.15,15.04,3y,15.04,0.95,51.4,2026-03-20T00:00:00.000Z
NUDM,Nuveen ESG International Developed Markets Equity Fund,-3.189,-4.54,5.69,-10.6,-8.85,15.52,3y,15.52,0.85,34.91,2026-03-20T00:00:00.000Z
NUGT,Direxion Daily Gold Miners Index Bull 2X Shares,-7.181,-20.86,141.52,-42.8,-20.5,72.2,3y,72.2,3.07,145.54,2026-03-20T00:00:00.000Z
NULG,Nuveen ESG Large-Cap Growth ETF,-2.039,-6.89,13.67,-5.33,-3.57,18.68,3y,18.68,1.3,91.28,2026-03-20T00:00:00.000Z
NULV,Nuveen ESG Large-Cap Value ETF,-0.967,-0.46,11.67,-5.33,-1.08,12.8,3y,12.8,0.68,45.08,2026-03-20T00:00:00.000Z
NUMG,Nuveen ESG Mid-Cap Growth ETF,-1.821,-12.76,-5.53,-4.95,-12.02,19.49,3y,19.49,1.19,41.51,2026-03-20T00:00:00.000Z
NUMV,Nuveen ESG Mid-Cap Value ETF,-1.454,-3.83,10.48,-7.48,-4.33,15.05,3y,15.05,0.73,37.96,2026-03-20T00:00:00.000Z
NUSC,Nuveen ESG Small-Cap ETF,-2.057,-2.9,10.91,-9.15,-3.48,19.6,3y,19.6,1.13,43.8,2026-03-20T00:00:00.000Z
NUSI,NEOS Nasdaq-100 Hedged Equity Income ETF,-1.536,-4.42,4.72,-2.99,-3.35,74.13,3y,74.13,0.82,51.7838,2026-03-20T00:00:00.000Z
NVD,GraniteShares 2x Short Nvidia ETF USD,6.327,11.96,-73.87,15.27,-18.85,96.6,3y,96.6,-3.74,7.815,2026-03-20T00:00:00.000Z
NVDD,Direxion Daily NVDA Bear 1X Shares,3.254,8.1,-39.72,8.3,-2.91,48.62,3y,48.62,-1.91,40.992,2026-03-20T00:00:00.000Z
NVDL,Graniteshares 2x Long Nvidia Daily ETF,-6.304,-19.93,63.65,-16.9,-3.35,91.43,3y,91.43,3.79,72.09,2026-03-20T00:00:00.000Z
NVDQ,T-Rex 2X Inverse Nvidia Daily Mutual Fund,5.961,10.62,-72.24,14.6,-10.47,99.83,3y,99.83,-3.73,18.13,2026-03-20T00:00:00.000Z
NVDS,Aptus Collared Investment Opportunity Trust - 1.5x Short Nvidia ETF,4.777,10.15,-61.59,11.62,-17,114.59,3y,114.59,-2.91,30.27,2026-03-20T00:00:00.000Z
NVDU,Direxion Daily NVDA Bull 2X Shares,-6.215,-19.89,54.71,-16.84,-3.69,93.21,3y,93.21,3.74,96.57,2026-03-20T00:00:00.000Z
NVDX,T-Rex 2x LNG NVIDIA Daily Target Fund,-6.415,-20.94,50.49,-17.33,-7.6,97.62,3y,97.62,3.77,13.86,2026-03-20T00:00:00.000Z
NVDY,YieldMax NVDA Option Income Strategy ETF,-2.849,-11.35,-24.56,-7.49,-6.29,43.81,3y,43.81,1.72,12.96,2026-03-20T00:00:00.000Z
NVOX,Defiance Daily Target 2x Long NVO ETF,-3.232,-58.55,-86.83,-46.78,-50.87,117.11,1y,,3.92,9.58,2026-03-20T00:00:00.000Z
OAIM,OneAscent International Equity ETF,-3.167,0.42,21.07,-7.71,2.57,14.48,3y,14.48,0.92,41.89,2026-03-20T00:00:00.000Z
OAKM,Oakmark U.S. Large Cap ETF,-0.442,-4.99,9.9,-5.22,-4.08,17.79,1y,,0.76,27.03,2026-03-20T00:00:00.000Z
OCTW,AllianzIM U.S. Large Cap Buffer20 Oct ETF,-0.657,-1.61,8.85,-1.92,-0.58,5.77,3y,5.77,0.41,38.38,2026-03-20T00:00:00.000Z
OEF,iShares S&P 100 ETF,-1.425,-7.23,15.88,-5.23,-5.36,15.7,3y,15.7,1.03,317.57,2026-03-20T00:00:00.000Z
OIH,VanEck Oil Services ETF,-1.439,30.74,48.33,-1.21,34.92,31.52,3y,31.52,1.2,386.97,2026-03-20T00:00:00.000Z
OILD,MicroSectors Oil & Gas Exploration & Production -3x Inverse Leveraged Exchange-Traded Note,0.285,-55.77,-68.76,-22,-59.46,64.71,3y,64.71,-0.87,42.2,2026-03-20T00:00:00.000Z
OILK,ProShares K-1 Free Crude Oil Strategy ETF,1.415,50.84,35.35,31.13,52.31,25.74,3y,25.74,-0.11,56.28,2026-03-20T00:00:00.000Z
OILU,Bank of Montreal MicroSectors Oil & Gas Exploration & Production 3X Leveraged ETNs,-0.425,101.06,54.68,24.04,114.84,66.72,3y,66.72,0.86,49.22,2026-03-20T00:00:00.000Z
OMAH,VistaShares Target 15 Berkshire Select Income ETF,-0.055,-3.94,-8.89,-2.49,-4.8,14.48,1y,,0.33,18.04,2026-03-20T00:00:00.000Z
OMFL,Invesco Russell 1000 Dynamic Multifactor ETF,-1.765,-2.53,12.44,-4.51,-0.23,14.69,3y,14.69,1.01,60.11,2026-03-20T00:00:00.000Z
ONEQ,Fidelity Nasdaq Composite Index Fund,-2.115,-6.79,21.64,-4.71,-4.75,19.56,3y,19.56,1.31,85.16,2026-03-20T00:00:00.000Z
ONEY,SPDR Russell 1000 Yield Focus ETF,-1.648,1.77,6.67,-7.04,1.28,14.82,3y,14.82,0.61,116.97,2026-03-20T00:00:00.000Z
OSCV,Opus Small Cap Value ETF,-1.389,2.98,8.58,-6.74,1.74,15.96,3y,15.96,0.7,38.35,2026-03-20T00:00:00.000Z
OSEA,Harbor International Compounders ETF,-2.17,-6.36,3.31,-8.36,-5.3,15.02,3y,15.02,0.91,28.4,2026-03-20T00:00:00.000Z
OUNZ,VanEck Merk Gold Trust,-3.024,3.89,47.38,-10,3.59,19.2,3y,19.2,0.56,43.3,2026-03-20T00:00:00.000Z
OUSA,ALPS O’Shares U.S. Quality Dividend ETF,-0.729,-3.69,4.3,-5.92,-4.21,11.52,3y,11.52,0.52,55.32,2026-03-20T00:00:00.000Z
OUSM,Alps O’Shares U.S. Small-Cap Quality Dividend ETF,-1.208,-2.34,0.46,-8.06,-3.86,15.02,3y,15.02,0.62,42.925,2026-03-20T00:00:00.000Z
PABU,iShares Paris-Aligned Climate MSCI USA ETF,-1.57,-8.79,8.87,-4.26,-7.21,15.95,3y,15.95,1.05,66.16,2026-03-20T00:00:00.000Z
PALL,abrdn Physical Palladium Shares ETF,-2.759,-14.11,45.66,-16.32,-14.4,39.82,3y,39.82,1.34,127.96,2026-03-20T00:00:00.000Z
PAPI,Parametric Equity Premium Income ETF,-1.433,3.27,0.68,-4.71,2.37,12.07,3y,12.07,0.38,26.82,2026-03-20T00:00:00.000Z
PAPR,Innovator U.S. Equity Power Buffer ETF April,-0.278,0.69,9.31,0.06,1.47,7.71,3y,7.71,0.19,39.42,2026-03-20T00:00:00.000Z
PAUG,Innovator U.S. Equity Power Buffer ETF - August,-0.839,-1.73,11.91,-2.14,-0.56,8.2,3y,8.2,0.43,42.55,2026-03-20T00:00:00.000Z
PAVE,Global X U.S. Infrastructure Development ETF,-1.94,0.35,25.85,-11.34,2.38,19.96,3y,19.96,1.15,49.02,2026-03-20T00:00:00.000Z
PBDC,Putnam BDC Income ETF,-1.704,-11.83,-21.55,-3.62,-13.33,16.97,3y,16.97,0.71,27.12,2026-03-20T00:00:00.000Z
PBUS,Invesco MSCI USA ETF,-1.467,-5.06,14.5,-5,-3.34,14.87,3y,14.87,1.01,65.14,2026-03-20T00:00:00.000Z
PBW,Invesco WilderHill Clean Energy ETF,-4.221,-4.64,77.25,-8.05,3.42,39.84,3y,39.84,2.45,30.86,2026-03-20T00:00:00.000Z
PCEF,Invesco CEF Income Composite ETF,-1.93,-5.34,-1.83,-7.07,-4.13,10.69,3y,10.69,0.56,18.8,2026-03-20T00:00:00.000Z
PDBA,Invesco Agriculture Commodity Fund,-0.555,5.15,-0.03,3.86,2.89,16.22,3y,16.22,0.06,35.81,2026-03-20T00:00:00.000Z
PDBC,Invesco Optimum Yield Diversified Commodity Strategy No K-1 ETF,0.639,30.5,28.56,19.27,27.43,15.95,3y,15.95,0.07,17.33,2026-03-20T00:00:00.000Z
PDEC,Innovator U.S. Equity Power Buffer ETF - December,-0.89,-2.44,11.66,-2.69,-1.31,8.1,3y,8.1,0.53,42.32,2026-03-20T00:00:00.000Z
PDN,Invesco FTSE RAFI Developed Markets ex-U.S. Small-Mid ETF,-2.789,-0.68,20.83,-10.05,0.74,14.55,3y,14.55,0.85,42.17,2026-03-20T00:00:00.000Z
PDP,Invesco Dorsey Wright Momentum ETF,-2.69,0.94,17.5,-6.51,5.66,19.96,3y,19.96,1.68,119.76,2026-03-20T00:00:00.000Z
PEJ,Invesco Leisure and Entertainment ETF,-1.859,-7.16,14.57,-6.88,-6.13,20.39,3y,20.39,0.89,57.01,2026-03-20T00:00:00.000Z
PEY,Invesco High Yield Equity Dividend Achievers ETF,-1.152,0.29,-4.94,-6.41,-0.82,16.56,3y,16.56,0.54,20.6,2026-03-20T00:00:00.000Z
PFEB,Innovator U.S. Equity Power Buffer ETF - February,-0.746,-2.16,10.55,-2.78,-0.99,7.37,3y,7.37,0.42,39.91,2026-03-20T00:00:00.000Z
PFF,iShares Preferred and Income Securities ETF,-1.433,-3.2,-3.48,-4.54,-2.48,8.92,3y,8.92,0.43,30.27,2026-03-20T00:00:00.000Z
PFFA,Virtus InfraCap U.S. Preferred Stock ETF,-2.782,-6.63,-7.15,-7.99,-6.98,10.58,3y,10.58,0.36,20.27,2026-03-20T00:00:00.000Z
PFFD,Global X U.S. Preferred ETF,-1.56,-4.39,-6.3,-5.62,-3.73,9.63,3y,9.63,0.45,18.3,2026-03-20T00:00:00.000Z
PFFV,Global X Variable Rate Preferred ETF,-0.861,-1.93,-8.29,-3.48,-2.84,7.86,3y,7.86,0.17,21.88,2026-03-20T00:00:00.000Z
PFLD,AAM Low Duration Preferred and Income Securities ETF,-0.461,-0.94,-5.77,-1.97,-0.92,6.69,3y,6.69,0.09,19.45,2026-03-20T00:00:00.000Z
PFM,Invesco Dividend Achievers ETF,-0.979,-2.13,9.65,-5.85,-1.58,11.85,3y,11.85,0.65,50.56,2026-03-20T00:00:00.000Z
PFXF,VanEck Preferred Securities ex Financials ETF,-1.808,-2.85,1.34,-5.54,-2.14,9.96,3y,9.96,0.53,17.38,2026-03-20T00:00:00.000Z
PGF,Invesco Financial Preferred ETF,-1.425,-3.15,-5.85,-4.35,-2.67,10.05,3y,10.05,0.26,13.84,2026-03-20T00:00:00.000Z
PGX,Invesco Preferred ETF,-1.344,-2.82,-5.09,-4.18,-2.48,9.8,3y,9.8,0.27,11.01,2026-03-20T00:00:00.000Z
PHO,Invesco Water Resources ETF,-1.022,-7.08,0.15,-9.63,-7.32,16.23,3y,16.23,0.74,65.85,2026-03-20T00:00:00.000Z
PICK,iShares MSCI Global Metals & Mining Producers ETF,-3.662,-1.01,35.15,-13.9,5.35,25.07,3y,25.07,1.5,51.83,2026-03-20T00:00:00.000Z
PID,Invesco International Dividend Achievers ETF,-1.302,-0.45,13,-6.51,0.37,12.63,3y,12.63,0.47,21.99,2026-03-20T00:00:00.000Z
PIEQ,Principal International Equity ETF,-2.822,-1.34,19.93,-7.03,2.04,17.58,1y,,1.01,33.06,2026-03-20T00:00:00.000Z
PILL,Direxion Shares ETF Trust Daily Pharmaceutical & Medical Bull 3X Shares,-6.09,-18.71,31.32,-25.02,-19.26,56.02,3y,56.02,2.39,9.56,2026-03-20T00:00:00.000Z
PINK,Simplify Health Care ETF,-1.861,-10.97,9.77,-9.92,-10.22,16.26,3y,16.26,0.89,32.69,2026-03-20T00:00:00.000Z
PIZ,Invesco Dorsey Wright Developed Markets Momentum ETF,-3.409,-3.31,20.42,-11.2,-0.15,17.23,3y,17.23,1.09,47.89,2026-03-20T00:00:00.000Z
PJAN,Innovator U.S. Equity Power Buffer ETF - January,-0.95,-2.38,9.82,-2.86,-1.67,7.51,3y,7.51,0.41,45.87,2026-03-20T00:00:00.000Z
PJP,Invesco Pharmaceuticals ETF,-1.291,-4.01,17.08,-7.79,-5.3,15.38,3y,15.38,0.6,100.2,2026-03-20T00:00:00.000Z
PJUL,Innovator U.S. Equity Power Buffer ETF July,-0.759,-1.48,13.03,-1.95,-0.4,8.24,3y,8.24,0.39,45.79,2026-03-20T00:00:00.000Z
PKB,Invesco Building & Construction ETF,-2.493,-1.63,33.22,-14.2,-0.05,24.47,3y,24.47,1.39,93.47,2026-03-20T00:00:00.000Z
PKW,Invesco BuyBack Achievers ETF,-1.092,-4.45,12.98,-6.56,-3.75,15.5,3y,15.5,0.81,129.52,2026-03-20T00:00:00.000Z
PLTM,GraniteShares Platinum Trust,-2.434,-10.44,91.09,-7.38,0.93,34.72,3y,34.72,1.48,18.44,2026-03-20T00:00:00.000Z
PLTY,YieldMax PLTR Option Income Strategy ETF,-2.296,-17.73,-36.68,5.79,-24.88,51.75,1y,,2.02,40,2026-03-20T00:00:00.000Z
PMAR,Innovator U.S. Equity Power Buffer ETF,-0.893,-1.25,10.56,-2.4,-0.26,7.54,3y,7.54,0.37,44.41,2026-03-20T00:00:00.000Z
PNOV,Innovator U.S. Equity Power Buffer ETF – November,-0.949,-2.72,8.73,-2.82,-1.31,7.8,3y,7.8,0.48,40.72,2026-03-20T00:00:00.000Z
PNQI,Invesco NASDAQ Internet ETF,-1.419,-15.41,-0.53,-2.88,-14.92,20.53,3y,20.53,1.17,45.17,2026-03-20T00:00:00.000Z
POCT,Innovator U.S. Equity Power Buffer ETF - October,-0.762,-2.16,9.85,-2.56,-0.92,7.33,3y,7.33,0.5,42.95,2026-03-20T00:00:00.000Z
PPA,INVESCO AEROSPACE & DEFENSE ETF (P3WR),-2.078,5,41.83,-6.62,11.77,17.07,3y,17.07,0.99,169.2,2026-03-20T00:00:00.000Z
PPH,VanEck Pharmaceutical ETF,-1.245,-2.88,8.11,-9.21,-0.27,14.87,3y,14.87,0.53,100.73,2026-03-20T00:00:00.000Z
PPI,ASTORIA REAL ASSETS ETF,-2.956,6.41,36.08,-4.9,10.23,43.39,3y,43.39,1.04,20.222,2026-03-20T00:00:00.000Z
PPLT,abrdn Physical Platinum Shares ETF,-2.517,-10.41,90.92,-7.54,1.11,34.3,3y,34.3,1.46,174.25,2026-03-20T00:00:00.000Z
PREF,Principal Spectrum Preferred Securities Active ETF,-0.739,-1.47,0.64,-2.29,-1.42,4.21,3y,4.21,0.11,18.81,2026-03-20T00:00:00.000Z
PRF,Invesco FTSE RAFI US 1000 ETF,-1.155,-0.55,15.55,-5.05,0.79,13.22,3y,13.22,0.79,47.05,2026-03-20T00:00:00.000Z
PRFZ,Invesco FTSE RAFI US 1500 Small-Mid ETF,-2.111,-2.6,15.37,-7.92,-3,94.63,3y,94.63,1.22,44.97,2026-03-20T00:00:00.000Z
PRN,Invesco Dorsey Wright Industrials ETF,-2.043,6.82,35.43,-8.62,15.5,24.22,3y,24.22,1.88,192.72,2026-03-20T00:00:00.000Z
PSC,Principal U.S. Small-Cap ETF,-1.74,-3.17,13.95,-7.49,-2.85,19.88,3y,19.88,1.24,56.2,2026-03-20T00:00:00.000Z
PSCE,Invesco S&P SmallCap Energy ETF,0.584,36.91,41.87,9.23,40,31.11,3y,31.11,0.89,60.24,2026-03-20T00:00:00.000Z
PSCT,Invesco S&P SmallCap Information Technology ETF,-3.546,2.45,38.75,-3.45,5.38,27.44,3y,27.44,2.15,59.3,2026-03-20T00:00:00.000Z
PSDM,PGIM Short Duration Multi-Sector Bond ETF,-0.395,-0.96,-0.14,-1.35,-1.08,2.43,3y,2.43,0.02,50.97,2026-03-20T00:00:00.000Z
PSFF,Pacer Swan SOS Fund of Funds,-0.676,-1.44,10.7,-1.66,-0.43,8.27,3y,8.27,0.37,31.893,2026-03-20T00:00:00.000Z
PSI,Invesco Semiconductors ETF,-2.633,14.22,81.36,-4.73,25.1,72.77,3y,72.77,2.5,94.65,2026-03-20T00:00:00.000Z
PSJ,Invesco Dynamic Software ETF,-3.417,-0.87,43.05,-3.59,7.71,25.45,3y,25.45,1.97,60.48,2026-03-20T00:00:00.000Z
PSK,SPDR ICE Preferred Securities ETF,-1.429,-3.09,-6.4,-4.14,-2.91,9.4,3y,9.4,0.26,31.03,2026-03-20T00:00:00.000Z
PSP,Invesco Global Listed Private Equity ETF,-2.871,-18.55,-17.24,-11.83,-18.44,20.73,3y,20.73,1.13,55.14,2026-03-20T00:00:00.000Z
PSQ,ProShares Short QQQ,1.935,6.18,-19.67,3.98,2.75,19.71,3y,19.71,-1.31,32.14,2026-03-20T00:00:00.000Z
PTF,Invesco Dorsey Wright Technology ETF,-4.821,11.95,41.72,-2.31,21.66,33.99,3y,33.99,2.66,88.45,2026-03-20T00:00:00.000Z
PTL,Inspire 500 ETF,-1.973,-0.61,17.87,-5.55,1.18,19.83,1y,,1.16,247.94,2026-03-20T00:00:00.000Z
PTLC,Pacer Trendpilot US Large Cap ETF,-1.452,-4.99,2.4,-5.08,-4.08,12.16,3y,12.16,1,52.93,2026-03-20T00:00:00.000Z
PTMC,Pacer Trendpilot US Mid Cap ETF,-2.247,-1.49,3.33,-7.97,-1.78,14.2,3y,14.2,1.07,35.67,2026-03-20T00:00:00.000Z
PTNQ,Pacer Trendpilot 100 ETF,-1.977,-5.27,3.52,-3.59,-4.02,12.54,3y,12.54,1.32,74.38,2026-03-20T00:00:00.000Z
PUTW,WisdomTree Equity Premium Income Fund,-0.863,-2.96,1.84,-3.42,-1.53,11.67,3y,11.67,0.7,32.17,2026-03-20T00:00:00.000Z
PVAL,Putnam Focused Large Cap Value ETF,-1.083,-0.67,19.61,-5.58,1.13,13.63,3y,13.63,0.75,45.68,2026-03-20T00:00:00.000Z
PWB,Invesco Large Cap Growth ETF,-1.713,-0.68,29.92,-4.84,4.1,18.44,3y,18.44,1.41,127.93,2026-03-20T00:00:00.000Z
PWV,Invesco Large Cap Value ETF,-0.451,2.3,14.56,-2.84,2.69,13.11,3y,13.11,0.45,68.39,2026-03-20T00:00:00.000Z
PXF,Invesco RAFI Developed Markets ex-U.S. ETF,-3.086,2.2,25.05,-8.47,4.76,14.57,3y,14.57,0.87,67.84,2026-03-20T00:00:00.000Z
PXH,Invesco FTSE RAFI Emerging Markets ETF,-2.81,-1.67,14.27,-7.75,2.01,17.39,3y,17.39,0.93,25.94,2026-03-20T00:00:00.000Z
PXJ,Invesco Oil & Gas Services ETF,-1.903,32.69,52.93,-2.07,34.21,29.43,3y,29.43,1.07,39.7,2026-03-20T00:00:00.000Z
PXMV,Invesco S&P MidCap Value with Momentum ETF,-0.827,-1.9,18.06,-7.55,-3.04,19.27,3y,19.27,0.7,63.54,2026-03-20T00:00:00.000Z
PXSV,Invesco S&P SmallCap Value with Momentum ETF,-1.146,0.36,12.78,-8.51,-1.73,21.31,3y,21.31,0.87,57.81,2026-03-20T00:00:00.000Z
PYLD,PIMCO Multisector Bond Active ETF,-0.798,-2.21,-0.84,-2.9,-2.17,4.29,3y,4.29,0.08,26.12,2026-03-20T00:00:00.000Z
QAI,NYLI Hedge Multi-Strategy Tracker ETF,-1.081,0.33,6.88,-2.56,0.3,6.59,3y,6.59,0.48,33.85,2026-03-20T00:00:00.000Z
QCLN,First Trust Nasdaq Clean Edge Green Energy Index Fund,-4.386,-1.51,52.85,-9.17,5.57,34.39,3y,34.39,2.23,45.78,2026-03-20T00:00:00.000Z
QDEC,FT Vest Nasdaq-100 Buffer ETF,-1.442,-3.12,18.06,-2.24,-1.13,11.23,3y,11.23,0.77,31.45,2026-03-20T00:00:00.000Z
QDF,FlexShares Quality Dividend Index Fund,-1.595,-3.68,13.42,-5.53,-2.57,14.06,3y,14.06,0.94,78.34,2026-03-20T00:00:00.000Z
QDPL,Pacer Metaurus US Large Cap Dividend Multiplier 400 ETF,-1.518,-5.96,7.51,-5.41,-3.87,13.97,3y,13.97,0.93,40.21,2026-03-20T00:00:00.000Z
QDVO,Amplify CWP Growth & Income ETF,-1.717,-7.4,7.19,-4.34,-5.88,18.62,1y,,0.95,26.91,2026-03-20T00:00:00.000Z
QEFA,SPDR MSCI EAFE StrategicFactors ETF,-2.525,-1.3,10.77,-8.36,1.05,13.23,3y,13.23,0.7,90.203,2026-03-20T00:00:00.000Z
QETH,Invesco Galaxy Ethereum ETF,-0.516,-31.71,4.79,9.39,-24.49,75.86,1y,,3.36,21.21,2026-03-20T00:00:00.000Z
QGRO,American Century U.S. Quality Growth ETF,-1.571,-7.99,9.73,-3.99,-6.57,17.94,3y,17.94,1.18,105.26,2026-03-20T00:00:00.000Z
QGRW,WisdomTree U.S. Quality Growth Fund,-2.114,-7.76,20.05,-4.75,-4.34,20.77,3y,20.77,1.37,54.18,2026-03-20T00:00:00.000Z
QID,ProShares UltraShort QQQ,3.767,11.39,-38.51,7.57,4.87,39.5,3y,39.5,-2.61,22.59,2026-03-20T00:00:00.000Z
QINT,American Century Quality Diversified International ETF,-3.02,-3.33,16.31,-9.95,-0.81,14.46,3y,14.46,0.9,62.62,2026-03-20T00:00:00.000Z
QLC,FlexShares US Quality Large Cap Fund,-1.62,-4.43,20.24,-5.19,-2.54,14.81,3y,14.81,1.03,77.75,2026-03-20T00:00:00.000Z
QLD,ProShares Ultra QQQ,-3.719,-11.37,32.87,-7.6,-7.65,38.64,3y,38.64,2.6,62.13,2026-03-20T00:00:00.000Z
QLTY,GMO U.S. Quality ETF,-1.034,-5.9,14.74,-5.53,-4.09,17.4,1y,,0.95,36.36,2026-03-20T00:00:00.000Z
QMOM,Alpha U.S. Quantitative Momentum ETF,-3.554,-0.44,11.76,-8.06,3.55,22.15,3y,22.15,1.55,66.197,2026-03-20T00:00:00.000Z
QQA,Invesco QQQ Income Advantage ETF,-1.665,-4.58,7.55,-3.15,-3.56,18.72,1y,,1.05,50.495,2026-03-20T00:00:00.000Z
QQEW,First Trust NASDAQ-100 Equal Weighted Index Fund,-1.536,-8.36,4.32,-2.46,-8,17.55,3y,17.55,1.2,129.53,2026-03-20T00:00:00.000Z
QQH,HCM Defender 100 Index ETF,-1.934,-8.35,18.28,-4.9,-7.72,21.79,3y,21.79,1.77,70.49,2026-03-20T00:00:00.000Z
QQQ,Invesco QQQ Trust,-1.848,-5.07,21.04,-3.55,-3.06,19.42,3y,19.42,1.3,582.06,2026-03-20T00:00:00.000Z
QQQE,Direxion NASDAQ-100 Equal Weighted Index Shares,-1.474,-3.38,10.71,-3.74,-2.61,17.08,3y,17.08,1.1,98.9,2026-03-20T00:00:00.000Z
QQQJ,Invesco NASDAQ Next Gen 100 ETF,-3.009,-3.76,20.45,-6.31,-1.23,17.98,3y,17.98,1.31,36.1,2026-03-20T00:00:00.000Z
QQQM,Invesco NASDAQ 100 ETF,-1.867,-5.07,21.04,-3.57,-3.05,19.3,3y,19.3,1.3,239.64,2026-03-20T00:00:00.000Z
QQQY,Dfn Non Standard 100 Enhanced Option and 0DTE In ETF,-1.596,-11,-23.39,-5.16,-10.81,20.12,3y,20.12,1.15,20.96,2026-03-20T00:00:00.000Z
QSY,WisdomTree U.S. Quality Shareholder Yield Fund,-1.079,-0.6,12.76,-6.46,-0.64,15.46,3y,15.46,0.67,93.51,2026-03-20T00:00:00.000Z
QTEC,First Trust NASDAQ-100 Technology Index Fund,-1.993,-4.94,20.2,-2.71,-2.51,25.55,3y,25.55,1.74,220.29,2026-03-20T00:00:00.000Z
QTUM,Defiance Quantum ETF,-2.679,-3.66,35.37,-7.32,1.05,25.74,3y,25.74,1.88,108.27,2026-03-20T00:00:00.000Z
QUAL,iShares MSCI USA Quality Factor ETF,-1.195,-3.66,11.19,-5.49,-2.28,14.5,3y,14.5,0.93,191.89,2026-03-20T00:00:00.000Z
QUS,SPDR MSCI USA StrategicFactors ETF,-1.095,-2.01,8.87,-4.49,-1.1,11.96,3y,11.96,0.67,170.7,2026-03-20T00:00:00.000Z
QVAL,Alpha Architect U.S. Quantitative Value ETF,-0.819,2.98,17.04,-5.64,2.73,17.95,3y,17.95,0.69,50.712,2026-03-20T00:00:00.000Z
QYLD,Global X Nasdaq 100 Covered Call ETF,-1.658,-2.71,1.18,-2.22,-2.11,13.12,3y,13.12,0.68,17.2,2026-03-20T00:00:00.000Z
RAAX,VanEck Real Assets ETF,-1.248,11.97,31.19,-1.71,11.43,14.31,3y,14.31,0.53,39.58,2026-03-20T00:00:00.000Z
RAYS,Global X Solar ETF,0.62,10.12,,-4.47,15.21,298.97,3y,298.97,1.12,2189.5,2026-03-20T00:00:00.000Z
RDIV,Invesco S&P Ultra Dividend Revenue ETF,-0.509,3.89,10.94,-2.99,3.05,17.25,3y,17.25,0.51,54.75,2026-03-20T00:00:00.000Z
RDTE,Roundhill Small Cap 0DTE Covered Call Strategy ETF,-1.903,-9.31,-27.11,-10.13,-13.52,21.18,1y,,1.29,26.8,2026-03-20T00:00:00.000Z
RDVI,FT Vest Rising Dividend Achievers Fund,-0.849,-3.02,6.64,-5.73,-1.57,16.19,3y,16.19,0.93,25.68,2026-03-20T00:00:00.000Z
RDVY,First Trust Rising Dividend Achievers ETF,-0.855,-2.52,15.25,-5.45,-0.91,16.77,3y,16.77,1.01,68.38,2026-03-20T00:00:00.000Z
RECS,Columbia Research Enhanced Core ETF,-1.429,-5.66,15.31,-5.25,-5.18,14.58,3y,14.58,0.94,38.64,2026-03-20T00:00:00.000Z
REET,iShares Global REIT ETF,-3.068,-0.24,2.76,-7.07,0.69,15.7,3y,15.7,0.42,24.96,2026-03-20T00:00:00.000Z
REGL,ProShares S&P MidCap 400 Dividend Aristocrats ETF,-1.559,-0.9,3.99,-8.87,-2.67,15.35,3y,15.35,0.49,83.99,2026-03-20T00:00:00.000Z
REMX,VanEck Rare Earth and Strategic Metals ETF,-4.641,3.02,78.64,-12.2,10.4,38.13,3y,38.13,1.97,79.1,2026-03-20T00:00:00.000Z
RETL,Direxion Daily Retail Bull 3X Shares,-5.096,-26.86,11.13,-30.26,-30.19,66.56,3y,66.56,3.1,6.89,2026-03-20T00:00:00.000Z
REZ,iShares Residential and Multisector Real Estate ETF,-3.622,0.1,-2.47,-6.56,-0.46,17.42,3y,17.42,0.29,82.75,2026-03-20T00:00:00.000Z
RFIX,Simplify Bond Bull ETF,-3.281,9.16,-24.14,1,4.88,31.62,1y,,-0.36,40.39,2026-03-20T00:00:00.000Z
RFV,Invesco S&P MidCap 400 Pure Value ETF,-1.273,-3.43,6.96,-9.66,-4.02,21.13,3y,21.13,0.96,124.91,2026-03-20T00:00:00.000Z
RGI,Invesco S&P 500 Equal Weight Industrials ETF,-1.439,0.3,15.47,-9.14,2.02,16.47,3y,16.47,0.88,57.54,2026-03-20T00:00:00.000Z
RING,iShares MSCI Global Gold Miners ETF,-3.634,-5.55,84.79,-23.06,-4.28,36.65,3y,36.65,1.58,69.48,2026-03-20T00:00:00.000Z
RIOX,Defiance Daily Target 2X Long Riot ETF,-10.976,-30.32,-31.88,-36.43,-49.6,176.7,1y,,8.18,18.25,2026-03-20T00:00:00.000Z
RLY,SPDR SSGA Multi-Asset Real Return ETF,-1.483,10.8,23.34,-0.17,10.94,11.9,3y,11.9,0.46,35.2,2026-03-20T00:00:00.000Z
ROBO,ROBO Global Robotics & Automation Index ETF,-3.552,-3.62,22.02,-12.34,0.35,21.19,3y,21.19,1.53,68.15,2026-03-20T00:00:00.000Z
ROBT,First Trust Nasdaq Artificial Intelligence and Robotics ETF,-2.692,-10.22,9.79,-7.76,-7.45,23.2,3y,23.2,1.7,47.102,2026-03-20T00:00:00.000Z
RODM,Hartford Multifactor Developed Markets (ex-US) ETF,-2.277,2.58,20.97,-5.75,3.5,12.13,3y,12.13,0.55,38.19,2026-03-20T00:00:00.000Z
ROKT,SPDR S&P Kensho Final Frontiers ETF,-1.309,14.1,86.14,-2.82,27.49,22,3y,22,1.55,101.02,2026-03-20T00:00:00.000Z
ROM,ProShares Ultra Technology ETF,-4.534,-14.02,40.87,-7.59,-7.9,45.96,3y,45.96,3.19,81.48,2026-03-20T00:00:00.000Z
ROUS,Hartford Multifactor US Equity ETF,-1.194,0.98,15.08,-4.03,1.94,12.85,3y,12.85,0.86,58.75,2026-03-20T00:00:00.000Z
RPG,Invesco S&P 500 Pure Growth ETF,-2.819,-0.27,19.96,-5.05,2.65,20.61,3y,20.61,1.34,47.23,2026-03-20T00:00:00.000Z
RPV,Invesco S&P 500 Pure Value ETF,-1.294,0.07,12.72,-7.22,0.81,16,3y,16,0.58,104.54,2026-03-20T00:00:00.000Z
RSHO,Tema American Reshoring ETF,-2.494,5.88,37.13,-12.08,9.66,21.39,3y,21.39,1.31,48.09,2026-03-20T00:00:00.000Z
RSP,Invesco S&P 500 Equal Weight ETF,-1.469,-1.23,8.62,-6.23,-0.67,13.99,3y,13.99,0.77,190.48,2026-03-20T00:00:00.000Z
RSPA,Invesco S&P 500 Equal Weight Income Advantage ETF,-1.149,-2.33,0.46,-5.72,-2.37,14.87,1y,,0.62,49.92,2026-03-20T00:00:00.000Z
RSPD,Invesco S&P 500 Equal Weight Consumer Discretionary ETF,-1.761,-7.57,4.43,-9.91,-8.35,65.37,3y,65.37,0.93,53.01,2026-03-20T00:00:00.000Z
RSPF,Invesco S&P 500 Equal Weight Financials ETF,0.127,-9.64,-2.14,-6.02,-10.04,17.13,3y,17.13,0.75,70.87,2026-03-20T00:00:00.000Z
RSPG,Invesco S&P 500 Equal Weight Energy ETF,-0.253,31.04,29.93,8.49,32.83,23.11,3y,23.11,0.35,106.48,2026-03-20T00:00:00.000Z
RSPH,Invesco S&P 500 Equal Weight Health Care ETF,-0.891,-6.15,-0.03,-8.5,-5.3,133.67,3y,133.67,0.64,30.04,2026-03-20T00:00:00.000Z
RSPN,Invesco S&P 500 Equal Weight Industrials ETF,-1.439,0.3,15.47,-9.14,2.02,93.81,3y,93.81,0.88,57.54,2026-03-20T00:00:00.000Z
RSPS,Invesco S&P 500 Equal Weight Consumer Staples ETF,-1.045,0.86,-2.56,-9.83,-2.36,94.32,3y,94.32,0.08,29.35,2026-03-20T00:00:00.000Z
RSPT,Invesco S&P 500 Equal Weight Technology ETF,-2.701,-0.02,27.69,-2.24,2.28,22.15,3y,22.15,1.63,45.75,2026-03-20T00:00:00.000Z
RSPU,Invesco S&P 500 Equal Weight Utilities ETF,-3.625,4.43,13.29,-3.47,5.55,43.45,3y,43.45,0.23,78.95,2026-03-20T00:00:00.000Z
RSSB,Return Stacked Global Stocks & Bonds ETF,-3.053,-5.68,11.82,-8.95,-6.22,18.4,1y,,1.03,26.67,2026-03-20T00:00:00.000Z
