symbol,name,daily_change_pct,ytd_return_pct,one_year_return_pct,perf_1m_pct,perf_3m_pct,vol_pct,vol_window,vol_3y_pct,beta,last_close,as_of
IFRA,iShares U.S. Infrastructure,-2.697,3.33,19.74,-7.68,4.76,16.4,3y,16.4,0.77,55.2,2026-03-20T00:00:00.000Z
IGE,iShares North American Natural Resources ETF,-0.961,16.96,31.75,-1.94,20.47,18.95,3y,18.95,0.63,59.79,2026-03-20T00:00:00.000Z
IGF,iShares Global Infrastructure ETF,-2.377,5.42,19.64,-3.89,7.54,13.09,3y,13.09,0.43,65.3,2026-03-20T00:00:00.000Z
IGM,iShares Expanded Tech Sector ETF,-2.309,-6.8,27.43,-3.02,-3.66,22.91,3y,22.91,1.58,120.57,2026-03-20T00:00:00.000Z
IGPT,Invesco AI and Next Gen Software ETF,-3.417,-0.87,41.61,-3.59,7.71,25.34,3y,25.34,1.95,60.48,2026-03-20T00:00:00.000Z
IGRO,iShares International Dividend Growth ETF,-2.308,-3.17,9.55,-9.16,-0.6,12.86,3y,12.86,0.7,80.84,2026-03-20T00:00:00.000Z
IGV,iShares Expanded Tech-Software Sector ETF,-1.74,-19.13,-10.72,1.48,-20.74,23.81,3y,23.81,1.34,82.99,2026-03-20T00:00:00.000Z
IHAK,iShares Cybersecurity and Tech ETF,-1.987,-6.25,-10.2,-0.65,-9.39,20.41,3y,20.41,0.98,44.39,2026-03-20T00:00:00.000Z
IHDG,WisdomTree International Hedged Quality Dividend Growth Fund,-2.433,-5.56,2.63,-9.79,-2.9,13.58,3y,13.58,0.86,46.51,2026-03-20T00:00:00.000Z
IHE,iShares U.S. Pharmaceuticals ETF,-1.281,-1.05,19.54,-7.18,-0.14,16.14,3y,16.14,0.51,83.98,2026-03-20T00:00:00.000Z
IHF,iShares U.S. Healthcare Providers ETF,-1.258,-12.4,-18.78,-8.35,-11.45,19.28,3y,19.28,0.55,42.38,2026-03-20T00:00:00.000Z
IHI,iShares U.S. Medical Devices ETF,-0.784,-12.04,-9.25,-7.92,-12.6,16.56,3y,16.56,0.62,54.44,2026-03-20T00:00:00.000Z
IJH,iShares Core S&P Mid-Cap ETF,-2.197,-1.55,10.59,-8.08,-0.17,17.95,3y,17.95,1.06,65.87,2026-03-20T00:00:00.000Z
IJJ,iShares S&P Mid-Cap 400 Value ETF,-1.726,-3.75,5.15,-9.82,-3.21,18.26,3y,18.26,0.93,128.08,2026-03-20T00:00:00.000Z
IJK,iShares S&P Mid-Cap 400 Growth ETF,-2.844,0.34,15.79,-6.67,2.5,18.5,3y,18.5,1.18,98.72,2026-03-20T00:00:00.000Z
IJR,iShares Core S&P Small-Cap ETF,-1.922,-0.79,13,-8.03,-1.21,20.49,3y,20.49,1.12,120.41,2026-03-20T00:00:00.000Z
IJS,iShares S&P Small-Cap 600 Value ETF,-1.309,-0.09,14.88,-8.46,-0.61,21.63,3y,21.63,1.13,114.58,2026-03-20T00:00:00.000Z
IJT,iShares S&P Small-Cap 600 Growth ETF,-2.422,-1.46,11.32,-7.6,-1.86,19.93,3y,19.93,1.12,140.58,2026-03-20T00:00:00.000Z
ILCB,iShares Morningstar U.S. Equity ETF,-1.472,-5.16,14.65,-5.12,-3.21,14.89,3y,14.89,1.01,89.67,2026-03-20T00:00:00.000Z
ILCG,iShares Morningstar Growth ETF,-2.149,-7.82,15.73,-5.25,-5.1,19.05,3y,19.05,1.29,96.08,2026-03-20T00:00:00.000Z
ILCV,iShares Morningstar Value ETF,-0.937,-2.82,12.88,-5.29,-1.75,12.53,3y,12.53,0.73,91.96,2026-03-20T00:00:00.000Z
ILDR,First Trust Innovation Leaders ETF,-2.704,-10.17,20.26,-5.14,-5.56,22.41,3y,22.41,1.58,29.87,2026-03-20T00:00:00.000Z
ILF,iShares Latin America 40 ETF,-3.722,5.71,33.4,-10.59,9.14,21.02,3y,21.02,1.11,32.59,2026-03-20T00:00:00.000Z
ILOW,AB International Low Volatility Equity ETF,-2.732,-3.3,9.94,-7.65,-1.04,15.04,1y,,0.74,41.446,2026-03-20T00:00:00.000Z
IMCB,iShares Morningstar Mid-Cap ETF,-1.685,-1.54,9.89,-6.26,-0.32,15.17,3y,15.17,0.92,82.25,2026-03-20T00:00:00.000Z
IMCG,iShares Morningstar Mid-Cap Growth ETF,-2.133,-2.79,7.89,-5.71,-1.37,16.91,3y,16.91,1.12,78.47,2026-03-20T00:00:00.000Z
IMCV,iShares Morningstar Mid-Cap ETF,-1.146,-0.23,11.65,-6.7,0.69,14.68,3y,14.68,0.7,82.78,2026-03-20T00:00:00.000Z
IMFL,Invesco International Developed Dynamic Multi-Factor Fund,-3.077,2.42,20.92,-9.23,5.25,14.84,3y,14.84,0.89,30.87,2026-03-20T00:00:00.000Z
IMTM,iShares MSCI International Momentum Factor ETF,-3.218,-4.87,12.65,-11.06,-1.38,16.19,3y,16.19,0.98,46.31,2026-03-20T00:00:00.000Z
INCO,Columbia India Consumer ETF,-1.971,-16.07,-7.1,-13.6,-13.24,14.95,3y,14.95,0.38,54.72,2026-03-20T00:00:00.000Z
INDA,ISHARES MSCI INDIA ETF,-1.957,-14.61,-7.94,-10.92,-12.04,13.41,3y,13.41,0.45,46.59,2026-03-20T00:00:00.000Z
INDF,Indofood Sukses Makmur Tbk,0,-10.49,-22.65,-11.81,-9.13,24.8,3y,24.8,0,5975,2026-03-17T00:00:00.000Z
INDL,Direxion Daily MSCI India Bull 3X Shares,-3.919,-28.45,-23.38,-21.34,-24.73,26.79,3y,26.79,0.91,41.43,2026-03-20T00:00:00.000Z
INDY,iShares India 50 ETF,-1.94,-15.2,-15.59,-11.5,-12.84,13.57,3y,13.57,0.49,41.96,2026-03-20T00:00:00.000Z
INFL,Horizon Kinetics Inflation Beneficiaries ETF,-1.807,12.94,22.11,-2.19,14.73,16.49,3y,16.49,0.8,50.54,2026-03-20T00:00:00.000Z
INTF,iShares International Equity Factor ETF,-2.925,-1.73,17.33,-8.8,1.32,14.93,3y,14.93,0.89,37.5,2026-03-20T00:00:00.000Z
IOO,iShares Global 100 ETF,-1.766,-5.93,21.17,-5.94,-2.77,15.6,3y,15.6,1.07,119.61,2026-03-20T00:00:00.000Z
IPAC,iShares Core MSCI Pacific ETF,-3.137,0.19,15.15,-9.77,2.96,16.52,3y,16.52,0.99,74.11,2026-03-20T00:00:00.000Z
IPKW,Invesco International Buyback Achievers ETF,-2.661,-2.53,14.96,-7.54,-0.63,15.91,3y,15.91,0.84,54.79,2026-03-20T00:00:00.000Z
IQDF,FlexShares International Quality Dividend Index Fund,-3.129,-0.78,19.08,-8.51,2.61,14.67,3y,14.67,0.89,30.65,2026-03-20T00:00:00.000Z
IQDG,WisdomTree International Quality Dividend Growth Fund,-2.989,-6.84,4.1,-11.64,-4.73,15.19,3y,15.19,0.94,38.95,2026-03-20T00:00:00.000Z
IQLT,iShares MSCI International Quality Factor ETF,-2.686,-2.98,8.6,-8.61,0.07,14.54,3y,14.54,0.87,44.56,2026-03-20T00:00:00.000Z
IQQQ,ProShares Nasdaq-100 High Income ETF,-1.888,-4.91,5.68,-3.53,-2.93,19.55,1y,,1.29,42.199,2026-03-20T00:00:00.000Z
IRBO,iShares Future AI & Tech ETF,-4.708,-3.73,42.55,-6.5,3.76,26.42,3y,26.42,2.08,47.77,2026-03-20T00:00:00.000Z
ISCF,iShares MSCI International Small-Cap Equity Factor ETF,-3.079,-2.92,16.43,-9.8,-0.02,15.29,3y,15.29,0.86,40.6,2026-03-20T00:00:00.000Z
ISCG,iShares Morningstar Small-Cap Growth ETF,-2.272,-3.52,16.91,-8.01,-1.65,20.26,3y,20.26,1.3,54.2,2026-03-20T00:00:00.000Z
ISCV,iShares Morningstar Small-Cap Value ETF,-1.653,-2.65,11.23,-8.94,-2.35,19.97,3y,19.97,1.01,67.23,2026-03-20T00:00:00.000Z
ISMD,Inspire Small/Mid Cap ETF,-2.518,-0.59,9.88,-8.83,-1.22,19.87,3y,19.87,1.11,38.71,2026-03-20T00:00:00.000Z
ISPY,ProShares S&P High Income ETF,-1.307,-5.18,1.48,-5.21,-3.47,15.42,1y,,0.92,43.34,2026-03-20T00:00:00.000Z
ISVAF,iShares NASDAQ 100 UCITS ETF USD (Acc),,,,,,,,,,,2026-03-23T08:28:27.220Z
ISVL,iShares International Developed Small-Cap ETF,-3.046,-3.41,21.24,-11.64,-1.01,15.32,3y,15.32,0.75,46.16,2026-03-20T00:00:00.000Z
ITA,iShares U.S. Aerospace & Defense ETF,-2.094,0.25,42.32,-8.6,8.67,18.44,3y,18.44,1.02,222.56,2026-03-20T00:00:00.000Z
ITB,iShares U.S. Home Construction ETF,-2.615,-9.46,-8.51,-19.97,-11.62,27.15,3y,27.15,0.78,88.27,2026-03-20T00:00:00.000Z
ITOT,iShares Core S&P Total U.S. Stock Market ETF,-1.563,-5.01,14.61,-5.49,-3.11,15.14,3y,15.14,1.03,141.68,2026-03-20T00:00:00.000Z
ITWO,ProShares Russell 2000 High Income ETF,-1.941,-2.99,4.91,-7.91,-2.9,22.14,1y,,1.27,38.9,2026-03-20T00:00:00.000Z
IUS,Invesco RAFI Strategic US Exchange-Traded Fund,-1.168,0.09,15.55,-4.26,1.43,12.87,3y,12.87,0.79,57.52,2026-03-20T00:00:00.000Z
IUSA,Northern Lights Fund Trust II A,-0.145,-3.08,12.49,-3.77,-3.31,13.11,3y,13.11,0.53,4897.75,2026-03-20T00:00:00.000Z
IUSG,iShares Core S&P U.S. Growth ETF,-1.982,-7.04,20.16,-4.93,-4.28,18.22,3y,18.22,1.24,156.31,2026-03-20T00:00:00.000Z
IUSV,iShares Core S&P U.S. Value ETF,-0.966,-2.36,8.89,-5.87,-1.42,13,3y,13,0.71,100.52,2026-03-20T00:00:00.000Z
IVE,ISHARES S&P 500 VALUE ETF,-0.949,-2.37,9.02,-5.69,-1.41,12.81,3y,12.81,0.71,207.73,2026-03-20T00:00:00.000Z
IVES,Amplify Bloomberg AI Value Chain ETF,-2.434,-8.56,-36.88,-4.22,-4.1,71.82,1y,,1.83,29.26,2026-03-20T00:00:00.000Z
IVLU,iShares MSCI International Value Factor ETF,-2.964,-1.38,20.27,-10.38,1.28,15.39,3y,15.39,0.85,37.98,2026-03-20T00:00:00.000Z
IVOG,Vanguard S&P Mid-Cap 400 Growth ETF,-2.616,0.76,16.04,-6.51,1.98,18.49,3y,18.49,1.18,122.85,2026-03-20T00:00:00.000Z
IVOL,Quadratic Interest Rate Volatility and Inflation Hedge ETF,0.322,-2.1,1.63,-1.63,-2.71,11.68,3y,11.68,-0.1,18.68,2026-03-20T00:00:00.000Z
IVOO,Vanguard S&P Mid-Cap 400 ETF,-2.256,-1.36,10.53,-7.88,-0.38,17.97,3y,17.97,1.05,111.79,2026-03-20T00:00:00.000Z
IVOV,Vanguard S&P Mid-Cap 400 Value ETF,-1.654,-3.27,5.49,-9.45,-4.55,18.21,3y,18.21,0.91,98.7,2026-03-20T00:00:00.000Z
IVV,iShares Core S&P 500 ETF,-1.457,-5.08,14.66,-5.29,-3.14,14.72,3y,14.72,1,651.3,2026-03-20T00:00:00.000Z
IVW,ISHARES S&P 500 GROWTH ETF (3IS8),-1.95,-7.47,20.39,-4.85,-4.71,18.44,3y,18.44,1.25,114.13,2026-03-20T00:00:00.000Z
IWB,iShares Russell 1000 ETF,-1.58,-5.18,14.32,-5.48,-3.26,14.86,3y,14.86,1.01,354.95,2026-03-20T00:00:00.000Z
IWC,iShares Micro-Cap ETF,-2.546,-1.81,32.87,-7.03,-1.3,23.85,3y,23.85,1.48,155.82,2026-03-20T00:00:00.000Z
IWD,iShares Russell 1000 Value ETF,-1.234,-0.42,12.12,-5.65,1.27,13.12,3y,13.12,0.76,211.31,2026-03-20T00:00:00.000Z
IWF,iShares Russell 1000 Growth ETF,-1.833,-9.39,15.82,-5.17,-7.35,18.86,3y,18.86,1.24,427.44,2026-03-20T00:00:00.000Z
IWL,iShares Russell Top 200 ETF,-1.401,-5.98,15.32,-5.12,-3.95,15.1,3y,15.1,1.02,160.44,2026-03-20T00:00:00.000Z
IWLG,NYLI Winslow Large Cap Growth ETF,-2.056,-10.82,8.7,-5.5,-8.69,19.74,3y,19.74,1.25,48.12,2026-03-20T00:00:00.000Z
IWM,iShares Russell 2000 ETF,-2.185,-2.64,17.37,-8.46,-2.03,21.01,3y,21.01,1.3,242.22,2026-03-20T00:00:00.000Z
IWMI,Neos Russell 2000 High Income ETF,-1.989,-5.61,1.47,-7.91,-6.03,19.44,1y,,1.05,46.31,2026-03-20T00:00:00.000Z
IWMY,Defiance R2000 Enhanced Options & 0DTE Income ETF,-2.352,-10.32,-34.55,-10.86,-11.66,19.06,1y,,1.16,17.81,2026-03-20T00:00:00.000Z
IWN,iShares Russell 2000 Value ETF,-1.741,0.32,18.34,-8.39,-0.1,20.71,3y,20.71,1.09,183.46,2026-03-20T00:00:00.000Z
IWO,iShares Russell 2000 Growth ETF,-2.599,-5.37,16.23,-8.47,-3.79,22,3y,22,1.49,309.55,2026-03-20T00:00:00.000Z
IWP,iShares Russell Mid-Cap Growth ETF,-2.364,-7.34,6.02,-5.74,-6,19.06,3y,19.06,1.22,128.06,2026-03-20T00:00:00.000Z
IWR,iShares Russell Mid-Cap ETF,-1.957,-1.67,11.06,-6.39,-0.47,15.93,3y,15.93,0.96,95.69,2026-03-20T00:00:00.000Z
IWS,iShares Russell Mid-Cap Value ETF,-1.939,-0.02,12.21,-6.58,1.14,15.47,3y,15.47,0.88,142.59,2026-03-20T00:00:00.000Z
IWV,ISHARES RUSSELL 3000 ETF,-1.555,-4.99,14.51,-5.58,-3.14,15,3y,15,1.02,368.52,2026-03-20T00:00:00.000Z
IWX,iShares Russell Top 200 Value ETF,-0.937,-0.61,12.07,-5.2,1.29,12.19,3y,12.19,0.69,91.99,2026-03-20T00:00:00.000Z
IWY,iShares Russell Top 200 Growth ETF,-1.674,-9.47,16.19,-4.94,-7.34,19.1,3y,19.1,1.23,249.67,2026-03-20T00:00:00.000Z
IXC,iShares Global Energy ETF,-0.625,29.88,34.23,9.31,34.85,19.69,3y,19.69,0.28,55.64,2026-03-20T00:00:00.000Z
IXG,iShares Global Financials ETF,-0.996,-8.54,7.52,-7.95,-6.63,15.17,3y,15.17,0.83,111.33,2026-03-20T00:00:00.000Z
IXJ,iShares Global Healthcare ETF,-1.274,-6.45,-0.94,-9.27,-4.83,13.49,3y,13.49,0.54,91.43,2026-03-20T00:00:00.000Z
IXN,iShares Global Tech ETF,-2.92,-4.55,28.55,-5.13,0.5,22.92,3y,22.92,1.65,101.08,2026-03-20T00:00:00.000Z
IXP,iShares Global Comm Services ETF,-1.493,-4.48,16.53,-3.62,-2.29,16.34,3y,16.34,0.85,115.46,2026-03-20T00:00:00.000Z
IXUS,iShares Core International Stock ETF,-2.942,-2.39,15.89,-9.45,1.49,14.58,3y,14.58,0.96,83.8,2026-03-20T00:00:00.000Z
IYC,iShares U.S. Consumer Discretionary ETF,-1.475,-6.99,8.23,-5.8,-7.83,17.35,3y,17.35,0.92,95.51,2026-03-20T00:00:00.000Z
IYE,iShares U.S. Energy ETF,-0.096,28.57,28.52,7.09,32.33,21.3,3y,21.3,0.27,62.42,2026-03-20T00:00:00.000Z
IYF,iShares U.S. Financials ETF,-0.069,-10.34,3.39,-6.83,-9.32,16.98,3y,16.98,0.79,116.24,2026-03-20T00:00:00.000Z
IYG,iShares U.S. Financial Services ETF,0.11,-11.96,4.43,-7.07,-10.75,17.96,3y,17.96,0.9,81.76,2026-03-20T00:00:00.000Z
IYH,iShares U.S. Healthcare ETF,-0.915,-7.25,-0.96,-7.77,-6.06,13.89,3y,13.89,0.5,60.62,2026-03-20T00:00:00.000Z
IYJ,iShares U.S. Industrials ETF,-1.144,-2.69,10.58,-9.33,-0.32,16,3y,16,0.96,146.07,2026-03-20T00:00:00.000Z
IYK,iShares U.S. Consumer Staples ETF,-0.972,3.82,-0.77,-7.7,2.23,12.12,3y,12.12,-0.02,69.26,2026-03-20T00:00:00.000Z
IYM,iShares U.S. Basic Materials ETF,-2.156,4.26,19.3,-10.54,7.3,17.93,3y,17.93,1,163.34,2026-03-20T00:00:00.000Z
IYR,iShares U.S. Real Estate ETF,-3.131,-0.57,-2.18,-6.39,-0.43,17.14,3y,17.14,0.43,93.45,2026-03-20T00:00:00.000Z
IYT,iShares U.S. Transportation ETF,-1.056,-2.97,12.41,-9.82,-2.05,21.14,3y,21.14,1.05,73.08,2026-03-20T00:00:00.000Z
IYW,iShares U.S. Technology ETF,-2.226,-7.71,26.17,-3.74,-4.41,23.02,3y,23.02,1.54,184.48,2026-03-20T00:00:00.000Z
IYY,iShares Dow Jones U.S. ETF,-1.499,-5.11,14.54,-5.34,-3.15,14.89,3y,14.89,1.01,157.75,2026-03-20T00:00:00.000Z
IYZ,iShares U.S. Telecommunications ETF,-1.564,14.63,43.49,0.93,19.83,16.88,3y,16.88,0.88,39.03,2026-03-20T00:00:00.000Z
JAVA,JPMorgan Active Value ETF,-0.895,-2.34,10.51,-6.8,-0.51,13,3y,13,0.81,70.88,2026-03-20T00:00:00.000Z
JDST,Direxion Daily Junior Gold Miners Index Bear 2X Shares,7.461,-8.96,-85.61,59.77,-13.22,78.54,3y,78.54,-3.53,48.25,2026-03-20T00:00:00.000Z
JEMA,JPMorgan ActiveBuilders Emerging Markets Equity Fund,-3.729,1.56,28.86,-8.02,8.19,17.66,3y,17.66,1.27,51.12,2026-03-20T00:00:00.000Z
JEPI,JPMorgan Equity Premium Income Fund,-1.041,-2.15,-2.27,-5.35,-2.01,10.29,3y,10.29,0.54,56.09,2026-03-20T00:00:00.000Z
JEPQ,JPMorgan Nasdaq Equity Premium Income ETF,-1.658,-4.01,5.73,-3.35,-2.42,15.19,3y,15.19,1.03,55.76,2026-03-20T00:00:00.000Z
JETS,U.S. Global Jets ETF,-2.43,-14.85,8.32,-17.22,-14.91,29.46,3y,29.46,1.45,24.09,2026-03-20T00:00:00.000Z
JGLO,JPMorgan Global Select Equity ETF,-1.67,-5.7,6.31,-7.28,-3.46,14.05,3y,14.05,0.9,64.17,2026-03-20T00:00:00.000Z
JGRO,JPMorgan Active Growth ETF,-1.88,-9.37,11.37,-5.33,-7.41,18.98,3y,18.98,1.26,84.02,2026-03-20T00:00:00.000Z
JHEM,John Hancock Multifactor Emerging Markets ETF,-3.136,0.21,22.88,-7.6,5.19,15.95,3y,15.95,1.09,33.67,2026-03-20T00:00:00.000Z
JHMD,John Hancock Multifactor Developed International ETF,-2.882,-2.67,12.71,-9.64,-1.33,14.55,3y,14.55,0.85,40.78,2026-03-20T00:00:00.000Z
JHML,John Hancock Multifactor Large Cap ETF,-1.479,-3.36,13.78,-5.4,-2.17,14.08,3y,14.08,0.94,77.53,2026-03-20T00:00:00.000Z
JHMM,John Hancock Multifactor Mid Cap ETF,-1.896,-0.96,13.44,-7.34,0.02,16.29,3y,16.29,0.99,65.73,2026-03-20T00:00:00.000Z
JHSC,John Hancock Multifactor Small Cap ETF,-1.743,-1.47,10.24,-8.96,-1.68,18.9,3y,18.9,1.08,41.825,2026-03-20T00:00:00.000Z
JIG,JPMorgan International Growth ETF,-3.576,-2.77,9.91,-9.25,1.82,15.82,3y,15.82,1.18,72.54,2026-03-20T00:00:00.000Z
JIRE,JPMorgan International Research Enhanced Equity ETF,-3.118,-3.73,10.89,-10.32,-0.71,14.88,3y,14.88,0.92,73.01,2026-03-20T00:00:00.000Z
JIVE,JPMorgan International Value ETF,-2.752,1.56,29.99,-8.71,5.4,14.86,3y,14.86,0.87,82.468,2026-03-20T00:00:00.000Z
JKD,iShares Morningstar Large-Cap ETF,-1.472,-5.16,16.03,-5.12,-3.21,14.92,3y,14.92,1.01,89.67,2026-03-20T00:00:00.000Z
JKE,iShares Morningstar Large-Cap Growth ETF,-2.149,-7.81,17.56,-5.25,-5.1,19.08,3y,19.08,1.29,96.08,2026-03-20T00:00:00.000Z
JKF,iShares Morningstar Large-Cap Value ETF,-0.937,-2.82,13.72,-5.29,-1.75,12.58,3y,12.58,0.73,91.96,2026-03-20T00:00:00.000Z
JKG,iShares Morningstar Mid-Cap ETF,-1.685,-1.54,11.2,-6.26,-0.32,15.19,3y,15.19,0.91,82.25,2026-03-20T00:00:00.000Z
JKH,iShares Morningstar Mid-Cap Growth ETF,-2.133,-2.79,9.43,-5.71,-1.37,16.93,3y,16.93,1.11,78.47,2026-03-20T00:00:00.000Z
JKI,iShares Morningstar Mid-Cap Value ETF,-1.15,-0.22,12.18,-6.7,0.69,14.69,3y,14.69,0.7,82.78,2026-03-20T00:00:00.000Z
JKK,iShares Morningstar Small-Cap Growth ETF,-2.272,-3.52,18.78,-8.01,-1.65,20.29,3y,20.29,1.3,54.2,2026-03-20T00:00:00.000Z
JMEE,JPMorgan Small & Mid Cap Enhanced Equity ETF,-2.193,-0.18,14.33,-7.55,0.82,18.08,3y,18.08,1.09,65.12,2026-03-20T00:00:00.000Z
JMOM,JPMorgan U.S. Momentum Factor ETF,-2.069,-1.56,18.05,-4.17,0.73,16.09,3y,16.09,1.11,67.69,2026-03-20T00:00:00.000Z
JNUG,Direxion Daily Junior Gold Miners Index Bull 2X Shares,-7.986,-23.65,155.45,-44.41,-23.68,79.92,3y,79.92,3.54,155.67,2026-03-20T00:00:00.000Z
JOET,Virtus Terranova U.S. Quality Momentum ETF,-1.391,-5.99,7.01,-6.68,-5.05,16.05,3y,16.05,1.01,39.69,2026-03-20T00:00:00.000Z
JOYY,JOYY Inc. American Depositary Shares,-0.424,-9.24,25.34,-5.2,-7.01,37.16,3y,37.16,0.66,58.76,2026-03-20T00:00:00.000Z
JPEF,JPMorgan Equity Focus ETF,-1.333,-4.26,11.1,-5.08,-3.02,15.08,3y,15.08,0.93,71.37,2026-03-20T00:00:00.000Z
JPEM,JPMorgan Diversified Return Emerging Markets Equity ETF,-2.477,-1.49,12.26,-8.62,-0.2,12.25,3y,12.25,0.71,60.23,2026-03-20T00:00:00.000Z
JPGB,JPMorgan Global Bond Opportunities ETF,-1.043,-2.81,-0.73,-3.71,-2.85,4.13,3y,4.13,0.14,47.45,2026-03-20T00:00:00.000Z
JPIE,JPMorgan Income ETF,-0.326,-0.76,-0.11,-1.23,-1.02,3.27,3y,3.27,0.04,45.92,2026-03-20T00:00:00.000Z
JPLD,JPMorgan Limited Duration ETF,-0.21,-0.26,0.48,-0.86,-0.48,2.24,3y,2.24,0,52.18,2026-03-20T00:00:00.000Z
JPSE,JPMorgan Diversified Return U.S. Small Cap Equity ETF,-2.233,0.69,14.58,-7.18,-0.12,18.55,3y,18.55,1,50.78,2026-03-20T00:00:00.000Z
JPXN,iShares JPX-Nikkei 400 ETF,-3.486,0.78,15.23,-10.81,2.57,17.73,3y,17.73,1.02,87.76,2026-03-20T00:00:00.000Z
JQUA,JPMorgan U.S. Quality Factor ETF,-1.205,-2.58,7.72,-3.73,-2.35,13.5,3y,13.5,0.84,61.47,2026-03-20T00:00:00.000Z
JSMD,Janus Small-Mid Cap Growth Alpha Fund,-2.684,-6.41,8.39,-9.87,-4.98,20.33,3y,20.33,1.49,77.155,2026-03-20T00:00:00.000Z
JTEK,JPMorgan U.S. Tech Leaders ETF,-2.888,-10.71,14.15,-4.36,-7.03,27.25,3y,27.25,1.8,80.85,2026-03-20T00:00:00.000Z
JVAL,JPMorgan U.S. Value Factor ETF,-1.577,-2.17,14.5,-6.34,-1.14,15.68,3y,15.68,1.06,48.42,2026-03-20T00:00:00.000Z
JXI,iShares Global Utilities ETF,-3.905,4.66,21.73,-3.23,7.16,14.59,3y,14.59,0.37,83.18,2026-03-20T00:00:00.000Z
KBA,KraneShares Bosera MSCI China A 50 Connect Index ETF,-1.494,-5.33,21.09,-3.2,-3.1,22.69,3y,22.69,0.69,29.68,2026-03-20T00:00:00.000Z
KBE,SPDR S&P Bank ETF,-0.155,-5.43,7.79,-10.89,-7.57,26.87,3y,26.87,0.93,57.85,2026-03-20T00:00:00.000Z
KBWB,Invesco KBW Bank ETF,0.404,-10.12,21.71,-10.62,-8.68,24.45,3y,24.45,1.08,77.08,2026-03-20T00:00:00.000Z
KBWD,Invesco KBW High Dividend Yield Financial ETF,-2.985,-10.64,-17.72,-9.46,-11.28,18.73,3y,18.73,0.61,12.35,2026-03-20T00:00:00.000Z
KBWP,Invesco KBW Property & Casualty Fund,0.766,-4.29,-1.33,-2.86,-6.02,17.2,3y,17.2,-0.03,119.78,2026-03-20T00:00:00.000Z
KBWY,Invesco KBW Premium Yield Equity Fund,-3.34,-1.48,-9.61,-5.77,-2.85,21.76,3y,21.76,0.45,15.34,2026-03-20T00:00:00.000Z
KCE,SPDR S&P Capital Markets ETF,-0.541,-10.28,4.85,-7.2,-9.24,21.28,3y,21.28,1.21,136.02,2026-03-20T00:00:00.000Z
KDEF,PLUS Korea Defense Industry Index ETF,-8.282,14.77,81.38,-8.07,24.17,44.83,1y,,1.36,52.6,2026-03-20T00:00:00.000Z
KEMX,KraneShares MSCI Emerging Markets ex China Index ETF,-4.273,4.37,38.69,-9.26,8.47,16.97,3y,16.97,1.21,39.564,2026-03-20T00:00:00.000Z
KHPI,Kensington Hedged Premium Income ETF,-1.573,-4.95,0.04,-4.76,-4.98,11.17,1y,,0.48,24.41,2026-03-20T00:00:00.000Z
KIE,SPDR S&P Insurance ETF,-0.037,-8.67,-8.93,-5.5,-10.42,16.59,3y,16.59,0.25,54.34,2026-03-20T00:00:00.000Z
KMLM,KraneShares Mount Lucas Managed Futures Index Strategy ETF,0.467,7.16,2.19,4.84,3.59,10.92,3y,10.92,0.14,27.97,2026-03-20T00:00:00.000Z
KNG,Fidelity S&P 500 Dividend Aristocrats ETF,-1.232,-2.53,-4.94,-8.26,-2.69,11.48,3y,11.48,0.37,48.09,2026-03-20T00:00:00.000Z
KOLD,ProShares UltraShort Bloomberg Natural Gas,2.43,-46.86,6.56,-11.52,-38.4,110,3y,110,1.94,19.81,2026-03-20T00:00:00.000Z
KOMP,SPDR S&P Kensho New Economies Composite ETF,-2.785,-4.48,19.65,-7.39,-1.21,22.49,3y,22.49,1.7,58.65,2026-03-20T00:00:00.000Z
KORU,Direxion Daily MSCI South Korea Bull 3X Shares ETF,-19.301,53.9,602.06,-29.86,129.42,80.59,3y,80.59,5.8,320.98,2026-03-20T00:00:00.000Z
KRE,SPDR S&P Regional Banking ETF,-0.237,-3.37,9.29,-11.2,-6.32,30.13,3y,30.13,0.96,63.04,2026-03-20T00:00:00.000Z
KSA,iShares MSCI Saudi Arabia ETF,-2.181,0.03,-8.92,-3.54,2.65,14.86,3y,14.86,0.56,36.78,2026-03-20T00:00:00.000Z
KSTR,KraneShares SSE STAR Market 50 Index ETF,-4.286,-6.61,22.98,-13.86,-0.17,41.93,3y,41.93,1.23,18.09,2026-03-20T00:00:00.000Z
KWEB,KraneShares CSI China Internet ETF,-2.956,-20.77,-25,-13.8,-21.26,35.49,3y,35.49,1.36,28.23,2026-03-20T00:00:00.000Z
KXI,iShares Global Consumer Staples ETF,-1.079,2.18,4.89,-8.43,1.07,11.61,3y,11.61,0.08,66.03,2026-03-20T00:00:00.000Z
LABD,Direxion Daily S&P Biotech Bear 3X Shares,4.987,-3.1,-73.07,14.61,-7.32,80.89,3y,80.89,-3.02,20.63,2026-03-20T00:00:00.000Z
LABU,Direxion Daily S&P Biotech Bull 3X Shares,-4.846,-9.37,84.01,-16.4,-8.8,80.17,3y,80.17,3.03,142.74,2026-03-20T00:00:00.000Z
LCTU,BlackRock U.S. Carbon Transition Readiness ETF,-1.592,-5.78,13.8,-5.45,-4.13,15.02,3y,15.02,1.03,69.86,2026-03-20T00:00:00.000Z
LFGY,YieldMax Crypto Industry & Tech Portfolio Option Income ETF,-3.394,-18.97,-45.23,-1.03,-17.12,41.06,1y,,2.3,21.06,2026-03-20T00:00:00.000Z
LGH,HCM Defender 500 Index ETF,-0.902,-7.81,16.4,-6.91,-5.37,17.01,3y,17.01,1.39,57.15,2026-03-20T00:00:00.000Z
LGLV,SPDR SSGA US Large Cap Low Volatility Index ETF,-1.161,0.69,2.6,-4.68,0.16,10.93,3y,10.93,0.36,177.04,2026-03-20T00:00:00.000Z
LGOV,First Trust Long Duration Opportunities ETF,-1.379,-1.58,-0.56,-3.62,-1.7,9.3,3y,9.3,0.05,21.45,2026-03-20T00:00:00.000Z
LIT,GLOBAL X LITHIUM & BATTERY T,-2.56,1.07,61.48,-8.41,5.28,30.74,3y,30.74,1.63,66.98,2026-03-20T00:00:00.000Z
LITP,Sprott Lithium Miners ETF,-4.589,-12.75,63.5,-15.88,-9.58,47.37,3y,47.37,2.09,11.02,2026-03-20T00:00:00.000Z
LLYX,Defiance Daily Target 2X Long LLY ETF,-2.697,-33.93,-16.25,-23.19,-31.28,85.7,1y,,0.92,16.96,2026-03-20T00:00:00.000Z
LMBS,First Trust Low Duration Opportunities ETF,-0.36,-0.14,1.36,-1.05,-0.24,2.87,3y,2.87,0.02,49.88,2026-03-20T00:00:00.000Z
LQDW,iShares Investment Grade Corporate Bond BuyWrite Strategy ETF,-0.804,-2.58,-8.95,-3.09,-3.41,6.51,3y,6.51,0.11,23.936,2026-03-20T00:00:00.000Z
LRGC,AB US Large Cap Strategic Equities ETF,-1.311,-6.19,11.82,-5.62,-3.8,15.27,3y,15.27,0.97,73.099,2026-03-20T00:00:00.000Z
LRGF,iShares U.S. Equity Factor ETF,-1.563,-5.82,11.8,-5.16,-4.23,15.1,3y,15.1,1.01,65.48,2026-03-20T00:00:00.000Z
LSGR,Natixis Loomis Sayles Focused Growth ETF,-1.877,-10.6,11.42,-4.34,-8.46,20.8,3y,20.8,1.17,39.72,2026-03-20T00:00:00.000Z
LST,Leuthold Select Industries ETF,-1.915,-2.5,20.36,-8.54,-0.85,17.87,1y,,0.98,39.43,2026-03-20T00:00:00.000Z
LVHB,Innovator Lunt Low Vol/High Beta Tactical ETF,-0.686,-1.58,11.54,-2.05,-0.63,7.64,3y,7.64,0.38,49.2,2026-03-20T00:00:00.000Z
LVHD,Franklin U.S. Low Volatility ETF,-1.519,4.84,3.96,-4.58,3.26,11.97,3y,11.97,0.2,41.886,2026-03-20T00:00:00.000Z
LVHI,Franklin International Low Volatility High Dividend ETF,-1.867,4.37,18.56,-4.66,7.18,11.34,3y,11.34,0.44,38.9,2026-03-20T00:00:00.000Z
MAGS,Roundhill Magnificent Seven Fund,-1.982,-10.68,24.86,-5.23,-10.63,26.04,3y,26.04,1.42,58.37,2026-03-20T00:00:00.000Z
MAGX,Redhill Daily 2x Leveraged & Inverse ETF,-4.132,-21.83,32.42,-11.14,-21.69,55.5,1y,,2.77,43.62,2026-03-20T00:00:00.000Z
MCHI,iShares MSCI China ETF,-2.816,-11.29,-5.32,-9.07,-7.16,27.54,3y,27.54,1.05,55.21,2026-03-20T00:00:00.000Z
MDST,Westwood Salient Enhanced Midstream ETF,0.035,8.36,3.29,1.65,11.36,17.93,1y,,0.15,28.91,2026-03-20T00:00:00.000Z
MDY,SPDR S&P MidCap 400 ETF Trust,-2.479,-1.61,10.17,-8.1,-0.65,17.98,3y,17.98,1.05,601.47,2026-03-20T00:00:00.000Z
MDYG,SPDR S&P 400 Mid Cap Growth ETF,-2.813,0.48,15.61,-6.51,2.39,18.35,3y,18.35,1.16,94.33,2026-03-20T00:00:00.000Z
MDYV,SPDR S&P 400 Mid Cap Value ETF,-1.593,-3.29,5.34,-9.47,-3.26,18.12,3y,18.12,0.92,82.79,2026-03-20T00:00:00.000Z
MEXX,Direxion Daily MSCI Mexico Bull 3X Shares,-9.707,-6.47,96.36,-35.53,1.5,70.47,3y,70.47,2.73,23.72,2026-03-20T00:00:00.000Z
MGC,Vanguard Mega Cap ETF,-1.382,-5.67,15.89,-4.75,-3.79,15.17,3y,15.17,1.02,236.93,2026-03-20T00:00:00.000Z
MGK,Vanguard Mega Cap Growth ETF,-1.75,-9.79,17.54,-4.23,-7.76,19.6,3y,19.6,1.26,370.63,2026-03-20T00:00:00.000Z
MGNR,American Beacon GLG Natural Resources ETF,-2.589,6.84,52.12,-8.69,10.09,27.27,1y,,1.35,47.79,2026-03-20T00:00:00.000Z
MGV,Vanguard Mega Cap Value ETF,-0.805,1.19,11.45,-5.48,2.23,12.08,3y,12.08,0.59,144.14,2026-03-20T00:00:00.000Z
MIDU,Direxion Daily Mid Cap Bull 3X Shares,-6.696,-7.63,9.45,-23.27,-4.5,54.32,3y,54.32,3.16,48.77,2026-03-20T00:00:00.000Z
MINO,PIMCO Municipal Income Opportunities Active Exchange-Traded Fund,-0.726,-0.62,0.18,-1.89,-0.66,4.67,3y,4.67,0.05,45.1,2026-03-20T00:00:00.000Z
MISL,First Trust Indxx Aerospace & Defense ETF,-2.365,3.24,48.14,-8.4,12.97,18.5,3y,18.5,1.12,45.82,2026-03-20T00:00:00.000Z
MKOR,Matthews Korea Active ETF,-5.711,24.01,100.77,-6.48,40.36,23.94,3y,23.94,1.77,44.58,2026-03-20T00:00:00.000Z
MLPA,Global X MLP ETF,-0.238,11.63,1.11,2.35,12.78,14.49,3y,14.49,0.17,54.44,2026-03-20T00:00:00.000Z
MLPQ,UBS ETRACS 2xMonthly Leveraged Alerian MLP Infrastructure Index ETN SeriesB,0.899,19.6,18.28,5.71,18.28,13.63,SI,,0.05,12015,2026-03-20T00:00:00.000Z
MLPX,Global X MLP & Energy Infrastructure ETF,-0.556,19.9,14.54,5.48,23.2,17.04,3y,17.04,0.15,73.34,2026-03-20T00:00:00.000Z
MOAT,VANECK MORNINGSTAR WIDE MOAT FUND,-0.898,-6.21,7.87,-8.54,-7,15.52,3y,15.52,0.82,97.09,2026-03-20T00:00:00.000Z
MODL,VictoryShares WestEnd U.S. Sector ETF,-1.372,-6.2,13.77,-5.15,-4.64,13.8,3y,13.8,0.9,44.577,2026-03-20T00:00:00.000Z
MOO,VanEck Agribusiness ETF,-2.682,8.84,15.45,-6.93,8.25,15.81,3y,15.81,0.55,80.19,2026-03-20T00:00:00.000Z
MOOD,Relative Sentiment Tactical Allocation Fund,-1.727,3.56,27.25,-5.5,5.28,10.98,3y,10.98,0.83,39.936,2026-03-20T00:00:00.000Z
MORT,VanEck Mortgage REIT Income ETF,-4.301,-8.68,-15.38,-8.76,-9.35,22.58,3y,22.58,0.56,9.79,2026-03-20T00:00:00.000Z
MRNY,YieldMax MRNA Option Income Strategy ETF,-1.16,24.25,-44.2,-4.14,16.64,54.56,1y,,1.63,18.75,2026-03-20T00:00:00.000Z
MSFD,Direxion Daily MSFT Bear 1X Shares,1.976,22.34,-2.97,4.47,22.54,23.64,3y,23.64,-0.91,14.399,2026-03-20T00:00:00.000Z
MSFL,GraniteShares 2x Long Microsoft ETF,-3.783,-37.34,-14.94,-9.25,-38.43,52.53,1y,,1.77,16.28,2026-03-20T00:00:00.000Z
MSFO,YieldMax MSFT Option Income Strategy ETF,-1.481,-20.57,-25.74,-5.38,-22.07,20.27,3y,20.27,0.84,11.97,2026-03-20T00:00:00.000Z
