symbol,name,daily_change_pct,ytd_return_pct,one_year_return_pct,perf_1m_pct,perf_3m_pct,vol_pct,vol_window,vol_3y_pct,last_close,as_of
AFIF,Anfield Universal Fixed Income Fund,0,0.64,2.71,0.32,0.64,3.92,3y,3.92,9.47,2026-02-19T00:00:00.000Z
AGG,iShares Core U.S. Aggregate Bond ETF,-0.035,0.98,3.61,1.16,0.8,5.84,3y,5.84,100.825,2026-02-19T00:00:00.000Z
AGGH,Simplify Aggregate Bond ETF,-0.167,0.75,0.55,0.65,0.43,9.41,3y,9.41,20.865,2026-02-19T00:00:00.000Z
AGGY,WisdomTree Yield Enhanced U.S. Aggregate Bond Fund,-0.067,1.09,3.27,1.32,0.83,5.77,3y,5.77,44.48,2026-02-19T00:00:00.000Z
AGZ,iShares Agency Bond ETF,-0.09,0.22,2.26,0.45,0.13,3.44,3y,3.44,110.52,2026-02-19T00:00:00.000Z
ANGL,VanEck Fallen Angel High Yield Bond ETF,-0.017,1.04,2.64,0.73,1.97,6.09,3y,6.09,29.705,2026-02-19T00:00:00.000Z
APCB,ActivePassive Core Bond ETF,-0.05,1.05,2.73,1.15,0.37,5.07,3y,5.07,29.93,2026-02-19T00:00:00.000Z
AVIG,Avantis Core Fixed Income ETF,-0.059,0.86,3.67,1.06,0.9,5.83,3y,5.83,42.265,2026-02-19T00:00:00.000Z
AVSF,Avantis Short-Term Fixed Income ETF,0,0.37,1.99,0.37,0.4,2.61,3y,2.61,47.25,2026-02-18T00:00:00.000Z
BAB,Invesco Taxable Municipal Bond ETF,0.182,1.29,4.4,1.81,0.84,7.98,3y,7.98,27.52,2026-02-19T00:00:00.000Z
BBAG,JPMorgan BetaBuilders U.S. Aggregate Bond ETF,0,0.93,3.15,1.12,0.69,5.83,3y,5.83,46.81,2026-02-19T00:00:00.000Z
BBHY,JPMorgan BetaBuilders U.S. High Yield Fund,0.15,0.26,0.04,-0.3,0.67,5.87,3y,5.87,46.63,2026-02-18T00:00:00.000Z
BGRN,iShares USD Green Bond ETF,-0.108,0.73,2.81,0.54,0.62,4.8,3y,4.8,48.249,2026-02-18T00:00:00.000Z
BIL,SPDR Bloomberg 1-3 Month T-Bill ETF,0.005,0.13,-0.07,-0.01,-0.07,1.33,3y,1.33,91.535,2026-02-19T00:00:00.000Z
BILS,SPDR Bloomberg 3-12 Month T-Bill ETF,0.02,0.1,0.04,-0.02,0.01,1.33,3y,1.33,99.35,2026-02-19T00:00:00.000Z
BILZ,PIMCO Ultra Short Government Active Exchange-Traded Fund,0.01,0.09,-0.14,-0.04,-0.04,1.34,3y,1.34,100.88,2026-02-18T00:00:00.000Z
BIV,Vanguard Intermediate-Term Bond ETF (likely mapping for ticker 0V1L),-0.038,0.78,4.57,1.21,0.64,6.03,3y,6.03,78.46,2026-02-19T00:00:00.000Z
BKAG,BNY Mellon Core Bond ETF,-0.07,0.85,3.36,1.13,0.75,5.8,3y,5.8,42.79,2026-02-19T00:00:00.000Z
BKHY,BNY Mellon High Yield ETF,0.027,0.33,-0.02,-0.23,0.35,7.06,3y,7.06,48.26,2026-02-18T00:00:00.000Z
BKLN,Invesco Senior Loan ETF,-0.048,-1.67,-1.99,-1.24,-1.38,3.88,3y,3.88,20.66,2026-02-19T00:00:00.000Z
BKUI,BNY Mellon Ultra Short Income ETF,0.01,0.22,0.39,0.09,0.11,1.39,3y,1.39,49.865,2026-02-18T00:00:00.000Z
BLV,Vanguard Long-Term Bond ETF,-0.113,2.25,2.78,2.54,0.88,12.02,3y,12.02,70.95,2026-02-19T00:00:00.000Z
BND,Vanguard Total Bond Market Index Fund,-0.047,0.97,3.45,1.12,0.75,5.74,3y,5.74,74.755,2026-02-19T00:00:00.000Z
BNDI,Neos Enhanced Income Aggregate Bond ETF,-0.115,0.58,1.72,0.74,0.26,5.98,3y,5.98,47.825,2026-02-18T00:00:00.000Z
BNDW,Vanguard Total World Bond ETF,0,1.08,1.64,1.09,-0.22,4.91,3y,4.91,69.47,2026-02-19T00:00:00.000Z
BNDX,Vanguard Total International Bond ETF,0.01,1.23,-0.3,1.06,-1.2,4.77,3y,4.77,48.905,2026-02-19T00:00:00.000Z
BOND,PIMCO Active Bond Exchange-Traded Fund,-0.053,1.13,3.48,0.91,0.92,5.74,3y,5.74,94.08,2026-02-19T00:00:00.000Z
BSCQ,Invesco BulletShares 2026 Corporate Bond ETF,0,0.13,0.51,0.31,0.03,2.53,3y,2.53,19.6,2026-02-19T00:00:00.000Z
BSCR,Invesco BulletShares 2027 Corporate Bond ETF,-0.076,0.15,1.31,0.43,0.23,3.3,3y,3.3,19.775,2026-02-19T00:00:00.000Z
BSCS,Invesco BulletShares 2028 Corporate Bond ETF,-0.073,0.17,2.05,0.56,0.36,4,3y,4,20.645,2026-02-19T00:00:00.000Z
BSCT,Invesco BulletShares 2029 Corporate Bond ETF,-0.053,0.4,2.88,0.8,0.58,4.87,3y,4.87,18.92,2026-02-19T00:00:00.000Z
BSCU,Invesco BulletShares 2030 Corporate Bond ETF,-0.029,0.59,3.28,0.59,0.89,5.54,3y,5.54,17.02,2026-02-18T00:00:00.000Z
BSCV,Invesco BulletShares 2031 Corporate Bond ETF,-0.119,0.51,3.97,1.08,0.84,6.07,3y,6.07,16.78,2026-02-19T00:00:00.000Z
BSCW,Invesco BulletShares 2032 Corporate Bond ETF,-0.071,0.79,3.75,0.77,1.11,6.54,3y,6.54,21.04,2026-02-18T00:00:00.000Z
BSCX,Invesco BulletShares 2033 Corporate Bond ETF,-0.069,0.75,4.27,1.43,1.1,6.35,3y,6.35,21.615,2026-02-19T00:00:00.000Z
BSCY,Invesco BulletShares 2034 Corporate Bond ETF,-0.047,1,4,0.76,1.29,5.51,1y,,21.21,2026-02-18T00:00:00.000Z
BSJQ,Invesco BulletShares 2026 High Yield Corporate Bond ETF,0,0,-0.55,0.3,-0.04,4.1,3y,4.1,23.33,2026-02-19T00:00:00.000Z
BSJR,Invesco Bulletshares 2027 High Yield Fund,-0.066,0.09,-0.09,0.38,0.33,4.9,3y,4.9,22.635,2026-02-19T00:00:00.000Z
BSJS,Invesco BulletShares 2028 High Yield Fund,-0.045,0.23,0.23,0.41,0.61,5.83,3y,5.83,22.05,2026-02-19T00:00:00.000Z
BSJT,Invesco BulletShares 2029 High Yield Fund,0.187,-0.37,-0.84,-0.88,0,6.41,3y,6.41,21.46,2026-02-18T00:00:00.000Z
BSJU,Invesco BulletShares 2030 High Yield Fund,-0.134,0.17,0.6,0.29,0.93,6.59,3y,6.59,26.155,2026-02-19T00:00:00.000Z
BSJV,Invesco BulletShares 2031 High Yield Fund,0.131,0.36,0.94,-0.36,1.1,6.43,3y,6.43,26.755,2026-02-18T00:00:00.000Z
BSMQ,Invesco BulletShares 2026 Municipal Bond Fund,0.042,0.11,-0.17,-0.17,0.04,2.37,3y,2.37,23.66,2026-02-18T00:00:00.000Z
BSMR,Invesco BulletShares 2027 Municipal Bond ETF,0.105,0.61,0.38,0.25,0.61,3.02,3y,3.02,23.82,2026-02-18T00:00:00.000Z
BSMS,Invesco BulletShares 2028 Municipal Bond ETF,-0.042,0.68,1.02,0.25,0.9,3.4,3y,3.4,23.67,2026-02-18T00:00:00.000Z
BSMT,Invesco BulletShares 2029 Municipal Bond ETF,-0.021,0.93,1.34,0.73,1.17,4.11,3y,4.11,23.37,2026-02-19T00:00:00.000Z
BSMU,Invesco BulletShares 2030 Municipal Bond ETF,-0.022,1.11,1.83,0.52,1.36,4.31,3y,4.31,22.29,2026-02-18T00:00:00.000Z
BSMV,Invesco BulletShares 2031 Municipal Bond ETF,-0.037,1.39,2.11,0.78,1.49,4.98,3y,4.98,21.44,2026-02-18T00:00:00.000Z
BSMW,Invesco BulletShares 2032 Municipal Bond ETF,0.02,1.35,1.74,0.6,1.17,5.2,3y,5.2,25.5,2026-02-18T00:00:00.000Z
BSSX,Invesco BulletShares 2033 Municipal Bond ETF,-0.05,1.37,1.55,0.71,1.33,8.28,3y,8.28,26.205,2026-02-18T00:00:00.000Z
BSV,Vanguard Short-Term Bond ETF,-0.019,0.27,2.06,0.39,0.31,2.76,3y,2.76,79.015,2026-02-19T00:00:00.000Z
BUCK,Simplify Treasury Option Income ETF,0.127,-0.15,-4.24,-0.13,-0.65,4.25,3y,4.25,23.71,2026-02-19T00:00:00.000Z
BUFP,PGIM Laddered Fund of Bond 12 ETF,0.066,0.6,10.43,-0.2,2.58,11.34,1y,,30.29,2026-02-18T00:00:00.000Z
BUXX,Strive Enhanced Income Short Duration Fund,0,0.4,-0.15,-0.05,0,2.03,3y,2.03,20.31,2026-02-19T00:00:00.000Z
BWX,SPDR Bloomberg International Treasury Bond ETF,-0.196,1.8,5.85,2.49,1.35,8.83,3y,8.83,22.885,2026-02-19T00:00:00.000Z
BWZ,SPDR Bloomberg Short Term International Treasury Bond ETF,-0.43,1.72,7.51,1.91,1.87,7.45,3y,7.45,27.76,2026-02-18T00:00:00.000Z
BYLD,iShares Yield Optimized Bond ETF,0.087,0.88,2.64,0.88,0.92,4.84,3y,4.84,22.98,2026-02-19T00:00:00.000Z
CAFX,Congress Intermediate Bond ETF,0.02,0.58,2.61,0.68,0.54,3.15,1y,,25.15,2026-02-19T00:00:00.000Z
CALI,iShares California Muni Bond ETF,0.01,0.42,0.62,0.18,0.33,1.32,1y,,50.69,2026-02-18T00:00:00.000Z
CALY,BlackRock Short-Term California Muni Bond ETF,0.522,15.1,85.56,-10.9,19.7,53.98,3y,53.98,13.49,2026-02-18T00:00:00.000Z
CDX,Simplify High Yield ETF,0.09,-0.32,-1.95,-1.21,-2.31,11.41,3y,11.41,22.13,2026-02-18T00:00:00.000Z
CEMB,iShares J.P. Morgan EM Corporate Bond ETF,-0.151,0.85,2.92,0.65,0.61,4.63,3y,4.63,46.22,2026-02-19T00:00:00.000Z
CGCB,Capital Group Core Bond ETF,-0.093,1.11,3.26,1.19,0.73,4.56,1y,,26.775,2026-02-19T00:00:00.000Z
CGHM,Capital Group Municipal High-Income ETF,0.019,1.47,1.75,1.12,1.17,4.95,1y,,25.845,2026-02-19T00:00:00.000Z
CGIB,Capital Group International Bond USD Hedged Fund,0.078,1.32,0.87,1.1,0.71,4.58,1y,,25.65,2026-02-19T00:00:00.000Z
CGMU,Capital Group Municipal Income ETF,-0.018,1.59,2.83,1.14,1.7,3.51,3y,3.51,27.835,2026-02-19T00:00:00.000Z
CGSD,Capital Group Short Duration Income ETF,-0.019,0.44,1.42,0.37,0.52,2.47,3y,2.47,26.105,2026-02-19T00:00:00.000Z
CGSM,Capital Group Short Duration Municipal Income ETF,0.075,0.99,2.03,0.64,1.02,1.75,1y,,26.63,2026-02-19T00:00:00.000Z
CGUI,Capital Group Ultra Short Income ETF,0,0.32,0.63,0.12,0.34,1.34,1y,,25.39,2026-02-18T00:00:00.000Z
CLIP,Global X 1-3 Month T-Bill ETF,0.01,0.11,0,-0.03,-0.01,1.36,3y,1.36,100.25,2026-02-18T00:00:00.000Z
CLOI,VanEck CLO ETF,0.047,0.16,-0.25,0.03,-0.08,3.04,3y,3.04,52.925,2026-02-19T00:00:00.000Z
CLOX,Eldridge AAA CLO ETF,0,0.27,0,0,0.14,3.77,3y,3.77,25.58,2026-02-19T00:00:00.000Z
CLOZ,Panagram BBB-B CLO ETF,0.265,0.11,-2.36,-0.56,-0.06,4.31,3y,4.31,26.53,2026-02-18T00:00:00.000Z
CLTL,Invesco Treasury Collateral ETF,0,0.09,0.11,0,0.02,1.44,3y,1.44,105.78,2026-02-17T00:00:00.000Z
CMBS,iShares CMBS ETF,-0.302,0.71,4.12,0.59,1.14,5.05,3y,5.05,49.5,2026-02-18T00:00:00.000Z
CMF,iShares California Muni Bond ETF,0.043,1.19,2.4,1.02,1.33,4.26,3y,4.26,58.185,2026-02-19T00:00:00.000Z
CORP,PIMCO Investment Grade Corporate Bond Index Exchange-Traded Fund,-0.076,1.01,3.31,1.21,0.87,6.07,3y,6.07,98.805,2026-02-19T00:00:00.000Z
CVSB,Calvert Ultra-Short Investment Grade ETF,-0.02,0.14,0.1,0.01,0.2,1.93,3y,1.93,50.82,2026-02-18T00:00:00.000Z
DBND,DoubleLine Opportunistic Bond ETF,-0.086,0.79,2.55,0.91,0.72,5.27,3y,5.27,46.7,2026-02-19T00:00:00.000Z
DFCA,Dimensional California Municipal Bond ETF,-0.229,0.97,0.95,0.36,0.98,2.67,3y,2.67,50.594,2026-02-18T00:00:00.000Z
DFCF,Dimensional Core Fixed Income ETF,-0.105,1.02,3.35,1.21,0.6,5.68,3y,5.68,42.985,2026-02-19T00:00:00.000Z
DFGP,Dimensional Global Core Fixed Income Fund,-0.045,1.67,3.42,1.46,-0.22,4.31,1y,,54.935,2026-02-19T00:00:00.000Z
DFGX,Dimensional Global ex US Core Fixed Income Fund,-0.028,1.69,1.84,1.3,-1.44,4.96,1y,,53.425,2026-02-19T00:00:00.000Z
DFIP,Dimensional Inflation-Protected Securities ETF,-0.083,1.2,1.91,1.08,-0.18,5.77,3y,5.77,42.045,2026-02-18T00:00:00.000Z
DFNM,Dimensional National Municipal Bond ETF,-0.256,1.11,1.47,0.39,1.03,2.61,3y,2.61,48.705,2026-02-18T00:00:00.000Z
DFSB,Dimensional Global Sustainability Fixed Income ETF,-0.038,1.57,2.7,1.37,-0.47,5.56,3y,5.56,52.54,2026-02-19T00:00:00.000Z
DFSD,Dimensional Short-Duration Fixed Income ETF,0.021,0.77,2.44,0.81,0.27,2.53,3y,2.53,48.35,2026-02-19T00:00:00.000Z
DGCB,Dimensional Global Credit Fund,-0.018,1.66,3.47,1.14,0.23,4.51,1y,,55.09,2026-02-18T00:00:00.000Z
DMBS,DoubleLine Mortgage ETF,0.02,1.25,3.94,1.03,1.11,6.52,3y,6.52,50.18,2026-02-19T00:00:00.000Z
DUSB,Dimensional Ultrashort Fixed Income ETF,0.039,0.08,-0.19,-0.09,-0.26,1.35,1y,,50.72,2026-02-19T00:00:00.000Z
EAGG,iShares ESG Aware U.S. Aggregate Bond ETF,-0.062,0.96,3.43,1.13,0.75,5.78,3y,5.78,48.29,2026-02-19T00:00:00.000Z
EBND,SPDR Bloomberg Emerging Markets Local Bond ETF,-0.207,1.57,7.71,1.66,2.43,7.64,3y,7.64,21.725,2026-02-19T00:00:00.000Z
EDGF,3Edge Dynamic Fixed Income ETF,-0.081,0.65,0.79,0.73,-0.52,3.15,1y,,24.79,2026-02-19T00:00:00.000Z
EDV,Vanguard Extended Duration Treasury ETF,-0.044,4.72,-0.47,5.3,0.15,20.91,3y,20.91,67.9,2026-02-19T00:00:00.000Z
ELD,WisdomTree Emerging Markets Local Debt Fund,-0.033,2.33,13.15,1.53,3.9,10.57,3y,10.57,29.86,2026-02-19T00:00:00.000Z
EMB,iShares J.P. Morgan USD Emerging Markets Bond ETF,-0.236,1.17,7.54,1.78,1.5,7.73,3y,7.73,97.43,2026-02-19T00:00:00.000Z
,Global X Emerging Markets Bond ETF,,,,,,,,,,
,Global X Emerging Markets Bond ETF,,,,,,,,,,
,Global X Emerging Markets Bond ETF,,,,,,,,,,
,Global X Emerging Markets Bond ETF,,,,,,,,,,
EMBD.TC,Global X Emerging Markets Bond ETF,-0.049,1.36,6.01,1.1,1.44,7.44,3y,7.44,24.255,2026-02-18T00:00:00.000Z
EMHC,SPDR Bloomberg Emerging Markets USD Bond ETF,0,1.39,6.13,1.34,1.14,7.41,3y,7.41,25.79,2026-02-18T00:00:00.000Z
EMHY,iShares J.P. Morgan EM High Yield Bond ETF,-0.305,1.18,5.71,1.28,1.6,7.3,3y,7.3,40.835,2026-02-19T00:00:00.000Z
EMLC,VanEck J.P. Morgan EM Local Currency Bond ETF,-0.151,2.01,10.83,1.62,3.29,7.6,3y,7.6,26.4,2026-02-19T00:00:00.000Z
EMNT,PIMCO Enhanced Short Maturity Active ESG Exchange-Traded Fund,0.005,0.22,0.16,0.08,0.2,1.64,3y,1.64,98.845,2026-02-18T00:00:00.000Z
EUSB,iShares ESG Advanced Total USD Bond Market ETF,-0.045,0.84,3.49,0.96,0.75,5.51,3y,5.51,44.22,2026-02-19T00:00:00.000Z
EVIM,Eaton Vance Intermediate Municipal Income ETF,-0.019,1.79,3.22,1.03,1.83,4.14,1y,,53.98,2026-02-18T00:00:00.000Z
EVLN,Eaton Vance Floating-Rate ETF,0.041,-0.93,-2.72,-1.29,-1.39,3.62,1y,,48.98,2026-02-19T00:00:00.000Z
EVSB,Eaton Vance Ultra-Short Income ETF,0.049,0.24,0.41,0.05,-0.01,1.55,1y,,51.02,2026-02-18T00:00:00.000Z
EVSM,Eaton Vance Short Duration Municipal Opportunities Fund,0.02,0.82,1.56,0.44,0.83,2.2,1y,,50.8,2026-02-19T00:00:00.000Z
FALN,iShares Fallen Angels USD Bond ETF,-0.054,1.04,2.28,0.6,1.86,6.15,3y,6.15,27.615,2026-02-19T00:00:00.000Z
FBND,Fidelity Total Bond ETF,-0.032,1.01,3.02,1.21,0.51,5.66,3y,5.66,46.505,2026-02-19T00:00:00.000Z
FCAL,First Trust California Municipal Fund,0,1.31,1.39,0.66,1.25,4.49,3y,4.49,49.975,2026-02-18T00:00:00.000Z
FCOR,Fidelity Corporate Bond ETF,-0.178,1.12,3.39,0.89,1.01,6.17,3y,6.17,48.314,2026-02-18T00:00:00.000Z
FDHY,Fidelity Enhanced High Yield ETF,-0.081,0.65,1.64,0.03,1.14,5.67,3y,5.67,49.58,2026-02-18T00:00:00.000Z
FEMB,First Trust Emerging Markets Local Currency Bond ETF,-0.519,2.68,13.27,1.96,3.6,9.69,3y,9.69,30.65,2026-02-19T00:00:00.000Z
FIGB,Fidelity Investment Grade Bond ETF,-0.023,1.01,3.47,1.27,0.6,6.32,3y,6.32,43.8,2026-02-19T00:00:00.000Z
FIIG,First Trust Intermediate Duration Investment Grade Corporate ETF,-0.188,0.4,3.21,0.81,0.24,6.03,3y,6.03,21.24,2026-02-19T00:00:00.000Z
FIXD,First Trust TCW Opportunistic Fixed Income Fund,-0.004,1.04,3.7,1.21,0.84,6.47,3y,6.47,44.745,2026-02-19T00:00:00.000Z
FLBL,Franklin Senior Loan ETF,0.043,-1.32,-4.9,-1.49,-2.53,4.17,3y,4.17,23.12,2026-02-19T00:00:00.000Z
FLCB,Franklin U.S. Core Bond ETF,0,0.99,3.22,1.11,0.83,5.67,3y,5.67,21.83,2026-02-19T00:00:00.000Z
FLCO,Franklin Investment Grade Corporate ETF,-0.16,0.99,2.73,0.71,0.83,6.34,3y,6.34,21.84,2026-02-18T00:00:00.000Z
FLDR,Fidelity Low Duration Bond ETF,0.02,0.3,0.59,0.26,0.13,1.75,3y,1.75,50.385,2026-02-19T00:00:00.000Z
FLGV,Franklin U.S. Treasury Bond ETF,-0.145,0.88,2.25,0.75,0.36,5.47,3y,5.47,20.695,2026-02-18T00:00:00.000Z
FLHY,Franklin High Yield Corporate Bond Fund,-0.183,0.49,1.81,0.02,1.34,5.82,3y,5.82,24.525,2026-02-19T00:00:00.000Z
FLIA,Franklin International Aggregate Bond Fund,0,1.44,0.47,0.99,-0.75,5.09,3y,5.09,20.46,2026-02-18T00:00:00.000Z
FLMI,Franklin Dynamic Municipal Bond ETF,0.059,1.75,3.03,1.38,1.71,4.71,3y,4.71,25.325,2026-02-19T00:00:00.000Z
FLOT,iShares Floating Rate Bond ETF,0,0.26,-0.06,0.08,0.06,2.49,3y,2.49,50.99,2026-02-19T00:00:00.000Z
FLRN,SPDR Bloomberg Investment Grade Floating Rate ETF,0,0.26,0.03,0.03,0.06,2.45,3y,2.45,30.82,2026-02-19T00:00:00.000Z
FLRT,Pacer Pacific Asset Floating Rate High Income ETF,-0.042,-0.28,-1.42,-0.67,-0.51,3.08,3y,3.08,47.05,2026-02-19T00:00:00.000Z
FLTB,Fidelity Limited Term Bond ETF,-0.02,0.34,2,0.32,0.51,2.83,3y,2.83,50.89,2026-02-18T00:00:00.000Z
FLTR,VanEck IG Floating Rate ETF,0.039,0.27,0.12,0.2,0.2,2.78,3y,2.78,25.56,2026-02-18T00:00:00.000Z
FLUD,Franklin Ultra Short Bond ETF,-0.04,0.2,0.58,0.08,0.1,2.06,3y,2.06,25.06,2026-02-19T00:00:00.000Z
FMB,First Trust Managed Municipal Fund,0.01,1.35,1.69,1.13,1.29,4.01,3y,4.01,51.88,2026-02-19T00:00:00.000Z
FMHI,First Trust Municipal High Income Fund,0.052,1.1,0.21,1.04,1.02,5.03,3y,5.03,48.52,2026-02-19T00:00:00.000Z
FSEC,Fidelity Investment Grade Securitized ETF,-0.09,1.22,4.08,0.93,0.54,7.38,3y,7.38,44.63,2026-02-18T00:00:00.000Z
FSMB,First Trust Short Duration Managed Municipal ETF,-0.049,0.9,1.58,0.52,0.8,2.19,3y,2.19,20.23,2026-02-19T00:00:00.000Z
FSYD,Fidelity Sustainable High Yield ETF,-0.153,1.08,2.25,0.31,2.33,5.98,3y,5.98,49.005,2026-02-19T00:00:00.000Z
FTCB,First Trust Core Investment Grade ETF,-0.117,0.97,3.06,1.02,0.16,4.97,1y,,21.395,2026-02-19T00:00:00.000Z
FTRB,Federated Hermes Total Return Bond ETF,-0.078,0.93,3.16,1.01,0.73,4.32,1y,,25.625,2026-02-18T00:00:00.000Z
FTSD,Franklin Short Duration U.S. Government ETF,0,0.23,0.85,0.16,0.36,2.26,3y,2.26,91.18,2026-02-18T00:00:00.000Z
FTSL,First Trust Senior Loan ETF,-0.088,-1.24,-2.05,-1.48,-1.37,3.33,3y,3.33,45.34,2026-02-19T00:00:00.000Z
FTSM,First Trust Enhanced Short Maturity Fund,0.008,0.14,0.23,0.02,0.06,1.36,3y,1.36,60.035,2026-02-19T00:00:00.000Z
FUMB,First Trust Ultra Short Duration Municipal ETF,-0.025,0.22,0.02,0.02,0.22,1.49,3y,1.49,20.135,2026-02-18T00:00:00.000Z
GBIL,Goldman Sachs Access Treasury 0-1 Year ETF,0.01,0.14,0.09,0.01,0.05,1.53,3y,1.53,100.11,2026-02-19T00:00:00.000Z
GCAL,Goldman Sachs Dynamic California Municipal Income ETF,-0.01,1.15,2.05,0.54,1.23,3.97,1y,,51.505,2026-02-18T00:00:00.000Z
GCOR,Goldman Sachs Access U.S. Aggregate Bond ETF,-0.155,1.04,3.02,0.88,0.85,5.79,3y,5.79,41.95,2026-02-18T00:00:00.000Z
GHYG,iShares U.S. & International High Yield Corporate Bond ETF,-0.087,-0.13,2.88,-0.35,0.74,6.13,3y,6.13,46.08,2026-02-18T00:00:00.000Z
GIGB,Goldman Sachs Access Investment Grade Corporate Bond ETF,-0.107,1.01,3.01,1.16,0.93,6.43,3y,6.43,46.715,2026-02-19T00:00:00.000Z
GMMF,iShares Government Money Market ETF,0,0.14,0.14,-0.02,0,1.06,1y,,100.395,2026-02-19T00:00:00.000Z
GMUB,Goldman Sachs Municipal Income ETF,0.019,1.21,3.43,0.74,1.47,3.6,1y,,51.83,2026-02-18T00:00:00.000Z
GNMA,iShares GNMA Bond ETF,-0.155,1.28,3.74,0.63,1.19,6.52,3y,6.52,44.95,2026-02-18T00:00:00.000Z
GOVT,iShares U.S. Treasury Bond ETF,-0.043,0.83,2.97,1.13,0.43,5.82,3y,5.82,23.21,2026-02-19T00:00:00.000Z
GOVZ,iShares 25+ Year Treasury STRIPS Bond ETF,-0.052,4.23,-2.43,5.14,-0.31,23.2,3y,23.2,9.62,2026-02-19T00:00:00.000Z
GRNB,VanEck Green Bond ETF,-0.041,0.41,2.53,0.49,0.42,4.43,3y,4.43,24.44,2026-02-19T00:00:00.000Z
GSST,Goldman Sachs Access Ultra Short Bond Fund,0.02,0.28,0.39,0.11,0.18,1.53,3y,1.53,50.64,2026-02-18T00:00:00.000Z
GSY,Invesco Ultra Short Duration ETF,0.02,0.18,0.28,0.4,0.08,1.53,3y,1.53,50.37,2026-02-19T00:00:00.000Z
GTIP,Goldman Sachs Access Inflation-Protected Securities Fund,-0.121,1.14,1.28,1.04,0.2,5.26,3y,5.26,49.72,2026-02-18T00:00:00.000Z
GTO,Invesco Total Return Bond ETF,-0.031,1.01,2.63,1.39,0.87,5.46,3y,5.46,47.885,2026-02-19T00:00:00.000Z
GVI,iShares Intermediate Government Bond ETF,-0.019,0.46,3.15,0.68,0.46,3.75,3y,3.75,107.8,2026-02-19T00:00:00.000Z
HTAB,Hartford Schroders Tax-Aware Bond ETF,-0.077,0.99,0.08,1.07,0.86,6.19,3y,6.19,19.41,2026-02-18T00:00:00.000Z
HTRB,Hartford Total Return Bond ETF,-0.072,1.09,2.94,0.98,0.42,5.92,3y,5.92,34.495,2026-02-19T00:00:00.000Z
HYBB,iShares BB Rated Corporate Bond ETF,0.161,0.51,1.67,0.15,0.88,5.59,3y,5.59,47.355,2026-02-18T00:00:00.000Z
HYD,VanEck High Yield Muni ETF,0.107,0.42,-0.8,0.74,1.23,5.98,3y,5.98,51.375,2026-02-19T00:00:00.000Z
HYDB,iShares High Yield Systematic Bond ETF,-0.179,0.24,0.03,-0.01,0.99,6,3y,6,47.515,2026-02-19T00:00:00.000Z
HYEM,VanEck Emerging Markets High Yield Bond Fund,-0.049,1.41,1.92,0.75,1.35,6.28,3y,6.28,20.2,2026-02-19T00:00:00.000Z
HYFI,AB High Yield ETF,0.026,0.18,1.04,-0.21,0.72,5.72,3y,5.72,37.75,2026-02-18T00:00:00.000Z
HYG,iShares iBoxx $ High Yield Corporate Bond ETF,-0.093,0.2,1.44,-0.06,0.93,5.82,3y,5.82,80.835,2026-02-19T00:00:00.000Z
HYGH,iShares Interest Rate Hedged High Yield Bond ETF,0.22,0.27,-1.09,-0.6,0.65,6.71,3y,6.71,86.36,2026-02-18T00:00:00.000Z
HYHG,ProShares High Yield-Interest Rate Hedged ETF,0.232,0.43,-2.38,-0.34,1.22,7.82,3y,7.82,64.72,2026-02-19T00:00:00.000Z
HYLB,Xtrackers USD High Yield Corporate Bond ETF,-0.095,0.23,1.16,-0.09,0.89,5.77,3y,5.77,36.935,2026-02-19T00:00:00.000Z
HYLS,FT Tactical High Yield ETF,0.145,-0.84,-0.53,-1.07,-0.5,5.25,3y,5.25,41.51,2026-02-18T00:00:00.000Z
HYMB,SPDR Nuveen ICE High Yield Municipal Bond ETF,0.099,1.3,-1.69,1.02,0.78,6.11,3y,6.11,25.285,2026-02-19T00:00:00.000Z
HYMU,iShares High Yield Bond ETF,0.089,0.97,-1.79,0.31,0.65,6.99,3y,6.99,22.46,2026-02-17T00:00:00.000Z
HYS,PIMCO 0-5 Year High Yield Corporate Bond Index Exchange-Traded Fund,-0.063,-0.28,-0.11,-0.54,0.31,5.41,3y,5.41,94.65,2026-02-19T00:00:00.000Z
HYTR,Counterpoint High Yield ETF,0.138,0.3,-0.98,-0.18,0.72,5.79,3y,5.79,21.805,2026-02-18T00:00:00.000Z
HYZD,WisdomTree Interest Rate Hedged High Yield Bond Fund,-0.044,-0.09,-0.04,-0.44,0.49,6.11,3y,6.11,22.55,2026-02-18T00:00:00.000Z
IAGG,iShares International Aggregate Bond Fund,0.02,1.04,0.94,0.9,-2.07,5.36,3y,5.36,50.57,2026-02-19T00:00:00.000Z
IBD,Inspire Corporate Bond ETF,-0.206,0.21,2.49,0.5,0.75,5.75,3y,5.75,24.26,2026-02-18T00:00:00.000Z
IBDR,iShares iBonds Dec 2026 Term Corporate ETF,0,0.08,0.5,0,-0.04,2.56,3y,2.56,24.25,2026-02-19T00:00:00.000Z
IBDS,iShares iBonds Dec 2027 Term Corporate ETF,0.041,0.16,1.29,0.12,0.21,3.32,3y,3.32,24.33,2026-02-19T00:00:00.000Z
IBDT,iShares iBonds Dec 2028 Term Corporate ETF,-0.02,0.18,2.02,0.26,0.33,4.06,3y,4.06,25.515,2026-02-19T00:00:00.000Z
IBDU,iShares iBonds Dec 2029 Term Corporate ETF,-0.043,0.41,2.73,0.45,0.62,4.96,3y,4.96,23.505,2026-02-19T00:00:00.000Z
IBDV,iShares iBonds Dec 2030 Term Corporate ETF,-0.023,0.5,3.52,0.7,0.7,5.46,3y,5.46,22.185,2026-02-19T00:00:00.000Z
IBDW,iShares iBonds Dec 2031 Term Corporate ETF,-0.023,0.59,4.01,0.85,0.85,6.13,3y,6.13,21.27,2026-02-19T00:00:00.000Z
IBDX,iShares iBonds Dec 2032 Term Corporate ETF,-0.078,0.74,4.17,1.02,0.98,6.56,3y,6.56,25.71,2026-02-19T00:00:00.000Z
IBDY,iShares iBonds Dec 2033 Term Corporate ETF,-0.114,0.77,4.32,1.11,1.04,6.62,3y,6.62,26.32,2026-02-19T00:00:00.000Z
IBDZ,iShares iBonds Dec 2034 Term Corporate ETF,-0.038,0.83,4.4,1.26,1.14,6.02,1y,,26.58,2026-02-19T00:00:00.000Z
IBHF,iShares iBonds 2026 Term High Yield and Income ETF,0.065,0.02,-1.09,-0.11,-0.45,4.4,3y,4.4,23.075,2026-02-18T00:00:00.000Z
IBHG,iShares iBonds 2027 High Yield Income,-0.058,-0.31,-0.89,-0.47,-0.12,5.12,3y,5.12,22.23,2026-02-19T00:00:00.000Z
IBHH,iShares iBonds 2028 Term High Yield ETF,0.042,0.21,0.47,-0.29,0.3,5.84,3y,5.84,23.7,2026-02-18T00:00:00.000Z
IBHI,iShares iBonds 2029 Term High Yield and Income ETF,0.127,0.08,-0.17,-0.46,0.47,6.49,3y,6.49,23.63,2026-02-18T00:00:00.000Z
IBHJ,iShares iBonds 2030 High Yield & Income ETF,0.263,0.3,0.93,0,0.98,6.35,3y,6.35,26.7,2026-02-18T00:00:00.000Z
IBIC,iShares iBonds Oct 2026 Term TIPS ETF,0.098,0.33,-0.25,0.23,-0.43,2.72,3y,2.72,25.645,2026-02-18T00:00:00.000Z
IBMO,iShares iBonds Dec 2026 Term ETF,0.039,0.29,0.73,0,0.31,1.92,3y,1.92,25.69,2026-02-18T00:00:00.000Z
IBMP,iShares iBonds Dec 2027 Term Corporate ETF,-0.02,0.39,1.17,0.1,0.45,2.35,3y,2.35,25.505,2026-02-19T00:00:00.000Z
IBMQ,iShares iBonds Dec 2028 Term Muni Bond ETF,-0.078,0.63,1.98,0.27,0.94,2.74,3y,2.74,25.74,2026-02-18T00:00:00.000Z
IBMR,iShares iBonds Dec 2029 Term Maturity Corporate ETF,0.039,0.92,2.39,0.39,1.3,3.23,3y,3.23,25.7,2026-02-18T00:00:00.000Z
IBMS,iShares iBonds Dec 2030 Term Muni Bond ETF,-0.095,1.23,3.33,0.51,1.48,2.82,1y,,26.365,2026-02-18T00:00:00.000Z
IBND,SPDR Bloomberg International Corporate Bond ETF,-0.308,1.22,12.81,0.71,2.02,8.46,3y,8.46,32.4,2026-02-19T00:00:00.000Z
IBTG,iShares iBonds Dec 2026 Term Treasury ETF,0.066,0.09,0.42,386.05,-0.02,129.67,3y,129.67,22.905,2026-02-18T00:00:00.000Z
IBTH,iShares iBonds Dec 2027 Term,0,0.09,1.37,0.09,0.16,3.65,3y,3.65,22.495,2026-02-19T00:00:00.000Z
IBTI,iShares iBonds Dec 2028 Term ETF,0,0.18,2.28,0.34,0.27,4.4,3y,4.4,22.415,2026-02-19T00:00:00.000Z
IBTJ,iShares iBonds Dec 2029 Term Fund,-0.091,0.32,2.83,0.5,0.36,5.09,3y,5.09,22.015,2026-02-18T00:00:00.000Z
IBTK,iShares iBonds Dec 2030 Treasury ETF,-0.1,0.5,3.37,0.71,0.48,5.95,3y,5.95,19.935,2026-02-18T00:00:00.000Z
IBTL,iShares iBonds Dec 2031 Term Fund,-91.593,-91.34,-92.14,-91.36,-91.93,317.98,3y,317.98,20.64,2026-02-19T00:00:00.000Z
IBTM,iShares iBonds Dec 2032 Term Treasury ETF,-0.022,0.72,4.26,1.2,0.41,7.08,3y,7.08,23.23,2026-02-19T00:00:00.000Z
IBTP,iShares iBonds Dec 2034 ETF,-0.019,0.91,4.29,1.46,0.41,5.66,1y,,26.03,2026-02-19T00:00:00.000Z
ICLO,Invesco AAA CLO Floating Rate Note ETF,0,0.27,-0.39,0.51,-0.08,3.14,3y,3.14,25.63,2026-02-19T00:00:00.000Z
ICSH,iShares Short Treasury Bond ETF,0.01,0.21,0.25,0.05,0.07,1.43,3y,1.43,50.685,2026-02-19T00:00:00.000Z
ICVT,iShares Convertible Bond ETF,-0.476,4.57,17.17,1.74,7.12,10.32,3y,10.32,104.6,2026-02-19T00:00:00.000Z
IEF,iShares 7-10 Year Treasury Bond ETF,-0.01,0.95,4.49,1.51,0.46,7.23,3y,7.23,96.99,2026-02-19T00:00:00.000Z
IEI,iShares 3-7 Year Treasury Bond ETF,0,0.5,3.62,0.84,0.38,4.65,3y,4.65,119.92,2026-02-19T00:00:00.000Z
IGBH,iShares Interest Rate Hedged Long-Term Corporate Bond ETF,-0.122,-0.18,-0.28,-0.77,0.84,5.45,3y,5.45,24.61,2026-02-19T00:00:00.000Z
IGEB,iShares Investment Grade Corporate Bond ETF,-0.13,0.83,3.21,1.05,0.85,6.06,3y,6.06,46.01,2026-02-19T00:00:00.000Z
IGHG,ProShares Investment Grade Interest Rate Hedged ETF,0.038,-0.36,0.22,-0.53,0.33,4.7,3y,4.7,78.33,2026-02-18T00:00:00.000Z
IGIB,iShares 5-10 Year Investment Grade Corporate Bond ETF,-0.074,0.8,4.77,1.08,0.97,5.97,3y,5.97,54.29,2026-02-19T00:00:00.000Z
IGLB,iShares 10+ Year Investment Grade Corporate Bond ETF,-0.136,1.89,3.07,1.99,1.2,11.2,3y,11.2,51.34,2026-02-19T00:00:00.000Z
IGOV,iShares International Treasury Bond ETF,-0.141,2.43,9.37,2.33,1.36,9.18,3y,9.18,42.61,2026-02-19T00:00:00.000Z
IGSB,iShares 1-5 Year Investment Grade Corporate Bond ETF,-0.019,0.4,2.27,0.42,0.49,2.85,3y,2.85,53.1,2026-02-19T00:00:00.000Z
ILTB,iShares Core 10+ Year USD Bond ETF,-0.295,2.08,2.26,1.34,1,11.77,3y,11.77,50.65,2026-02-18T00:00:00.000Z
IMSI,Invesco Rochester High Yield Fund,0.332,1.4,0.46,0.87,1,3.84,3y,3.84,51.4,2026-02-17T00:00:00.000Z
IMTB,iShares Core 5-10 Year USD Bond ETF,0.011,1.01,4.4,0.81,1.04,6.18,3y,6.18,44.605,2026-02-18T00:00:00.000Z
INMU,iShares Intermediate Muni Income Active ETF,0,1.62,2.88,0.85,1.62,3.94,3y,3.94,24.46,2026-02-18T00:00:00.000Z
ISCXF,iShares USD Corp Bond USD A Fund,,,,,,,,,,2026-02-19T15:23:08.131Z
ISHG,iShares 3 Year International Treasury Bond ETF,-0.105,1.45,11.03,1.21,1.32,7.43,3y,7.43,76.18,2026-02-19T00:00:00.000Z
ISHUF,iShares U.S. Treasury 0-1 Year USD A,,,,,,,,,,2026-02-19T15:23:08.555Z
ISHVF,iShares U.S. Aggregate Bond USD Accumulating Fund,,,,,,,,,,2026-02-19T15:23:08.627Z
ISTB,iShares Core 1-5 Year USD Bond ETF,-0.031,0.28,2.08,0.4,0.34,2.81,3y,2.81,48.895,2026-02-19T00:00:00.000Z
