symbol,name,daily_change_pct,ytd_return_pct,one_year_return_pct,perf_1m_pct,perf_3m_pct,vol_pct,vol_window,vol_3y_pct,last_close,as_of
FNGS,MicroSectors FANG+ ETN,1.001,-2.12,12.37,-4.08,-7.49,26.71,3y,26.71,65.6,2026-01-22T00:00:00.000Z
FNGU,MicroSectors FANG+ Index 3X Leveraged ETN,2.733,-8.08,-96.67,-13.63,-26.24,193.05,3y,193.05,22.18,2026-01-22T00:00:00.000Z
FNOV,FT Vest US Equity Buffer ETF,0.309,0.46,13.05,0.85,3.63,9.98,3y,9.98,55.17,2026-01-22T00:00:00.000Z
FNX,First Trust Mid Cap Core AlphaDEX Fund,0.325,6.25,11.38,6.34,7.87,19.32,3y,19.32,135.81,2026-01-22T00:00:00.000Z
FNY,First Trust Mid Cap Growth Fund,0.569,6.5,16.21,6.39,6.64,20.18,3y,20.18,98.93,2026-01-22T00:00:00.000Z
FPAG,FPA Global Equity ETF,1.022,4.23,24.03,5.3,7.45,16.28,3y,16.28,39.035,2026-01-22T00:00:00.000Z
FPE,First Trust Preferred Securities and Income ETF,0.055,0.16,2.64,0.49,-0.65,7.03,3y,7.03,18.3,2026-01-22T00:00:00.000Z
FPEI,First Trust Institutional Preferred Securities and Income ETF,-0.026,-0.15,3.38,0.21,0,6.59,3y,6.59,19.41,2026-01-22T00:00:00.000Z
FPX,First Trust US Equity Opportunities ETF,0.646,1.05,28.75,-0.84,2.65,25.5,3y,25.5,166.83,2026-01-22T00:00:00.000Z
FQAL,Fidelity Quality Factor ETF,0.224,0.71,13.11,0.9,2.17,14.08,3y,14.08,76.17,2026-01-22T00:00:00.000Z
FRDM,Freedom 100 Emerging Markets ETF,1.584,8.52,66.06,14.96,22.99,18.48,3y,18.48,57.09,2026-01-22T00:00:00.000Z
FREL,Fidelity MSCI Real Estate Index ETF,-1.009,2.19,-0.76,2.96,-1.51,17.74,3y,17.74,27.48,2026-01-22T00:00:00.000Z
FSIG,First Trust Limited Duration Investment Grade Corporate ETF,0.052,-0.23,1.38,-0.1,-0.57,3.14,3y,3.14,19.14,2026-01-22T00:00:00.000Z
FSMD,Fidelity Small-Mid Multifactor ETF,0.086,4.72,7.77,3.97,6.27,17.37,3y,17.37,46.58,2026-01-22T00:00:00.000Z
FSMO,Fidelity Covington Trust - Fidelity Small-Mid Cap Opportunities ETF,2.007,6.03,17.96,6.75,14.21,19,3y,19,33.04,2026-01-21T00:00:00.000Z
FSTA,Fidelity MSCI Consumer Staples Index ETF,-0.153,6.31,6.07,5.3,3.45,11.58,3y,11.58,52.24,2026-01-22T00:00:00.000Z
FTA,First Trust Large Cap Value AlphaDEX Fund,0.078,3.04,11.9,4.07,7.3,15.11,3y,15.11,89.55,2026-01-22T00:00:00.000Z
FTC,First Trust Large Cap Growth Fund,0.352,2.12,13.17,2.49,2.66,17.93,3y,17.93,165.37,2026-01-22T00:00:00.000Z
FTCS,First Trust Capital Strength ETF,0.01,3.89,6.98,3.66,2.46,11.35,3y,11.35,96.11,2026-01-22T00:00:00.000Z
FTEC,Fidelity MSCI Information Technology Index ETF,0.744,-0.25,19.53,-0.24,-0.82,23.09,3y,23.09,224.92,2026-01-22T00:00:00.000Z
FTGC,First Trust Global Tactical Commodity Strategy Fund,-0.041,5.98,-1.32,7.37,-4.98,15.62,3y,15.62,24.62,2026-01-22T00:00:00.000Z
FTGS,First Trust Growth Strength ETF,0.69,3.25,10.75,2.62,0.67,16.65,3y,16.65,36.46,2026-01-22T00:00:00.000Z
FTHI,First Trust Exchange-Traded Fund IV - First Trust BuyWrite Income ETF,0.551,-0.08,0.13,0.55,0.47,11.68,3y,11.68,23.73,2026-01-22T00:00:00.000Z
FTLB,First Trust Hedged BuyWrite Income ETF,0.145,-0.38,-0.96,0.58,-0.48,13.4,3y,13.4,20.74,2026-01-21T00:00:00.000Z
FTLS,First Trust Long/Short Equity ETF,0.692,0.35,5.4,0.28,1.96,9.99,3y,9.99,71.26,2026-01-22T00:00:00.000Z
FTQI,First Trust Nasdaq BuyWrite Fund,0.627,0.24,-1.83,0.14,0.43,13.38,3y,13.38,20.87,2026-01-22T00:00:00.000Z
FTXL,First Trust Nasdaq Semiconductor ETF,0.188,13.46,62.82,19.3,28.03,34.28,3y,34.28,154.3,2026-01-22T00:00:00.000Z
FTXO,First Trust Nasdaq Bank ETF,-0.183,1.15,13.38,1.52,13.23,26.83,3y,26.83,38.729,2026-01-22T00:00:00.000Z
FUTY,Fidelity MSCI Utilities Index ETF,-0.662,-0.64,7.7,1.3,-5.18,16.25,3y,16.25,55.5,2026-01-22T00:00:00.000Z
FV,First Trust Dorsey Wright Focus 5 ETF,0.267,5.57,9.28,7.43,8.17,19.26,3y,19.26,67.57,2026-01-22T00:00:00.000Z
FVAL,Fidelity Value Factor ETF,0.783,1.13,15.5,1.68,5.19,14.61,3y,14.61,73.38,2026-01-22T00:00:00.000Z
FVD,First Trust Value Line Dividend Index Fund,-0.084,2.75,6.39,3.11,2.97,11.46,3y,11.46,47.46,2026-01-22T00:00:00.000Z
FWD,AB Disruptors ETF,0.396,6.71,32.94,8.73,9.04,24.17,3y,24.17,113.97,2026-01-22T00:00:00.000Z
FXC,Invesco CurrencyShares Canadian Dollar Trust,0.311,-0.37,3.93,0.1,1.66,5.5,3y,5.5,70.88,2026-01-22T00:00:00.000Z
FXE,Invesco CurrencyShares Euro Trust,0.51,0.32,12.7,0.36,1.31,7.21,3y,7.21,108.44,2026-01-22T00:00:00.000Z
FXF,Invesco CurrencyShares Swiss Franc Trust,0.657,0.3,14.2,0.67,0.66,8.19,3y,8.19,111.92,2026-01-22T00:00:00.000Z
FXG,First Trust Consumer Staples AlphaDEX Fund,-0.046,5.89,0.76,5.34,1.91,12.39,3y,12.39,64.55,2026-01-22T00:00:00.000Z
FXH,First Trust Health Care AlphaDEX Fund,0.238,3.08,7.73,2.86,4.14,15.16,3y,15.16,118.13,2026-01-22T00:00:00.000Z
FXI,iShares China Large-Cap ETF,0.356,-0.85,28.39,2.28,-1.15,28.92,3y,28.92,39.48,2026-01-22T00:00:00.000Z
FXL,First Trust Technology AlphaDEX Fund,0.735,3.65,12.24,2.7,2.6,23.06,3y,23.06,175.39,2026-01-22T00:00:00.000Z
FXN,First Trust Energy AlphaDEX Fund,0.114,4.45,-1.62,8.64,12.89,26.31,3y,26.31,17.6,2026-01-22T00:00:00.000Z
FXO,First Trust Financials AlphaDEX Fund,0.196,1,8.25,0.34,7,21.45,3y,21.45,61.31,2026-01-22T00:00:00.000Z
FXR,First Trust Industrials/Producer Durables AlphaDEX Fund,0.47,7.73,9.96,9.04,9.74,19.27,3y,19.27,87.69,2026-01-22T00:00:00.000Z
FXU,First Trust Utilities AlphaDEX Fund,-0.517,1.45,16.06,3.57,-1.49,15.88,3y,15.88,46.17,2026-01-22T00:00:00.000Z
FXY,Invesco CurrencyShares Japanese Yen Trust,-0.103,-0.99,-2.31,-0.5,-4.23,10.19,3y,10.19,58.01,2026-01-22T00:00:00.000Z
FYC,First Trust Small Cap Growth Fund,1.348,6.99,28.79,6.1,9.2,21.48,3y,21.48,103.77,2026-01-22T00:00:00.000Z
FYEE,Fidelity Yield Enhanced Equity Fund,0.592,0.56,5.49,1.26,2.12,16.94,1y,,28.88,2026-01-22T00:00:00.000Z
FYLD,Cambria Foreign Shareholder Yield ETF,0.584,4.62,34.05,7.19,12.8,15.39,3y,15.39,34.45,2026-01-22T00:00:00.000Z
FYX,First Trust Small Cap Core AlphaDEX Fund,0.392,7.71,17.49,6.93,10.84,21.3,3y,21.3,122.91,2026-01-22T00:00:00.000Z
GARP,iShares MSCI USA Quality GARP ETF,0.594,1.25,18.91,1.71,3.57,20.05,3y,20.05,69.43,2026-01-22T00:00:00.000Z
GBTC,Grayscale Bitcoin Trust ETF,-0.839,-0.56,-17.08,1.32,-20.41,54.75,3y,54.75,69.75,2026-01-22T00:00:00.000Z
GBUG,Sprott Active Gold & Silver Fund,4.462,22.76,78.78,20.02,46.36,55.1,1y,,52.91,2026-01-22T00:00:00.000Z
GCOW,Pacer Global Cash Cows Dividend ETF,0.164,2.35,23.61,2.03,6.62,12.74,3y,12.74,42.67,2026-01-22T00:00:00.000Z
GDE,WisdomTree Efficient Gold Plus,2.455,12.86,77.58,12,14.69,22.38,3y,22.38,69.7,2026-01-22T00:00:00.000Z
GDEC,FT VEST US Equity Moderate B Fund,0.079,0.37,10.85,0.58,2.82,10.43,1y,,37.96,2026-01-22T00:00:00.000Z
GDMN,WisdomTree Efficient Gold Plus Miners Fund,3.873,31.68,275.63,28.39,54.67,43.99,3y,43.99,122.84,2026-01-22T00:00:00.000Z
GDX,VanEck Gold Miners ETF,3.831,22.68,179.63,19.8,44.48,33.59,3y,33.59,105.17,2026-01-22T00:00:00.000Z
GDXD,MicroSectors Gold Miners -3X Inverse Leveraged ETNs,-12.424,-49.59,-98.26,-48.69,-75.09,101.96,3y,101.96,4.3,2026-01-22T00:00:00.000Z
GDXJ,VanEck Junior Gold Miners ETF,5.455,25.52,202,20.79,49.4,37.38,3y,37.38,142.09,2026-01-22T00:00:00.000Z
GDXU,MicroSectors Gold Miners 3X Leveraged Exchange-Traded Notes,12.632,81.05,,68.2,171.24,103.25,3y,103.25,438.25,2026-01-22T00:00:00.000Z
GDXY,YieldMax Gold Miners Option Income Strategy ETF,1.536,12.76,17.05,8.12,13.12,33.04,1y,,17.85,2026-01-22T00:00:00.000Z
GEM,Goldman Sachs ActiveBeta Emerging Markets Equity ETF,1.019,4.69,37.76,6.64,7.44,15.52,3y,15.52,44.62,2026-01-22T00:00:00.000Z
GGLL,Direxion Daily GOOGL Bull 2x Shares,1.295,9.24,116.13,14.08,61.52,54.52,3y,54.52,107.2,2026-01-22T00:00:00.000Z
GGLS,Direxion Daily GOOGL Bear 1X Shares,-0.619,-4.61,-44.94,-7.89,-25.61,30.39,3y,30.39,6.42,2026-01-22T00:00:00.000Z
GIAX,Nicholas Global Equity and Income ETF,0.606,0.76,-13.8,-0.42,-4.81,21.63,1y,,16.61,2026-01-22T00:00:00.000Z
GII,SPDR S&P Global Infrastructure ETF,0.534,1.58,14.86,3.4,2.25,13.22,3y,13.22,71.5,2026-01-22T00:00:00.000Z
GLD,SPDR Gold Shares,1.846,13.44,78.48,13.22,19.76,16.55,3y,16.55,451.79,2026-01-22T00:00:00.000Z
GLDM,SPDR Gold MiniShares Trust,1.863,13.51,79.09,13.29,19.68,16.47,3y,16.47,97.32,2026-01-22T00:00:00.000Z
GLL,ProShares UltraShort Gold,-3.702,-22.9,-68.96,-22.45,-30.55,33.17,3y,33.17,20.03,2026-01-22T00:00:00.000Z
GLOV,Goldman Sachs ActiveBeta World Low Volatility Portfolio,0.658,0.81,14.59,0.63,2.5,10.72,3y,10.72,58.16,2026-01-22T00:00:00.000Z
GLTR,abrdn Physical Precious Metals Basket Shares ETF,2.839,20.87,117.81,23.81,43.96,19.87,3y,19.87,251.35,2026-01-22T00:00:00.000Z
GMOI,GMO International Value ETF,0.361,2.38,41.55,3.22,11.74,15.98,1y,,34.785,2026-01-22T00:00:00.000Z
GNR,SPDR S&P Global Natural Resources ETF,0.089,7.23,27.89,10.84,16.81,17.73,3y,17.73,67.82,2026-01-22T00:00:00.000Z
GOAU,U.S. Global GO GOLD and Precious Metal Miners ETF,3.93,23.39,156.34,20.67,39.55,33.83,3y,33.83,52.36,2026-01-22T00:00:00.000Z
GOEX,Global X Gold Explorers ETF,5.309,26.54,213.58,20.82,51.48,36.59,3y,36.59,101.16,2026-01-22T00:00:00.000Z
GOOX,T-Rex 2x LNG Alphabet Daily,1.568,9.26,123.2,12.89,64.87,64.08,1y,,77.07,2026-01-22T00:00:00.000Z
GOOY,YieldMax GOOGL Option Income Strategy ETF,0.403,2.4,-2.92,3.39,9.04,25.16,3y,25.16,14.96,2026-01-22T00:00:00.000Z
GOVI,Invesco Equal Weight 0-30 Yr GovI Mutual Fund,0.255,-0.07,1.66,-0.61,-2.76,9.57,3y,9.57,27.5,2026-01-22T00:00:00.000Z
GPIQ,Nasdaq 100 Core Premium Income ETF,0.702,1.47,6.54,0.26,0.34,21.1,1y,,53.08,2026-01-22T00:00:00.000Z
GPIX,S&P 500 Core Premium Income Fund,0.474,0.84,5.25,0.59,1.17,17.45,1y,,52.97,2026-01-22T00:00:00.000Z
GPTY,YieldMax AI & Tech Portfolio Option Income ETF,0.718,-1.48,-15.99,-2.64,-11.56,29.6,1y,,42.08,2026-01-22T00:00:00.000Z
GREK,Global X MSCI Greece ETF,2.064,7.06,74.19,7.36,14.1,22.03,3y,22.03,72.2,2026-01-22T00:00:00.000Z
GRID,First Trust NASDAQ Clean Edge Smart Grid Infrastructure Index Fund,0.29,2.23,26.66,4.29,3.07,18.51,3y,18.51,159.3,2026-01-22T00:00:00.000Z
GRNY,Fundstrat Granny Shots US Large Cap ETF,0.274,2.44,22.02,2.28,0.83,25.39,1y,,25.6,2026-01-22T00:00:00.000Z
GRPM,Invesco S&P MidCap 400 GARP ETF,0.032,3.29,5.16,2.13,5.35,20.39,3y,20.39,124.6,2026-01-22T00:00:00.000Z
GSEW,Goldman Sachs Equal Weight U.S. Large Cap Equity ETF,0.261,2.98,9.38,3.06,3.26,14.59,3y,14.59,88.37,2026-01-22T00:00:00.000Z
GSG,iShares S&P GSCI Commodity-Indexed Trust,-0.533,5.2,5.98,6.35,7.39,17.12,3y,17.12,24.27,2026-01-22T00:00:00.000Z
GSIE,Goldman Sachs ActiveBeta International Equity ETF,0.616,1.92,28.27,2.77,7.27,14.03,3y,14.03,44.1,2026-01-22T00:00:00.000Z
GSLC,Goldman Sachs ActiveBeta U.S. Large Cap Equity ETF,0.529,0.48,12.09,0.43,1.97,14.72,3y,14.72,133.13,2026-01-22T00:00:00.000Z
GSSC,Goldman Sachs ActiveBeta U.S. Small Cap Equity ETF,0.657,7.14,12.96,5.31,7.6,20.53,3y,20.53,81.24,2026-01-22T00:00:00.000Z
GSUS,Goldman Sachs MarketBeta U.S.,0.582,0.59,14.34,0.77,2.14,15,3y,15,95.12,2026-01-22T00:00:00.000Z
GUNR,FlexShares Morningstar Global Upstream Natural Resources Index Fund,0,7.58,30.36,10.59,16.32,16.3,3y,16.3,50.11,2026-01-22T00:00:00.000Z
GUSH,Direxion Daily S&P Oil & Gas Exploration & Production Bull 2X Shares,-0.041,8.06,-24.46,14.79,14.58,57.22,3y,57.22,24.68,2026-01-22T00:00:00.000Z
GVAL,Cambria Global Value ETF,1.388,7.96,58.57,10.28,17.98,17.37,3y,17.37,34.32,2026-01-22T00:00:00.000Z
GVIP,Goldman Sachs Hedge Industry VIP ETF,1.054,3.09,23.3,4.64,5.66,18.55,3y,18.55,161.04,2026-01-22T00:00:00.000Z
GWX,SPDR S&P International Small Cap ETF,1.263,4.97,36.99,5.3,8.12,14.67,3y,14.67,43.29,2026-01-22T00:00:00.000Z
GXC,SPDR S&P China ETF,0.519,2.58,36.43,3.38,1.37,26.71,3y,26.71,102.66,2026-01-22T00:00:00.000Z
GXG,Global X MSCI Colombia ETF,2.207,19.34,78.37,15.32,24.67,22.03,3y,22.03,42.15,2026-01-21T00:00:00.000Z
HACK,Amplify Cybersecurity ETF,1.238,-1.01,0.35,-3.91,-10.17,21.07,3y,21.07,78.49,2026-01-22T00:00:00.000Z
HAUZ,Xtrackers International Real Estate ETF,0.546,2.88,19.89,3.95,1.27,15.17,3y,15.17,23.93,2026-01-22T00:00:00.000Z
HAWX,iShares Currency Hedged MSCI ACWI ex U.S. ETF,0.194,3.17,25.55,3.65,6.58,11.98,3y,11.98,41.32,2026-01-22T00:00:00.000Z
HCMT,Direxion HCM Tactical Enhanced US ETF,1.243,1.47,3.58,1.06,1.87,29.31,3y,29.31,39.11,2026-01-22T00:00:00.000Z
HDEF,Xtrackers MSCI EAFE High Dividend Yield Equity ETF,0.451,-0.03,24.47,1.07,5.3,13.38,3y,13.38,31.18,2026-01-22T00:00:00.000Z
HDGE,AdvisorShares Ranger Equity Bear ETF,-0.558,-0.62,3.75,-2.37,-1.11,22.83,3y,22.83,16.05,2026-01-22T00:00:00.000Z
HDV,iShares Core High Dividend ETF,0.188,4.72,11.09,5.91,4.62,11.9,3y,11.9,128.04,2026-01-22T00:00:00.000Z
HEDJ,WisdomTree Europe Hedged Equity Fund,0.607,2.09,18.22,4.07,5.78,15.34,3y,15.34,54.7,2026-01-22T00:00:00.000Z
HEFA,iShares Currency Hedged MSCI EAFE ETF,0.047,2.34,19.46,1.83,5.33,13.05,3y,13.05,42.85,2026-01-22T00:00:00.000Z
HEGD,Swan Hedged Equity US Large Cap Fund,0.277,0.2,11.22,0.24,1.16,8.55,3y,8.55,25.38,2026-01-22T00:00:00.000Z
HELO,JPMorgan Hedged Equity Laddered Overlay ETF,0.529,0.17,5.63,0.39,1.74,8.9,1y,,66.55,2026-01-22T00:00:00.000Z
HEQT,Simplify Hedged Equity ETF,0.31,0.87,7.48,0.94,2.6,8.12,3y,8.12,32.32,2026-01-22T00:00:00.000Z
HEWJ,iShares Currency Hedged MSCI Japan ETF,0.107,5.63,32.44,2.39,7.43,19.93,3y,19.93,56.09,2026-01-22T00:00:00.000Z
HFXI,New York Life Investments FTSE International Equity Currency Neutral ETF,0.532,3.37,26.24,5.79,7.02,13.2,3y,13.2,34.01,2026-01-22T00:00:00.000Z
HGER,Harbor Commodity All-Weather Fund,0.038,7.37,14.71,7.76,2.32,14.13,3y,14.13,26.51,2026-01-22T00:00:00.000Z
HIBL,Direxion Daily S&P 500 High Beta Bull 3X Shares,0.827,9.26,53.57,9.58,19.61,74.27,3y,74.27,75.62,2026-01-22T00:00:00.000Z
HIBS,Direxion Daily S&P 500 High Beta Bear 3X Shares,-0.93,-10.69,-73.32,-12.62,-26.8,76.69,3y,76.69,4.26,2026-01-22T00:00:00.000Z
HIGH,Simplify Enhanced Income ETF,0.045,-0.39,-4.96,-0.74,-3.68,10.26,3y,10.26,22.24,2026-01-22T00:00:00.000Z
HLAL,Wahed FTSE USA Shariah ETF,0.803,1.28,16.98,0.96,3.81,15.74,3y,15.74,62.891,2026-01-22T00:00:00.000Z
HMOP,Hartford Municipal Opportunities ETF,0.102,0.64,2.02,0.54,0.18,4.1,3y,4.1,39.38,2026-01-22T00:00:00.000Z
HNDL,NASDAQ 7 Handl Index ETF,0.181,0.27,1.56,0.87,-1.16,10.47,3y,10.47,22.13,2026-01-22T00:00:00.000Z
HODL,VanEck Bitcoin ETF,-0.824,-0.43,-15.94,1.53,-20.16,41.47,1y,,25.26,2026-01-22T00:00:00.000Z
HSUN,Hartford Strategic Income ETF,0.211,0.23,3.31,-0.53,-0.49,5.04,3y,5.04,35.57,2026-01-21T00:00:00.000Z
HYBI,Neos Enhanced Income Cash Alternative ETF,0.129,-0.05,-2.56,-0.29,-0.76,6.31,1y,,50.34,2026-01-22T00:00:00.000Z
HYBL,SPDR Blackstone High Income Fund,-0.053,0.28,-0.07,0.78,0.46,4.61,3y,4.61,28.54,2026-01-22T00:00:00.000Z
HYGV,FlexShares High Yield Value-Scored Bond Index Fund,0.061,0.72,-0.28,1.18,0.43,6.36,3y,6.36,41.075,2026-01-22T00:00:00.000Z
HYGW,iShares High Yield Corporate Bond BuyWrite ETF,0.1,0.37,-6.08,0,-0.79,5.48,3y,5.48,29.98,2026-01-22T00:00:00.000Z
IAI,iShares U.S. Broker-Dealers & Securities Exchanges ETF,0.653,3.49,22.4,4.46,9.02,20.1,3y,20.1,188.16,2026-01-22T00:00:00.000Z
IAK,iShares U.S. Insurance ETF,0.476,-3.02,2.43,-4.07,2.22,17.38,3y,17.38,130.95,2026-01-22T00:00:00.000Z
IAT,iShares U.S. Regional Banks ETF,-0.8,4.44,9.28,4.07,17.31,30.48,3y,30.48,58.29,2026-01-22T00:00:00.000Z
IAU,iShares Gold Trust,1.86,13.49,78.86,13.28,19.62,16.5,3y,16.5,92.56,2026-01-22T00:00:00.000Z
IAUM,iShares Gold Trust Micro,1.871,13.5,79.13,13.29,19.65,16.44,3y,16.44,49.01,2026-01-22T00:00:00.000Z
IBB,iShares Biotechnology ETF,1.416,5.11,30.52,4.37,13.85,19.4,3y,19.4,177.64,2026-01-22T00:00:00.000Z
IBCA,iShares iBonds Dec 2035 Term Corporate ETF,0.096,0.23,159.7,0.35,-1.25,101.02,1y,,25.97,2026-01-22T00:00:00.000Z
IBIT,iShares Bitcoin Trust,-0.861,-0.53,-16.14,1.52,-20.19,41.99,1y,,50.67,2026-01-22T00:00:00.000Z
IBLC,iShares Blockchain and Tech ETF,-1.172,3.27,19.57,3.94,-25.77,60.97,3y,60.97,45.54,2026-01-22T00:00:00.000Z
IBOT,VanEck Robotics ETF,0.846,6.85,30.83,9.42,10.56,21.49,3y,21.49,57.23,2026-01-22T00:00:00.000Z
IBTO,iShares iBonds Dec 2033 Term Treasury ETF,0,-0.33,3.1,-0.45,-1.88,6.9,3y,6.9,24.465,2026-01-22T00:00:00.000Z
ICF,iShares Cohen & Steers Realty Majors ETF,-1.061,1.54,-1.5,2.73,-2.65,17.65,3y,17.65,60.59,2026-01-22T00:00:00.000Z
ICLN,iShares Global Clean Energy ETF,2.086,5.91,59.84,10.16,10.83,23.98,3y,23.98,18.11,2026-01-22T00:00:00.000Z
ICOI,Bitwise COIN Option Income Strategy ETF,-0.245,-2.51,-64.42,-15.75,-50.55,59.51,SI,,16.32,2026-01-22T00:00:00.000Z
ICOP,iShares Copper and Metals Mining ETF,-1.801,11.64,85.54,16.62,34.06,30.85,3y,30.85,50.17,2026-01-22T00:00:00.000Z
ICOW,Pacer Developed Markets International ETF,-0.296,3.48,34.45,3.69,9.11,15.07,3y,15.07,40.47,2026-01-22T00:00:00.000Z
IDEV,iShares Core MSCI International Developed Markets ETF (IDEV),0.47,2.68,28.29,4.32,5.91,14.37,3y,14.37,85.52,2026-01-22T00:00:00.000Z
IDHQ,Invesco S&P International Developed Quality ETF,0.326,3.41,25.59,5.27,6.64,14.57,3y,14.57,36.95,2026-01-22T00:00:00.000Z
IDMO,Invesco S&P International Developed Momentum ETF,0.58,1.65,35.5,0.81,8.09,15.82,3y,15.82,57.18,2026-01-22T00:00:00.000Z
IDOG,Alps International Sector Dividend Dogs ETF,0.766,1.05,32.57,2.98,8.38,14.66,3y,14.66,39.44,2026-01-22T00:00:00.000Z
IDU,iShares U.S. Utilities ETF,-0.521,-0.58,7.12,1.38,-4.7,15.56,3y,15.56,108.88,2026-01-22T00:00:00.000Z
IDV,iShares International Select Dividend ETF,0.147,2.13,44.98,4.88,11.1,14.35,3y,14.35,40.84,2026-01-22T00:00:00.000Z
IDVO,Amplify CWP International Enhanced Dividend Income ETF,0.743,7.06,35.14,9.88,13.29,15.04,3y,15.04,42.03,2026-01-22T00:00:00.000Z
IDX,VanEck Indonesia Index ETF,1.181,2.21,13.81,-0.41,4.45,19.4,3y,19.4,17.14,2026-01-22T00:00:00.000Z
IEFA,iShares Core MSCI EAFE ETF,0.411,2.72,27.49,4.46,5.24,14.62,3y,14.62,92.81,2026-01-22T00:00:00.000Z
IEMG,iShares Core MSCI Emerging Markets ETF,0.813,4.29,35.98,8.88,7.29,16,3y,16,71.96,2026-01-22T00:00:00.000Z
IEO,iShares U.S. Oil & Gas Exploration & Production ETF,-0.233,3.38,-4.11,6.45,7.47,26.13,3y,26.13,94.12,2026-01-22T00:00:00.000Z
IETC,iShares U.S. Tech Independence Fund,0.931,-0.84,13.4,-2.31,-3.26,21.85,3y,21.85,99.79,2026-01-22T00:00:00.000Z
IEUR,iShares Core MSCI Europe ETF,0.508,2.16,29.29,4.12,6.39,15.14,3y,15.14,73.23,2026-01-22T00:00:00.000Z
IEV,iShares Europe ETF,0.427,1.71,29.39,3.47,6.66,14.93,3y,14.93,70.62,2026-01-22T00:00:00.000Z
IEZ,iShares U.S. Oil Equipment & Services ETF,0.887,15.45,12.75,21.98,31.67,32.01,3y,32.01,25.03,2026-01-22T00:00:00.000Z
IFRA,iShares U.S. Infrastructure,0.326,6.65,15.68,8.08,6.27,16.66,3y,16.66,56.97,2026-01-22T00:00:00.000Z
IGE,iShares North American Natural Resources ETF,0.938,9.49,20.96,12.89,18.08,19.23,3y,19.23,55.97,2026-01-22T00:00:00.000Z
IGF,iShares Global Infrastructure ETF,0.624,1.49,14.62,3.44,2.33,13.06,3y,13.06,62.86,2026-01-22T00:00:00.000Z
IGM,iShares Expanded Tech Sector ETF,0.825,0.17,23.48,0.07,0.34,23.05,3y,23.05,129.59,2026-01-22T00:00:00.000Z
IGPT,Invesco AI and Next Gen Software ETF,1.382,5.79,32.85,9.82,11.55,24.89,3y,24.89,64.54,2026-01-22T00:00:00.000Z
IGRO,iShares International Dividend Growth ETF,0.65,2,22.74,3.49,5.55,12.6,3y,12.6,85.16,2026-01-22T00:00:00.000Z
IGV,iShares Expanded Tech-Software Sector ETF,1.614,-5.53,-4.91,-10.04,-15.71,23.11,3y,23.11,96.94,2026-01-22T00:00:00.000Z
IHAK,iShares Cybersecurity and Tech ETF,1.553,2.18,-4.39,-1.45,-7.96,19.97,3y,19.97,48.38,2026-01-22T00:00:00.000Z
IHDG,WisdomTree International Hedged Quality Dividend Growth Fund,0.179,2.5,11.83,3.95,7.51,13.38,3y,13.38,50.48,2026-01-22T00:00:00.000Z
IHE,iShares U.S. Pharmaceuticals ETF,0.551,3.19,30.7,3.02,17.15,16,3y,16,87.58,2026-01-22T00:00:00.000Z
IHF,iShares U.S. Healthcare Providers ETF,1.213,3.45,-1.92,4.75,-2.51,18.43,3y,18.43,50.05,2026-01-22T00:00:00.000Z
IHI,iShares U.S. Medical Devices ETF,-1.73,-1.79,-3.65,-2.95,0.45,16.73,3y,16.73,60.78,2026-01-22T00:00:00.000Z
IJAN,Innovator International Developed Power Buffer ETF - January,0.245,1.29,18.55,2.03,4.01,9.49,3y,9.49,36.79,2026-01-22T00:00:00.000Z
IJH,iShares Core S&P Mid-Cap ETF,0.014,5.14,6.91,5.24,7.39,18.23,3y,18.23,70.35,2026-01-22T00:00:00.000Z
IJJ,iShares S&P Mid-Cap 400 Value ETF,-0.143,4.79,6.5,4.76,7.16,18.7,3y,18.7,139.45,2026-01-22T00:00:00.000Z
IJK,iShares S&P Mid-Cap 400 Growth ETF,0.039,5.42,7.34,5.62,7.76,18.47,3y,18.47,103.72,2026-01-22T00:00:00.000Z
IJR,iShares Core S&P Small-Cap ETF,0.238,7.46,8.73,6.58,8.88,20.83,3y,20.83,130.43,2026-01-22T00:00:00.000Z
IJS,iShares S&P Small-Cap 600 Value ETF,0.348,8,10.35,7.3,11.19,22.04,3y,22.04,123.85,2026-01-22T00:00:00.000Z
IJT,iShares S&P Small-Cap 600 Growth ETF,0.164,6.91,7.36,5.87,6.78,20.15,3y,20.15,152.52,2026-01-22T00:00:00.000Z
ILCB,iShares Morningstar U.S. Equity ETF,0.549,0.78,13.83,1.21,2.2,15.1,3y,15.1,95.29,2026-01-22T00:00:00.000Z
ILCG,iShares Morningstar Growth ETF,0.735,0,12.74,0.39,-0.7,19.12,3y,19.12,104.23,2026-01-22T00:00:00.000Z
ILCV,iShares Morningstar Value ETF,0.355,1.54,15.13,1.87,5.7,12.84,3y,12.84,96.09,2026-01-22T00:00:00.000Z
ILDR,First Trust Innovation Leaders ETF,0.994,0.87,23.06,1.46,0.66,22.54,3y,22.54,33.54,2026-01-22T00:00:00.000Z
ILF,iShares Latin America 40 ETF,1.861,11.84,57.01,14.17,22.23,20.41,3y,20.41,34.48,2026-01-22T00:00:00.000Z
ILOW,AB International Low Volatility Equity ETF,0.3,1.35,24.04,2.43,2.67,14.45,1y,,43.44,2026-01-22T00:00:00.000Z
IMCB,iShares Morningstar Mid-Cap ETF,0.151,3.17,7.82,3.69,3.63,15.52,3y,15.52,86.19,2026-01-22T00:00:00.000Z
IMCG,iShares Morningstar Mid-Cap Growth ETF,0.349,3.36,5.1,3.63,0.48,17.09,3y,17.09,83.43,2026-01-22T00:00:00.000Z
IMCV,iShares Morningstar Mid-Cap ETF,0.105,3.24,10.43,3.96,6.71,15.12,3y,15.12,85.66,2026-01-22T00:00:00.000Z
IMTM,iShares MSCI International Momentum Factor ETF,0.28,3.04,29.68,4.89,6.32,15.58,3y,15.58,50.16,2026-01-22T00:00:00.000Z
INCO,Columbia India Consumer ETF,0.26,-5.52,0.02,-4.81,-7.54,14.47,3y,14.47,61.6,2026-01-22T00:00:00.000Z
INDA,ISHARES MSCI INDIA ETF,0.485,-5.06,1.91,-4.34,-4.92,13.33,3y,13.33,51.8,2026-01-22T00:00:00.000Z
INDF,Indofood Sukses Makmur Tbk,1.111,1.5,-10.26,-1.09,-8.14,24.3,3y,24.3,6825,2026-01-23T00:00:00.000Z
INDY,iShares India 50 ETF,0.468,-4.65,-4.9,-4.28,-11.52,13.36,3y,13.36,47.18,2026-01-22T00:00:00.000Z
INFL,Horizon Kinetics Inflation Beneficiaries ETF,0.996,11.02,20.91,12.09,14.65,16.15,3y,16.15,49.68,2026-01-22T00:00:00.000Z
INTF,iShares International Equity Factor ETF,0.539,2.62,32.61,4.59,8.24,14.68,3y,14.68,39.16,2026-01-22T00:00:00.000Z
IOO,iShares Global 100 ETF,0.435,-0.2,23.77,1.06,4.59,15.61,3y,15.61,126.9,2026-01-22T00:00:00.000Z
IPAC,iShares Core MSCI Pacific ETF,0.524,3.76,24.61,5.3,3.09,16.05,3y,16.05,76.75,2026-01-22T00:00:00.000Z
IPAY,Amplify Digital Payments ETF,1.673,0.15,-13.48,-2.36,-10.36,22.48,3y,22.48,51.65,2026-01-22T00:00:00.000Z
IPKW,Invesco International Buyback Achievers ETF,0.493,1.59,38.53,2.47,11.09,15.63,3y,15.63,57.108,2026-01-22T00:00:00.000Z
IPO,Renaissance IPO ETF,1.046,0.68,1.57,1.09,-3.21,28.66,3y,28.66,47.34,2026-01-22T00:00:00.000Z
IQDF,FlexShares International Quality Dividend Index Fund,0.881,3.85,33.89,6.58,11.62,14.27,3y,14.27,32.08,2026-01-22T00:00:00.000Z
IQDG,WisdomTree International Quality Dividend Growth Fund,0.726,2.87,20.44,4.09,7.15,14.95,3y,14.95,43.01,2026-01-22T00:00:00.000Z
IQLT,iShares MSCI International Quality Factor ETF,0.341,2.53,22.28,4.25,5.42,14.39,3y,14.39,47.09,2026-01-22T00:00:00.000Z
IQQQ,ProShares Nasdaq-100 High Income ETF,0.697,1.24,3.46,0.43,0.13,20.51,1y,,44.931,2026-01-22T00:00:00.000Z
IRBO,iShares Future AI & Tech ETF,0.662,4.19,32.87,8.48,5.73,25.71,3y,25.71,51.7,2026-01-22T00:00:00.000Z
ISCF,iShares MSCI International Small-Cap Equity Factor ETF,1.119,4.77,33.66,6.5,7.92,15.13,3y,15.13,43.815,2026-01-22T00:00:00.000Z
ISCG,iShares Morningstar Small-Cap Growth ETF,0.638,6.62,15.08,5.81,7.75,20.46,3y,20.46,59.9,2026-01-22T00:00:00.000Z
ISCV,iShares Morningstar Small-Cap Value ETF,0.356,6.14,11.13,5.71,9.35,20.43,3y,20.43,73.3,2026-01-22T00:00:00.000Z
ISPY,ProShares S&P High Income ETF,0.589,0.92,1.56,0.92,1.47,15.99,1y,,46.13,2026-01-22T00:00:00.000Z
ISVAF,iShares Nasdaq 100 UCITS ETF USD (Acc),,,,,,,,,,2026-01-23T08:58:54.857Z
ISVVF,iShares MSCI ACWI Mutual Fund,,,,,,,,,,2026-01-23T08:58:54.938Z
ITA,iShares U.S. Aerospace & Defense ETF,-1.852,6.22,50.68,10.24,10.53,18.03,3y,18.03,235.82,2026-01-22T00:00:00.000Z
ITB,iShares U.S. Home Construction ETF,-1.063,9.8,-1.98,9.02,1.27,27.12,3y,27.12,107.04,2026-01-22T00:00:00.000Z
ITOT,iShares Core S&P Total U.S. Stock Market ETF,0.539,1.32,13.79,1.65,2.89,15.38,3y,15.38,151.13,2026-01-22T00:00:00.000Z
ITWO,ProShares Russell 2000 High Income ETF,0.836,8.23,5.05,6.58,8.12,22.23,1y,,43.4,2026-01-22T00:00:00.000Z
IUS,Invesco RAFI Strategic US Exchange-Traded Fund,0.441,3.08,15.52,3.66,6.07,13.12,3y,13.12,59.24,2026-01-22T00:00:00.000Z
IUSA,Northern Lights Fund Trust II A,0.385,1.14,3.81,0.54,2.35,13.52,3y,13.52,5110.75,2026-01-22T00:00:00.000Z
IUSG,iShares Core S&P U.S. Growth ETF,0.689,0.01,16.73,0.41,1.8,18.17,3y,18.17,168.17,2026-01-22T00:00:00.000Z
IUSV,iShares Core S&P U.S. Value ETF,0.229,2.23,10.78,2.58,4.06,13.42,3y,13.42,105.25,2026-01-22T00:00:00.000Z
IVE,ISHARES S&P 500 VALUE ETF,0.254,2.07,10.99,2.4,3.91,13.22,3y,13.22,217.17,2026-01-22T00:00:00.000Z
IVES,Amplify Bloomberg AI Value Chain ETF,1.239,2.12,-36.57,1.84,-1.68,72.36,1y,,32.68,2026-01-22T00:00:00.000Z
IVLU,iShares MSCI International Value Factor ETF,0.634,3.01,42.34,4.78,11.56,15.23,3y,15.23,39.67,2026-01-22T00:00:00.000Z
IVOG,Vanguard S&P Mid-Cap 400 Growth ETF,0.14,5.8,7.68,5.47,7.39,18.48,3y,18.48,128.99,2026-01-22T00:00:00.000Z
IVOL,Quadratic Interest Rate Volatility and Inflation Hedge ETF,-0.846,-1.68,5.81,-2.19,-3.84,13.46,3y,13.46,18.76,2026-01-22T00:00:00.000Z
IVOO,Vanguard S&P Mid-Cap 400 ETF,-0.034,5.09,6.92,4.79,7.47,18.23,3y,18.23,119.1,2026-01-22T00:00:00.000Z
IVOV,Vanguard S&P Mid-Cap 400 Value ETF,-0.075,4.88,6.72,2.75,5.85,44.97,3y,44.97,107.02,2026-01-22T00:00:00.000Z
IVV,iShares Core S&P 500 ETF,0.529,0.84,14.24,1.24,2.6,14.94,3y,14.94,691.96,2026-01-22T00:00:00.000Z
IVW,ISHARES S&P 500 GROWTH ETF (3IS8),0.762,-0.28,17.32,0.2,1.5,18.39,3y,18.39,123,2026-01-22T00:00:00.000Z
IWB,iShares Russell 1000 ETF,0.524,1,13.7,1.37,2.57,15.09,3y,15.09,378.09,2026-01-22T00:00:00.000Z
