symbol,name,daily_change_pct,ytd_return_pct,one_year_return_pct,perf_1m_pct,perf_3m_pct,vol_pct,vol_window,vol_3y_pct,last_close,as_of
ISTXF,iShares U.S. Treasury 1-3 Year USD A Mutual Fund,,,,,,,,,,2026-02-19T15:23:08.993Z
ISVQF,iShares USD Short Duration USD A,,,,,,,,,,2026-02-19T15:23:09.069Z
ISZXF,iShares USD Treasury Bond 3-7 Year UCITS ETF,,,,,,,,,,2026-02-19T15:23:09.144Z
ITBFF,iShares USD Treasury 1-3 Year UCITS ETF,,,,,,,,,,2026-02-19T15:23:09.242Z
ITM,VanEck Intermediate Muni ETF,0.01,1.26,3.61,1.3,1.87,4.23,3y,4.23,47.775,2026-02-19T00:00:00.000Z
IUSB,iShares Core Total Bond Market ETF,-0.011,0.93,3.4,1.09,0.78,5.51,3y,5.51,46.965,2026-02-19T00:00:00.000Z
JAAA,Janus Henderson AAA CLO ETF,-0.02,0.26,-0.22,-0.02,0.18,2.05,3y,2.05,50.74,2026-02-19T00:00:00.000Z
JAGG,JPMorgan U.S. Aggregate Bond ETF,-0.085,1.03,3.81,0.58,0.62,5.85,3y,5.85,46.86,2026-02-17T00:00:00.000Z
JBBB,Janus Henderson B-BBB CLO ETF,-0.199,0.09,-3.39,-0.86,-0.64,4.43,3y,4.43,47.665,2026-02-19T00:00:00.000Z
JBND,JPMorgan Active Bond ETF,-0.018,1.09,3.9,1.34,0.92,4.41,1y,,54.59,2026-02-19T00:00:00.000Z
JCPB,JPMorgan Core Plus Bond ETF,-0.01,1.12,3.31,1.22,0.97,5.54,3y,5.54,47.855,2026-02-19T00:00:00.000Z
JCPI,J.P. Morgan Inflation Managed Bond Fund,-0.144,0.93,2.77,0.8,0.19,4.12,3y,4.12,48.61,2026-02-18T00:00:00.000Z
JHMB,John Hancock Mortgage-Backed Securities ETF,-0.089,1.45,3.62,0.83,1.06,6.64,3y,6.64,22.455,2026-02-18T00:00:00.000Z
JMBS,Janus Henderson Mortgage-Backed Securities ETF,-0.032,1.24,3.93,0.97,1.17,6.62,3y,6.62,46.145,2026-02-19T00:00:00.000Z
JMHI,JPMorgan High Yield Municipal ETF,0.02,1.19,-0.02,0.69,1.19,4.69,3y,4.69,50.9,2026-02-18T00:00:00.000Z
JMSI,JPMorgan Sustainable Municipal Income ETF,-0.02,1.24,1.74,0.72,1.33,3.81,3y,3.81,50.99,2026-02-18T00:00:00.000Z
JMST,JPMorgan Ultra-Short Municipal Income Fund,-0.01,0.28,0.52,0.05,0.3,1.16,3y,1.16,51.075,2026-02-19T00:00:00.000Z
JMUB,JPMorgan Municipal Bond ETF,0.02,1.11,1.65,0.85,0.91,3.45,3y,3.45,51.1,2026-02-19T00:00:00.000Z
JNK,SPDR Bloomberg High Yield Bond ETF,-0.082,0.22,0.86,-0.14,1.03,5.94,3y,5.94,97.45,2026-02-19T00:00:00.000Z
JPHY,JPMorgan Active High Yield ETF,-0.02,0.12,8.77,-0.29,0.33,7.48,3y,7.48,50.7,2026-02-18T00:00:00.000Z
JPST,JPMorgan Ultra-Short Income ETF,0.01,0.19,0.45,0.07,0.11,1.49,3y,1.49,50.715,2026-02-19T00:00:00.000Z
JSCP,JPMorgan Short Duration Core Plus ETF,-0.031,0.36,1.91,0.43,0.52,2.91,3y,2.91,47.725,2026-02-19T00:00:00.000Z
JSI,Janus Henderson Securitized Income ETF,0.01,0.69,0.92,0.56,0.69,3.19,1y,,52.47,2026-02-19T00:00:00.000Z
KORP,American Century Diversified Corporate Bond ETF,-0.105,1.1,3.2,1.21,0.97,5.52,3y,5.52,47.74,2026-02-19T00:00:00.000Z
LDRT,iShares iBonds 1-5 Year Treasury Ladder ETF,0,0.12,1.52,0.32,0.24,3.19,1y,,25.37,2026-02-19T00:00:00.000Z
LDUR,PIMCO Enhanced Low Duration Active Exchange-Traded Fund,-0.083,0.34,0.86,0.21,0.33,2.42,3y,2.42,96.28,2026-02-18T00:00:00.000Z
LEMB,iShares J.P. Morgan EM Local Currency Bond ETF,-0.117,2.52,14.49,2.03,2.25,6.87,3y,6.87,42.66,2026-02-19T00:00:00.000Z
LONZ,PIMCO Senior Loan Active Exchange-Traded Fund,0.03,-0.62,-1.95,-1.14,-0.97,3.55,3y,3.55,49.985,2026-02-18T00:00:00.000Z
LQD,iShares iBoxx $ Investment Grade Corporate Bond ETF,-0.108,1.19,3.64,1.43,1.04,7.71,3y,7.71,111.47,2026-02-19T00:00:00.000Z
LQDH,iShares Interest Rate Hedged Corporate Bond ETF,0.215,0.04,-0.54,-0.55,0.63,4.19,3y,4.19,93.38,2026-02-18T00:00:00.000Z
LQTI,FT Vest Investment Grade & Target Income ETF,-0.348,0.7,-1.23,0.55,-0.25,6.45,1y,,20.03,2026-02-19T00:00:00.000Z
LTPZ,PIMCO 15+ Year U.S. TIPS Index Exchange-Traded Fund,-0.113,2.79,-0.39,3.11,0.13,13.79,3y,13.79,53.08,2026-02-19T00:00:00.000Z
MBB,iShares MBS ETF,-0.031,1.15,4.61,1.12,1.28,6.75,3y,6.75,96.23,2026-02-19T00:00:00.000Z
MBSF,Regan Floating Rate MBS ETF,0.039,0.23,0.98,0.29,0.27,3.08,1y,,25.729,2026-02-18T00:00:00.000Z
MEAR,iShares Short Maturity Bond ETF,-0.014,0.5,0.83,0.28,0.42,1.38,3y,1.38,50.57,2026-02-19T00:00:00.000Z
MINT,PIMCO Enhanced Short Maturity Active Exchange-Traded Fund,0.025,0.22,0.04,0,0.09,1.46,3y,1.46,100.595,2026-02-19T00:00:00.000Z
MLN,VanEck Long Muni ETF,0.085,0.31,-0.25,1.35,0.2,7.08,3y,7.08,17.645,2026-02-19T00:00:00.000Z
MMIN,NYLI MacKay Muni Insured ETF,-0.021,1.02,1.49,0.89,0.81,5.29,3y,5.29,24.245,2026-02-19T00:00:00.000Z
MMIT,NYLI MacKay Muni Intermediate ETF,-0.041,1.41,2.32,0.94,1.33,3.69,3y,3.69,24.68,2026-02-19T00:00:00.000Z
MTBA,Simplify MBS ETF,0.079,0.51,1.43,0.16,0.64,3.26,1y,,50.67,2026-02-18T00:00:00.000Z
MUB,iShares National Muni Bond ETF,0.088,1.09,1.79,1.1,1.23,4.22,3y,4.22,108.405,2026-02-19T00:00:00.000Z
MUNI,PIMCO Intermediate Municipal Bond Active Exchange-Traded Fund,0,1.35,2.49,1.03,1.24,3.62,3y,3.62,53.16,2026-02-19T00:00:00.000Z
MUU,Dx Daily Muni Bond Bull 2x Shares,-2.272,61.5,755.86,23.36,141.57,128.57,1y,,196.5901,2026-02-19T00:00:00.000Z
NBSD,Neuberger Berman Short Duration Income ETF,-0.029,0.35,0.86,0.15,0.36,3.41,1y,,51.355,2026-02-19T00:00:00.000Z
NCLO,Nuveen AA-BBB CLO ETF,0.08,0.24,-0.34,0.02,0.16,3.44,1y,,25.065,2026-02-19T00:00:00.000Z
NEAR,iShares Short Maturity Bond ETF,-0.039,0.23,1.3,0.29,0.2,2.09,3y,2.09,51.24,2026-02-19T00:00:00.000Z
NUBD,Nuveen ESG U.S. Aggregate Bond ETF,-0.133,0.92,3.06,0.8,0.74,5.72,3y,5.72,22.56,2026-02-18T00:00:00.000Z
NYF,iShares New York Muni Bond ETF,0.055,1.1,1.63,1.02,1.14,4.06,3y,4.06,54.21,2026-02-19T00:00:00.000Z
OACP,OneAscent Core Plus Bond ETF,0.013,0.79,2.54,0.58,0.68,5.21,3y,5.21,23.215,2026-02-18T00:00:00.000Z
OBIL,US Treasury 12 Month Bill Mutual Fund,0,0.07,0.36,0.02,0.12,1.47,3y,1.47,50.255,2026-02-18T00:00:00.000Z
PAAA,PGIM AAA CLO ETF,0.01,0.3,0.11,0.01,0.15,1.84,3y,1.84,51.445,2026-02-19T00:00:00.000Z
PBFR,PGIM Laddered Fixed Income Fund ETF,0.014,0.42,8.84,-0.09,2.08,8.33,1y,,29.344,2026-02-18T00:00:00.000Z
PCRB,Putnam ESG Core Bond ETF,-0.118,0.94,2.71,0.74,0.72,5.84,3y,5.84,49.749,2026-02-18T00:00:00.000Z
PCY,Invesco Emerging Markets Sovereign Debt ETF,-0.295,1.45,8.08,3.02,1.08,10.63,3y,10.63,22.005,2026-02-19T00:00:00.000Z
PFIX,Simplify Interest Rate Hedge ETF,0.255,-12.06,-17.97,-11.84,-10.8,52.15,3y,52.15,43.26,2026-02-19T00:00:00.000Z
PGHY,Invesco Global ex-US High Yield Corporate Bond ETF,0.401,0.8,-0.2,0.1,0.7,5.53,3y,5.53,20.05,2026-02-18T00:00:00.000Z
PHB,Invesco Fundamental High Yield Corporate Bond ETF,-0.053,0.38,2.41,0.81,1.03,5.24,3y,5.24,18.7,2026-02-19T00:00:00.000Z
PHYL,PGIM Active High Yield Bond ETF,-0.042,0.3,1.09,-0.1,1.06,5.19,3y,5.19,35.595,2026-02-19T00:00:00.000Z
PICB,Invesco International Corporate Bond ETF,-0.493,1.81,9.8,1.77,3.02,8.46,3y,8.46,24.2,2026-02-18T00:00:00.000Z
PLW,Invesco Exchange-Traded Fund Trust II - Invesco 1-30 Laddered Treasury ETF,-0.285,1.71,2.64,1.35,0.72,9.5,3y,9.5,27.99,2026-02-18T00:00:00.000Z
PMBS,PIMCO Mortgage-Backed Securities Active ETF,-0.133,1.46,4.26,0.75,1.62,4.8,1y,,50.358,2026-02-18T00:00:00.000Z
PMMF,iShares Prime Money Market ETF,0.02,0.19,0.21,0.02,0.03,1.12,1y,,100.4399,2026-02-19T00:00:00.000Z
PSH,PGIM Short Duration High Yield Fund,0.03,0.06,-0.27,-0.4,0.21,4.16,1y,,50.415,2026-02-18T00:00:00.000Z
PSQA,Palmer Square CLO Senior Debt ETF,0.049,0.69,1.01,0.51,0.22,2.87,1y,,20.53,2026-02-18T00:00:00.000Z
PTBD,Pacer Trendpilot US Bond ETF,-0.077,0.41,-4.18,0.15,-0.26,6,3y,6,19.48,2026-02-19T00:00:00.000Z
PTRB,PGIM Total Return Bond ETF,-0.094,1.07,2.96,1.02,0.72,5.88,3y,5.88,42.44,2026-02-19T00:00:00.000Z
PULS,PGIM Ultra Short Bond ETF,0.01,0.21,0.11,0.03,0.03,1.66,3y,1.66,49.725,2026-02-19T00:00:00.000Z
PWZ,Invesco California AMT-Free Municipal Bond ETF,0.061,1.14,0.02,1.72,0.64,6.76,3y,6.76,24.485,2026-02-19T00:00:00.000Z
PZA,Invesco National AMT-Free Municipal Bond ETF,0.149,1.01,-0.11,1.62,0.75,6.16,3y,6.16,23.485,2026-02-19T00:00:00.000Z
QHY,WisdomTree U.S. High Yield Corporate Bond Fund,0.182,0.5,2.14,0.19,0.82,5.69,1y,,46.69,2026-02-18T00:00:00.000Z
QLTA,iShares AAA - A Rated Corporate Bond ETF,-0.103,0.94,3.1,1.1,0.75,6.33,3y,6.33,48.5,2026-02-19T00:00:00.000Z
RAVI,FlexShares Ultra-Short Income Fund,0,0.21,0.24,0.08,0.09,1.43,3y,1.43,75.53,2026-02-18T00:00:00.000Z
REM,iShares Mortgage Real Estate ETF,-0.861,-0.47,-3.46,-4.28,3.29,22.66,3y,22.66,22.465,2026-02-19T00:00:00.000Z
RMOP,Rockefeller Opportunistic Municipal Bond ETF,0.02,0.9,-1.02,0.58,0.48,6.15,1y,,25.28,2026-02-18T00:00:00.000Z
SBND,Columbia Short Duration Bond ETF,-0.131,0.5,2.31,0.34,0.5,3.41,3y,3.41,19.005,2026-02-18T00:00:00.000Z
SCCR,Schwab Core Bond ETF,-0.115,0.93,3.85,0.93,0.73,4.46,1y,,26.06,2026-02-19T00:00:00.000Z
SCHI,Schwab 5-10 Year Corporate Bond ETF,-0.065,0.76,4.26,1.07,0.94,6.09,3y,6.09,23.135,2026-02-19T00:00:00.000Z
SCHJ,Schwab 1-5 Year Corporate Bond ETF,-0.08,0.32,2.13,0.32,0.44,2.78,3y,2.78,24.97,2026-02-19T00:00:00.000Z
SCHO,Schwab Short-Term U.S. Treasury ETF,-0.061,0.14,0.97,0.14,0.14,2.33,3y,2.33,24.395,2026-02-19T00:00:00.000Z
SCHP,Schwab U.S. TIPS ETF,-0.019,1.19,2.19,1.27,-0.02,5.3,3y,5.3,26.795,2026-02-19T00:00:00.000Z
SCHQ,Schwab Long-Term U.S. Treasury ETF,-0.062,2.34,2.08,2.86,0.5,13.38,3y,13.38,32.39,2026-02-19T00:00:00.000Z
SCHR,Schwab Intermediate-Term U.S. Treasury ETF,-0.04,0.56,3.62,0.96,0.4,5.22,3y,5.22,25.21,2026-02-19T00:00:00.000Z
SCHZ,Schwab U.S. Aggregate Bond ETF,-0.064,0.88,3.35,1.05,0.79,5.82,3y,5.82,23.575,2026-02-19T00:00:00.000Z
SCMB,Schwab Municipal Bond ETF,0.038,1.16,1.48,0.66,1.05,4.2,3y,4.2,26.07,2026-02-19T00:00:00.000Z
SCUS,Schwab Ultra-Short Income ETF,-0.04,0.14,0.36,0.04,0.12,1.31,1y,,25.23,2026-02-19T00:00:00.000Z
SCYB,Schwab High Yield Bond ETF,-0.094,0.17,0.32,-0.17,0.7,5.5,3y,5.5,26.495,2026-02-19T00:00:00.000Z
SEIX,Virtus Seix Senior Loan ETF,0,-0.36,-3.16,-0.39,-0.87,3.48,3y,3.48,23.26,2026-02-19T00:00:00.000Z
SGOV,iShares 0-3 Month Treasury Bond ETF,0.005,0.13,0.02,-0.01,0,1.31,3y,1.31,100.545,2026-02-19T00:00:00.000Z
SHM,SPDR Nuveen Bloomberg Short Term Municipal Bond ETF,0.021,0.83,1.59,0.41,0.98,2.19,3y,2.19,48.41,2026-02-19T00:00:00.000Z
SHV,iShares Short Treasury Bond ETF,0.014,0.11,0.01,-0.02,0,1.32,3y,1.32,110.295,2026-02-19T00:00:00.000Z
SHY,iShares 1-3 Year Treasury Bond ETF,0,0.14,1.16,0.22,0.19,2.24,3y,2.24,82.98,2026-02-19T00:00:00.000Z
SHYD,VanEck Short High Yield Municipal Fund,0,0.87,1.81,0.35,1.32,5.21,3y,5.21,23.08,2026-02-19T00:00:00.000Z
SHYG,iShares 0-5 Year High Yield Corporate Bond ETF,-0.058,-0.17,-0.64,-0.38,0.32,5.01,3y,5.01,42.825,2026-02-19T00:00:00.000Z
SHYL,Xtrackers Short Duration High Yield Bond ETF,0.089,-0.11,-0.58,-0.58,0.19,5.18,3y,5.18,44.91,2026-02-18T00:00:00.000Z
SIHY,Harbor Scientific Alpha High-Yield ETF,0.052,0.48,-0.17,-0.22,0.26,6.39,3y,6.39,45.91,2026-02-18T00:00:00.000Z
SIXO,AllianzIM U.S. Large Cap 6 Month Buffer10 Apr/Oct ETF,0.402,0.64,5.16,-0.16,2.43,7.93,3y,7.93,34.96,2026-02-18T00:00:00.000Z
SJB,ProShares Short High Yield,0.131,0.07,-4.56,0.13,-1.74,6.02,3y,6.02,15.28,2026-02-19T00:00:00.000Z
SJNK,SPDR Bloomberg Short Term High Yield Bond ETF,-0.04,-0.08,-0.86,-0.43,0.32,5.09,3y,5.09,25.3,2026-02-19T00:00:00.000Z
SKOR,FlexShares Credit-Scored U.S. Bond Index Fund,-0.047,0.52,2.82,0.46,0.71,4.1,3y,4.1,49.365,2026-02-18T00:00:00.000Z
SLQD,iShares 0-5 Year Investment Grade Corporate Bond ETF,-0.049,0.31,1.87,0.27,0.4,2.39,3y,2.39,50.865,2026-02-19T00:00:00.000Z
SMB,VanEck Short Muni ETF,0,0.23,1.75,0.29,0.81,2.38,3y,2.38,17.46,2026-02-18T00:00:00.000Z
SMBS,Schwab Mortgage-Backed Securities ETF,-0.019,1.03,3.7,0.8,0.97,4.88,1y,,25.915,2026-02-19T00:00:00.000Z
SMMU,PIMCO Short Term Municipal Bond Active ETF,0.079,0.73,1.6,0.47,0.83,1.88,3y,1.88,50.86,2026-02-19T00:00:00.000Z
SMTH,ALPS Smith Core Plus Bond ETF,-0.323,0.61,2.32,0.79,0.36,4.36,1y,,26.215,2026-02-19T00:00:00.000Z
SPAB,SPDR Portfolio Aggregate Bond ETF,-0.019,1.03,3.56,1.15,0.76,5.69,3y,5.69,26.005,2026-02-19T00:00:00.000Z
SPBO,SPDR Portfolio Corporate Bond ETF,-0.118,0.97,2.87,1.11,0.9,6.44,3y,6.44,29.615,2026-02-19T00:00:00.000Z
SPHY,SPDR Portfolio High Yield Bond ETF,-0.105,0.15,-0.06,-0.19,0.7,5.74,3y,5.74,23.725,2026-02-19T00:00:00.000Z
SPIB,SPDR Portfolio Intermediate Term Corporate Bond ETF,-0.029,0.56,3.31,0.71,0.77,4.11,3y,4.11,34.01,2026-02-19T00:00:00.000Z
SPIP,SPDR Portfolio TIPS ETF,-0.019,1.21,1.96,1.33,0.25,5.86,3y,5.86,26.245,2026-02-19T00:00:00.000Z
SPLB,SPDR Portfolio Long Term Corporate Bond ETF,-0.087,1.95,2.68,2.04,1.28,11.42,3y,11.42,23,2026-02-19T00:00:00.000Z
SPMB,SPDR Portfolio Mortgage Backed Bond ETF,-0.022,1.32,4.83,1.18,1.05,6.75,3y,6.75,22.685,2026-02-19T00:00:00.000Z
SPSB,SPDR Portfolio Short Term Corporate Bond ETF,-0.05,0.22,1.15,0.22,0.31,2.18,3y,2.18,30.285,2026-02-19T00:00:00.000Z
SPSK,SP Funds Dow Jones Global Sukuk ETF,-0.136,0.52,2.77,0.69,-1.21,6.18,3y,6.18,18.345,2026-02-19T00:00:00.000Z
SPTI,SPDR Portfolio Intermediate Term Treasury ETF,-0.034,0.62,3.76,0.94,0.35,5.22,3y,5.22,29,2026-02-19T00:00:00.000Z
SPTL,SPDR Portfolio Long Term Treasury ETF,-0.074,2.5,2.58,2.97,0.67,13.41,3y,13.41,27.08,2026-02-19T00:00:00.000Z
SPTS,SPDR Portfolio Short Term Treasury ETF,-0.034,0.14,1,0.14,0.17,2.29,3y,2.29,29.31,2026-02-18T00:00:00.000Z
SRLN,SPDR Blackstone Senior Loan ETF,-0.074,-1.6,-2.68,-1.67,-1.36,3.83,3y,3.83,40.64,2026-02-19T00:00:00.000Z
STIP,iShares 0-5 Year TIPS Bond ETF,0.029,0.54,1.16,0.54,0.09,2.52,3y,2.52,102.93,2026-02-19T00:00:00.000Z
STOT,SPDR DoubleLine Short Duration Total Return Tactical ETF,0.042,0.17,0.89,0.06,0,2.07,3y,2.07,47.37,2026-02-18T00:00:00.000Z
STPZ,PIMCO 1-5 Year U.S. TIPS Index Exchange-Traded Fund,0.037,0.6,1.75,0.56,0.13,2.86,3y,2.86,53.94,2026-02-18T00:00:00.000Z
SUB,iShares Short-Term National Muni Bond ETF,0.009,0.65,1.5,0.34,0.84,1.67,3y,1.67,107.42,2026-02-19T00:00:00.000Z
SUSB,iShares ESG Aware 1-5 Year USD Bond ETF,-0.079,0.36,2.1,0.4,0.42,2.89,3y,2.89,25.32,2026-02-19T00:00:00.000Z
SUSC,iShares ESG Aware USD Corporate Bond ETF,-0.085,0.96,3.35,1.14,0.9,6.37,3y,6.37,23.59,2026-02-19T00:00:00.000Z
SYFI,AB Short Duration High Yield ETF,-0.056,0.17,-0.3,-0.19,0.81,5.04,1y,,35.96,2026-02-19T00:00:00.000Z
TAFI,"AB Active ETFs, Inc. AB Tax-Aware Short Duration Municipal ETF",0.039,0.87,1.27,0.39,0.79,2.18,3y,2.18,25.44,2026-02-18T00:00:00.000Z
TAFM,AB Tax-Aware Intermediate Municipal ETF,0,1.29,1.64,0.78,1.34,6.04,1y,,25.78,2026-02-18T00:00:00.000Z
TAGG,T. Rowe Price QM U.S. Bond ETF,-0.149,0.93,2.86,0.78,0.74,6.34,3y,6.34,43.45,2026-02-18T00:00:00.000Z
TAXF,American Century Diversified Municipal Bond ETF,-0.117,1.09,1.41,0.63,1.21,4.4,3y,4.4,51.07,2026-02-18T00:00:00.000Z
TBF,ProShares Short 20+ Year Treasury,-0.021,-2.46,-3.82,-3.15,-1.03,14.63,3y,14.63,23.555,2026-02-19T00:00:00.000Z
TBIL,US Treasury 3 Month Bill ETF,-0.01,0.11,0.03,-0.03,0.03,1.33,3y,1.33,49.955,2026-02-19T00:00:00.000Z
TBT,ProShares UltraShort 20+ Year Treasury,-0.045,-5.08,-8.26,-6.48,-2.11,29.2,3y,29.2,33.135,2026-02-19T00:00:00.000Z
TBUX,T. Rowe Price Ultra Short-Term Bond ETF,0.04,0.26,0.54,0.08,0.1,1.82,3y,1.82,49.97,2026-02-18T00:00:00.000Z
TCPB,Thrivent Core Plus Bond ETF,-0.058,0.89,3.18,1,0.58,4.53,1y,,51.765,2026-02-19T00:00:00.000Z
TDTF,FlexShares iBoxx 5-Year Target Duration TIPS Index Fund,-0.021,1.02,2.39,1.11,0.1,5.17,3y,5.17,24.175,2026-02-19T00:00:00.000Z
TDTT,FlexShares iBoxx 3-Year Target Duration TIPS Index Fund,0,0.5,1.09,0.54,-0.04,3.46,3y,3.46,24.17,2026-02-18T00:00:00.000Z
TFI,SPDR Nuveen Bloomberg Municipal Bond ETF,0.043,1.11,1.23,1.03,1.11,4.46,3y,4.46,46.26,2026-02-19T00:00:00.000Z
TFLO,iShares Treasury Floating Rate Bond ETF,0,0.2,-0.06,0.02,0.1,1.37,3y,1.37,50.58,2026-02-19T00:00:00.000Z
TFLR,T. Rowe Price Floating Rate ETF,0.059,-0.74,-1.37,-1.22,-0.83,4.32,3y,4.32,51.03,2026-02-18T00:00:00.000Z
TIP,iShares TIPS Bond ETF,-0.013,1.17,2.66,1.33,0.34,5.38,3y,5.38,111.145,2026-02-19T00:00:00.000Z
TIPX,SPDR Bloomberg 1-10 Year TIPS ETF,-0.026,0.81,2.59,0.92,0.23,4.15,3y,4.15,19.235,2026-02-19T00:00:00.000Z
TLH,iShares 10-20 Year Treasury Bond ETF,-0.048,2.11,3.12,2.59,0.71,11.93,3y,11.93,103.65,2026-02-19T00:00:00.000Z
TLT,iShares 20+ Year Treasury Bond ETF,-0.067,2.8,1.56,3.25,0.43,14.72,3y,14.72,89.47,2026-02-19T00:00:00.000Z
TMF,Direxion Daily 20+ Year Treasury Bull 3X Shares,-0.199,8.14,-1.18,10.13,0.2,43.26,3y,43.26,40.12,2026-02-19T00:00:00.000Z
TMV,Direxion Daily 20+ Year Treasury Bear 3X Shares,0.175,-7.9,-11.2,-9.55,-2.11,43.61,3y,43.61,34.4,2026-02-19T00:00:00.000Z
TUSB,Thrivent Ultra Short Bond ETF,0.02,0.23,0.79,0.11,0.12,1.73,1y,,50.525,2026-02-19T00:00:00.000Z
TUSI,Touchstone Ultra Short Income Fund,0.059,0.38,0.14,0.18,0.14,1.77,3y,1.77,25.425,2026-02-19T00:00:00.000Z
TYD,Direxion Daily 7-10 Year Treasury Bull 3X Shares,-0.535,2.6,8.68,3.54,0.85,21.52,3y,21.52,26.04,2026-02-18T00:00:00.000Z
UBND,VictoryShares Core Plus Intermediate Bond Fund,-0.113,0.84,2.86,0.57,0.84,5.25,3y,5.25,22.155,2026-02-18T00:00:00.000Z
UBT,ProShares Ultra 20+ Year Treasury,-0.229,5.69,2.11,6.85,0.69,29.06,3y,29.06,17.46,2026-02-19T00:00:00.000Z
UCON,First Trust TCW Unconstrained Plus Bond ETF,0.02,0.64,2.61,0.8,0.58,3.96,3y,3.96,25.335,2026-02-19T00:00:00.000Z
UITB,VictoryShares Core Intermediate Bond ETF,-0.021,0.87,3.41,1.12,0.7,5.51,3y,5.51,47.735,2026-02-19T00:00:00.000Z
ULST,SPDR SSgA Ultra Short Term Bond ETF,0.025,0.17,0.25,0.05,-0.05,1.66,3y,1.66,40.59,2026-02-19T00:00:00.000Z
USFR,WisdomTree Floating Rate Treasury Fund,0.04,0.22,-0.02,0.04,0.18,1.39,3y,1.39,50.44,2026-02-18T00:00:00.000Z
USHY,iShares Broad USD High Yield Corporate Bond ETF,-0.12,0.15,0.6,-0.17,0.71,5.82,3y,5.82,37.475,2026-02-19T00:00:00.000Z
USIG,iShares Broad USD Investment Grade Corporate Bond ETF,-0.086,0.96,3.35,1.13,0.88,6.06,3y,6.06,52.255,2026-02-19T00:00:00.000Z
USTB,VictoryShares Short-Term Bond ETF,-0.02,0.3,1.23,0.28,0.33,2.43,3y,2.43,50.98,2026-02-18T00:00:00.000Z
UTEN,US Treasury 10 Year Note ETF,-0.011,1.06,4.1,1.66,0.45,7.73,3y,7.73,44.47,2026-02-19T00:00:00.000Z
UTWO,U.S. Treasury 2-Year Note ETF,-0.041,0.15,1.12,0.25,0.29,2.35,3y,2.35,48.655,2026-02-18T00:00:00.000Z
UYLD,Angel Oak UltraShort Income Fund,0.039,0.32,0.21,0.11,0.17,1.78,3y,1.78,51.3,2026-02-19T00:00:00.000Z
VCEB,Vanguard ESG U.S. Corporate Bond Fund,-0.055,0.89,2.47,0.6,0.76,6.03,3y,6.03,64.145,2026-02-18T00:00:00.000Z
VCIT,Vanguard Intermediate-Term Corporate Bond Fund,-0.065,0.79,4.45,1.11,0.89,5.96,3y,5.96,84.405,2026-02-19T00:00:00.000Z
VCLT,Vanguard Long-Term Corporate Bond Fund,-0.129,1.91,2.52,1.98,1.15,11.47,3y,11.47,77.22,2026-02-19T00:00:00.000Z
VCRB,Vanguard Core Bond ETF,0.105,1.22,3.56,1.23,0.79,4.24,1y,,78.695,2026-02-19T00:00:00.000Z
VCRPF,Vanguard USD Corporate Bond Fund,,,,,,,,,,2026-02-19T15:23:57.363Z
VCSH,Vanguard Short-Term Corporate Bond ETF,-0.031,0.34,2.2,0.36,0.5,2.77,3y,2.77,80.035,2026-02-19T00:00:00.000Z
VGIT,Vanguard Intermediate-Term Treasury Fund,-0.008,0.59,3.69,0.98,0.39,5.21,3y,5.21,60.265,2026-02-19T00:00:00.000Z
VGLT,Vanguard Long-Term Treasury Fund,-0.044,2.47,2.23,2.97,0.56,13.41,3y,13.41,57.065,2026-02-19T00:00:00.000Z
VGSH,Vanguard Short-Term Treasury Fund,0.008,0.16,1.06,0.21,0.18,2.26,3y,2.26,58.845,2026-02-19T00:00:00.000Z
VMBS,Vanguard Mortgage-Backed Securities Fund,0.032,1.14,4.47,1.14,1.29,6.66,3y,6.66,47.555,2026-02-19T00:00:00.000Z
VNLA,Janus Henderson Short Duration Income ETF,0.02,0.24,0.43,0.02,0.12,1.62,3y,1.62,49.27,2026-02-19T00:00:00.000Z
VPLS,Vanguard Core-Plus Bond ETF,-0.051,1.02,3.2,1.18,0.63,4.29,1y,,78.905,2026-02-19T00:00:00.000Z
VRIG,Invesco Variable Rate Investment Grade ETF,0,0.3,0.06,0.12,0.2,2.01,3y,2.01,25.18,2026-02-18T00:00:00.000Z
VTC,Vanguard Total Corporate Bond Fund,-0.076,1.01,2.93,1.11,0.85,6.31,3y,6.31,78.38,2026-02-19T00:00:00.000Z
VTEB,Vanguard Tax-Exempt Bond ETF,0.039,1.01,1.62,0.89,1.07,4.12,3y,4.12,50.88,2026-02-19T00:00:00.000Z
VTES,Vanguard Short-Term Tax-Exempt Bond ETF,-0.024,0.88,1.83,0.54,1.03,1.86,3y,1.86,102.505,2026-02-19T00:00:00.000Z
VTIP,Vanguard Short-Term Inflation-Protected Securities Index Fund,0.02,0.55,1.47,0.53,-0.64,2.91,3y,2.91,49.72,2026-02-19T00:00:00.000Z
VUSB,Vanguard Ultra-Short Bond ETF,0.02,0.22,0.5,0.09,0.18,1.57,3y,1.57,49.96,2026-02-19T00:00:00.000Z
VWOB,Vanguard Emerging Markets Government Bond Fund,-0.241,1.07,6.27,1.6,0.99,7.34,3y,7.34,68.175,2026-02-19T00:00:00.000Z
WFHY,WisdomTree Trust - WisdomTree U.S. High Yield Corporate Bond Fund,-0.026,0.31,2.59,-0.12,0.71,8.05,3y,8.05,46.6052,2026-02-17T00:00:00.000Z
WINC,iShares World Equity Income UCITS ETF,0.883,0.55,-4.81,2.4,0.93,15.07,1y,,4.8545,2026-02-18T00:00:00.000Z
WIP,SPDR FTSE International Government Inflation-Protected Bond ETF,-0.159,3.83,9.25,2.22,4.9,10.16,3y,10.16,40.815,2026-02-19T00:00:00.000Z
XBB,BondBloxx BB Rated USD High Yield Corporate Bond ETF,0.123,0.41,2.12,-0.07,1.1,5.55,3y,5.55,41.39,2026-02-18T00:00:00.000Z
XBIL,U.S. Treasury 6-Month Bill ETF,0.02,0.12,0.06,-0.02,0.05,1.34,3y,1.34,50.14,2026-02-18T00:00:00.000Z
XCCC,BondBloxx CCC-Rated USD High Yield Corporate Bond ETF,-0.093,-1.26,-4.56,-1.51,-0.83,8.32,3y,8.32,37.555,2026-02-19T00:00:00.000Z
XEMD,BondBloxx JPM USD Emerging Markets 1-10 Year Bond ETF,-0.227,1.8,6.75,1.42,2.07,5.91,3y,5.91,45.27,2026-02-19T00:00:00.000Z
XFIV,BondBloxx Bloomberg Five Year Target Duration US Treasury ETF,0,0.62,3.75,1.04,0.41,5.41,3y,5.41,49.77,2026-02-19T00:00:00.000Z
XHLF,BondBloxx Bloomberg Six Month Target Duration US Treasury ETF,0.02,0.06,0.12,-0.02,0.02,1.32,3y,1.32,50.31,2026-02-18T00:00:00.000Z
XMPT,VanEck CEF Municipal Income ETF,-0.044,2.79,1.63,1.22,2.37,8.34,3y,8.34,22.49,2026-02-18T00:00:00.000Z
XSVN,BondBloxx Bloomberg Seven Year Target Duration US Treasury ETF,-0.206,0.91,4.31,1.05,0.52,6.97,3y,6.97,48.45,2026-02-18T00:00:00.000Z
XTEN,BondBloxx Bloomberg Ten Year Target Duration US Treasury ETF,0.011,1.58,3.85,2.11,0.6,9.25,3y,9.25,46.91,2026-02-19T00:00:00.000Z
XTRE,BondBloxx Bloomberg Three Year Target Duration US Treasury ETF,-0.02,0.29,2.19,0.47,0.24,3.41,3y,3.41,49.9,2026-02-19T00:00:00.000Z
XTWO,BondBloxx Bloomberg Two Year Target Duration US Treasury ETF,-0.01,0.17,0.96,0.22,0.18,2.43,3y,2.43,49.555,2026-02-18T00:00:00.000Z
YEAR,AB Ultra Short Income ETF,0.03,0.15,0.25,0.09,-0.01,1.8,3y,1.8,50.575,2026-02-19T00:00:00.000Z
YLD,Principal Active High Yield ETF,-0.078,0.97,-1.06,0.31,1.29,6.13,3y,6.13,19.185,2026-02-19T00:00:00.000Z
ZNOV,INVESCO VICTORY SHORT-TERM BOND ETF,0,0.56,5.63,0.58,1.36,3.68,1y,,26.82,2026-02-19T00:00:00.000Z
ZROZ,PIMCO 25+ Year Zero Coupon U.S. Treasury Index Exchange-Traded Fund,-0.104,4.82,-2.3,5.56,-0.42,23.19,3y,23.19,67.01,2026-02-19T00:00:00.000Z