symbol,name,daily_change_pct,ytd_return_pct,one_year_return_pct,vol_pct,vol_window,vol_3y_pct,last_close,as_of
SEIV,SEI Enhanced U.S. Large Cap Value Fund,-0.563,17.54,19.53,15.97,3y,15.97,38.86,2025-10-09T19:09:44.327Z
SEPW,AllianzIM U.S. Large Cap Buffer20 Sep ETF,-0.064,8.9,11.02,8.29,1y,,31.46,2025-10-09T19:09:44.889Z
SETH,ProShares Short Ether Strategy ETF,4.086,-46.07,-65.35,75.84,1y,,8.025,2025-10-09T19:09:45.447Z
SETM,Sprott Critical Materials ETF,0.183,76.19,48.4,32.28,3y,32.28,27.38,2025-10-09T19:09:46.130Z
SFLO,VS Small Cap Free Cash Flow ETF,-1.006,7.21,6.89,24.26,1y,,28.84,2025-10-09T19:09:46.769Z
SFLR,Innovator Equity Managed Floor ETF,-0.083,11.42,14.91,10.21,3y,10.21,36.29,2025-10-09T19:09:47.305Z
SFY,SoFi Select 500 ETF,-0.252,19.87,26.29,18.15,3y,18.15,130.86,2025-10-09T19:09:47.848Z
SGDJ,Sprott Junior Gold Miners ETF,-6.009,110.12,101.48,38.26,3y,38.26,73.52,2025-10-09T19:09:48.520Z
SGDM,Sprott Gold Miners ETF,-4.61,111.5,101.65,32.59,3y,32.59,61.04,2025-10-09T19:09:49.175Z
SGOL,abrdn Physical Gold Shares ETF,-2.178,48.6,49.48,15.4,3y,15.4,37.73,2025-10-09T19:09:49.809Z
SH,ProShares Short S&P500,0.491,-13.39,-16.19,16.06,3y,16.06,36.81,2025-10-09T19:09:50.418Z
SHLD,Global X Defense Tech ETF,-1.734,88.39,84.39,23.22,1y,,70.27,2025-10-09T19:09:51.093Z
SHNY,MicroSectors Gold 3X Leveraged ETNs,-6.8,157.29,142.42,46.08,3y,46.08,111.02,2025-10-09T19:09:51.603Z
SIL,Global X Silver Miners ETF,-5.105,111.88,100.1,35.04,3y,35.04,70.175,2025-10-09T19:09:52.226Z
SILJ,Amplify Junior Silver Miners ETF,-5.556,123,83.57,39.84,3y,39.84,23.46,2025-10-09T19:09:52.868Z
SIVR,abrdn Physical Silver Shares ETF,-0.877,64.17,52.85,27.79,3y,27.79,46.33,2025-10-09T19:09:53.431Z
SIXG,Defiance Connective Tech ETF,0.262,35.72,50.36,28.47,1y,,64.94,2025-10-09T19:09:53.931Z
SKYY,First Trust Cloud Computing ETF,-0.313,14.56,35.06,27.54,3y,27.54,137.1,2025-10-09T19:09:54.467Z
SLV,iShares Silver Trust,-0.976,63.85,52.52,27.68,3y,27.68,44.125,2025-10-09T19:09:55.001Z
SLVO,UBS AG ETRACS Monthly Pay 2xLeveraged Silver Shares Covered Call Exchange Traded Note,-0.96,23.67,13.97,20.03,3y,20.03,92.295,2025-10-09T19:09:55.653Z
SLVP,iShares MSCI Global Silver and Metals Miners ETF,-4.337,124.36,105.79,38.81,3y,38.81,27.35,2025-10-09T19:09:56.252Z
SLX,VanEck Steel ETF,-0.858,29.2,7.16,25.69,3y,25.69,75.09,2025-10-09T19:09:56.784Z
SLYG,SPDR S&P 600 Small Cap Growth ETF,-1.173,3.52,2.05,20.92,3y,20.92,93.52,2025-10-09T19:09:57.351Z
SLYV,SPDR S&P 600 Small Cap Value ETF,-1.281,1.12,3.79,22.28,3y,22.28,87.87,2025-10-09T19:09:57.945Z
SMCY,YieldMax SMCI Option Income Strategy ETF,0,-30.6,-68.13,89.01,1y,,17.67,2025-10-09T19:09:58.455Z
SMDV,ProShares Russell 2000 Dividend Growers ETF,-0.587,-1.06,-2.64,19.64,3y,19.64,66,2025-10-09T19:09:59.073Z
SMH,VanEck Semiconductor ETF,-0.613,40.51,38.57,34.31,3y,34.31,343.95,2025-10-09T19:09:59.612Z
SMIG,Bahl & Gaynor Small/Mid Cap Income Growth ETF,-1.251,0.86,0.83,15.75,3y,15.75,29.2,2025-10-09T19:10:00.150Z
SMIN,iShares MSCI India Small-Cap ETF,-0.316,-5.64,-11.42,18.13,3y,18.13,72.61,2025-10-09T19:10:00.726Z
SMLF,iShares U.S. Small-Cap Equity Factor ETF,-1.066,9.58,13.28,20.46,3y,20.46,74.23,2025-10-09T19:10:01.316Z
SMMD,iShares Russell 2500 ETF,-1.056,9.12,10.61,19.96,3y,19.96,74.03,2025-10-09T19:10:01.865Z
SMMV,iShares MSCI USA Small-Cap Min Volatility ETF,0.397,4.07,5.6,13.35,3y,13.35,43.02,2025-10-09T19:10:02.562Z
SNOY,YieldMax SNOW Option Income Strategy ETF,-0.758,-12.91,-3.91,49.66,1y,,15.72,2025-10-09T19:10:03.145Z
SNPE,Xtrackers S&P 500 ESG ETF,-0.536,13.69,16.18,16.29,3y,16.29,60.345,2025-10-09T19:10:03.802Z
SNTH,Mrp Synthequity ETF,-0.454,22.72,22.72,17.77,SI,,30.68,2025-10-09T19:10:04.402Z
SOXL,Direxion Daily Semiconductor Bull 3X Shares,-2.56,50.65,14.49,103.32,3y,103.32,41.685,2025-10-09T19:10:05.204Z
SOXQ,Invesco PHLX Semiconductor ETF,-0.778,35.59,30.95,35.5,3y,35.5,53.57,2025-10-09T19:10:05.825Z
SOXS,Direxion Daily Semiconductor Bear 3X Shares,2.812,-80.99,-79.21,111.32,3y,111.32,4.205,2025-10-09T19:10:06.375Z
SOXX,iShares Semiconductor ETF,-1.017,33.09,25.22,34.92,3y,34.92,288.575,2025-10-09T19:10:07.030Z
SPDN,Direxion Daily S&P 500 Bear 1X Shares,0.472,-13.18,-15.48,16.32,3y,16.32,9.585,2025-10-09T19:10:08.011Z
SPDW,SPDR Portfolio Developed World ex-US ETF,-1.059,26.26,16.41,15.24,3y,15.24,42.99,2025-10-09T19:10:08.711Z
SPEM,SPDR Portfolio Emerging Markets ETF,-1.01,23.07,9.88,15.91,3y,15.91,47.05,2025-10-09T19:10:09.300Z
SPEU,SPDR Portfolio Europe ETF,-1.108,25.96,15.46,15.83,3y,15.83,49.97,2025-10-09T19:10:09.958Z
SPGM,SPDR Portfolio MSCI Global Stock Market ETF,-0.633,19.06,17.33,14.99,3y,14.99,75.34,2025-10-09T19:10:10.630Z
SPGP,Invesco S&P 500 GARP ETF,-0.792,8.75,7.86,18.32,3y,18.32,114.05,2025-10-09T19:10:11.239Z
SPHB,Invesco S&P 500 High Beta ETF,-0.803,26.91,26.42,25.63,3y,25.63,112.48,2025-10-09T19:10:11.784Z
SPHD,Invesco S&P 500 High Dividend Low Volatility ETF,-0.695,0.45,-2.61,14.27,3y,14.27,48.58,2025-10-09T19:10:12.326Z
SPHQ,Invesco S&P 500 Quality ETF,-0.697,9.7,10.93,15.03,3y,15.03,73.345,2025-10-09T19:10:12.953Z
SPLG,SPDR Portfolio S&P 500 ETF,-0.467,14.6,18.03,15.91,3y,15.91,78.81,2025-10-09T19:10:13.605Z
SPLV,Invesco S&P 500 Low Volatility ETF,-0.7,3.76,2.32,11.91,3y,11.91,72.33,2025-10-09T19:10:14.252Z
SPMD,SPDR Portfolio S&P 400 Mid Cap ETF,-1.257,4.37,4.93,18.93,3y,18.93,56.935,2025-10-09T19:10:14.891Z
SPMO,Invesco S&P 500 Momentum ETF,0.119,27.24,33.54,18.49,3y,18.49,121.575,2025-10-09T19:10:15.482Z
SPRE,SP Funds S&P Global REIT Sharia ETF,-0.67,-1.98,-9.32,19.12,3y,19.12,19.26,2025-10-09T19:10:16.019Z
SPRX,Spear Alpha ETF,1.026,51.94,84.67,38.98,3y,38.98,42.74,2025-10-09T19:10:16.671Z
SPSM,SPDR Portfolio S&P 600 Small Cap ETF,-1.323,2.17,2.86,21.3,3y,21.3,45.865,2025-10-09T19:10:17.402Z
SPTM,SPDR Portfolio S&P 1500 Composite Stock Market ETF,-0.589,13.61,16.84,15.97,3y,15.97,80.98,2025-10-09T19:10:17.947Z
SPUS,SP Funds S&P 500 Sharia Industry Exclusions ETF,-0.577,16.63,21.6,18.52,3y,18.52,50,2025-10-09T19:10:18.592Z
SPUU,Direxion Daily S&P 500 Bull 2X Shares,-0.202,24.4,30.2,31.41,3y,31.41,182.99,2025-10-09T19:10:19.212Z
SPXL,Direxion Daily S&P 500 Bull 3X Shares,-1.371,28.58,35.91,47.16,3y,47.16,215.12,2025-10-09T19:10:19.742Z
SPXS,Direxion Daily S&P 500 Bear 3X Shares,1.611,-40.7,-45.36,48.77,3y,48.77,37.535,2025-10-09T19:10:20.384Z
SPXU,ProShares UltraPro Short S&P 500 Fund,1.369,-41.36,-46.81,48.55,3y,48.55,13.33,2025-10-09T19:10:21.020Z
SPY,SPDR S&P 500 ETF Trust,-0.441,14.62,18.02,16.26,3y,16.26,670.14,2025-10-09T19:10:21.622Z
SPYD,SPDR Portfolio S&P 500 High Dividend ETF,-0.711,0.49,-3.45,16.33,3y,16.33,43.32,2025-10-09T19:10:22.303Z
SPYG,SPDR Portfolio S&P 500 Growth ETF,-0.189,19.99,28.61,19.62,3y,19.62,105.42,2025-10-09T19:10:22.866Z
SPYI,NEOS S&P 500 High Income ETF,-0.285,3.47,3.37,13.51,3y,13.51,52.52,2025-10-09T19:10:23.520Z
SPYT,Defiance S&P 500 Target Income ETF,-0.301,-4.58,-6.97,18.87,1y,,18.225,2025-10-09T19:10:24.068Z
SPYU,Max S&P 500 4X Leveraged Exchange-Traded Note,-1.975,19.14,23.58,72.97,1y,,55.08,2025-10-09T19:10:24.572Z
SPYV,SPDR Portfolio S&P 500 Value ETF,-0.859,8.86,5.83,13.95,3y,13.95,55.39,2025-10-09T19:10:25.248Z
SPYX,SPDR S&P 500 Fossil Fuel Reserves Free ETF,-0.46,14.92,18.55,16.13,3y,16.13,55.16,2025-10-09T19:10:25.761Z
SQQQ,ProShares UltraPro Short QQQ,1.004,-53.46,-62.02,64.79,3y,64.79,14.585,2025-10-09T19:10:26.288Z
SQY,YieldMax SQ Option Income Strategy ETF,1.188,-49.16,-46.97,50.23,1y,,9.37,2025-10-09T19:10:26.811Z
SRTY,ProShares UltraPro Short Russell2000,3.103,-38.85,-45.17,65.88,3y,65.88,11.465,2025-10-09T19:10:27.368Z
SRVR,Pacer Data & Infrastructure Real Estate ETF,-0.459,5.26,-0.95,19.21,3y,19.21,31.44,2025-10-09T19:10:27.993Z
SSG,ProShares UltraShort Semiconductors,-1.581,-67.54,-72.31,80.87,3y,80.87,8.405,2025-10-09T19:10:28.544Z
SSO,ProShares Ultra S&P500,-1.045,22.96,28.36,31.73,3y,31.73,113.145,2025-10-09T19:10:29.061Z
STCE,Schwab Crypto Thematic ETF,-0.104,106.85,174.4,53.06,3y,53.06,96.04,2025-10-09T19:10:29.716Z
STLG,iShares Factors US Growth Style ETF,1.265,19.86,25.56,20.89,3y,20.89,67.24,2025-10-09T19:10:30.360Z
STRV,Strive 500 ETF,-0.344,15.08,18.99,16.22,3y,16.22,43.42,2025-10-09T19:10:31.033Z
SUSA,iShares MSCI USA ESG Select ETF,0.639,12.97,14.61,16.29,3y,16.29,137.06,2025-10-09T19:10:31.633Z
SUSL,iShares ESG MSCI USA Leaders ETF,0.545,15.28,16.96,16.72,3y,16.72,118.356,2025-10-09T19:10:32.263Z
SVIX,-1X Short VIX Futures ETF,-0.282,-14.52,-8.15,70.7,3y,70.7,21.19,2025-10-09T19:10:32.928Z
SVOL,Simplify Volatility Premium ETF,-0.552,-12.99,-15.56,24.11,3y,24.11,18.02,2025-10-09T19:10:33.505Z
SVXY,ProShares Short VIX Short-Term Futures ETF,-0.255,2.67,9.93,35.82,3y,35.82,50.83,2025-10-09T19:10:34.017Z
SYLD,Cambria Shareholder Yield ETF,-1.208,-0.63,-5.9,19.34,3y,19.34,67.89,2025-10-09T19:10:34.669Z
TAIL,Cambria Tail Risk ETF,-0.085,5.25,-1.17,15.23,3y,15.23,11.82,2025-10-09T19:10:35.352Z
TAN,Invesco Solar ETF,2.557,36.25,10.33,37.86,3y,37.86,47.32,2025-10-09T19:10:35.971Z
TARK,Tradr 2x Long Innovation ETF,-2.848,107.33,50.05,91.54,3y,91.54,90.81,2025-10-09T19:10:36.498Z
TBLD,Thornburg Income Builder Opportunities Trust,-0.519,23.89,15.38,13.46,3y,13.46,20.145,2025-10-09T19:10:37.144Z
TCAF,T. Rowe Price Capital Appreciation Equity ETF,-0.621,15.86,17.03,17.17,1y,,38.42,2025-10-09T19:10:37.773Z
TCAL,T. Rowe Price Capital Appreciation Premium Income ETF,-0.462,-2.17,-2.17,12.75,SI,,24.4565,2025-10-09T19:10:38.333Z
TCHP,T. Rowe Price Blue Chip Growth ETF,-0.182,17.73,25.98,21.19,3y,21.19,49.46,2025-10-09T19:10:38.974Z
TDIV,FT NASDAQ Technology Dividend Index Fund,-0.678,26.89,25.17,20.36,3y,20.36,99.61,2025-10-09T19:10:39.625Z
TDVG,T. Rowe Price Dividend Growth ETF,-0.656,11.25,8.96,13.13,3y,13.13,43.9,2025-10-09T19:10:40.135Z
TDVI,FT Vest Technology Dividend Mutual Fund,-0.549,20.33,16.85,23.09,1y,,29,2025-10-09T19:10:40.648Z
TECL,Direxion Daily Technology Bull 3x Shares,-0.922,49.21,57.96,71.11,3y,71.11,134.27,2025-10-09T19:10:41.228Z
TECS,Direxion Daily Technology Bear 3X Shares,1.133,-62.81,-67.35,74.32,3y,74.32,17.86,2025-10-09T19:10:41.748Z
TGRT,T. Rowe Price Growth ETF,-0.451,16.59,24.07,22.74,1y,,44.13,2025-10-09T19:10:42.339Z
THD,iShares MSCI Thailand ETF,-0.755,0.6,-10.72,20.1,3y,20.1,59.835,2025-10-09T19:10:43.036Z
THNQ,Robo Global Artificial Intelligence ETF,-0.111,38.15,46.72,26.2,3y,26.2,67.775,2025-10-09T19:10:43.609Z
TILT,FlexShares Morningstar US Market Factor Tilt Index Fund,-0.471,12.82,15.57,16.61,3y,16.61,243.25,2025-10-09T19:10:44.227Z
TLTW,iShares 20+ Year Treasury Bond BuyWrite Fund,-0.086,-1.36,-10.53,12.52,3y,12.52,23.27,2025-10-09T19:10:44.787Z
TMFC,Motley Fool 100 Index ETF,-0.547,18.76,27.22,19.15,3y,19.15,70.9,2025-10-09T19:10:45.410Z
TMSL,T. Rowe Price Small-Mid Cap ETF,-0.878,8.66,9.09,21.42,1y,,35.01,2025-10-09T19:10:46.044Z
TNA,Direxion Daily Small Cap Bull 3X Shares,-2.637,11.02,10.55,64.86,3y,64.86,46.53,2025-10-09T19:10:46.568Z
TOPT,iShares Top 20 U.S. Stocks ETF,-0.195,18.29,23.72,22.39,1y,,30.7199,2025-10-09T19:10:47.146Z
TOTL,SPDR DoubleLine Total Return Tactical ETF,-0.086,2.63,-0.75,6.28,3y,6.28,40.435,2025-10-09T19:10:47.667Z
TOUS,T. Rowe Price International Equity ETF,-1.089,28.67,16.89,16.24,1y,,33.61,2025-10-09T19:10:48.256Z
TQQQ,ProShares UltraPro QQQ,-0.946,37.16,54.96,62.27,3y,62.27,107.85,2025-10-09T19:10:48.794Z
TRFK,Pacer Data and Digital Revolution ETF,-0.028,40.13,50.98,29.3,3y,29.3,71.3,2025-10-09T19:10:49.411Z
TSDD,Graniteshares 2x Short Tesla Daily ETF,3.284,-72.39,-93.22,151.77,1y,,10.38,2025-10-09T19:10:49.979Z
TSL,GraniteShares 1.25 Long TSLA ETF,-2.173,7.91,84.34,81.18,3y,81.18,18.01,2025-10-09T19:10:50.547Z
TSLL,Direxion Daily TSLA Bull 2X Shares,-3.151,-18.69,68.99,112.04,3y,112.04,19.67,2025-10-09T19:10:51.068Z
TSLQ,Tradr 2x Short Tesla Daily ETF,1.985,-72.64,-61.62,148.92,3y,148.92,8.22,2025-10-09T19:10:51.704Z
TSLR,GraniteShares 1.25x Long Tesla Daily ETF,-3.177,-16.47,76.6,139.03,1y,,31.7,2025-10-09T19:10:52.270Z
TSLS,Direxion Daily TSLA Bear 1X Shares,1.759,-35.66,-64.71,63.34,3y,63.34,5.495,2025-10-09T19:10:52.950Z
TSLT,T-Rex 2X Long Tesla Daily Target,-3.081,-19.55,68.07,138.79,1y,,26.74,2025-10-09T19:10:53.472Z
TSLY,YieldMax TSLA Option Income Strategy ETF,-1.296,-37.74,-32.09,52.84,3y,52.84,8.38,2025-10-09T19:10:54.008Z
TSLZ,T-Rex 2X Inverse Tesla Daily Fund,3.445,-73.46,-93.79,152.31,1y,,0.7417,2025-10-09T19:10:54.667Z
TSME,Thrivent Small-Mid Cap ESG ETF,-0.675,12.57,13.53,21.15,3y,21.15,41.2,2025-10-09T19:10:55.225Z
TSMX,Direxion Daily Taiwan Semiconductor Bull 2X Shares,-3.971,73.33,94.33,83.84,1y,,53.421,2025-10-09T19:10:55.718Z
TSMY,YieldMax TSM Option Income Strategy ETF,-1.449,-12.14,-15.51,37.36,1y,,17,2025-10-09T19:10:56.277Z
TSPA,T. Rowe Price U.S. Equity Research ETF,-0.472,14.13,18.09,15.97,3y,15.97,42.17,2025-10-09T19:10:56.969Z
TSPY,Tappalpha SPY G and D Index ETF,-0.372,1.9,1.52,18.34,1y,,25.425,2025-10-09T19:10:57.456Z
TTAC,Abacus FCF Leaders ETF,-0.583,7.67,10.69,15.97,3y,15.97,71.61,2025-10-09T19:10:58.136Z
TUA,Simplify Short Term Treasury Futures Strategy ETF,-0.091,3.15,-1.4,11.54,3y,11.54,21.91,2025-10-09T19:10:58.716Z
TUR,iShares MSCI Turkey ETF,-0.803,-8.5,-1.88,32.02,3y,32.02,33.35,2025-10-09T19:10:59.264Z
TVAL,T. Rowe Price Value ETF,-0.581,11.04,7.61,15.58,1y,,34.21,2025-10-09T19:10:59.848Z
TWM,ProShares UltraShort Russell2000,1.993,-25.04,-29.61,43.76,3y,43.76,33.26,2025-10-09T19:11:00.460Z
TZA,Direxion Daily Small Cap Bear 3X Shares,2.771,-38.42,-43.68,66.18,3y,66.18,7.975,2025-10-09T19:11:01.059Z
UAE,iShares MSCI UAE ETF,-0.311,17.69,32.07,16.82,3y,16.82,19.23,2025-10-09T19:11:01.596Z
UCO,ProShares Ultra Bloomberg Crude Oil,-2.333,-22.86,-29.23,52.03,3y,52.03,21.77,2025-10-09T19:11:02.153Z
UDEC,Innovator U.S. Equity Ultra Fund,0.416,10.03,10.14,7.57,3y,7.57,38.6,2025-10-09T19:11:02.681Z
UDN,Invesco DB US Dollar Index Bearish Fund,-0.618,11.42,-0.62,8.8,3y,8.8,18.485,2025-10-09T19:11:03.216Z
UDOW,ProShares UltraPro Dow30,-2.14,13.49,13.53,41.58,3y,41.58,106.09,2025-10-09T19:11:03.780Z
UFO,Procure Space ETF,-0.149,72.2,112.16,27.95,3y,27.95,40.14,2025-10-09T19:11:04.316Z
UGL,ProShares Ultra Gold,-4.588,100.88,98.8,31.2,3y,31.2,48.04,2025-10-09T19:11:04.823Z
ULTY,YieldMax Ultra Option Income Strategy ETF,-1.892,-39.77,-47.94,34.08,1y,,5.445,2025-10-09T19:11:05.346Z
UNG,"United States Natural Gas Fund, L.P.",-2.061,-24.57,-16.58,61.4,3y,61.4,12.83,2025-10-09T19:11:05.878Z
UPRO,ProShares UltraPro S&P500,-1.403,28.75,35.99,47.34,3y,47.34,113.17,2025-10-09T19:11:06.466Z
URA,Global X Uranium ETF,-0.666,80.29,69.78,36.49,3y,36.49,50.68,2025-10-09T19:11:07.116Z
URAA,Direxion Daily Uranium Industry Bull 2X Shares,-0.302,128.1,94.32,80.02,1y,,46.19,2025-10-09T19:11:07.714Z
URNJ,Sprott Junior Uranium Miners ETF,-0.643,44.51,31.33,49.6,3y,49.6,30.115,2025-10-09T19:11:08.286Z
URNM,Sprott Uranium Miners ETF,-0.147,41.28,28.92,39.13,3y,39.13,61.02,2025-10-09T19:11:08.913Z
URTH,iShares MSCI World ETF,-0.648,17.48,17.63,15.22,3y,15.22,182.33,2025-10-09T19:11:09.524Z
URTY,ProShares UltraPro Russell2000,-2.913,10.14,9.6,65.06,3y,65.06,54.32,2025-10-09T19:11:10.091Z
USD,ProShares Ultra Semiconductors,0.95,60.42,71.39,77.5,3y,77.5,108.38,2025-10-09T19:11:10.694Z
USDU,WisdomTree Bloomberg U.S. Dollar Bullish Fund,0.544,-3.68,-0.35,8.98,3y,8.98,26.795,2025-10-09T19:11:11.288Z
USDX,SGI Enhanced Core ETF,0.077,1.19,-0.17,3.74,1y,,25.875,2025-10-09T19:11:11.813Z
USMC,Principal U.S. Mega-Cap ETF,0,14.92,20.99,15.97,3y,15.97,68.48,2025-10-09T19:11:12.377Z
USMV,iShares MSCI USA Min Vol Factor ETF,-0.65,6.94,5.22,11.59,3y,11.59,94.81,2025-10-09T19:11:12.931Z
USO,"United States Oil Fund, LP",-1.7,-6.04,-8.74,30.2,3y,30.2,72.28,2025-10-09T19:11:13.427Z
USPX,Franklin U.S. Equity Index ETF,-0.399,14.82,18.59,16.73,3y,16.73,58.915,2025-10-09T19:11:14.036Z
USRT,iShares Core U.S. REIT ETF,-0.83,0.97,-4.11,19.27,3y,19.27,57.34,2025-10-09T19:11:14.720Z
USVM,VictoryShares US Small Mid Cap Value Momentum ETF,-1.197,6.39,6.62,18.93,3y,18.93,89.71,2025-10-09T19:11:15.325Z
USXF,iShares ESG Aware MSCI USA ETF,-0.344,16.28,18.39,18.66,3y,18.66,58,2025-10-09T19:11:15.940Z
UTES,Virtus Reaves Utilities ETF,-0.37,31.93,33.61,20.93,3y,20.93,86.19,2025-10-09T19:11:16.570Z
UTSL,Direxion Daily Utilities Bull 3X Shares,-0.707,50.72,29.83,52.14,3y,52.14,49.18,2025-10-09T19:11:17.131Z
UUP,Invesco DB US Dollar Index Bullish Fund,0.754,-5.46,-2.23,8.66,3y,8.66,28.05,2025-10-09T19:11:17.674Z
UVIX,2x Long VIX Futures ETF,0.702,-71.56,-83.96,133.07,3y,133.07,10.04,2025-10-09T19:11:18.373Z
UVXY,ProShares Ultra VIX Short-Term Futures ETF,0.861,-50.75,-66.04,98.98,3y,98.98,10.54,2025-10-09T19:11:18.965Z
UWM,ProShares Ultra Russell2000,-1.955,12.37,13.61,43.44,3y,43.44,47.15,2025-10-09T19:11:19.657Z
VAW,Vanguard Materials ETF,-1.719,8.87,-2.74,18.48,3y,18.48,202.44,2025-10-09T19:11:20.401Z
VB,Vanguard Small-Cap ETF,-1.054,6.35,8.75,19.99,3y,19.99,255.26,2025-10-09T19:11:21.043Z
VBK,Vanguard Small-Cap Growth ETF,-0.733,8.1,14.26,21.72,3y,21.72,303.33,2025-10-09T19:11:21.621Z
VBR,Vanguard Small-Cap Value ETF,-1.315,4.85,4.57,19.28,3y,19.28,207.13,2025-10-09T19:11:22.147Z
VCR,Vanguard Consumer Discretionary ETF,-0.771,4.38,17.12,22.23,3y,22.23,387.925,2025-10-09T19:11:22.672Z
VDC,Vanguard Consumer Staples ETF,0.066,0.68,-0.28,12.14,3y,12.14,212.23,2025-10-09T19:11:23.297Z
VDE,Vanguard Energy ETF,-1.453,1.07,-4.99,23.27,3y,23.27,124.09,2025-10-09T19:11:23.902Z
VEA,Vanguard FTSE Developed Markets ETF,-0.953,26.28,16.15,15.4,3y,15.4,60.26,2025-10-09T19:11:24.469Z
VEU,Vanguard FTSE All-World ex-US ETF,-1.034,25.51,14.3,14.91,3y,14.91,71.79,2025-10-09T19:11:25.107Z
VFH,Vanguard Financials ETF,-0.625,9.98,18.43,18.37,3y,18.37,129.595,2025-10-09T19:11:25.624Z
VFLO,VictoryShares Free Cash Flow ETF,-1.119,10.32,11.34,19.54,1y,,37.565,2025-10-09T19:11:26.189Z
VFMO,Vanguard U.S. Momentum Factor Fund,-0.153,18.36,22.45,20.33,3y,20.33,195.49,2025-10-09T19:11:26.705Z
VFMV,Vanguard U.S. Minimum Volatility ETF,0.356,8.17,7.44,11.34,3y,11.34,130.26,2025-10-09T19:11:27.220Z
VFVA,Vanguard U.S. Value Factor Fund,-1.054,7.03,5.61,20.1,3y,20.1,126.595,2025-10-09T19:11:27.799Z
VGK,Vanguard FTSE Europe ETF,-1.204,26.58,15.49,16.4,3y,16.4,79.985,2025-10-09T19:11:28.386Z
VGT,Vanguard Information Technology ETF,-0.254,23.29,31.89,24.18,3y,24.18,766.07,2025-10-09T19:11:28.905Z
VHT,Vanguard Health Care ETF,-0.206,5.78,-2.75,14.08,3y,14.08,268.755,2025-10-09T19:11:29.578Z
VIG,Vanguard Dividend Appreciation ETF,-0.647,11.04,10.7,13.4,3y,13.4,216.4,2025-10-09T19:11:30.286Z
VIGI,Vanguard International Dividend Appreciation Index Fund,-0.733,12.8,3.99,13.64,3y,13.64,90.105,2025-10-09T19:11:30.786Z
VIOG,Vanguard S&P Small-Cap 600 Growth ETF,-1.181,3.34,2.07,20.9,3y,20.9,120.45,2025-10-09T19:11:31.447Z
VIOO,Vanguard S&P Small-Cap 600 ETF,-1.208,3.53,3.17,45.97,3y,45.97,109.59,2025-10-09T19:11:32.097Z
VIOV,Vanguard S&P Small-Cap 600 Value ETF,-1.417,1.56,4.32,46.36,3y,46.36,94.245,2025-10-09T19:11:32.794Z
VIS,Vanguard Industrials ETF,-1.589,16.4,13.79,17.43,3y,17.43,295.45,2025-10-09T19:11:33.384Z
VIXM,ProShares VIX Mid-Term Futures ETF,0.125,9.45,-1.05,32.93,3y,32.93,15.99,2025-10-09T19:11:33.913Z
VIXY,ProShares VIX Short-Term Futures ETF,0.511,-29.38,-42.98,67.67,3y,67.67,32.455,2025-10-09T19:11:34.627Z
VLU,SPDR S&P 1500 Value Tilt ETF,0.254,11.59,11.34,14.66,3y,14.66,204.94,2025-10-09T19:11:35.300Z
VLUE,iShares MSCI USA Value Factor ETF,-1.06,19.08,15.75,16.31,3y,16.31,125.585,2025-10-09T19:11:35.852Z
VNM,VanEck Vietnam ETF,1.546,61.89,51.05,25.56,3y,25.56,18.715,2025-10-09T19:11:36.399Z
VNQ,Vanguard Real Estate ETF,-0.785,0.87,-5.53,19.11,3y,19.11,89.055,2025-10-09T19:11:36.982Z
VNQI,Vanguard Global ex-US Real Estate Index Fund,-0.719,19.57,1.34,15.68,3y,15.68,46.98,2025-10-09T19:11:37.543Z
VO,Vanguard Mid-Cap ETF,-0.965,10.91,11.79,16.33,3y,16.33,292.52,2025-10-09T19:11:38.178Z
VOE,Vanguard Mid-Cap Value ETF,-0.957,7.16,4.38,15.34,3y,15.34,172.76,2025-10-09T19:11:38.876Z
VONE,Vanguard Russell 1000 ETF,-0.281,14.57,18.4,16.15,3y,16.15,304.76,2025-10-09T19:11:39.480Z
VONG,Vanguard Russell 1000 Growth Fund,-0.323,18.09,27.65,20.08,3y,20.08,121.795,2025-10-09T19:11:40.130Z
VONV,Vanguard Russell 1000 Value Index Fund,-0.817,9.98,7.9,14.15,3y,14.15,89.235,2025-10-09T19:11:40.681Z
VOO,Vanguard S&P 500 ETF,-0.428,14.64,18.05,15.87,3y,15.87,616.12,2025-10-09T19:11:41.190Z
VOOG,Vanguard S&P 500 Growth ETF,-0.245,19.88,28.5,19.67,3y,19.67,439,2025-10-09T19:11:41.839Z
VOOV,Vanguard S&P 500 Value ETF,-0.847,8.75,5.85,14.05,3y,14.05,199.665,2025-10-09T19:11:42.491Z
VOT,Vanguard Mid-Cap Growth ETF,-0.683,15.81,21.58,19.13,3y,19.13,295.08,2025-10-09T19:11:43.025Z
VOTE,TCW Transform 500 ETF,0.633,15.43,18.3,16.11,3y,16.11,79.275,2025-10-09T19:11:43.563Z
VOX,Vanguard Communication Services ETF,-0.341,18.1,27.7,19.94,3y,19.94,184.29,2025-10-09T19:11:44.244Z
VPL,Vanguard FTSE Pacific ETF,-0.727,25.05,14.34,16.34,3y,16.34,88.8,2025-10-09T19:11:44.788Z
VPN,Global X Data Center REITs & Digital Infrastructure ETF,-0.468,28.15,22.82,21.21,3y,21.21,21.26,2025-10-09T19:11:45.415Z
VPU,Vanguard Utilities ETF,-0.442,19.18,14.65,17.11,3y,17.11,196.07,2025-10-09T19:11:45.922Z
VRP,Invesco Variable Rate Preferred ETF,-0.101,2.04,1.71,7.55,3y,7.55,24.745,2025-10-09T19:11:46.486Z
VSGX,Vanguard ESG International Stock ETF,-1.036,23.51,13.62,14.92,3y,14.92,69.72,2025-10-09T19:11:47.119Z
VSLU,Applied Finance Valuation Large Cap ETF,0.391,18,19.6,15.63,3y,15.63,43.14,2025-10-09T19:11:47.736Z
VSS,Vanguard FTSE All-World ex-US Small-Cap ETF,-0.891,24.6,14.38,15.26,3y,15.26,142.39,2025-10-09T19:11:48.256Z
VT,Vanguard Total World Stock ETF,-0.688,18.14,16.6,14.93,3y,14.93,138.51,2025-10-09T19:11:48.761Z
VTHR,Vanguard Russell 3000 ETF,-0.471,14.2,17.76,16.34,3y,16.34,295.98,2025-10-09T19:11:49.294Z
VTI,Vanguard Total Stock Market ETF,-0.491,14.15,17.85,16.47,3y,16.47,330.18,2025-10-09T19:11:49.797Z
VTV,Vanguard Value ETF,-0.695,9.88,7.19,13.29,3y,13.29,185.77,2025-10-09T19:11:50.339Z
VTWG,Vanguard Russell 2000 Growth ETF,-0.697,12.78,16.61,22.59,3y,22.59,238.03,2025-10-09T19:11:50.857Z
VTWO,Vanguard Russell 2000 ETF,-1.013,10.37,12.18,21.74,3y,21.74,98.67,2025-10-09T19:11:51.522Z
VTWV,Vanguard Russell 2000 Value Index Fund,-1.147,8.05,7.99,21.91,3y,21.91,156.04,2025-10-09T19:11:52.045Z
VUG,Vanguard Growth ETF,-0.327,18.52,28.1,20.79,3y,20.79,485.495,2025-10-09T19:11:52.605Z
VV,Vanguard Large-Cap Index Fund ETF Shares,-0.492,14.97,18.96,16.3,3y,16.3,309.62,2025-10-09T19:11:53.250Z
VWO,Vanguard FTSE Emerging Markets ETF,-0.946,24.02,10.06,16.16,3y,16.16,54.47,2025-10-09T19:11:53.766Z
VXF,Vanguard Extended Market ETF,-0.865,10.71,16.97,21.05,3y,21.05,210.91,2025-10-09T19:11:54.347Z
VXUS,Vanguard Total International Stock Index Fund,-1.006,25.41,14.42,14.9,3y,14.9,73.78,2025-10-09T19:11:54.896Z
VYM,Vanguard High Dividend Yield ETF,-0.772,9.89,9.63,13.6,3y,13.6,140.16,2025-10-09T19:11:55.510Z
VYMI,Vanguard International High Dividend Yield Index Fund,-0.907,24.56,14.97,14.36,3y,14.36,84.15,2025-10-09T19:11:56.076Z
WCLD,WisdomTree Cloud Computing Fund,0.409,-5.16,13.22,31.58,3y,31.58,35.595,2025-10-09T19:11:56.616Z
WCMI,First Trust WCM International Equity ETF,-1.111,29.59,6.69,21.5,1y,,16.9693,2025-10-09T19:11:57.106Z
WEAT,Teucrium Commodity Trust - Teucrium Wheat Fund,0,-14.23,-23.65,24.61,3y,24.61,4.1,2025-10-09T19:11:57.661Z
WEBL,Direxion Daily Dow Jones Internet Bull 3x Shares,0.24,24.01,79.58,72.12,3y,72.12,33.42,2025-10-09T19:11:58.296Z
WGMI,Valkyrie Bitcoin Miners ETF,1.553,142.41,201.39,81.13,3y,81.13,56.24,2025-10-09T19:11:59.011Z
WINN,Harbor Long-Term Growers ETF,-0.253,16.05,24.41,21.29,3y,21.29,31.6,2025-10-09T19:11:59.673Z
WTAI,WisdomTree Artificial Intelligence and Innovation Fund,-0.033,36.75,52.85,28.53,3y,28.53,30.25,2025-10-09T19:12:00.359Z
WTV,WisdomTree U.S. Value Fund,-1.03,8.58,12.2,16.85,3y,16.85,90.34,2025-10-09T19:12:01.000Z
WWJD,Inspire International ETF,-0.323,23.06,11.77,15.57,3y,15.57,35.455,2025-10-09T19:12:01.684Z
XAR,SPDR S&P Aerospace & Defense ETF,-1.674,48.43,54.53,20.51,3y,20.51,245.46,2025-10-09T19:12:02.271Z
XBI,SPDR S&P Biotech ETF,0.944,16.28,10.49,28.14,3y,28.14,106.435,2025-10-09T19:12:03.163Z
XCEM,Columbia EM Core ex-China ETF,-0.779,24.7,14.96,15.61,3y,15.61,36.96,2025-10-09T19:12:03.747Z
XES,SPDR S&P Oil & Gas Equipment & Services ETF,-2.839,-11.3,-16.72,35.72,3y,35.72,71.87,2025-10-09T19:12:04.424Z
XHB,SPDR S&P Homebuilders ETF,-2.375,1.7,-13.26,26.61,3y,26.61,105.24,2025-10-09T19:12:04.981Z
XLB,Materials Select Sector SPDR Fund,-1.618,6.29,-6.79,18,3y,18,88.445,2025-10-09T19:12:05.511Z
XLC,Communication Services Select Sector SPDR Fund,-0.415,18.32,28.37,19.48,3y,19.48,115.1,2025-10-09T19:12:06.006Z
XLE,Energy Select Sector SPDR Fund,-1.467,1.16,-6.25,23,3y,23,87.665,2025-10-09T19:12:06.614Z
XLF,Financial Select Sector SPDR Fund,-0.57,10.36,18,17.32,3y,17.32,53.205,2025-10-09T19:12:07.200Z
XLG,Invesco S&P 500 Top 50 ETF,-0.223,16.58,23.66,17.97,3y,17.97,58.07,2025-10-09T19:12:07.854Z
XLI,Industrial Select Sector SPDR Fund,-1.6,16.6,13.26,16.47,3y,16.47,153.1,2025-10-09T19:12:08.406Z
XLK,Technology Select Sector SPDR Fund,-0.347,24.88,29.47,24.06,3y,24.06,289.68,2025-10-09T19:12:08.912Z
XLP,Consumer Staples Select Sector SPDR Fund,0.084,-0.66,-3.48,12.16,3y,12.16,77.855,2025-10-09T19:12:09.414Z
XLRE,The Real Estate Select Sector SPDR Fund,-0.629,1.91,-4.95,19.21,3y,19.21,41.06,2025-10-09T19:12:10.058Z
XLSR,SPDR SSGA US Sector Rotation ETF,-0.124,13.17,17.46,16.52,3y,16.52,60.305,2025-10-09T19:12:10.701Z
XLU,Utilities Select Sector SPDR Fund,-0.308,18.68,13.95,17.3,3y,17.3,90.52,2025-10-09T19:12:11.221Z
XLV,Health Care Select Sector SPDR Fund,-0.329,4.67,-4.59,13.84,3y,13.84,144.035,2025-10-09T19:12:11.770Z
XLY,Consumer Discretionary Select Sector SPDR Fund,-0.571,6.17,20.48,21.98,3y,21.98,235.05,2025-10-09T19:12:12.310Z
XME,SPDR S&P Metals & Mining ETF,-0.548,76.49,59.27,28.02,3y,28.02,101.71,2025-10-09T19:12:12.932Z
XMHQ,Invesco S&P MidCap Quality ETF,-1.436,5.68,2.49,19.96,3y,19.96,104.015,2025-10-09T19:12:13.433Z
