symbol,name,daily_change_pct,ytd_return_pct,one_year_return_pct,perf_1m_pct,perf_3m_pct,vol_pct,vol_window,vol_3y_pct,beta,last_close,as_of
FEX,First Trust Large Cap Core Fund A,-1.615,0,16.17,-5.66,2.24,14.28,3y,14.28,0.95,120.0181,2026-03-20T00:00:00.000Z
FEZ,SPDR Euro Stoxx 50 ETF,-3.475,-8.21,4.44,-11.48,-5.96,17.33,3y,17.33,0.97,60,2026-03-20T00:00:00.000Z
FFEB,FT Vest US Equity Buffer ETF,-0.969,-1.69,13.2,-3.32,-0.37,9.59,3y,9.59,0.55,55.685,2026-03-20T00:00:00.000Z
FFLC,Fidelity Large Cap Core Fund,-1.757,-5.32,14.54,-6.66,-2.6,15.45,3y,15.45,1.04,50.88,2026-03-20T00:00:00.000Z
FFLG,Fidelity Fund Large Cap Growth ETF,-2.476,-7.67,21.19,-5.37,-3.86,21.51,3y,21.51,1.44,27.765,2026-03-20T00:00:00.000Z
FFOG,Franklin Focused Growth Mutual Fund,-2.545,-11.08,14.78,-4.88,-8.56,25.68,1y,,1.54,41.35,2026-03-20T00:00:00.000Z
FFSM,Fidelity Small-Mid Cap Opportunities ETF,-2.744,0.1,21.31,-8.45,1.4,18.89,3y,18.89,1.19,31.19,2026-03-20T00:00:00.000Z
FFTY,Innovator IBD 50 ETF,-3.821,-3.24,20.25,-12.53,0.96,29.08,3y,29.08,2.24,33.73,2026-03-20T00:00:00.000Z
FGD,First Trust Dow Jones Global Select Dividend Index Fund,-2.55,1.04,25.14,-8.51,3.27,13.59,3y,13.59,0.78,30.96,2026-03-20T00:00:00.000Z
FGDL,Franklin Responsibly Sourced Gold ETF,-2.868,3.4,46.84,-10.26,3.34,19.51,3y,19.51,0.56,59.94,2026-03-20T00:00:00.000Z
FGLD,Franklin Responsibly Sourced Gold ETF,-2.868,3.4,47.45,-10.26,3.34,19.54,3y,19.54,0.5,59.94,2026-03-20T00:00:00.000Z
FGRO,Fidelity Growth Opportunities ETF,-2.476,-7.67,23.4,-5.37,-3.86,21.56,3y,21.56,1.45,27.765,2026-03-20T00:00:00.000Z
FHEQ,Fidelity Hedged Equity ETF,-0.873,-4.5,10.67,-3.87,-3.81,11.05,1y,,0.74,29.53,2026-03-20T00:00:00.000Z
FHLC,Fidelity MSCI Health Care Index ETF,-1.311,-7.12,0.39,-7.74,-6.28,13.75,3y,13.75,0.52,69.25,2026-03-20T00:00:00.000Z
FIAT,YieldMax Short COIN Option Income Strategy ETF,2.537,-8.23,-71.83,-20.3,-10.07,62.12,1y,,-2.41,24.65,2026-03-20T00:00:00.000Z
FIBR,iShares Systematic Bond ETF,-1.02,-1.59,1.14,-2.58,-1.62,4.76,3y,4.76,0.07,88.31,2026-03-20T00:00:00.000Z
FIDI,Fidelity International High Dividend ETF,-3.152,1.51,18.9,-5.9,2.96,14.03,3y,14.03,0.64,26.575,2026-03-20T00:00:00.000Z
FIDU,Fidelity MSCI Industrials Index ETF,-1.904,2.21,22.6,-9.15,5.56,16.77,3y,16.77,1.04,86.03,2026-03-20T00:00:00.000Z
FILL,iShares US Power Infrastructure ETF,-3.061,7.03,4.44,-2.73,10.56,19.63,3y,19.63,0.82,25.65,2026-03-20T00:00:00.000Z
FINX,GLOBAL X FINTECH ETF,-1.483,-18.9,-17.18,0.29,-19.09,26.49,3y,26.49,1.87,23.91,2026-03-20T00:00:00.000Z
FISR,SPDR SSGA Fixed Income Sector Rotation ETF,-0.939,-1.3,-1.28,-2.34,-1.66,6.08,3y,6.08,0.05,25.528,2026-03-20T00:00:00.000Z
FIVA,Fidelity International Value Factor ETF,-3.718,-3.58,19.24,-11.54,-0.48,14.77,3y,14.77,0.88,33.41,2026-03-20T00:00:00.000Z
FIW,First Trust Water ETF,-1.377,-7.08,-0.8,-10.03,-7.15,16.32,3y,16.32,0.79,101.73,2026-03-20T00:00:00.000Z
FJAN,FT Vest U.S. Equity Buffer ETF FJAN,-1.082,-2.94,12.39,-3.25,-1.28,9.25,3y,9.25,0.57,50.26,2026-03-20T00:00:00.000Z
FLBR,Franklin FTSE Brazil ETF,-4.154,12.62,27.89,-8.05,10.72,24.35,3y,24.35,1.04,21.69,2026-03-20T00:00:00.000Z
FLCA,Franklin FTSE Canada ETF,-1.461,-1.98,27.47,-6.15,-0.47,15.23,3y,15.23,0.86,47.535,2026-03-20T00:00:00.000Z
FLCH,Franklin FTSE China ETF,-2.986,-10.42,-2.94,-8.82,-7.58,26.72,3y,26.72,0.95,22.09,2026-03-20T00:00:00.000Z
FLGB,Franklin FTSE United Kingdom ETF,-2.963,-1.85,14.69,-8.26,-0.41,14.45,3y,14.45,0.7,33.41,2026-03-20T00:00:00.000Z
FLIN,Franklin FTSE India ETF,-1.976,-14.77,-8.02,-10.72,-12.41,13.86,3y,13.86,0.43,33.24,2026-03-20T00:00:00.000Z
FLJH,Franklin FTSE Japan Hedged ETF,-2.497,2.09,21.35,-8.61,-1.55,23.96,3y,23.96,0.92,38.66,2026-03-20T00:00:00.000Z
FLJP,Franklin FTSE Japan ETF,-3.393,0.03,13.34,-11.08,-2.33,18.1,3y,18.1,0.96,34.74,2026-03-20T00:00:00.000Z
FLKR,Franklin FTSE South Korea ETF,-6.595,22.09,109.61,-7.27,34.84,26.66,3y,26.66,1.9,40.79,2026-03-20T00:00:00.000Z
FLLA,Franklin FTSE Latin America ETF,-3.411,7.2,30.84,-9.71,7.03,20.81,3y,20.81,1.01,26.05,2026-03-20T00:00:00.000Z
FLMX,Franklin FTSE Mexico ETF,-2.903,0.46,32.78,-12.81,1.68,22.91,3y,22.91,0.87,34.178,2026-03-20T00:00:00.000Z
FLQG,Franklin LibertyQ Global Equity ETF,-1.724,-5.38,15.32,-5.16,-3.82,15.11,3y,15.11,1.01,56.705,2026-03-20T00:00:00.000Z
FLQL,Franklin U.S. Large Cap Multisector Fund,-1.784,-3.68,17.43,-5.54,-1.84,15.07,3y,15.07,1.06,67.16,2026-03-20T00:00:00.000Z
FLQM,Franklin U.S. Mid Cap Multifactor Index Fund,-1.148,-3.84,2.41,-6.18,-4.68,14.71,3y,14.71,0.64,54.35,2026-03-20T00:00:00.000Z
FLSP,Franklin Systematic Style Premia ETF,0.411,0.04,12.43,-2.02,-1.76,13.08,3y,13.08,0.17,26.87,2026-03-20T00:00:00.000Z
FLTW,Franklin FTSE Taiwan ETF,-3.447,8.73,47.51,-3.78,14.46,22.17,3y,22.17,1.47,67.5,2026-03-20T00:00:00.000Z
FMAT,Fidelity MSCI Materials Index ETF,-2.231,-0.13,9,-12.49,1.72,17.48,3y,17.48,0.92,53.9,2026-03-20T00:00:00.000Z
FMDE,Fidelity Enhanced Mid Cap ETF,-2.106,-3.58,10.48,-6.14,-2.43,18.7,1y,,0.99,35.32,2026-03-20T00:00:00.000Z
FMIL,Fidelity New Millennium ETF,-1.757,-5.32,15.85,-6.66,-2.6,15.54,3y,15.54,1.04,50.88,2026-03-20T00:00:00.000Z
FNCL,Fidelity MSCI Financials Index ETF,-0.46,-11.25,-0.29,-7.02,-10.9,17.05,3y,17.05,0.8,69.23,2026-03-20T00:00:00.000Z
FNDA,Schwab Fundamental U.S. Small Company ETF,-2.103,-0.53,12.87,-8.61,-0.5,19.65,3y,19.65,1.1,31.65,2026-03-20T00:00:00.000Z
FNDB,Schwab Fundamental U.S. Broad Market ETF,-1.215,0.11,15.31,-5.23,1.59,13.44,3y,13.44,0.79,26.82,2026-03-20T00:00:00.000Z
FNDC,Schwab Fundamental International Small Company Index ETF,-2.52,-0.18,19.85,-9.97,2.4,14.34,3y,14.34,0.77,44.87,2026-03-20T00:00:00.000Z
FNDE,Schwab Fundamental Emerging Markets Large Company Index ETF,-2.91,-0.33,15.34,-7.51,4.77,16.87,3y,16.87,0.93,36.7,2026-03-20T00:00:00.000Z
FNDF,Schwab Fundamental International Large Company Index ETF,-3.002,2.79,25.95,-8.25,6.57,14.71,3y,14.71,0.85,47.17,2026-03-20T00:00:00.000Z
FNDX,Schwab Fundamental U.S. Large Company Index ETF,-1.079,0.26,15.69,-4.91,1.85,13.25,3y,13.25,0.75,27.51,2026-03-20T00:00:00.000Z
FNGB,MicroSectors FANG+ 3X Leveraged ETNs,-6.478,-28.8,16.71,-5.45,-28.86,75.15,1y,,3.85,17.18,2026-03-20T00:00:00.000Z
FNGD,MicroSectors FANG+ Index -3X Inverse Leveraged Exchange Traded Note,7.063,28.94,-55.84,2.55,27.55,77.19,3y,77.19,-3.92,70.79,2026-03-20T00:00:00.000Z
FNGG,Direxion Daily NYSE FANG+ Bull 2X Shares,-3.991,-18.74,9.23,-3.16,-18.69,50.98,3y,50.98,2.55,162.13,2026-03-20T00:00:00.000Z
FNGS,MicroSectors FANG+ ETN,-2.46,-8.89,17.09,-1.13,-8.65,25.84,3y,25.84,1.36,61.06,2026-03-20T00:00:00.000Z
FNGU,MicroSectors FANG+ Index 3X Leveraged ETN,-6.478,-28.8,-96.79,-5.45,-28.86,192.07,3y,192.07,3.83,17.18,2026-03-20T00:00:00.000Z
FNX,First Trust Mid Cap Core AlphaDEX Fund,-2.114,-2.19,13.21,-8.81,-0.96,18.95,3y,18.95,1.09,125.02,2026-03-20T00:00:00.000Z
FNY,First Trust Mid Cap Growth Fund,-2.632,-4.02,17.49,-8.26,-1.45,20.23,3y,20.23,1.43,89.16,2026-03-20T00:00:00.000Z
FOXY,Simplify Currency Strategy ETF,0.932,11.91,12.74,2.4,7.41,16.58,1y,,0.13,30.31,2026-03-20T00:00:00.000Z
FPAG,FPA Global Equity ETF,-1.39,-5.26,15.05,-10.2,-3.27,16.01,3y,16.01,0.98,35.48,2026-03-20T00:00:00.000Z
FPE,First Trust Preferred Securities and Income ETF,-1.278,-2.74,0.11,-3.74,-2.31,5.41,3y,5.41,0.23,17.77,2026-03-20T00:00:00.000Z
FPEI,First Trust Institutional Preferred Securities and Income ETF,-0.936,-2.01,1.55,-2.81,-1.42,4.85,3y,4.85,0.15,19.05,2026-03-20T00:00:00.000Z
FPX,First Trust US Equity Opportunities ETF,-3.19,-2.94,38.17,-2.9,-0.24,25.69,3y,25.69,1.66,160.23,2026-03-20T00:00:00.000Z
FQAL,Fidelity Quality Factor ETF,-1.811,-4.63,11.33,-5.72,-3.23,13.81,3y,13.81,0.93,72.13,2026-03-20T00:00:00.000Z
FRDM,Freedom 100 Emerging Markets ETF,-3.762,2.59,48.51,-10.12,11.37,19.55,3y,19.55,1.38,53.97,2026-03-20T00:00:00.000Z
FREL,Fidelity MSCI Real Estate Index ETF,-4.066,-0.86,-3.75,-6.88,-1.77,17.27,3y,17.27,0.44,26.66,2026-03-20T00:00:00.000Z
FRNW,Fidelity Clean Energy ETF,-2.472,6.03,63.31,-2.72,13.7,26.19,3y,26.19,1.51,22.49,2026-03-20T00:00:00.000Z
FSIG,First Trust Limited Duration Investment Grade Corporate ETF,-0.526,-1.49,-0.74,-1.72,-1.15,3.08,3y,3.08,0.04,18.9,2026-03-20T00:00:00.000Z
FSMD,Fidelity Small-Mid Multifactor ETF,-2.728,-2.2,9.77,-7.92,-2.33,17.23,3y,17.23,0.96,43.5,2026-03-20T00:00:00.000Z
FSMO,Fidelity Covington Trust - Fidelity Small-Mid Cap Opportunities ETF,-2.744,0.1,23.38,-8.45,1.4,18.91,3y,18.91,1.19,31.19,2026-03-20T00:00:00.000Z
FSTA,Fidelity MSCI Consumer Staples Index ETF,-1.516,4.46,2.66,-7.33,1.64,11.87,3y,11.87,0.02,51.33,2026-03-20T00:00:00.000Z
FTA,First Trust Large Cap Value AlphaDEX Fund,-1.096,3.79,17.1,-4.73,4.69,14.57,3y,14.57,0.56,90.2,2026-03-20T00:00:00.000Z
FTC,First Trust Large Cap Growth Fund,-2.348,-5.22,14.59,-6.18,-1.79,18.01,3y,18.01,1.4,153.49,2026-03-20T00:00:00.000Z
FTCS,First Trust Capital Strength ETF,-0.647,-0.37,3.74,-5.7,-0.65,11.2,3y,11.2,0.41,92.17,2026-03-20T00:00:00.000Z
FTEC,Fidelity MSCI Information Technology Index ETF,-2.384,-6.84,24.69,-4.16,-3.63,23.17,3y,23.17,1.59,210.06,2026-03-20T00:00:00.000Z
FTGC,First Trust Global Tactical Commodity Strategy Fund,0.07,23.42,12.74,15,24.87,16.41,3y,16.41,0.2,28.67,2026-03-20T00:00:00.000Z
FTGS,First Trust Growth Strength ETF,-1.324,-3.55,13,-4.42,-2.93,16.48,3y,16.48,0.95,34.058,2026-03-20T00:00:00.000Z
FTHI,First Trust Exchange-Traded Fund IV - First Trust BuyWrite Income ETF,-1.304,-4.38,2.07,-4.86,-2.36,11.67,3y,11.67,0.76,22.71,2026-03-20T00:00:00.000Z
FTLB,First Trust Hedged BuyWrite Income ETF,-1.479,-4.03,5.16,-2.73,-2.15,13.46,3y,13.46,0.82,19.98,2026-03-20T00:00:00.000Z
FTLS,First Trust Long/Short Equity ETF,-0.244,-2.3,8.15,-2.09,-1.11,9.9,3y,9.9,0.66,69.38,2026-03-20T00:00:00.000Z
FTQI,First Trust Nasdaq BuyWrite Fund,-1.479,-4.03,3.74,-2.73,-2.15,13.44,3y,13.44,0.83,19.98,2026-03-20T00:00:00.000Z
FTXL,First Trust Nasdaq Semiconductor ETF,-2.807,9.75,82.39,-4.61,22.19,34.87,3y,34.87,2.35,149.25,2026-03-20T00:00:00.000Z
FTXN,First Trust Nasdaq Oil & Gas ETF,0.107,31.34,24.82,9.59,34.3,23.78,3y,23.78,0.34,37.47,2026-03-20T00:00:00.000Z
FTXO,First Trust Nasdaq Bank ETF,0.183,-8.64,14.43,-11.24,-7.71,25.33,3y,25.33,1.01,34.98,2026-03-20T00:00:00.000Z
FTXR,First Trust Nasdaq Transportation ETF,-1.913,-5.55,21.29,-13.02,-5.27,22.25,3y,22.25,1.25,36.91,2026-03-20T00:00:00.000Z
FUTY,Fidelity MSCI Utilities Index ETF,-4.674,2.24,11.94,-4.05,3.25,16.21,3y,16.21,0.37,57.11,2026-03-20T00:00:00.000Z
FV,First Trust Dorsey Wright Focus 5 ETF,-1.69,-5.84,7.01,-8.05,-1.79,19.07,3y,19.07,1.14,60.269,2026-03-20T00:00:00.000Z
FVAL,Fidelity Value Factor ETF,-1.858,-5.39,13.62,-6.29,-3.99,14.29,3y,14.29,0.94,68.65,2026-03-20T00:00:00.000Z
FVD,First Trust Value Line Dividend Index Fund,-1.212,0.58,3.68,-5.76,0.5,11.27,3y,11.27,0.32,46.46,2026-03-20T00:00:00.000Z
FWD,AB Disruptors ETF,-3.329,1.15,43.64,-6.58,6.97,24.42,3y,24.42,1.81,108.03,2026-03-20T00:00:00.000Z
FXA,Invesco CurrencyShares Australian Dollar Trust,-0.983,4.9,10.52,-0.52,6.28,9.44,3y,9.44,0.39,69.53,2026-03-20T00:00:00.000Z
FXB,Invesco CurrencyShares British Pound Sterling Trust,-0.712,-0.77,2.58,-0.9,-0.31,7.18,3y,7.18,0.14,128.26,2026-03-20T00:00:00.000Z
FXC,Invesco CurrencyShares Canadian Dollar Trust,0.169,0.21,4.45,-0.18,0.54,5.46,3y,5.46,0.04,71.29,2026-03-20T00:00:00.000Z
FXE,Invesco CurrencyShares Euro Trust,-0.196,-1.32,5.99,-1.79,-1.54,7.15,3y,7.15,0.04,106.66,2026-03-20T00:00:00.000Z
FXF,Invesco CurrencyShares Swiss Franc Trust,-0.018,0.39,10.74,-1.67,0.78,8.15,3y,8.15,0.01,112.01,2026-03-20T00:00:00.000Z
FXG,First Trust Consumer Staples AlphaDEX Fund,-1.495,1.59,-2.73,-8.4,-0.05,12.53,3y,12.53,0.16,61.93,2026-03-20T00:00:00.000Z
FXH,First Trust Health Care AlphaDEX Fund,-1.412,-7.98,0.14,-8.82,-7.23,15.06,3y,15.06,0.71,105.45,2026-03-20T00:00:00.000Z
FXI,iShares China Large-Cap ETF,-2.846,-11.7,-8.27,-8.94,-7.11,28.61,3y,28.61,1.02,35.16,2026-03-20T00:00:00.000Z
FXL,First Trust Technology AlphaDEX Fund,-2.179,-5.28,15.44,-3.43,-3.02,23.23,3y,23.23,1.67,160.28,2026-03-20T00:00:00.000Z
FXN,First Trust Energy AlphaDEX Fund,0.092,28.96,30.98,9.31,31.62,25.7,3y,25.7,0.47,21.73,2026-03-20T00:00:00.000Z
FXO,First Trust Financials AlphaDEX Fund,-0.36,-8.93,3.58,-8.4,-8.82,20.07,3y,20.07,0.85,55.28,2026-03-20T00:00:00.000Z
FXR,First Trust Industrials/Producer Durables AlphaDEX Fund,-1.731,-2.37,11.29,-12.74,0.18,19.14,3y,19.14,1.13,79.47,2026-03-20T00:00:00.000Z
FXU,First Trust Utilities AlphaDEX Fund,-3.335,5.71,17.51,-3.04,7.39,15.74,3y,15.74,0.24,48.11,2026-03-20T00:00:00.000Z
FXY,Invesco CurrencyShares Japanese Yen Trust,-1.03,-1.59,-6.94,-2.67,-2.37,10.15,3y,10.15,0.02,57.66,2026-03-20T00:00:00.000Z
FXZ,First Trust Materials AlphaDEX Fund,-3.268,4.79,21.77,-9.8,8.42,21.74,3y,21.74,1.23,69.57,2026-03-20T00:00:00.000Z
FYC,First Trust Small Cap Growth Fund,-2.484,-2.46,32.23,-6.66,-0.74,21.48,3y,21.48,1.44,94.6,2026-03-20T00:00:00.000Z
FYEE,Fidelity Yield Enhanced Equity Fund,-4.178,-5.78,4.39,-6.11,-5.71,16.48,1y,,0.89,27.06,2026-03-20T00:00:00.000Z
FYLD,Cambria Foreign Shareholder Yield ETF,-2.331,9.41,30.21,-3.89,11.03,15.37,3y,15.37,0.6,36.03,2026-03-20T00:00:00.000Z
FYX,First Trust Small Cap Core AlphaDEX Fund,-1.865,1.45,24.18,-7.08,1.68,20.86,3y,20.86,1.16,115.77,2026-03-20T00:00:00.000Z
GARP,iShares MSCI USA Quality GARP ETF,-2.036,-5.26,23.78,-4.3,-1.56,20.12,3y,20.12,1.43,64.96,2026-03-20T00:00:00.000Z
GBTC,Grayscale Bitcoin Trust ETF,-0.11,-22.08,-19.14,4.45,-18.55,53.75,3y,53.75,2.24,54.65,2026-03-20T00:00:00.000Z
GBUG,Sprott Active Gold & Silver Fund,-4.31,-8.35,83.55,-23.78,-9.14,47.96,1y,,1.61,39.5,2026-03-20T00:00:00.000Z
GCC,WisdomTree Enhanced Commodity Strategy Fund,-0.421,11.1,20.87,6.11,12.1,14.92,3y,14.92,0.51,23.63,2026-03-20T00:00:00.000Z
GCOW,Pacer Global Cash Cows Dividend ETF,-1.472,7.6,19.25,-3.84,7.5,12.77,3y,12.77,0.42,44.86,2026-03-20T00:00:00.000Z
GDE,WisdomTree Efficient Gold Plus,-4.06,-2.06,48.78,-13.39,-0.84,24.47,3y,24.47,1.4,60.49,2026-03-20T00:00:00.000Z
GDMN,WisdomTree Efficient Gold Plus Miners Fund,-6.423,-7.39,105.71,-29.2,-8.09,48.59,3y,48.59,1.8,86.4,2026-03-20T00:00:00.000Z
GDX,VanEck Gold Miners ETF,-3.353,-6.54,77.14,-23.14,-6.65,36.15,3y,36.15,1.53,80.12,2026-03-20T00:00:00.000Z
GDXD,MicroSectors Gold Miners -3X Inverse Leveraged ETNs,10.42,-21.74,-94.94,91.84,-26.15,107.98,3y,107.98,-4.74,66.76,2026-03-20T00:00:00.000Z
GDXJ,VanEck Junior Gold Miners ETF,-3.854,-7.45,85.3,-24.04,-8.59,40.16,3y,40.16,1.75,104.77,2026-03-20T00:00:00.000Z
GDXU,MicroSectors Gold Miners 3X Leveraged Exchange-Traded Notes,-10.845,-41.79,144.64,-59.65,-42.26,112.64,3y,112.64,4.72,140.91,2026-03-20T00:00:00.000Z
GDXY,YieldMax Gold Miners Option Income Strategy ETF,-1.939,-20.15,-22.97,-25.21,-23.07,39.66,1y,,1.31,12.64,2026-03-20T00:00:00.000Z
GEM,Goldman Sachs ActiveBeta Emerging Markets Equity ETF,-3.193,-0.42,24.13,-8.81,3.82,16.2,3y,16.2,1.14,42.44,2026-03-20T00:00:00.000Z
GFEB,FT VEST US Equity Moderate Fund,-0.582,-1.48,10.67,-2.96,-0.32,7.53,3y,7.53,0.4,40.97,2026-03-20T00:00:00.000Z
GGLL,Direxion Daily GOOGL Bull 2x Shares,-4.195,-11.57,165.06,-2.56,-1.11,53.54,3y,53.54,2.28,86.78,2026-03-20T00:00:00.000Z
GGLS,Direxion Daily GOOGL Bear 1X Shares,2.026,4.75,-49.39,0.57,-2.22,29.22,3y,29.22,-1.14,7.05,2026-03-20T00:00:00.000Z
GII,SPDR S&P Global Infrastructure ETF,-2.604,5.23,19.97,-3.93,5.29,13.29,3y,13.29,0.41,74.07,2026-03-20T00:00:00.000Z
GLD,SPDR Gold Shares,-3.056,3.79,47.05,-10.05,3.53,19.33,3y,19.33,0.56,413.38,2026-03-20T00:00:00.000Z
GLDM,SPDR Gold MiniShares Trust,-3.037,3.88,47.47,-10,3.67,19.21,3y,19.21,0.55,89.07,2026-03-20T00:00:00.000Z
GLL,ProShares UltraShort Gold,6.352,-14.93,-58.43,21.1,-14.31,37.96,3y,37.96,-1.11,22.1,2026-03-20T00:00:00.000Z
GLOV,Goldman Sachs ActiveBeta World Equity ETF,-1.916,-3.13,8.31,-6.27,-2.71,10.83,3y,10.83,0.69,55.8832,2026-03-20T00:00:00.000Z
GLTR,abrdn Physical Precious Metals Basket Shares ETF,-4.091,-1.01,62.21,-11.41,2.02,25.6,3y,25.6,1.04,205.86,2026-03-20T00:00:00.000Z
GMOI,GMO International Value ETF,-2.409,2.54,25.91,-7.12,4.09,16.49,1y,,0.69,34.84,2026-03-20T00:00:00.000Z
GNR,SPDR S&P Global Natural Resources ETF,-2.185,10.4,28.18,-4.62,12.77,18.02,3y,18.02,0.77,69.83,2026-03-20T00:00:00.000Z
GOAU,U.S. Global GO GOLD and Precious Metal Miners ETF,-4.278,-8.78,61.02,-22.61,-8.74,36.57,3y,36.57,1.58,38.71,2026-03-20T00:00:00.000Z
GOEX,Global X Gold Explorers ETF,-3.864,-8.18,95.26,-24.48,-10.16,39.39,3y,39.39,1.59,73.4,2026-03-20T00:00:00.000Z
GOOX,T-Rex 2x LNG Alphabet Daily,-4.625,-13.17,164.69,-4.55,-3.92,60.22,1y,,2.29,61.25,2026-03-20T00:00:00.000Z
GOOY,YieldMax GOOGL Option Income Strategy ETF,-1.477,-8.69,3.98,-1.91,-5.66,24.87,3y,24.87,1.02,13.34,2026-03-20T00:00:00.000Z
GOVI,Invesco Equal Weight 0-30 Yr GovI Mutual Fund,-1.419,-1.53,-2.66,-3.28,-2.06,9.22,3y,9.22,0.03,27.1,2026-03-20T00:00:00.000Z
GPIQ,Nasdaq 100 Core Premium Income ETF,-1.797,-4.91,9.29,-3.53,-3.66,20.21,1y,,1.12,49.74,2026-03-20T00:00:00.000Z
GPIX,S&P 500 Core Premium Income Fund,-1.444,-5.12,5.93,-4.99,-3.93,16.93,1y,,0.86,49.84,2026-03-20T00:00:00.000Z
GREK,Global X MSCI Greece ETF,-1.313,-7.47,29.92,-12.16,-5.81,22.13,3y,22.13,0.73,62.4,2026-03-20T00:00:00.000Z
GRID,First Trust NASDAQ Clean Edge Smart Grid Infrastructure Index Fund,-3.288,3.25,34.35,-7.91,7.4,18.62,3y,18.62,1.16,160.88,2026-03-20T00:00:00.000Z
GRNY,Fundstrat Granny Shots US Large Cap ETF,-1.57,-4.64,27.84,-4.34,-1.93,24.37,1y,,1.44,23.83,2026-03-20T00:00:00.000Z
GRPM,Invesco S&P MidCap 400 GARP ETF,-0.934,-4.19,7.86,-6.52,-3.81,20.09,3y,20.09,1.03,115.57,2026-03-20T00:00:00.000Z
GSEP,FT Vest US Equity Moderate B Fund,-0.863,-2.27,9.26,-2.64,-0.99,7.61,3y,7.61,0.51,37.92,2026-03-20T00:00:00.000Z
GSEW,Goldman Sachs Equal Weight U.S. Large Cap Equity ETF,-1.569,-2.04,8.9,-5.51,-1.01,14.34,3y,14.34,0.9,84.06,2026-03-20T00:00:00.000Z
GSG,iShares S&P GSCI Commodity-Indexed Trust,1.342,37.49,42.18,24.54,39.12,17.89,3y,17.89,-0.02,31.72,2026-03-20T00:00:00.000Z
GSIE,Goldman Sachs ActiveBeta International Equity ETF,-2.976,-3.56,12.6,-9.42,-1.58,14.23,3y,14.23,0.84,41.73,2026-03-20T00:00:00.000Z
GSLC,Goldman Sachs ActiveBeta U.S. Large Cap Equity ETF,-1.397,-5.68,12.19,-5.26,-4.27,14.55,3y,14.55,0.98,124.96,2026-03-20T00:00:00.000Z
GSSC,Goldman Sachs ActiveBeta U.S. Small Cap Equity ETF,-2.11,-3.95,11.75,-8.49,-4.62,20.33,3y,20.33,1.22,72.83,2026-03-20T00:00:00.000Z
GSUS,Goldman Sachs MarketBeta U.S.,-1.473,-5.21,14.81,-4.88,-3.5,14.78,3y,14.78,1.01,89.63,2026-03-20T00:00:00.000Z
GUNR,FlexShares Morningstar Global Upstream Natural Resources Index Fund,-2.444,11.4,31.13,-3.35,14.35,16.61,3y,16.61,0.67,51.89,2026-03-20T00:00:00.000Z
GUSH,Direxion Daily S&P Oil & Gas Exploration & Production Bull 2X Shares,2.271,83.36,52.24,35.62,87.3,56,3y,56,0.88,41.88,2026-03-20T00:00:00.000Z
GVAL,Cambria Global Value ETF,-2.935,-0.13,26.39,-10.34,2.42,17.6,3y,17.6,0.75,31.75,2026-03-20T00:00:00.000Z
GVIP,Goldman Sachs Hedge Industry VIP ETF,-2.202,-6.5,20.28,-7.85,-2.86,18.62,3y,18.62,1.34,146.05,2026-03-20T00:00:00.000Z
GWX,SPDR S&P International Small Cap ETF,-2.761,-0.1,24.25,-9.57,1.6,14.99,3y,14.99,0.86,41.2,2026-03-20T00:00:00.000Z
GXC,SPDR S&P China ETF,-2.583,-8.44,-0.34,-8.77,-5.98,26.37,3y,26.37,0.96,91.63,2026-03-20T00:00:00.000Z
GXG,Global X MSCI Colombia ETF,-0.719,5.52,35.23,-9.52,2.47,22.28,3y,22.28,0.76,37.27,2026-03-20T00:00:00.000Z
HACK,Amplify Cybersecurity ETF,-2.424,-3.53,1.3,-0.01,-4.44,21.47,3y,21.47,1.08,76.49,2026-03-20T00:00:00.000Z
HAP,VanEck Natural Resources ETF,-2.193,11.51,35.46,-5.58,12.57,16.16,3y,16.16,0.71,68.23,2026-03-20T00:00:00.000Z
HAUZ,Xtrackers International Real Estate ETF,-3.227,-3.31,9.23,-10.65,-3.72,15.31,3y,15.31,0.57,22.49,2026-03-20T00:00:00.000Z
HCMT,Direxion HCM Tactical Enhanced US ETF,-2.828,-10.41,9.41,-8.14,-6.8,29.33,3y,29.33,2.25,34.53,2026-03-20T00:00:00.000Z
HDEF,Xtrackers MSCI EAFE High Dividend Yield Equity ETF,-2.481,0.3,13.02,-6.67,1.47,13.48,3y,13.48,0.44,31.284,2026-03-20T00:00:00.000Z
HDGE,AdvisorShares Ranger Equity Bear ETF,0.887,12.69,4.18,8.98,10.91,21.91,3y,21.91,-0.94,18.2,2026-03-20T00:00:00.000Z
HDLV,UBS ETRACS Monthly Pay 2xLeveraged US High Dividend Low Volatility ETN,-0.477,1.92,-1.38,-6.19,1.33,12.68,3y,12.68,0.06,36.54,2026-03-20T00:00:00.000Z
HDV,iShares Core High Dividend ETF,-0.789,8.04,10.53,-4.36,8.54,11.73,3y,11.73,0.18,132.1,2026-03-20T00:00:00.000Z
HEDJ,WisdomTree Europe Hedged Equity Fund,-3.017,-7.02,-0.04,-10.49,-4.1,15.34,3y,15.34,0.84,49.82,2026-03-20T00:00:00.000Z
HEFA,iShares Currency Hedged MSCI EAFE ETF,-2.341,-2.36,9.19,-8.16,-1.04,13.14,3y,13.14,0.8,40.88,2026-03-20T00:00:00.000Z
HEGD,Swan Hedged Equity US Large Cap Fund,-0.684,-2.61,11.98,-2.7,-1.56,8.06,3y,8.06,0.51,24.67,2026-03-20T00:00:00.000Z
HELO,JPMorgan Hedged Equity Laddered Overlay ETF,-0.726,-3.25,6.35,-3.64,-1.7,8.1,3y,8.1,0.57,64.28,2026-03-20T00:00:00.000Z
HEQT,Simplify Hedged Equity ETF,-0.872,-2.39,8.41,-3.53,-1.31,8.1,3y,8.1,0.55,31.275,2026-03-20T00:00:00.000Z
HEWJ,iShares Currency Hedged MSCI Japan ETF,-2.463,2.18,24.74,-8.47,1.55,20.33,3y,20.33,0.99,54.26,2026-03-20T00:00:00.000Z
HEZU,iShares Currency Hedged MSCI Eurozone ETF,-3.017,-5.54,3.41,-9.15,-3.04,14.43,3y,14.43,0.87,42.11,2026-03-20T00:00:00.000Z
HFXI,New York Life Investments FTSE International Equity Currency Neutral ETF,-3.328,-1.12,14.5,-9.01,0.37,13.55,3y,13.55,0.86,32.53,2026-03-20T00:00:00.000Z
HGER,Harbor Commodity All-Weather Fund,0.098,24.34,29.81,12,24.39,15.25,3y,15.25,0.24,30.7,2026-03-20T00:00:00.000Z
HIBL,Direxion Daily S&P 500 High Beta Bull 3X Shares,-7.621,-13.31,89.69,-19.29,-4.97,73.73,3y,73.73,5.18,60,2026-03-20T00:00:00.000Z
HIBS,Direxion Daily S&P 500 High Beta Bear 3X Shares,8.601,4.03,-77.44,18.42,-6.73,76.43,3y,76.43,-5.32,49.62,2026-03-20T00:00:00.000Z
HLAL,Wahed FTSE USA Shariah ETF,-1.5,-4.08,20.26,-4.45,-2.8,15.54,3y,15.54,1.01,59.563,2026-03-20T00:00:00.000Z
HMOP,Hartford Municipal Opportunities ETF,-0.663,-0.46,0.8,-1.99,-0.55,4.03,3y,4.03,0.07,38.95,2026-03-20T00:00:00.000Z
HNDL,NASDAQ 7 Handl Index ETF,-1.878,-1.97,2.78,-4.14,-0.96,10.38,3y,10.38,0.53,21.636,2026-03-20T00:00:00.000Z
HODL,VanEck Bitcoin ETF,-0.101,-21.8,-17.95,4.64,-18.29,45.36,1y,,2.23,19.84,2026-03-20T00:00:00.000Z
HSUN,Hartford Strategic Income ETF,-0.926,-2.03,0.35,-3,-2.51,4.92,3y,4.92,0.1,34.77,2026-03-20T00:00:00.000Z
HYBL,SPDR Blackstone High Income Fund,-0.486,-2.92,-2.14,-2.56,-2.78,4.49,3y,4.49,0.14,27.63,2026-03-20T00:00:00.000Z
HYGV,FlexShares High Yield Value-Scored Bond Index Fund,-0.923,-2.57,-2.31,-2.88,-2.4,6.05,3y,6.05,0.22,39.73,2026-03-20T00:00:00.000Z
IAI,iShares U.S. Broker-Dealers & Securities Exchanges ETF,0.018,-9.99,15.32,-4.42,-8.05,20.04,3y,20.04,1.17,163.64,2026-03-20T00:00:00.000Z
IAK,iShares U.S. Insurance ETF,0.181,-5.9,-5.8,-5.52,-7.19,16.58,3y,16.58,0.08,127.06,2026-03-20T00:00:00.000Z
IAT,iShares U.S. Regional Banks ETF,0.193,-6.88,11.43,-13.22,-6.96,27.93,3y,27.93,0.92,51.97,2026-03-20T00:00:00.000Z
IAU,iShares Gold Trust,-3.056,3.85,47.28,-10.01,3.6,19.23,3y,19.23,0.55,84.7,2026-03-20T00:00:00.000Z
IAUM,iShares Gold Trust Micro,-3.026,3.89,47.52,-9.97,3.63,19.13,3y,19.13,0.55,44.86,2026-03-20T00:00:00.000Z
IBB,iShares Biotechnology ETF,-1.709,-4.35,20.12,-7.64,-3.51,19.46,3y,19.46,0.85,161.65,2026-03-20T00:00:00.000Z
IBCA,iShares iBonds Dec 2035 Term Corporate ETF,-1.206,-2.01,153.9,-3.09,-2.16,92.56,1y,,0.11,25.39,2026-03-20T00:00:00.000Z
IBIT,iShares Bitcoin Trust,-0.126,-21.93,-18.19,4.47,-18.35,45.71,1y,,2.23,39.77,2026-03-20T00:00:00.000Z
IBOT,VanEck Robotics ETF,-2.922,-1.06,25.43,-10.88,3.77,21.61,3y,21.61,1.54,52.994,2026-03-20T00:00:00.000Z
IBTO,iShares iBonds Dec 2033 Term Treasury ETF,-0.798,-1.24,-0.21,-2.12,-1.68,6.81,3y,6.81,-0.01,24.24,2026-03-20T00:00:00.000Z
ICF,iShares Cohen & Steers Realty Majors ETF,-3.165,2.56,-0.28,-5.56,2.55,17.22,3y,17.22,0.36,61.2,2026-03-20T00:00:00.000Z
ICLN,iShares Global Clean Energy ETF,-3.68,5.61,52.41,-3.99,12.87,24.44,3y,24.44,1.49,18.06,2026-03-20T00:00:00.000Z
ICOP,iShares Copper and Metals Mining ETF,-4.144,-5.81,49.1,-19.78,0.12,32.75,3y,32.75,1.87,42.33,2026-03-20T00:00:00.000Z
ICOW,Pacer Developed Markets International ETF,-2.477,5.2,26.13,-5.33,5.99,15.18,3y,15.18,0.77,41.145,2026-03-20T00:00:00.000Z
IDEV,iShares Core MSCI International Developed Markets ETF (IDEV),-2.916,-3.27,12.91,-9.88,-0.37,14.6,3y,14.6,0.89,80.57,2026-03-20T00:00:00.000Z
IDHQ,Invesco S&P International Developed Quality ETF,-3.574,-2.6,10.79,-9.87,0.49,15.17,3y,15.17,1,34.8,2026-03-20T00:00:00.000Z
IDMO,Invesco S&P International Developed Momentum ETF,-4.022,-5.81,16.57,-10.43,-4.71,16.36,3y,16.36,0.91,52.98,2026-03-20T00:00:00.000Z
IDOG,Alps International Sector Dividend Dogs ETF,-2.877,2.08,20.4,-5.26,3.51,14.71,3y,14.71,0.57,39.84,2026-03-20T00:00:00.000Z
IDU,iShares U.S. Utilities ETF,-3.852,2.78,11.94,-3.58,4.45,15.48,3y,15.48,0.32,112.57,2026-03-20T00:00:00.000Z
IDV,iShares International Select Dividend ETF,-2.904,2,29.41,-6.57,5.32,14.57,3y,14.57,0.65,40.79,2026-03-20T00:00:00.000Z
IDVO,Amplify CWP International Enhanced Dividend Income ETF,-2.354,-0.66,18.4,-9.37,3.7,15.4,3y,15.4,1.07,39,2026-03-20T00:00:00.000Z
IEFA,iShares Core MSCI EAFE ETF,-3.121,-3.45,10.91,-10.12,-0.49,14.84,3y,14.84,0.89,87.23,2026-03-20T00:00:00.000Z
IEMG,iShares Core MSCI Emerging Markets ETF,-3.35,-0.91,22.61,-8.75,5.64,16.62,3y,16.62,1.16,68.37,2026-03-20T00:00:00.000Z
IEO,iShares U.S. Oil & Gas Exploration & Production ETF,0.14,33.36,28.84,13.44,34.14,25.46,3y,25.46,0.37,121.41,2026-03-20T00:00:00.000Z
IETC,iShares U.S. Tech Independence Fund,-2.398,-10.62,14.69,-1.89,-8.5,21.99,3y,21.99,1.53,89.95,2026-03-20T00:00:00.000Z
IEUR,iShares Core MSCI Europe ETF,-3.059,-5.82,7.72,-10.67,-2.77,15.2,3y,15.2,0.85,67.51,2026-03-20T00:00:00.000Z
IEV,iShares Europe ETF,-3.106,-6.09,8.63,-10.82,-3.71,15.03,3y,15.03,0.86,65.2,2026-03-20T00:00:00.000Z
IEZ,iShares U.S. Oil Equipment & Services ETF,-1.491,28,42.82,-2.7,34.51,31.16,3y,31.16,1.15,27.75,2026-03-20T00:00:00.000Z
