symbol,name,daily_change_pct,ytd_return_pct,one_year_return_pct,perf_1m_pct,perf_3m_pct,vol_pct,vol_window,vol_3y_pct,last_close,as_of
ISTXF,iShares U.S. Treasury 1-3 Year USD A Mutual Fund,,,,,,,,,,2026-01-27T10:53:36.743Z
ISVQF,iShares USD Short Duration USD A,,,,,,,,,,2026-01-27T10:53:36.794Z
ISZXF,iShares USD Treasury Bond 3-7 Year UCITS ETF,,,,,,,,,,2026-01-27T10:53:36.833Z
ITBFF,iShares USD Treasury 1-3 Year UCITS ETF,,,,,,,,,,2026-01-27T10:53:36.877Z
ITM,VanEck Intermediate Muni ETF,0.021,0.19,3.32,0.02,0.3,4.29,3y,4.29,47.27,2026-01-26T00:00:00.000Z
IUSB,iShares Core Total Bond Market ETF,0.129,0.43,3.38,0.49,-0.64,5.6,3y,5.6,46.73,2026-01-26T00:00:00.000Z
JAAA,Janus Henderson AAA CLO ETF,-0.059,0.32,-0.39,0.61,0.22,2.08,3y,2.08,50.77,2026-01-26T00:00:00.000Z
JAGG,JPMorgan U.S. Aggregate Bond ETF,0.065,0.24,2.54,-0.06,-1.27,5.92,3y,5.92,46.49,2026-01-23T00:00:00.000Z
JBBB,Janus Henderson B-BBB CLO ETF,-0.021,1.24,-2.19,1.22,0.5,4.42,3y,4.42,48.21,2026-01-26T00:00:00.000Z
JBND,JPMorgan Active Bond ETF,0.185,0.37,3.65,0.07,-0.59,4.47,1y,,54.2,2026-01-26T00:00:00.000Z
JCPB,JPMorgan Core Plus Bond ETF,0.147,0.5,3.1,0.17,-0.63,5.6,3y,5.6,47.56,2026-01-26T00:00:00.000Z
JCPI,J.P. Morgan Inflation Managed Bond Fund,-0.052,0.36,2.96,0.16,-1.4,4.17,3y,4.17,48.335,2026-01-26T00:00:00.000Z
JHMB,John Hancock Mortgage-Backed Securities ETF,-0.246,0.68,4.21,-0.04,-0.65,6.66,3y,6.66,22.285,2026-01-26T00:00:00.000Z
JMBS,Janus Henderson Mortgage-Backed Securities ETF,0.24,0.83,4.15,0.7,-0.2,6.71,3y,6.71,45.96,2026-01-26T00:00:00.000Z
JMHI,JPMorgan High Yield Municipal ETF,0.264,0.48,0.04,0.54,-0.44,4.73,3y,4.73,50.54,2026-01-26T00:00:00.000Z
JMSI,JPMorgan Sustainable Municipal Income ETF,-0.03,0.54,1.17,0.39,0.13,3.84,3y,3.84,50.64,2026-01-26T00:00:00.000Z
JMST,JPMorgan Ultra-Short Municipal Income Fund,0,0.29,0.51,0.14,0.24,1.17,3y,1.17,51.08,2026-01-26T00:00:00.000Z
JMUB,JPMorgan Municipal Bond ETF,0.059,0.42,1.36,0.34,0.15,3.5,3y,3.5,50.75,2026-01-26T00:00:00.000Z
JNK,SPDR Bloomberg High Yield Bond ETF,0.051,0.7,1.25,0.96,0.48,6.15,3y,6.15,97.92,2026-01-26T00:00:00.000Z
JPHY,JPMorgan Active High Yield ETF,-0.012,0.52,9.11,0.2,0.21,7.64,3y,7.64,50.9,2026-01-26T00:00:00.000Z
JPST,JPMorgan Ultra-Short Income ETF,0.02,0.22,0.44,0.06,0,1.49,3y,1.49,50.73,2026-01-26T00:00:00.000Z
JSCP,JPMorgan Short Duration Core Plus ETF,0.063,0.14,1.84,-0.02,-0.06,2.93,3y,2.93,47.62,2026-01-26T00:00:00.000Z
JSI,Janus Henderson Securitized Income ETF,0.057,0.36,0.63,0.64,-0.1,3.29,1y,,52.3,2026-01-26T00:00:00.000Z
KORP,American Century Diversified Corporate Bond ETF,0.076,0.67,3.46,0.73,-0.93,5.58,3y,5.58,47.535,2026-01-26T00:00:00.000Z
LDRT,iShares iBonds 1-5 Year Treasury Ladder ETF,0.059,0.02,1.53,0.3,-0.18,3.26,1y,,25.345,2026-01-26T00:00:00.000Z
LDUR,PIMCO Enhanced Low Duration Active Exchange-Traded Fund,0.042,0.19,0.89,0.01,0.01,2.42,3y,2.42,96.13,2026-01-26T00:00:00.000Z
LEMB,iShares J.P. Morgan EM Local Currency Bond ETF,0.284,1.95,15.49,2.24,2.69,7.03,3y,7.03,42.42,2026-01-26T00:00:00.000Z
LONZ,PIMCO Senior Loan Active Exchange-Traded Fund,-0.079,0.61,-1.22,-0.26,-0.03,3.55,3y,3.55,50.605,2026-01-26T00:00:00.000Z
LQD,iShares iBoxx $ Investment Grade Corporate Bond ETF,0.081,0.7,3.76,0.64,-1.42,7.86,3y,7.86,110.93,2026-01-26T00:00:00.000Z
LQDH,iShares Interest Rate Hedged Corporate Bond ETF,-0.053,0.87,0.74,1.01,0.62,4.22,3y,4.22,94.15,2026-01-26T00:00:00.000Z
LQTI,FT Vest Investment Grade & Target Income ETF,0.28,0.78,0.23,0.23,-2.29,6.59,1y,,20.046,2026-01-26T00:00:00.000Z
LTPZ,PIMCO 15+ Year U.S. TIPS Index Exchange-Traded Fund,0.325,1.51,0.17,0.85,-3.83,13.97,3y,13.97,52.42,2026-01-26T00:00:00.000Z
MBB,iShares MBS ETF,0.209,0.64,4.61,0.65,-0.1,6.84,3y,6.84,95.75,2026-01-26T00:00:00.000Z
MBSF,Regan Floating Rate MBS ETF,0.117,0.23,0.74,0.43,0.55,3.12,1y,,25.73,2026-01-26T00:00:00.000Z
MEAR,iShares Short Maturity Bond ETF,0.038,0.3,0.78,0.37,0.16,1.4,3y,1.4,50.47,2026-01-26T00:00:00.000Z
MINT,PIMCO Enhanced Short Maturity Active Exchange-Traded Fund,-0.01,0.29,0.04,0.07,0.1,1.46,3y,1.46,100.66,2026-01-26T00:00:00.000Z
MLN,VanEck Long Muni ETF,0,-0.4,-0.57,-0.9,-1.13,7.17,3y,7.17,17.52,2026-01-26T00:00:00.000Z
MMIN,NYLI MacKay Muni Insured ETF,0.042,0.42,1.35,0.31,0,5.35,3y,5.35,24.1,2026-01-26T00:00:00.000Z
MMIT,NYLI MacKay Muni Intermediate ETF,0.041,0.62,1.87,0.47,0.41,3.73,3y,3.73,24.49,2026-01-26T00:00:00.000Z
MTBA,Simplify MBS ETF,0.138,0.41,1.91,0.58,-0.18,3.36,1y,,50.62,2026-01-26T00:00:00.000Z
MUB,iShares National Muni Bond ETF,0.046,0.39,1.55,0.81,0.12,4.27,3y,4.27,107.66,2026-01-26T00:00:00.000Z
MUNI,PIMCO Intermediate Municipal Bond Active Exchange-Traded Fund,0.095,0.55,1.97,0.5,0.13,3.66,3y,3.66,52.74,2026-01-26T00:00:00.000Z
MUU,Dx Daily Muni Bond Bull 2x Shares,-5.258,47.87,679.56,90.15,193.4,127.7,1y,,180,2026-01-26T00:00:00.000Z
NBSD,Neuberger Berman Short Duration Income ETF,0.066,0.34,0.8,0.31,0,3.45,1y,,51.35,2026-01-26T00:00:00.000Z
NCLO,Nuveen AA-BBB CLO ETF,0.012,0.37,-0.21,0.41,0.05,3.42,1y,,25.098,2026-01-26T00:00:00.000Z
NEAR,iShares Short Maturity Bond ETF,0.039,0.12,1.15,0.39,-0.25,2.07,3y,2.07,51.18,2026-01-26T00:00:00.000Z
NUBD,Nuveen ESG U.S. Aggregate Bond ETF,0.107,0.31,3.29,0.38,-1.17,5.79,3y,5.79,22.425,2026-01-26T00:00:00.000Z
NYF,iShares New York Muni Bond ETF,0.019,0.3,1.07,0.54,0.06,4.11,3y,4.11,53.78,2026-01-26T00:00:00.000Z
OACP,OneAscent Core Plus Bond ETF,0.108,0.26,2.78,-0.02,-0.84,5.32,3y,5.32,23.095,2026-01-26T00:00:00.000Z
OBIL,US Treasury 12 Month Bill Mutual Fund,0.02,0.13,0.31,0,0,1.47,3y,1.47,50.285,2026-01-26T00:00:00.000Z
PAAA,PGIM AAA CLO ETF,0.01,0.39,0.1,0.54,0.21,1.85,3y,1.85,51.49,2026-01-26T00:00:00.000Z
PBFR,PGIM Laddered Fixed Income Fund ETF,0.218,0.62,9.54,0.55,2.32,8.31,1y,,29.4,2026-01-26T00:00:00.000Z
PCRB,Putnam ESG Core Bond ETF,0.121,0.39,3.87,0.43,-0.53,5.94,3y,5.94,49.475,2026-01-26T00:00:00.000Z
PCY,Invesco Emerging Markets Sovereign Debt ETF,0.185,-0.05,8.08,0,-0.64,10.99,3y,10.99,21.68,2026-01-26T00:00:00.000Z
PFIX,Simplify Interest Rate Hedge ETF,-1.127,-7.28,-16.1,-4.66,0.44,52.32,3y,52.32,45.61,2026-01-26T00:00:00.000Z
PGHY,Invesco Global ex-US High Yield Corporate Bond ETF,0.1,0.45,0.71,0.4,0.35,5.54,3y,5.54,19.98,2026-01-26T00:00:00.000Z
PHB,Invesco Fundamental High Yield Corporate Bond ETF,0,0,2.53,0.38,0.38,5.45,3y,5.45,18.63,2026-01-26T00:00:00.000Z
PHYL,PGIM Active High Yield Bond ETF,0.056,0.73,1.65,0.56,0.59,5.34,3y,5.34,35.75,2026-01-26T00:00:00.000Z
PICB,Invesco International Corporate Bond ETF,0.664,1.98,12.43,1.34,1.89,8.59,3y,8.59,24.24,2026-01-26T00:00:00.000Z
PLW,Invesco Exchange-Traded Fund Trust II - Invesco 1-30 Laddered Treasury ETF,0.15,0.08,1.82,0.01,-2.61,9.59,3y,9.59,27.5412,2026-01-23T00:00:00.000Z
PMBS,PIMCO Mortgage-Backed Securities Active ETF,0.236,0.99,5.09,0.62,0.36,4.9,1y,,50.128,2026-01-26T00:00:00.000Z
PMMF,iShares Prime Money Market ETF,0.04,0.24,0.45,0.35,0.02,1.1,1y,,100.49,2026-01-26T00:00:00.000Z
PSH,PGIM Short Duration High Yield Fund,-0.079,0.45,0.06,0.25,-0.11,4.17,1y,,50.61,2026-01-26T00:00:00.000Z
PSQA,Palmer Square CLO Senior Debt ETF,0.068,0.39,1.24,-0.66,0.44,2.86,1y,,20.469,2026-01-26T00:00:00.000Z
PTBD,Pacer Trendpilot US Bond ETF,0.077,0.34,-3.4,0.54,-0.99,6.23,3y,6.23,19.465,2026-01-26T00:00:00.000Z
PTRB,PGIM Total Return Bond ETF,0.036,0.49,2.92,0.09,-0.89,5.95,3y,5.95,42.195,2026-01-26T00:00:00.000Z
PULS,PGIM Ultra Short Bond ETF,0,0.28,0.1,0.02,-0.02,1.67,3y,1.67,49.76,2026-01-26T00:00:00.000Z
PWZ,Invesco California AMT-Free Municipal Bond ETF,-0.083,-0.25,-0.82,-0.04,-0.74,6.8,3y,6.8,24.15,2026-01-26T00:00:00.000Z
PZA,Invesco National AMT-Free Municipal Bond ETF,0.086,-0.17,-0.81,0.22,-0.85,6.25,3y,6.25,23.21,2026-01-26T00:00:00.000Z
QHY,WisdomTree U.S. High Yield Corporate Bond Fund,0.021,0.54,2.28,0.45,0.14,5.73,1y,,46.71,2026-01-26T00:00:00.000Z
QLTA,iShares AAA - A Rated Corporate Bond ETF,0.083,0.56,3.18,0.54,-1.17,6.44,3y,6.44,48.32,2026-01-26T00:00:00.000Z
RAVI,FlexShares Ultra-Short Income Fund,0.026,0.25,0.21,0.36,-0.01,1.42,3y,1.42,75.56,2026-01-26T00:00:00.000Z
REM,iShares Mortgage Real Estate ETF,-0.085,4.12,8.2,6.14,5.95,22.88,3y,22.88,23.5,2026-01-26T00:00:00.000Z
RMOP,Rockefeller Opportunistic Municipal Bond ETF,0.08,0.28,-0.85,0.14,-0.81,6.23,1y,,25.125,2026-01-26T00:00:00.000Z
SBND,Columbia Short Duration Bond ETF,0.079,0.32,2.57,0.03,-0.18,3.45,3y,3.45,18.97,2026-01-26T00:00:00.000Z
SCCR,Schwab Core Bond ETF,0.077,0.43,2.86,0.5,-0.73,4.59,1y,,25.93,2026-01-26T00:00:00.000Z
SCHI,Schwab 5-10 Year Corporate Bond ETF,0.087,0.3,4.3,0.39,-0.78,6.2,3y,6.2,23.03,2026-01-26T00:00:00.000Z
SCHJ,Schwab 1-5 Year Corporate Bond ETF,0,0.16,2.05,0.36,-0.24,2.81,3y,2.81,24.93,2026-01-26T00:00:00.000Z
SCHO,Schwab Short-Term U.S. Treasury ETF,0.041,0.08,0.79,0.25,-0.2,2.33,3y,2.33,24.38,2026-01-26T00:00:00.000Z
SCHP,Schwab U.S. TIPS ETF,0.113,0.49,2.5,0.53,-1.81,5.39,3y,5.39,26.61,2026-01-26T00:00:00.000Z
SCHQ,Schwab Long-Term U.S. Treasury ETF,0.408,1.17,2.37,0.88,-2.82,13.48,3y,13.48,32.02,2026-01-26T00:00:00.000Z
SCHR,Schwab Intermediate-Term U.S. Treasury ETF,0.04,-0.12,3.22,0,-0.95,5.28,3y,5.28,25.04,2026-01-26T00:00:00.000Z
SCHZ,Schwab U.S. Aggregate Bond ETF,0.128,0.39,3.3,0.47,-0.8,5.89,3y,5.89,23.46,2026-01-26T00:00:00.000Z
SCMB,Schwab Municipal Bond ETF,0.077,0.47,1.25,0.7,-0.04,4.25,3y,4.25,25.89,2026-01-26T00:00:00.000Z
SCUS,Schwab Ultra-Short Income ETF,-0.04,0.18,0.24,0.34,0.04,1.35,1y,,25.24,2026-01-26T00:00:00.000Z
SCYB,Schwab High Yield Bond ETF,0.075,0.64,0.6,0.87,0.15,5.55,3y,5.55,26.62,2026-01-26T00:00:00.000Z
SEIX,Virtus Seix Senior Loan ETF,-0.116,-0.05,-2.45,0.1,-0.29,3.5,3y,3.5,23.333,2026-01-26T00:00:00.000Z
SGOV,iShares 0-3 Month Treasury Bond ETF,0.01,0.21,0.04,0.33,0,1.32,3y,1.32,100.62,2026-01-26T00:00:00.000Z
SHM,SPDR Nuveen Bloomberg Short Term Municipal Bond ETF,0.021,0.52,1.64,0.67,0.4,2.22,3y,2.22,48.26,2026-01-26T00:00:00.000Z
SHV,iShares Short Treasury Bond ETF,0.009,0.19,0,0.31,-0.03,1.32,3y,1.32,110.38,2026-01-26T00:00:00.000Z
SHY,iShares 1-3 Year Treasury Bond ETF,0.036,0.01,0.95,0.23,-0.23,2.26,3y,2.26,82.87,2026-01-26T00:00:00.000Z
SHYD,VanEck Short High Yield Municipal Fund,0,0.61,1.59,0.13,1.1,5.31,3y,5.31,23.02,2026-01-26T00:00:00.000Z
SHYG,iShares 0-5 Year High Yield Corporate Bond ETF,0.07,0.51,-0.12,0.79,0.12,5.13,3y,5.13,43.12,2026-01-26T00:00:00.000Z
SHYL,Xtrackers Short Duration High Yield Bond ETF,0.027,0.51,-0.25,0.64,-0.02,5.3,3y,5.3,45.189,2026-01-26T00:00:00.000Z
SIHY,Harbor Scientific Alpha High-Yield ETF,-0.054,0.74,-0.07,0.92,-0.28,6.56,3y,6.56,46.03,2026-01-26T00:00:00.000Z
SIXO,AllianzIM U.S. Large Cap 6 Month Buffer10 Apr/Oct ETF,0.2,0.87,5.93,0.55,2.7,7.9,3y,7.9,35.04,2026-01-26T00:00:00.000Z
SJB,ProShares Short High Yield,0,-0.26,-4.87,-1.36,-1.36,6.27,3y,6.27,15.23,2026-01-26T00:00:00.000Z
SJNK,SPDR Bloomberg Short Term High Yield Bond ETF,0.079,0.59,-0.39,0.79,0.16,5.23,3y,5.23,25.47,2026-01-26T00:00:00.000Z
SKOR,FlexShares Credit-Scored U.S. Bond Index Fund,0.033,0.2,2.99,0.39,-0.41,4.17,3y,4.17,49.211,2026-01-26T00:00:00.000Z
SLQD,iShares 0-5 Year Investment Grade Corporate Bond ETF,0.039,0.2,1.88,0.42,-0.14,2.42,3y,2.42,50.81,2026-01-26T00:00:00.000Z
SMB,VanEck Short Muni ETF,0,0,1.81,-0.17,0.46,2.44,3y,2.44,17.42,2026-01-26T00:00:00.000Z
SMBS,Schwab Mortgage-Backed Securities ETF,0.233,0.7,3.61,0.58,-0.19,4.98,1y,,25.83,2026-01-26T00:00:00.000Z
SMMU,PIMCO Short Term Municipal Bond Active ETF,-0.079,0.32,1.52,0.28,0.2,1.9,3y,1.9,50.65,2026-01-26T00:00:00.000Z
SMTH,ALPS Smith Core Plus Bond ETF,0.096,0.04,2.66,0.1,-0.89,4.47,1y,,26.065,2026-01-26T00:00:00.000Z
SPAB,SPDR Portfolio Aggregate Bond ETF,0.116,0.39,3.4,0.43,-0.84,5.76,3y,5.76,25.84,2026-01-26T00:00:00.000Z
SPBO,SPDR Portfolio Corporate Bond ETF,0.068,0.61,2.97,0.65,-1.11,6.55,3y,6.55,29.51,2026-01-26T00:00:00.000Z
SPHY,SPDR Portfolio High Yield Bond ETF,0.084,0.63,0.29,0.89,0.17,5.89,3y,5.89,23.84,2026-01-26T00:00:00.000Z
SPIB,SPDR Portfolio Intermediate Term Corporate Bond ETF,0.059,0.18,3.29,0.41,-0.35,4.18,3y,4.18,33.88,2026-01-26T00:00:00.000Z
SPIP,SPDR Portfolio TIPS ETF,0.077,0.5,2.28,0.5,-1.62,5.94,3y,5.94,26.06,2026-01-26T00:00:00.000Z
SPLB,SPDR Portfolio Long Term Corporate Bond ETF,0.131,1.46,2.97,1.19,-2.47,11.62,3y,11.62,22.89,2026-01-26T00:00:00.000Z
SPMB,SPDR Portfolio Mortgage Backed Bond ETF,0.178,0.67,4.93,0.63,-0.35,6.85,3y,6.85,22.54,2026-01-26T00:00:00.000Z
SPSB,SPDR Portfolio Short Term Corporate Bond ETF,0.033,0.13,1.07,0.43,-0.13,2.19,3y,2.19,30.26,2026-01-26T00:00:00.000Z
SPSK,SP Funds Dow Jones Global Sukuk ETF,0,-0.16,2.82,-1.78,-2.1,6.23,3y,6.23,18.22,2026-01-26T00:00:00.000Z
SPTI,SPDR Portfolio Intermediate Term Treasury ETF,0.104,-0.07,3.34,0.03,-0.89,5.29,3y,5.29,28.8,2026-01-26T00:00:00.000Z
SPTL,SPDR Portfolio Long Term Treasury ETF,0.451,1.21,2.77,0.87,-2.76,13.52,3y,13.52,26.74,2026-01-26T00:00:00.000Z
SPTS,SPDR Portfolio Short Term Treasury ETF,0,0.03,0.9,0.21,-0.31,2.3,3y,2.3,29.28,2026-01-26T00:00:00.000Z
SRLN,SPDR Blackstone Senior Loan ETF,-0.145,-0.1,-1.67,0.24,-0.17,3.83,3y,3.83,41.26,2026-01-26T00:00:00.000Z
STIP,iShares 0-5 Year TIPS Bond ETF,0.029,0.19,1.42,0.34,-0.94,2.56,3y,2.56,102.57,2026-01-26T00:00:00.000Z
STOT,SPDR DoubleLine Short Duration Total Return Tactical ETF,-0.116,0.04,1.09,0.28,-0.42,2.06,3y,2.06,47.31,2026-01-26T00:00:00.000Z
STPZ,PIMCO 1-5 Year U.S. TIPS Index Exchange-Traded Fund,0.074,0.24,2.17,0.06,-0.98,2.9,3y,2.9,53.75,2026-01-26T00:00:00.000Z
SUB,iShares Short-Term National Muni Bond ETF,0.047,0.42,1.53,0.58,0.65,1.7,3y,1.7,107.18,2026-01-26T00:00:00.000Z
SUSB,iShares ESG Aware 1-5 Year USD Bond ETF,0.079,0.2,2.14,0.4,-0.28,2.92,3y,2.92,25.28,2026-01-26T00:00:00.000Z
SUSC,iShares ESG Aware USD Corporate Bond ETF,0.128,0.62,3.45,0.66,-1.01,6.48,3y,6.48,23.51,2026-01-26T00:00:00.000Z
SYFI,AB Short Duration High Yield ETF,-0.055,0.53,-0.11,0.19,0.28,5.11,1y,,36.09,2026-01-26T00:00:00.000Z
TAFI,"AB Active ETFs, Inc. AB Tax-Aware Short Duration Municipal ETF",0.039,0.52,1.16,0.32,0.16,2.19,3y,2.19,25.35,2026-01-26T00:00:00.000Z
TAFM,AB Tax-Aware Intermediate Municipal ETF,0.117,0.51,1.47,0.31,-0.17,6.18,1y,,25.58,2026-01-26T00:00:00.000Z
TAGG,T. Rowe Price QM U.S. Bond ETF,0.209,0.35,3.15,0.61,-0.78,6.41,3y,6.41,43.2,2026-01-26T00:00:00.000Z
TAXF,American Century Diversified Municipal Bond ETF,0.158,0.42,1.38,0.65,0.12,4.45,3y,4.45,50.73,2026-01-26T00:00:00.000Z
TBF,ProShares Short 20+ Year Treasury,-0.459,-1.12,-3.94,-1.24,2.98,14.75,3y,14.75,23.88,2026-01-26T00:00:00.000Z
TBIL,US Treasury 3 Month Bill ETF,0.02,0.2,0.04,0,0.06,1.33,3y,1.33,50,2026-01-26T00:00:00.000Z
TBT,ProShares UltraShort 20+ Year Treasury,-0.871,-2.23,-8.55,-1.78,6.09,29.43,3y,29.43,34.13,2026-01-26T00:00:00.000Z
TBUX,T. Rowe Price Ultra Short-Term Bond ETF,0.06,0.32,0.52,0.46,0.06,1.81,3y,1.81,50,2026-01-26T00:00:00.000Z
TCPB,Thrivent Core Plus Bond ETF,0.078,0.37,2.65,0.51,-0.99,4.62,1y,,51.5,2026-01-26T00:00:00.000Z
TDTF,FlexShares iBoxx 5-Year Target Duration TIPS Index Fund,0.083,0.38,2.74,0.38,-1.44,5.26,3y,5.26,24.02,2026-01-26T00:00:00.000Z
TDTT,FlexShares iBoxx 3-Year Target Duration TIPS Index Fund,0.042,0.17,1.43,0.37,-1.11,3.51,3y,3.51,24.09,2026-01-26T00:00:00.000Z
TFI,SPDR Nuveen Bloomberg Municipal Bond ETF,0,0.33,1.03,0.53,0,4.53,3y,4.53,45.9,2026-01-26T00:00:00.000Z
TFLO,iShares Treasury Floating Rate Bond ETF,-0.02,0.24,-0.02,0.38,0.12,1.37,3y,1.37,50.6,2026-01-26T00:00:00.000Z
TFLR,T. Rowe Price Floating Rate ETF,-0.087,0.31,-0.73,0.5,-0.12,4.31,3y,4.31,51.57,2026-01-26T00:00:00.000Z
TIP,iShares TIPS Bond ETF,0.136,0.47,2.93,0.5,-1.43,5.46,3y,5.46,110.38,2026-01-26T00:00:00.000Z
TIPX,SPDR Bloomberg 1-10 Year TIPS ETF,0,0.21,2.8,0.37,-1.09,4.21,3y,4.21,19.12,2026-01-26T00:00:00.000Z
TLH,iShares 10-20 Year Treasury Bond ETF,0.372,0.93,3.42,0.82,-2.24,12.04,3y,12.04,102.45,2026-01-26T00:00:00.000Z
TLT,iShares 20+ Year Treasury Bond ETF,0.478,1.52,1.75,0.97,-3.37,14.83,3y,14.83,88.35,2026-01-26T00:00:00.000Z
TMF,Direxion Daily 20+ Year Treasury Bull 3X Shares,1.424,3.69,-1.18,1.69,-10.87,43.62,3y,43.62,38.47,2026-01-26T00:00:00.000Z
TMV,Direxion Daily 20+ Year Treasury Bear 3X Shares,-1.48,-3.75,-11.67,-1.8,10.31,43.97,3y,43.97,35.95,2026-01-26T00:00:00.000Z
TUSB,Thrivent Ultra Short Bond ETF,0.04,0.27,0.83,0.49,0.02,1.75,1y,,50.545,2026-01-26T00:00:00.000Z
TUSI,Touchstone Ultra Short Income Fund,0,0.24,0.02,-0.12,-0.08,1.78,3y,1.78,25.39,2026-01-26T00:00:00.000Z
TYD,Direxion Daily 7-10 Year Treasury Bull 3X Shares,0.399,-0.79,8.58,-0.98,-4.95,21.8,3y,21.8,25.18,2026-01-26T00:00:00.000Z
UBND,VictoryShares Core Plus Intermediate Bond Fund,0.159,0.34,3.09,0.46,-0.61,5.32,3y,5.32,22.045,2026-01-26T00:00:00.000Z
UBT,ProShares Ultra 20+ Year Treasury,0.832,2.66,1.98,0.3,-6.66,29.32,3y,29.32,16.96,2026-01-26T00:00:00.000Z
UCON,First Trust TCW Unconstrained Plus Bond ETF,0.04,-0.22,2.11,-0.04,-0.63,4.07,3y,4.07,25.12,2026-01-26T00:00:00.000Z
UITB,VictoryShares Core Intermediate Bond ETF,0.158,0.27,3.77,0.36,-0.77,5.59,3y,5.59,47.455,2026-01-26T00:00:00.000Z
ULST,SPDR SSgA Ultra Short Term Bond ETF,0.049,0.2,0.17,0.37,-0.27,1.66,3y,1.66,40.6,2026-01-26T00:00:00.000Z
USFR,WisdomTree Floating Rate Treasury Fund,0.02,0.3,0.04,0.1,0.2,1.38,3y,1.38,50.48,2026-01-26T00:00:00.000Z
USHY,iShares Broad USD High Yield Corporate Bond ETF,0.106,0.67,1.07,0.91,0.19,6.01,3y,6.01,37.67,2026-01-26T00:00:00.000Z
USIG,iShares Broad USD Investment Grade Corporate Bond ETF,0.096,0.56,3.44,0.6,-0.95,6.17,3y,6.17,52.05,2026-01-26T00:00:00.000Z
USTB,VictoryShares Short-Term Bond ETF,0.059,0.2,1.19,0.37,-0.08,2.44,3y,2.44,50.93,2026-01-26T00:00:00.000Z
UTEN,US Treasury 10 Year Note ETF,0.177,0.1,3.79,-0.28,-1.46,7.81,3y,7.81,44.05,2026-01-26T00:00:00.000Z
UTWO,U.S. Treasury 2-Year Note ETF,0.021,-0.02,0.91,-0.07,-0.15,2.36,3y,2.36,48.57,2026-01-26T00:00:00.000Z
UYLD,Angel Oak UltraShort Income Fund,0.039,0.32,0.18,0.06,0.04,1.79,3y,1.79,51.3,2026-01-26T00:00:00.000Z
VCEB,Vanguard ESG U.S. Corporate Bond Fund,0.047,0.44,2.93,0.47,-1.22,6.14,3y,6.14,63.86,2026-01-26T00:00:00.000Z
VCIT,Vanguard Intermediate-Term Corporate Bond Fund,0.095,0.27,4.41,0.08,-0.93,6.08,3y,6.08,83.97,2026-01-26T00:00:00.000Z
VCLT,Vanguard Long-Term Corporate Bond Fund,0.117,1.41,2.8,1.08,-2.52,11.67,3y,11.67,76.84,2026-01-26T00:00:00.000Z
VCRB,Vanguard Core Bond ETF,0.15,0.55,3.39,0.59,-0.87,4.34,1y,,78.1709,2026-01-26T00:00:00.000Z
VCRPF,Vanguard USD Corporate Bond Fund,,,,,,,,,,2026-01-27T10:54:10.623Z
VCSH,Vanguard Short-Term Corporate Bond ETF,0.038,0.15,2.16,0.41,-0.19,2.8,3y,2.8,79.88,2026-01-26T00:00:00.000Z
VGIT,Vanguard Intermediate-Term Treasury Fund,0.1,-0.1,3.3,0.03,-0.91,5.27,3y,5.27,59.85,2026-01-26T00:00:00.000Z
VGLT,Vanguard Long-Term Treasury Fund,0.446,1.2,2.49,0.9,-2.88,13.53,3y,13.53,56.36,2026-01-26T00:00:00.000Z
VGSH,Vanguard Short-Term Treasury Fund,0.034,0.03,0.86,0.24,-0.25,2.26,3y,2.26,58.77,2026-01-26T00:00:00.000Z
VMBS,Vanguard Mortgage-Backed Securities Fund,0.212,0.55,4.46,0.53,0.06,6.76,3y,6.76,47.28,2026-01-26T00:00:00.000Z
VNLA,Janus Henderson Short Duration Income ETF,0.02,0.33,0.63,0.46,0.08,1.62,3y,1.62,49.31,2026-01-26T00:00:00.000Z
VPLS,Vanguard Core-Plus Bond ETF,0.128,0.49,3.13,0.59,-0.82,4.36,1y,,78.485,2026-01-26T00:00:00.000Z
VRIG,Invesco Variable Rate Investment Grade ETF,0.02,-0.06,0.04,0.1,0.12,2.04,3y,2.04,25.09,2026-01-26T00:00:00.000Z
VTC,Vanguard Total Corporate Bond Fund,0.073,0.62,3.08,0.62,-1.09,6.42,3y,6.42,78.084,2026-01-26T00:00:00.000Z
VTEB,Vanguard Tax-Exempt Bond ETF,0.04,0.34,1.22,0.68,0,4.18,3y,4.18,50.54,2026-01-26T00:00:00.000Z
VTES,Vanguard Short-Term Tax-Exempt Bond ETF,0.029,0.55,1.73,0.47,0.54,1.87,3y,1.87,102.17,2026-01-26T00:00:00.000Z
VTIP,Vanguard Short-Term Inflation-Protected Securities Index Fund,0,0.16,1.73,0.28,-1.3,2.95,3y,2.95,49.53,2026-01-26T00:00:00.000Z
VUSB,Vanguard Ultra-Short Bond ETF,0.07,0.26,0.48,0.43,0.04,1.56,3y,1.56,49.98,2026-01-26T00:00:00.000Z
VWOB,Vanguard Emerging Markets Government Bond Fund,0.074,0.47,6.12,0.52,0.47,7.56,3y,7.56,67.77,2026-01-26T00:00:00.000Z
WFHY,WisdomTree Trust - WisdomTree U.S. High Yield Corporate Bond Fund,0.021,0.54,2.33,0.45,0.17,8.24,3y,8.24,46.71,2026-01-26T00:00:00.000Z
WINC,iShares World Equity Income UCITS ETF,-0.095,-1.54,-3.61,-1.21,1.27,15.09,1y,,4.7535,2026-01-26T00:00:00.000Z
WIP,SPDR FTSE International Government Inflation-Protected Bond ETF,0.42,3.41,11.13,3.36,2.78,10.29,3y,10.29,40.65,2026-01-26T00:00:00.000Z
XBB,BondBloxx BB Rated USD High Yield Corporate Bond ETF,0.06,0.4,2.25,0.25,0.47,5.8,3y,5.8,41.385,2026-01-26T00:00:00.000Z
XBIL,U.S. Treasury 6-Month Bill ETF,0.02,0.2,0.06,0,0.02,1.35,3y,1.35,50.18,2026-01-26T00:00:00.000Z
XCCC,BondBloxx CCC-Rated USD High Yield Corporate Bond ETF,0,0.8,-3.52,0.09,-0.71,8.42,3y,8.42,38.34,2026-01-26T00:00:00.000Z
XEMD,BondBloxx JPM USD Emerging Markets 1-10 Year Bond ETF,0.044,1.27,6.41,0.73,2.05,6.22,3y,6.22,45.035,2026-01-26T00:00:00.000Z
XFIV,BondBloxx Bloomberg Five Year Target Duration US Treasury ETF,0.067,-0.15,3.17,-0.31,-0.94,5.46,3y,5.46,49.393,2026-01-26T00:00:00.000Z
XHLF,BondBloxx Bloomberg Six Month Target Duration US Treasury ETF,0,0.14,0.14,-0.02,-0.08,1.31,3y,1.31,50.35,2026-01-26T00:00:00.000Z
XMPT,VanEck CEF Municipal Income ETF,-0.182,0.05,0.64,0.6,-0.59,8.51,3y,8.51,21.89,2026-01-26T00:00:00.000Z
XSVN,BondBloxx Bloomberg Seven Year Target Duration US Treasury ETF,0.115,-0.02,3.69,-0.55,-1.39,7.03,3y,7.03,48.005,2026-01-26T00:00:00.000Z
XTEN,BondBloxx Bloomberg Ten Year Target Duration US Treasury ETF,0.303,0.5,3.87,0.11,-1.82,9.32,3y,9.32,46.41,2026-01-26T00:00:00.000Z
XTRE,BondBloxx Bloomberg Three Year Target Duration US Treasury ETF,0.026,-0.05,1.94,-0.2,-0.54,3.44,3y,3.44,49.73,2026-01-26T00:00:00.000Z
XTWO,BondBloxx Bloomberg Two Year Target Duration US Treasury ETF,0.012,0.01,0.68,-0.11,-0.35,2.43,3y,2.43,49.475,2026-01-26T00:00:00.000Z
YEAR,AB Ultra Short Income ETF,0.02,0.14,0.22,-0.12,-0.16,1.8,3y,1.8,50.57,2026-01-26T00:00:00.000Z
YLD,Principal Active High Yield ETF,-0.104,1.05,-1.18,0.37,-0.16,6.17,3y,6.17,19.2,2026-01-26T00:00:00.000Z
ZNOV,INVESCO VICTORY SHORT-TERM BOND ETF,0.149,0.6,5.92,0.54,1.25,3.65,1y,,26.83,2026-01-26T00:00:00.000Z
ZROZ,PIMCO 25+ Year Zero Coupon U.S. Treasury Index Exchange-Traded Fund,0.86,2.71,-2.03,0.05,-6.44,23.29,3y,23.29,65.66,2026-01-26T00:00:00.000Z