symbol,name,daily_change_pct,ytd_return_pct,one_year_return_pct,perf_1m_pct,perf_3m_pct,vol_pct,vol_window,vol_3y_pct,last_close,as_of
DGT,SPDR Global Dow ETF,-0.393,26.59,25.28,0.99,3.67,13.43,3y,13.43,167.13,2025-12-29T00:00:00.000Z
DHS,WisdomTree U.S. High Dividend Fund,-0.039,9.77,8.9,0.08,1.62,13.47,3y,13.47,102.38,2025-12-29T00:00:00.000Z
DIA,SPDR Dow Jones Industrial Average ETF Trust,-0.501,14.34,12.04,2.16,4.65,13.37,3y,13.37,484.59,2025-12-29T00:00:00.000Z
DIG,ProShares Ultra Energy ETF,1.814,-2.42,2.1,0.14,-3.54,44.09,3y,44.09,35.93,2025-12-29T00:00:00.000Z
DIHP,Dimensional International High Profitability Portfolio,-0.486,25.87,25.38,1.78,4.98,13.83,3y,13.83,31.745,2025-12-29T00:00:00.000Z
DISV,Dimensional International Small Cap Equity Fund,-0.131,43.14,43.57,4.7,6.82,15.2,3y,15.2,38.06,2025-12-29T00:00:00.000Z
DIV,Global X SuperDividend U.S. ETF,0.402,-3.43,-3.53,-1.52,-0.57,13.54,3y,13.54,17.48,2025-12-29T00:00:00.000Z
DIVB,iShares Core Dividend ETF,-0.261,13.32,11.95,2.25,2.96,13.74,3y,13.74,53.59,2025-12-29T00:00:00.000Z
DIVI,Franklin International Core Dividend Tilt Index ETF,-0.383,30.58,29.6,1.96,4.87,14.54,3y,14.54,38.99,2025-12-29T00:00:00.000Z
DIVO,Amplify CWP Enhanced Dividend Income ETF,-0.477,13.36,11.49,1.3,3.15,10.89,3y,10.89,45.89,2025-12-29T00:00:00.000Z
DJD,Invesco Dow Jones Industrial Average Dividend ETF,-0.16,13.27,12.08,-0.3,5.12,12.44,3y,12.44,57.44,2025-12-29T00:00:00.000Z
DJIA,Global X Dow 30 Covered Call ETF,0,1.03,-4.57,0.76,3.2,10.89,3y,10.89,22.57,2025-12-29T00:00:00.000Z
DJP,iPath Bloomberg Commodity Index Total Return ETN,-2.316,17.23,19.45,2.18,7.11,14.6,3y,14.6,37.96,2025-12-29T00:00:00.000Z
DLN,WisdomTree U.S. LargeCap Dividend Fund,-0.225,14.19,12.18,0.78,2.25,12,3y,12,88.68,2025-12-29T00:00:00.000Z
DLS,WisdomTree International SmallCap Dividend Fund,0.186,28.82,27.2,2.45,2.4,14.33,3y,14.33,81,2025-12-29T00:00:00.000Z
DMXF,iShares ESG Advanced MSCI EAFE Index Fund,-0.217,17.97,16.28,-0.45,0.42,15.63,3y,15.63,75.77,2025-12-29T00:00:00.000Z
DNL,WisdomTree Global ex-U.S. Quality Dividend Growth Fund,-0.289,14.98,13.31,2,3.04,15.39,3y,15.39,41.38,2025-12-29T00:00:00.000Z
DNOV,FT Vest US Equity Deep Buffer Fund,-0.133,14.38,12.76,1.14,4.63,7.97,3y,7.97,48.942,2025-12-29T00:00:00.000Z
DOCT,FT Vest U.S. Equity Deep Buffer Fund,-0.09,12.96,11.62,1.25,2.99,251.79,3y,251.79,44.45,2025-12-29T00:00:00.000Z
DOG,ProShares Short Dow30,0.562,-12.65,-10.7,-2.88,-4.47,13.48,3y,13.48,23.28,2025-12-29T00:00:00.000Z
DOL,WisdomTree International LargeCap Dividend Fund,-0.046,33.69,32.34,3.6,6.38,13.63,3y,13.63,65.84,2025-12-29T00:00:00.000Z
DON,WisdomTree U.S. MidCap Dividend Fund,-0.344,2.86,1.16,0.48,0.02,16.92,3y,16.92,52.12,2025-12-29T00:00:00.000Z
DPST,Direxion Daily Regional Banks Bull 3X Shares,-2.843,0.21,-6.53,13.52,4.62,96.58,3y,96.58,106.27,2025-12-29T00:00:00.000Z
DRIP,Direxion Daily S&P Oil & Gas Exploration & Production Bear 2X Shares,-2.283,-14.22,-22.37,6.14,7.15,56.53,3y,56.53,8.99,2025-12-29T00:00:00.000Z
DRIV,Global X Autonomous & Electric Vehicles ETF,-1.445,30.24,26.56,3.57,7.1,24.29,3y,24.29,30.02,2025-12-29T00:00:00.000Z
DRN,Direxion Daily Real Estate Bull 3X Shares,0.812,-9.2,-12.93,-4.51,-10.32,53.24,3y,53.24,8.69,2025-12-29T00:00:00.000Z
DRSK,Aptus Defined Risk ETF,-0.754,5.35,3.32,-1.6,0.45,8.04,3y,8.04,28.95,2025-12-29T00:00:00.000Z
DRV,Direxion Daily Real Estate Bear 3X Shares,-1.031,-14.54,-11.2,3.84,8.04,53.42,3y,53.42,25.93,2025-12-29T00:00:00.000Z
DRVN,Driven Brands Holdings Inc.,-0.472,-7.93,-9.95,0.96,-8.44,47.94,3y,47.94,14.75,2025-12-29T00:00:00.000Z
DSI,iShares MSCI KLD 400 Social ETF,-0.49,18.18,14.61,1.75,3.79,16.06,3y,16.06,130.03,2025-12-29T00:00:00.000Z
DSTL,Distillate U.S. Fundamental Stability & Value ETF,-0.601,8.75,6.55,1.71,3.33,13.95,3y,13.95,59.55,2025-12-29T00:00:00.000Z
DTCR,Global X Data Center & Digital Infrastructure ETF,0.284,27.49,27.03,2.97,4.14,23.85,1y,,21.15,2025-12-29T00:00:00.000Z
DTD,WisdomTree U.S. Total Dividend Fund,-0.187,12.92,10.87,0.71,2.16,12.44,3y,12.44,85.54,2025-12-29T00:00:00.000Z
DTH,WisdomTree International High Dividend Fund,-0.116,37.12,35.93,2.69,5.21,14.1,3y,14.1,51.53,2025-12-29T00:00:00.000Z
DUG,ProShares UltraShort Energy,-1.596,-18.89,-22.36,-2.36,0.21,43.16,3y,43.16,32.68,2025-12-29T00:00:00.000Z
DUHP,Dimensional US High Profitability ETF,-0.312,13.81,11.5,1.16,2.35,13.9,3y,13.9,38.4,2025-12-29T00:00:00.000Z
DUSA,Davis Select U.S. Equity ETF,-1.172,22.2,19.48,3.29,6.35,17.28,3y,17.28,51.42,2025-12-29T00:00:00.000Z
DUST,Direxion Daily Gold Miners Index Bear 2X Shares,12.012,-88.19,-88.84,-13.66,-33.09,66.59,3y,66.59,7.46,2025-12-29T00:00:00.000Z
DVY,iShares Select Dividend ETF,-0.224,8.57,7.39,-0.49,0.62,14.79,3y,14.79,142.3,2025-12-29T00:00:00.000Z
DVYE,iShares Emerging Markets Dividend ETF,-0.417,20.99,19.68,-0.35,5,16.65,3y,16.65,31.07,2025-12-29T00:00:00.000Z
DWAS,Invesco Dorsey Wright SmallCap Momentum ETF,-0.879,6.76,5.98,1.14,6.48,23.94,3y,23.94,98.13,2025-12-29T00:00:00.000Z
DXD,ProShares UltraShort Dow30,1.054,-25.93,-22.63,-4.91,-8.7,26.77,3y,26.77,20.14,2025-12-29T00:00:00.000Z
DXJ,WisdomTree Japan Hedged Equity Fund,0.188,30.45,29.16,2.36,11.57,19.94,3y,19.94,143.9,2025-12-29T00:00:00.000Z
DYNF,iShares U.S. Equity Factor Rotation Active ETF,-0.406,19.92,16.57,1.46,3.93,16,3y,16,61.35,2025-12-29T00:00:00.000Z
EAGL,Eagle Capital Select Equity ETF,-0.259,17.58,15.33,3.28,4.8,17.3,1y,,32.78,2025-12-29T00:00:00.000Z
ECH,iShares MSCI Chile ETF,-0.347,62.09,59.77,6.75,22.22,22.68,3y,22.68,40.15,2025-12-29T00:00:00.000Z
EDC,Direxion Daily MSCI Emerging Markets Bull 3X Shares,-0.711,90.45,78.12,5.64,8.01,48.8,3y,48.8,54.47,2025-12-29T00:00:00.000Z
EDIV,SPDR S&P Emerging Markets Dividend ETF,-0.711,11.65,10.26,0.75,0.77,13.3,3y,13.3,39.11,2025-12-29T00:00:00.000Z
EDZ,Direxion Daily MSCI Emerging Markets Bear 3X Shares,0.82,-61.33,-58.88,-6.23,-12.13,49.7,3y,49.7,35.65,2025-12-29T00:00:00.000Z
EEM,iShares MSCI Emerging Markets ETF,-0.255,30.89,28.19,0.77,2.76,16.42,3y,16.42,54.66,2025-12-29T00:00:00.000Z
EEMA,iShares MSCI Emerging Markets Asia ETF,0.011,31.6,28.56,1.14,2.72,18.26,3y,18.26,93.95,2025-12-29T00:00:00.000Z
EEMS,iShares MSCI Emerging Markets Small-Cap ETF,-0.624,15.23,14.44,-1.28,-0.9,14.36,3y,14.36,66.9,2025-12-29T00:00:00.000Z
EEMV,iShares MSCI Emerging Markets Minimum Volatility Factor ETF,-0.497,10.95,9.74,-0.51,0.66,10.28,3y,10.28,64.13,2025-12-29T00:00:00.000Z
EETH,ProShares Ether ETF,-0.245,-46,-46.94,-15.92,-46.51,79.25,1y,,36.59,2025-12-29T00:00:00.000Z
EFA,iShares MSCI EAFE ETF,-0.3,27.78,26.92,1.49,3.54,14.66,3y,14.66,96.28,2025-12-29T00:00:00.000Z
EFAA,Invesco MSCI EAFE Income Advantage ETF,-0.276,15.99,15.54,2.21,3.12,12.85,1y,,54.15,2025-12-29T00:00:00.000Z
EFAV,iShares MSCI EAFE Min Volatility Factor ETF,-0.012,22.93,22.59,0.55,2.74,10.93,3y,10.93,86.65,2025-12-29T00:00:00.000Z
EFG,iShares MSCI EAFE Growth ETF,-0.383,18.46,16.87,0.77,0.96,15.66,3y,15.66,114.4,2025-12-29T00:00:00.000Z
EFIV,SPDR S&P 500 ESG ETF,-0.274,18.49,14.95,1.29,4.83,15.06,3y,15.06,66.66,2025-12-29T00:00:00.000Z
EFV,iShares MSCI EAFE Value ETF,-0.279,36.71,36.66,1.97,5.76,14.67,3y,14.67,71.46,2025-12-29T00:00:00.000Z
EGGY,NestYield Dynamic Income ETF,-0.301,-7.05,-7.6,1.49,-8.14,26.58,1y,,36.49,2025-12-29T00:00:00.000Z
EIDO,iShares MSCI Indonesia ETF,1.083,-0.53,0.32,-1.06,5.54,19.52,3y,19.52,18.67,2025-12-29T00:00:00.000Z
EIPI,FT Energy Income Partners Enhanced Income ETF,0.762,0.46,1.8,-1.34,-0.35,15.04,1y,,19.84,2025-12-29T00:00:00.000Z
EIS,iShares MSCI Israel ETF,0.383,43.74,42.38,7.41,12.28,20.75,3y,20.75,110.12,2025-12-29T00:00:00.000Z
EMGF,iShares MSCI Emerging Markets Multifactor ETF,-0.069,28.17,25.55,0.78,2.75,16.07,3y,16.07,57.88,2025-12-29T00:00:00.000Z
EMLP,First Trust North American Energy Infrastructure Fund,0.291,5.72,5.83,-2.62,-0.84,13.31,3y,13.31,37.91,2025-12-29T00:00:00.000Z
EMQQ,EMQQ The Emerging Markets Internet & Ecommerce ETF,-0.144,20.23,15.76,-2.27,-10.53,24.34,3y,24.34,41.72,2025-12-29T00:00:00.000Z
EMXC,iShares MSCI Emerging Markets ex China ETF,0.207,30.44,28.82,1.91,7.66,14.99,3y,14.99,72.5,2025-12-29T00:00:00.000Z
ENFR,Alerian Energy Infrastructure ETF,0.383,-0.79,0.74,1.06,-2.93,16.57,3y,16.57,31.43,2025-12-29T00:00:00.000Z
ENTR,ERShares Private-Public Crossover ETF,-0.341,12.37,10.79,4.66,-1.35,23.8,3y,23.8,20.44,2025-12-26T00:00:00.000Z
EPHE,iShares MSCI Philippines ETF,0.04,-0.83,0.6,0.28,0.2,17.29,3y,17.29,25.09,2025-12-29T00:00:00.000Z
EPI,WisdomTree India Earnings Fund,-0.61,-0.37,-0.83,-1.68,3.28,14.67,3y,14.67,45.64,2025-12-29T00:00:00.000Z
EPOL,iShares MSCI Poland ETF,-0.682,67.19,64.05,2.61,8.88,26.91,3y,26.91,34.96,2025-12-29T00:00:00.000Z
EPP,iShares MSCI Pacific ex Japan ETF,-1.011,16.31,14.6,0.97,-1.15,16.87,3y,16.87,50.93,2025-12-29T00:00:00.000Z
EPS,WisdomTree U.S. LargeCap Fund,-0.349,16.82,13.62,1.09,3.87,14.25,3y,14.25,71.4,2025-12-29T00:00:00.000Z
EPU,iShares MSCI Peru and Global Exposure ETF,-2.467,80.06,78.27,14.03,18.34,21.07,3y,21.07,71.95,2025-12-29T00:00:00.000Z
EQAL,Invesco Russell 1000 Equal Weight ETF,-0.338,9.76,8.73,1.16,2.31,15.73,3y,15.73,53.07,2025-12-29T00:00:00.000Z
EQL,Alps Equal Sector Weight ETF,-0.192,12.07,10.2,0.69,1.83,12.87,3y,12.87,46.7,2025-12-29T00:00:00.000Z
EQWL,Invesco S&P 100 Equal Weight ETF,-0.268,16.67,14.65,2,3.92,13.4,3y,13.4,118.96,2025-12-29T00:00:00.000Z
EQWM,Invesco S&P MidCap Quality ETF,-0.076,6.38,4.93,2.4,1.02,19.15,3y,19.15,104.7,2025-12-26T00:00:00.000Z
ERX,Direxion Daily Energy Bull 2X Shares,1.884,-2.19,2.45,0.45,-3.28,44.11,3y,44.11,55.71,2025-12-29T00:00:00.000Z
ERY,Direxion Daily Energy Bear 2X Shares,-1.722,-18.88,-22.5,-1.87,0.86,43.49,3y,43.49,19.98,2025-12-29T00:00:00.000Z
ESGD,iShares ESG Aware MSCI EAFE ETF,-0.314,25.74,24.95,1.23,2.94,14.75,3y,14.75,95.36,2025-12-29T00:00:00.000Z
ESGE,iShares ESG Aware MSCI Emerging Markets ETF,-0.181,32.47,29.56,0.27,2.17,16.68,3y,16.68,44.18,2025-12-29T00:00:00.000Z
ESGU,iShares ESG Aware MSCI USA ETF,-0.371,16.89,13.75,1.19,3.57,15.41,3y,15.41,150.37,2025-12-29T00:00:00.000Z
ESGV,Vanguard ESG U.S. Stock ETF,-0.44,16.67,13.22,1.33,3.41,16.24,3y,16.24,122.06,2025-12-29T00:00:00.000Z
ESML,iShares ESG Aware MSCI USA Small-Cap ETF,-0.554,11.02,9.38,1.51,3.71,19.95,3y,19.95,46.65,2025-12-29T00:00:00.000Z
ESPO,VanEck Video Gaming and eSports ETF,-0.363,24.32,23.6,-5,-14.44,21.39,3y,21.39,104.38,2025-12-29T00:00:00.000Z
ETHD,ProShares UltraShort Ether ETF,0.393,-75.55,-75.09,-4.24,41.16,152.68,1y,,51.1,2025-12-29T00:00:00.000Z
ETHT,ProShares Ultra Ether ETF,-0.355,-68.53,-69.91,-12.47,-60.11,152.21,1y,,36.49,2025-12-29T00:00:00.000Z
ETHU,2X Ether ETF,-0.431,-68.1,-69.47,-11.58,-59.75,152.25,1y,,53.15,2025-12-29T00:00:00.000Z
ETHV,VanEck Ethereum ETF,-0.152,-15.42,-16.54,-3.35,-30.32,74.9,1y,,42.805,2025-12-29T00:00:00.000Z
ETHW,Bitwise Ethereum ETF,-0.238,-15.5,-16.71,-3.46,-30.36,74.85,1y,,20.94,2025-12-29T00:00:00.000Z
ETQ,T-Rex 2x Inverse Daily Target ETF,-0.045,-75.57,-75.33,-6.5,34.24,152.79,1y,,44.3,2025-12-29T00:00:00.000Z
ETU,Trex 2x Long Ether ETU ETF,-0.565,-65.92,-67.01,-11.84,-59.44,151.79,1y,,14.07,2025-12-29T00:00:00.000Z
EU,Encore Energy Corp,-1.224,-34.59,-28.82,-9.7,-21.68,72.67,3y,72.67,2.42,2025-12-29T00:00:00.000Z
EUAD,STOXX Europe Aerospace & Defense ETF,-1.483,71.59,70.72,3.31,-9.88,28.38,1y,,41.86,2025-12-29T00:00:00.000Z
EUFN,iShares MSCI Europe Financials ETF,-0.909,60.88,58.6,6.62,8.46,18.83,3y,18.83,37.05,2025-12-29T00:00:00.000Z
EUSA,iShares MSCI USA Equal Weighted ETF,-0.229,9.83,7.79,1.6,1.52,14.98,3y,14.98,104.48,2025-12-29T00:00:00.000Z
EVTR,Eaton Vance Total Return Fund,0.058,3.41,3.79,-0.81,-0.14,4.13,1y,,51.58,2025-12-29T00:00:00.000Z
EWA,iShares MSCI Australia ETF,-0.75,10.75,8.88,2.44,-1.93,18.6,3y,18.6,26.48,2025-12-29T00:00:00.000Z
EWC,iShares MSCI Canada ETF,-0.858,34.65,34.28,3.98,7.67,15.27,3y,15.27,54.33,2025-12-29T00:00:00.000Z
EWD,iShares MSCI Sweden ETF,-0.665,31.77,31.27,3.98,4.45,20.48,3y,20.48,49.32,2025-12-29T00:00:00.000Z
EWG,iShares MSCI Germany ETF,-0.328,34.61,31.61,4.7,2.9,17.13,3y,17.13,42.51,2025-12-29T00:00:00.000Z
EWH,iShares MSCI Hong Kong ETF,-2.054,30.85,26.83,-3.16,-0.19,20.99,3y,20.99,21.46,2025-12-29T00:00:00.000Z
EWI,iShares MSCI Italy ETF,-0.842,52.35,50.11,3.08,5.17,18.19,3y,18.19,54.16,2025-12-29T00:00:00.000Z
EWJ,iShares MSCI Japan ETF,0.148,21.01,20.63,-2.31,1.1,17.95,3y,17.95,81.09,2025-12-29T00:00:00.000Z
EWJV,iShares MSCI Japan Value ETF,0.443,27.71,29.83,-1.21,1.78,18.39,3y,18.39,39.871,2025-12-29T00:00:00.000Z
EWL,iShares MSCI Switzerland ETF,-0.314,31.62,29.87,4.87,10.59,14.37,3y,14.37,60.35,2025-12-29T00:00:00.000Z
EWM,iShares MSCI Malaysia ETF,-0.398,13.15,15.28,3.34,6.79,13.38,3y,13.38,27.53,2025-12-29T00:00:00.000Z
EWMC,Invesco S&P MidCap 400 Equal Weight ETF,-0.32,7.67,8.14,2.11,1.51,20.53,3y,20.53,121.64,2025-12-26T00:00:00.000Z
EWN,iShares MSCI Netherlands ETF,-0.28,28.41,26.36,-1.37,-1.16,19.46,3y,19.46,57,2025-12-29T00:00:00.000Z
EWP,iShares MSCI Spain ETF,-0.167,73.77,73.32,4.28,9.98,18.38,3y,18.38,53.8,2025-12-29T00:00:00.000Z
EWQ,iShares MSCI France ETF,-0.421,26.59,25.08,1.26,2.76,17.13,3y,17.13,44.99,2025-12-29T00:00:00.000Z
EWS,iShares MSCI Singapore ETF,0.544,27.36,26.08,-1.49,-2.09,16.99,3y,16.99,27.7,2025-12-29T00:00:00.000Z
EWT,iShares MSCI Taiwan ETF,0.492,23.35,19.24,-0.52,0.4,23.07,3y,23.07,63.33,2025-12-29T00:00:00.000Z
EWU,iShares MSCI United Kingdom ETF,-0.497,30.16,29.2,2.4,5.74,14.28,3y,14.28,44.02,2025-12-29T00:00:00.000Z
EWW,iShares MSCI Mexico ETF,-0.9,47.76,45.65,3.87,4.52,23.21,3y,23.21,70.51,2025-12-29T00:00:00.000Z
EWX,SPDR S&P Emerging Markets Small Cap ETF,-1.076,12.04,10.35,-0.9,-2.41,14.41,3y,14.41,65.25,2025-12-29T00:00:00.000Z
EWY,iShares MSCI South Korea ETF,3.005,93.11,87.29,7.83,23.03,24.51,3y,24.51,98.72,2025-12-29T00:00:00.000Z
EWZ,iShares MSCI Brazil ETF,-0.977,38.35,38.05,-6.12,1.39,24.54,3y,24.54,31.42,2025-12-29T00:00:00.000Z
EWZS,iShares MSCI Brazil Small-Cap ETF,-1.233,37.7,35.81,-8.3,-8.36,28.98,3y,28.98,12.82,2025-12-29T00:00:00.000Z
EXI,iShares Global Industrials ETF,-0.288,25.22,23.45,2.91,2.56,15.17,3y,15.17,176.39,2025-12-29T00:00:00.000Z
EYLD,Cambria Emerging Shareholder Yield Fund,-0.624,22.13,20.11,-0.98,3.32,16.11,3y,16.11,38.25,2025-12-29T00:00:00.000Z
EZA,iShares MSCI South Africa ETF,-2.674,61.66,58.26,0.88,7.9,26.24,3y,26.24,68.43,2025-12-29T00:00:00.000Z
EZBC,Franklin Bitcoin ETF,-0.494,-10.74,-12.19,-3.21,-23.98,42.09,1y,,50.35,2025-12-29T00:00:00.000Z
EZET,Franklin Ethereum ETF,-0.27,-15.6,-16.68,-3.44,-30.36,75.04,1y,,22.18,2025-12-29T00:00:00.000Z
EZM,WisdomTree U.S. MidCap Fund,-0.398,8.72,6.78,0.88,2.58,19.52,3y,19.52,67.57,2025-12-29T00:00:00.000Z
EZU,iShares MSCI Eurozone ETF,-0.358,36.88,34.75,2.69,4.19,16.75,3y,16.75,64.1,2025-12-29T00:00:00.000Z
FAS,Direxion Daily Financial Bull 3x Shares,-1.542,16.05,10.34,5.64,-3.79,49.9,3y,49.9,173.7,2025-12-29T00:00:00.000Z
FAZ,Direxion Daily Financial Bear 3x Shares,1.638,-41.92,-38.97,-13.01,-6.86,50.12,3y,50.12,37.23,2025-12-29T00:00:00.000Z
FBCG,Fidelity Blue Chip Growth Fund,-0.63,18.65,14.92,1.43,3.23,22.92,3y,22.92,55.22,2025-12-29T00:00:00.000Z
FBL,Graniteshares 2x Long Meta ETF,-3.483,-6.08,-8.83,4.72,-27.28,72.02,3y,72.02,32.42,2025-12-29T00:00:00.000Z
FBOT,Fidelity Disruptive Automation ETF,-0.223,19.62,16.66,3.71,3.11,20.43,3y,20.43,33.53,2025-12-29T00:00:00.000Z
FBT,First Trust NYSE Arca Biotechnology Index Fund,-0.556,27.74,27.35,-0.83,20.43,19.57,3y,19.57,212.95,2025-12-29T00:00:00.000Z
FBTC,Fidelity Wise Origin Bitcoin Index Fund,-0.524,-10.81,-12.2,-3.2,-23.98,42.03,1y,,75.88,2025-12-29T00:00:00.000Z
FBY,YieldMax META Option Income Strategy ETF,-0.317,-35.09,-35.85,-2.18,-20.83,29.42,3y,29.42,12.58,2025-12-29T00:00:00.000Z
FCG,First Trust Natural Gas ETF,0.951,-6.97,-2.18,-3.03,-1.31,27.96,3y,27.96,23.36,2025-12-29T00:00:00.000Z
FCOM,Fidelity MSCI Communication Services Index ETF,-0.163,24.04,21.45,2.39,2.69,18.78,3y,18.78,73.28,2025-12-29T00:00:00.000Z
FCTE,SMI 3Fourteen FC Trend ETF,-0.512,-2.32,-4.89,1.63,-4.71,19.77,1y,,25.27,2025-12-29T00:00:00.000Z
FCVT,First Trust SSI Strategic Convertible Securities ETF,-0.16,19.04,17.28,1.04,2,11.78,3y,11.78,43.57,2025-12-29T00:00:00.000Z
FDCF,Fidelity Disruptive Communications ETF,0.05,27.12,24.47,3.52,-2.45,20.56,3y,20.56,48.345,2025-12-29T00:00:00.000Z
FDD,First Trust STOXX European Select Dividend Index Fund,-0.457,55.58,54.75,5.7,8.59,16.63,3y,16.63,17.44,2025-12-29T00:00:00.000Z
FDEM,Fidelity Emerging Markets Multi-Asset Fund,-0.389,20.77,19.92,1.15,2.43,14.52,3y,14.52,30.76,2025-12-29T00:00:00.000Z
FDEV,Fidelity International Multi-Asset Fund,-0.315,27.52,27.19,2.86,5.93,12.53,3y,12.53,34.85,2025-12-29T00:00:00.000Z
FDG,American Century Focused Dynamic Growth ETF,-0.734,23.37,18.19,3.97,6.64,21.44,3y,21.44,127.974,2025-12-29T00:00:00.000Z
FDIG,Fidelity Crypto Industry & Digital Payments ETF,-0.457,19.14,11.57,-8.12,-18.85,59.53,3y,59.53,39.674,2025-12-29T00:00:00.000Z
FDIS,Fidelity MSCI Consumer Discretionary Index ETF,-0.957,7.43,1.56,2.67,-0.15,21.22,3y,21.22,103.47,2025-12-29T00:00:00.000Z
FDL,First Trust Morningstar Dividend Leaders Index Fund,0.113,10.45,9.94,1.04,3.27,13.87,3y,13.87,44.48,2025-12-29T00:00:00.000Z
FDLO,Fidelity Low Volatility Factor ETF,-0.237,11.54,9.06,-0.31,2.58,11.35,3y,11.35,67.26,2025-12-29T00:00:00.000Z
FDMO,Fidelity Momentum Factor ETF,-0.539,21.56,18.15,1.37,2.44,17.64,3y,17.64,84.91,2025-12-29T00:00:00.000Z
FDN,First Trust Dow Jones Internet Index Fund,-0.304,11.53,7.77,1.86,-4.17,22.47,3y,22.47,271.78,2025-12-29T00:00:00.000Z
FDRR,Fidelity Dividend ETF for Rising Rates,-0.325,19.44,17.26,0.89,5.04,14,3y,14,61.329,2025-12-29T00:00:00.000Z
FDT,First Trust Developed Markets ex-US Fund,-0.188,47.72,48,1.86,6.53,15.84,3y,15.84,79.77,2025-12-29T00:00:00.000Z
FDTX,Fidelity Disruptive Technology ETF,-0.354,15.64,12.48,3.8,1.34,24.86,3y,24.86,41.134,2025-12-29T00:00:00.000Z
FDV,Federated Hermes U.S. Strategic Dividend ETF,-0.483,8.38,7.2,-0.21,1.19,13,3y,13,28.84,2025-12-29T00:00:00.000Z
FDVV,Fidelity High Dividend ETF,-0.193,14.03,12.72,0.49,2.63,13.15,3y,13.15,56.99,2025-12-29T00:00:00.000Z
FEGE,First Eagle Global Equity ETF,-0.701,33.61,32.49,2.57,6.03,14.53,1y,,46.77,2025-12-29T00:00:00.000Z
FELC,Fidelity Enhanced Large Cap Core ETF,-0.362,17.13,13.94,1.66,3.61,18.46,1y,,38.5,2025-12-29T00:00:00.000Z
FELG,Fidelity Enhanced Large Cap Growth ETF,-0.473,19.22,14.74,0.81,2.83,23.49,1y,,42.11,2025-12-29T00:00:00.000Z
FELV,Fidelity Enhanced Large Cap Value ETF,-0.2,15.01,13.18,1.98,4.33,16.31,1y,,34.94,2025-12-29T00:00:00.000Z
FENI,Fidelity Enhanced International ETF,-0.326,33.7,32.77,2.8,4.56,16.87,1y,,36.7,2025-12-29T00:00:00.000Z
FENY,Fidelity MSCI Energy Index ETF,0.939,2.36,5.1,-0.08,-1,22.43,3y,22.43,24.73,2025-12-29T00:00:00.000Z
FEOE,First Eagle Overseas Equity ETF,-0.527,41.5,40.52,3.48,6.87,14.26,1y,,49.06,2025-12-29T00:00:00.000Z
FEPI,Rex FANG Innovation Premium Income ETF,-0.196,-7.55,-10.4,1.08,-2.14,23.35,1y,,45.81,2025-12-29T00:00:00.000Z
FESM,Fidelity Enhanced Small Cap ETF,-0.598,17.9,16.33,1.4,5.11,22.97,1y,,38.26,2025-12-29T00:00:00.000Z
FETH,Fidelity Ethereum Fund,-0.205,-15.62,-16.72,-3.41,-30.31,75.01,1y,,29.18,2025-12-29T00:00:00.000Z
FEX,First Trust Large Cap Core Fund A,-0.338,14.64,13.88,1.9,2.68,14.68,3y,14.68,119.7547,2025-12-29T00:00:00.000Z
FEZ,SPDR Euro Stoxx 50 ETF,-0.618,34.96,32.43,2.53,4.18,17.4,3y,17.4,64.32,2025-12-29T00:00:00.000Z
FFLC,Fidelity Large Cap Core Fund,-0.352,17.11,14.42,1.66,3.68,15.71,3y,15.71,53.79,2025-12-29T00:00:00.000Z
FFLG,Fidelity Fund Large Cap Growth ETF,-0.51,19.73,16.14,1.41,2.89,21.89,3y,21.89,30.22,2025-12-29T00:00:00.000Z
FFSM,Fidelity Small-Mid Cap Opportunities ETF,-0.89,15.44,14.73,1.76,7.19,18.99,3y,18.99,31.17,2025-12-29T00:00:00.000Z
FFTY,Innovator IBD 50 ETF,-1.868,23.21,17.15,0.25,-4.62,27.51,3y,27.51,35.73,2025-12-29T00:00:00.000Z
FGD,First Trust Dow Jones Global Select Dividend Index Fund,-0.229,36.84,36.35,1.06,6.06,13.53,3y,13.53,30.46,2025-12-29T00:00:00.000Z
FGDL,Franklin Responsibly Sourced Gold ETF,-4.268,63.14,65.54,4.47,12.99,16.45,3y,16.45,57.897,2025-12-29T00:00:00.000Z
FGLD,Franklin Responsibly Sourced Gold ETF,1.117,70.41,72.35,9.62,20.67,16.28,3y,16.28,60.4778,2025-12-26T00:00:00.000Z
FGRO,Fidelity Growth Opportunities ETF,0.049,20.34,19.16,3.07,4.74,21.96,3y,21.96,30.375,2025-12-26T00:00:00.000Z
FHEQ,Fidelity Hedged Equity ETF,-0.352,13.48,11.04,0.78,1.9,11.3,1y,,31.14,2025-12-29T00:00:00.000Z
FHLC,Fidelity MSCI Health Care Index ETF,-0.253,14.39,13.06,-1.76,14.41,13.69,3y,13.69,74.86,2025-12-29T00:00:00.000Z
FIAT,YieldMax Short COIN Option Income Strategy ETF,0.846,-70.31,-68.03,2.35,-0.62,60.09,1y,,27.43,2025-12-29T00:00:00.000Z
FIBR,iShares Systematic Bond ETF,0.067,3.27,3.6,-0.53,0.05,5.09,3y,5.09,89.9,2025-12-26T00:00:00.000Z
FIDI,Fidelity International High Dividend ETF,-0.23,33.27,33.98,3.26,6.72,14.08,3y,14.08,26,2025-12-29T00:00:00.000Z
FIDU,Fidelity MSCI Industrials Index ETF,-0.37,19.35,17.04,2.4,2.9,16.81,3y,16.81,83.52,2025-12-29T00:00:00.000Z
FIG,CI Investment Grade Bond ETF,-1.843,-67.26,-67.26,4.62,-28.87,97.88,SI,,37.82,2025-12-29T00:00:00.000Z
FINX,GLOBAL X FINTECH ETF,-0.499,-3.6,-7.39,0.42,-11.58,26.32,3y,26.32,30.135,2025-12-29T00:00:00.000Z
FIVA,Fidelity International Value Factor ETF,-0.262,42,40.55,5.22,9.87,14.58,3y,14.58,34.28,2025-12-29T00:00:00.000Z
FIVG,Defiance 5G Next Gen Connectivity ETF,-0.102,35.45,34.8,2.27,5.35,23.7,3y,23.7,64.8138,2025-12-26T00:00:00.000Z
FIW,First Trust Water ETF,-0.271,8.92,6.9,-1.62,-0.59,16.47,3y,16.47,110.46,2025-12-29T00:00:00.000Z
FJAN,FT Vest U.S. Equity Buffer ETF FJAN,-0.039,12.97,13.02,1.59,3.57,9.44,3y,9.44,51.84,2025-12-29T00:00:00.000Z
FLCA,Franklin FTSE Canada ETF,-0.612,32.68,33.18,4.1,7.69,15.02,3y,15.02,48.76,2025-12-29T00:00:00.000Z
FLCG,Federated Hermes MDT Large Cap Growth ETF,-0.447,18.09,13.87,2.3,2.77,23.57,1y,,33.42,2025-12-29T00:00:00.000Z
FLCH,Franklin FTSE China ETF,-1.524,31.95,27.08,-2.57,-7.25,27.17,3y,27.17,23.91,2025-12-29T00:00:00.000Z
FLGB,Franklin FTSE United Kingdom ETF,-0.472,29,27.95,2.24,5.21,14.49,3y,14.49,33.72,2025-12-29T00:00:00.000Z
FLIN,Franklin FTSE India ETF,-0.78,-0.63,-0.63,-2.43,2.25,13.6,3y,13.6,38.16,2025-12-29T00:00:00.000Z
FLJP,Franklin FTSE Japan ETF,0.289,21.39,22.5,-2.94,0,17.53,3y,17.53,34.68,2025-12-29T00:00:00.000Z
FLKR,Franklin FTSE South Korea ETF,2.54,84.73,79.39,5.97,19.53,23.98,3y,23.98,32.29,2025-12-29T00:00:00.000Z
FLMX,Franklin FTSE Mexico ETF,-0.822,46.81,44.23,3.75,4.95,22.47,3y,22.47,34.486,2025-12-29T00:00:00.000Z
FLQG,Franklin LibertyQ Global Equity ETF,-0.103,17.93,16.72,2.04,4.59,15.4,3y,15.4,60.5074,2025-12-26T00:00:00.000Z
FLQL,Franklin U.S. Large Cap Multisector Fund,-0.553,19.89,16.5,1.16,2.86,15.06,3y,15.06,70.11,2025-12-29T00:00:00.000Z
FLQM,Franklin U.S. Mid Cap Multifactor Index Fund,-0.315,5.32,3.67,0.83,0.94,15.03,3y,15.03,57,2025-12-29T00:00:00.000Z
FLTW,Franklin FTSE Taiwan ETF,0.58,29.68,25.65,1.95,4.14,21.52,3y,21.52,60.69,2025-12-29T00:00:00.000Z
FMAT,Fidelity MSCI Materials Index ETF,-0.997,12.48,9.63,3.83,3.17,17.51,3y,17.51,53.64,2025-12-29T00:00:00.000Z
FMDE,Fidelity Enhanced Mid Cap ETF,-0.434,11.98,9.85,1.69,1.41,19.1,1y,,36.74,2025-12-29T00:00:00.000Z
FMIL,Fidelity New Millennium ETF,0.093,17.53,17.02,2.76,4.71,15.81,3y,15.81,53.98,2025-12-26T00:00:00.000Z
FNCL,Fidelity MSCI Financials Index ETF,-0.582,14.81,12.83,4.7,2.46,17.75,3y,17.75,78.62,2025-12-29T00:00:00.000Z
FNDA,Schwab Fundamental U.S. Small Company ETF,-0.592,7.98,6.54,1.24,2.54,19.96,3y,19.96,31.93,2025-12-29T00:00:00.000Z
FNDB,Schwab Fundamental U.S. Broad Market ETF,-0.261,15.34,13.63,1.25,4.12,13.81,3y,13.81,26.76,2025-12-29T00:00:00.000Z
FNDC,Schwab Fundamental International Small Company Index ETF,-0.111,31.81,31.16,-0.07,0.76,14.23,3y,14.23,44.83,2025-12-29T00:00:00.000Z
FNDE,Schwab Fundamental Emerging Markets Large Company Index ETF,-0.746,24.45,21.83,-2.68,-0.53,16.52,3y,16.52,35.94,2025-12-29T00:00:00.000Z
FNDF,Schwab Fundamental International Large Company Index ETF,0.044,36.88,36.56,1.21,5.61,14.45,3y,14.45,45.35,2025-12-29T00:00:00.000Z
FNDX,Schwab Fundamental U.S. Large Company Index ETF,-0.182,16.14,14.2,1.33,4.34,13.64,3y,13.64,27.42,2025-12-29T00:00:00.000Z
FNGB,MicroSectors FANG+ 3X Leveraged ETNs,-0.375,9.56,9.56,-8.89,-7.88,83.32,1y,,26.55,2025-12-26T00:00:00.000Z
FNGD,MicroSectors FANG+ Index -3X Inverse Leveraged Exchange Traded Note,1.996,-62.26,-57.77,9.66,0.59,81.54,3y,81.54,5.11,2025-12-29T00:00:00.000Z
FNGG,Direxion Daily NYSE FANG+ Bull 2X Shares,-1.586,15.21,6.69,-15.6,-13.74,53.49,3y,53.49,209.51,2025-12-29T00:00:00.000Z
FNGO,MicroSectors FANG+ Index 2X Leveraged ETNs,-1.595,28.74,17.9,-7.27,-5.56,53.62,3y,53.62,118.98,2025-12-29T00:00:00.000Z
FNGS,MicroSectors FANG+ ETN,-0.737,20.36,14.52,-3.59,-2.04,27.05,3y,27.05,68.69,2025-12-29T00:00:00.000Z
FNGU,MicroSectors FANG+ Index 3X Leveraged ETN,-2.034,-95.61,-95.04,-11.08,-11.41,193.73,3y,193.73,26.01,2025-12-29T00:00:00.000Z
FNOV,FT Vest US Equity Buffer ETF,-0.109,15.22,13.28,1.34,4.45,10.11,3y,10.11,55.1,2025-12-29T00:00:00.000Z
FNX,First Trust Mid Cap Core AlphaDEX Fund,-0.608,10.22,9.08,1.27,1.98,19.39,3y,19.39,127.6,2025-12-29T00:00:00.000Z
FNY,First Trust Mid Cap Growth Fund,-0.876,15.63,13.52,0.87,1.83,20.26,3y,20.26,92.79,2025-12-29T00:00:00.000Z
FOCT,FT Vest U.S. Equity Buffer ETF,-0.142,15.54,13.57,1.17,3.81,10.03,3y,10.03,49.21,2025-12-29T00:00:00.000Z
FPE,First Trust Preferred Securities and Income ETF,0,2.76,2.88,0,-0.16,7.14,3y,7.14,18.24,2025-12-29T00:00:00.000Z
FPEI,First Trust Institutional Preferred Securities and Income ETF,0.052,3.63,3.63,0.18,0.26,6.64,3y,6.64,19.41,2025-12-29T00:00:00.000Z
FPX,First Trust US Equity Opportunities ETF,-0.802,37.73,34.3,4.66,0.94,25.64,3y,25.64,166.97,2025-12-29T00:00:00.000Z
FQAL,Fidelity Quality Factor ETF,-0.363,16.81,14.28,0.97,2.8,14.23,3y,14.23,76.391,2025-12-29T00:00:00.000Z
FRDM,Freedom 100 Emerging Markets ETF,0.373,56.18,52.23,6.62,16.11,18.5,3y,18.5,51.18,2025-12-29T00:00:00.000Z
