symbol,name,daily_change_pct,ytd_return_pct,one_year_return_pct,perf_1m_pct,perf_3m_pct,vol_pct,vol_window,vol_3y_pct,last_close,as_of
ISTXF,iShares U.S. Treasury 1-3 Year USD A Mutual Fund,,,,,,,,,,2025-12-30T09:06:26.959Z
ISVQF,iShares USD Short Duration USD A,,,,,,,,,,2025-12-30T09:06:27.117Z
ITM,VanEck Intermediate Muni ETF,-0.296,1.9,2.43,-0.06,1.16,4.33,3y,4.33,47.14,2025-12-29T00:00:00.000Z
IUSB,iShares Core Total Bond Market ETF,0.107,3.27,3.46,-0.72,-0.06,5.71,3y,5.71,46.68,2025-12-29T00:00:00.000Z
JAAA,Janus Henderson AAA CLO ETF,0.02,-0.39,-0.16,-0.3,-0.45,2.1,3y,2.1,50.55,2025-12-29T00:00:00.000Z
JAGG,JPMorgan U.S. Aggregate Bond ETF,0.086,3.32,3.3,-0.52,0.37,6.01,3y,6.01,46.71,2025-12-29T00:00:00.000Z
JBBB,Janus Henderson B-BBB CLO ETF,-0.021,-3.43,-3.03,-0.74,-1.12,4.49,3y,4.49,47.64,2025-12-29T00:00:00.000Z
JBND,JPMorgan Active Bond ETF,0.184,3.96,3.86,-0.48,0.44,4.56,1y,,54.37,2025-12-29T00:00:00.000Z
JCPB,JPMorgan Core Plus Bond ETF,0.126,3.43,3.26,-0.47,0.21,5.66,3y,5.66,47.66,2025-12-29T00:00:00.000Z
JCPI,J.P. Morgan Inflation Managed Bond Fund,0.01,3.87,3.57,-0.72,-0.85,4.22,3y,4.22,48.415,2025-12-29T00:00:00.000Z
JHMB,John Hancock Mortgage-Backed Securities ETF,-0.626,3.88,3.38,-0.47,0.36,6.72,3y,6.72,22.215,2025-12-29T00:00:00.000Z
JMBS,Janus Henderson Mortgage-Backed Securities ETF,-0.066,3.39,3.72,-0.61,0.13,6.79,3y,6.79,45.74,2025-12-29T00:00:00.000Z
JMHI,JPMorgan High Yield Municipal ETF,0.01,0.21,0.51,-0.84,0.01,4.78,3y,4.78,50.375,2025-12-29T00:00:00.000Z
JMSI,JPMorgan Sustainable Municipal Income ETF,0.018,0.72,0.76,-0.2,0.58,3.87,3y,3.87,50.499,2025-12-29T00:00:00.000Z
JMST,JPMorgan Ultra-Short Municipal Income Fund,0.025,0.62,0.47,0.12,0.01,1.17,3y,1.17,51.033,2025-12-29T00:00:00.000Z
JMUB,JPMorgan Municipal Bond ETF,0.119,0.79,0.87,-0.29,0.41,3.52,3y,3.52,50.635,2025-12-29T00:00:00.000Z
JNK,SPDR Bloomberg High Yield Bond ETF,0.031,1.5,1.83,-0.39,-0.89,6.29,3y,6.29,97.19,2025-12-29T00:00:00.000Z
JPHY,JPMorgan Active High Yield ETF,0.114,10.18,9.7,0.04,-0.32,7.73,3y,7.73,50.88,2025-12-29T00:00:00.000Z
JPST,JPMorgan Ultra-Short Income ETF,0.02,0.73,0.49,0.04,0.04,1.47,3y,1.47,50.76,2025-12-29T00:00:00.000Z
JSCP,JPMorgan Short Duration Core Plus ETF,0.105,2.43,2.3,0.12,0.33,2.95,3y,2.95,47.765,2025-12-29T00:00:00.000Z
JSI,Janus Henderson Securitized Income ETF,-0.071,0.29,0.77,-0.46,-0.36,3.33,1y,,52.04,2025-12-29T00:00:00.000Z
KORP,American Century Diversified Corporate Bond ETF,0.106,3.16,3.31,-0.9,-0.59,5.63,3y,5.63,47.4,2025-12-29T00:00:00.000Z
LDUR,PIMCO Enhanced Low Duration Active Exchange-Traded Fund,0.104,1.48,1.14,0.11,0.31,2.42,3y,2.42,96.37,2025-12-29T00:00:00.000Z
LEMB,iShares J.P. Morgan EM Local Currency Bond ETF,-0.408,14.76,14.31,-1.14,0.75,7.15,3y,7.15,41.45,2025-12-29T00:00:00.000Z
LONZ,PIMCO Senior Loan Active Exchange-Traded Fund,-0.049,-0.59,-1.25,0.2,-0.53,3.54,3y,3.54,50.78,2025-12-29T00:00:00.000Z
LQD,iShares iBoxx $ Investment Grade Corporate Bond ETF,0.136,3.69,3.54,-1.12,-0.71,8,3y,8,110.79,2025-12-29T00:00:00.000Z
LQDH,iShares Interest Rate Hedged Corporate Bond ETF,0,0.66,0.53,-0.09,-0.17,4.25,3y,4.25,93.35,2025-12-29T00:00:00.000Z
LQTI,FT Vest Investment Grade & Target Income ETF,0.1,0.55,0.55,-1.23,-1.52,6.6,1y,,20.11,2025-12-29T00:00:00.000Z
LTPZ,PIMCO 15+ Year U.S. TIPS Index Exchange-Traded Fund,0.346,0.38,-0.53,-2.64,-2.06,14.25,3y,14.25,52.27,2025-12-29T00:00:00.000Z
MBB,iShares MBS ETF,0.094,4.2,4.55,-0.55,0.27,6.95,3y,6.95,95.45,2025-12-29T00:00:00.000Z
MBSF,Regan Floating Rate MBS ETF,0.035,0.64,0.74,0.11,0.78,3.53,1y,,25.629,2025-12-29T00:00:00.000Z
MEAR,iShares Short Maturity Bond ETF,0.04,0.68,0.69,-0.16,-0.3,1.4,3y,1.4,50.31,2025-12-29T00:00:00.000Z
MINT,PIMCO Enhanced Short Maturity Active Exchange-Traded Fund,0.01,0.34,0.05,0.02,0.04,1.45,3y,1.45,100.66,2025-12-29T00:00:00.000Z
MLN,VanEck Long Muni ETF,-0.113,-1.34,-1.07,0.06,0.74,7.26,3y,7.26,17.61,2025-12-29T00:00:00.000Z
MMIN,NYLI MacKay Muni Insured ETF,0.083,0.42,0.46,0.04,1.18,5.39,3y,5.39,24.05,2025-12-29T00:00:00.000Z
MMIT,NYLI MacKay Muni Intermediate ETF,0.041,1.37,1.5,-0.01,0.62,3.76,3y,3.76,24.39,2025-12-29T00:00:00.000Z
MTBA,Simplify MBS ETF,0.059,1.47,1.92,-0.03,0.22,3.53,1y,,50.46,2025-12-29T00:00:00.000Z
MUB,iShares National Muni Bond ETF,0.14,0.34,0.84,-0.34,0.58,4.31,3y,4.31,107.04,2025-12-29T00:00:00.000Z
MUNI,PIMCO Intermediate Municipal Bond Active Exchange-Traded Fund,0.076,1.51,1.37,-0.11,0.55,3.69,3y,3.69,52.56,2025-12-29T00:00:00.000Z
MUU,Dx Daily Muni Bond Bull 2x Shares,6.742,551.15,520.97,49.84,169.3,126.3,1y,,107.18,2025-12-29T00:00:00.000Z
NBSD,Neuberger Berman Short Duration Income ETF,0.02,0.83,1.16,0.06,0.1,3.59,1y,,51.15,2025-12-29T00:00:00.000Z
NCLO,Nuveen AA-BBB CLO ETF,0.16,-0.08,0.08,-0.42,-0.28,3.4,1y,,25.04,2025-12-29T00:00:00.000Z
NEAR,iShares Short Maturity Bond ETF,0.02,1.27,1.47,-0.37,-0.31,2.07,3y,2.07,51.11,2025-12-29T00:00:00.000Z
NUBD,Nuveen ESG U.S. Aggregate Bond ETF,0.134,3.03,3.25,-0.77,-0.11,5.89,3y,5.89,22.425,2025-12-29T00:00:00.000Z
NYF,iShares New York Muni Bond ETF,0.075,0.49,0.87,-0.26,0.36,4.15,3y,4.15,53.51,2025-12-29T00:00:00.000Z
OBIL,US Treasury 12 Month Bill Mutual Fund,0,0.63,0.4,0.08,0.06,1.47,3y,1.47,50.325,2025-12-29T00:00:00.000Z
PAAA,PGIM AAA CLO ETF,0.02,0.06,-0.25,-0.37,-0.52,1.96,1y,,51.24,2025-12-29T00:00:00.000Z
PCRB,Putnam ESG Core Bond ETF,0.132,2.83,3.09,-0.47,0.01,390.18,3y,390.18,49.44,2025-12-29T00:00:00.000Z
PCY,Invesco Emerging Markets Sovereign Debt ETF,0.184,9.38,8.46,-0.09,1.21,11.22,3y,11.22,21.8,2025-12-29T00:00:00.000Z
PFIX,Simplify Interest Rate Hedge ETF,-1.589,-11.13,-11.39,-0.34,-2.68,52.54,3y,52.54,46.46,2025-12-29T00:00:00.000Z
PGHY,Invesco Global ex-US High Yield Corporate Bond ETF,-0.1,1.27,0.76,0.25,-0.3,5.6,3y,5.6,19.91,2025-12-29T00:00:00.000Z
PHB,Invesco Fundamental High Yield Corporate Bond ETF,0.215,2.93,3.1,0.11,0.32,5.53,3y,5.53,18.64,2025-12-29T00:00:00.000Z
PHYL,PGIM Active High Yield Bond ETF,0.056,2.47,1.86,0.25,-0.28,5.43,3y,5.43,35.66,2025-12-29T00:00:00.000Z
PICB,Invesco International Corporate Bond ETF,0,11.65,10.57,1.35,0.67,8.77,3y,8.77,23.96,2025-12-29T00:00:00.000Z
PLW,Invesco Exchange-Traded Fund Trust II - Invesco 1-30 Laddered Treasury ETF,-0.108,2.18,1.43,-1.43,-0.16,9.73,3y,9.73,27.63,2025-12-26T00:00:00.000Z
PMBS,PIMCO Mortgage-Backed Securities Active ETF,0.07,4.4,4,-0.12,0.71,5.11,1y,,49.97,2025-12-29T00:00:00.000Z
PMMF,iShares Prime Money Market ETF,0.01,0.16,0.16,-0.31,-0.33,1.14,1y,,100.2,2025-12-29T00:00:00.000Z
PSH,PGIM Short Duration High Yield Fund,0.089,0.84,0.22,0.06,-0.4,4.35,1y,,50.6,2025-12-29T00:00:00.000Z
PTRB,PGIM Total Return Bond ETF,0.118,3.32,3.07,-0.56,0.12,6.08,3y,6.08,42.33,2025-12-29T00:00:00.000Z
PULS,PGIM Ultra Short Bond ETF,0.02,0.48,0.1,0.02,-0.04,1.65,3y,1.65,49.8,2025-12-29T00:00:00.000Z
PWZ,Invesco California AMT-Free Municipal Bond ETF,0,-1.91,-1.71,-0.7,1,6.81,3y,6.81,24.16,2025-12-29T00:00:00.000Z
PZA,Invesco National AMT-Free Municipal Bond ETF,0.086,-2.11,-1.53,-0.43,0.52,6.34,3y,6.34,23.21,2025-12-29T00:00:00.000Z
QHY,WisdomTree U.S. High Yield Corporate Bond Fund,0.103,2.77,2.47,-0.08,-0.14,5.85,1y,,46.503,2025-12-29T00:00:00.000Z
QLTA,iShares AAA - A Rated Corporate Bond ETF,0.104,3.21,3.07,-0.94,-0.49,6.57,3y,6.57,48.28,2025-12-29T00:00:00.000Z
RAVI,FlexShares Ultra-Short Income Fund,0.04,0.19,0.32,-0.33,-0.38,1.42,3y,1.42,75.34,2025-12-29T00:00:00.000Z
REM,iShares Mortgage Real Estate ETF,-0.673,3.17,2.93,-3.28,1.33,22.92,3y,22.92,22.14,2025-12-29T00:00:00.000Z
RMOP,Rockefeller Opportunistic Municipal Bond ETF,0.171,-1.25,-1.13,-0.11,0.94,6.31,1y,,25.133,2025-12-29T00:00:00.000Z
SBND,Columbia Short Duration Bond ETF,-0.363,2.66,2.41,-0.34,-0.29,3.5,3y,3.5,18.925,2025-12-29T00:00:00.000Z
SCCR,Schwab Core Bond ETF,0.077,2.74,2.74,-0.77,-0.08,4.73,1y,,25.9,2025-12-29T00:00:00.000Z
SCHI,Schwab 5-10 Year Corporate Bond ETF,0.13,4.44,4.49,-0.6,-0.04,6.34,3y,6.34,23.06,2025-12-29T00:00:00.000Z
SCHJ,Schwab 1-5 Year Corporate Bond ETF,0.02,2.11,2.38,-0.3,-0.12,2.86,3y,2.86,24.905,2025-12-29T00:00:00.000Z
SCHO,Schwab Short-Term U.S. Treasury ETF,0.082,0.95,1.2,-0.29,-0.12,2.35,3y,2.35,24.37,2025-12-29T00:00:00.000Z
SCHP,Schwab U.S. TIPS ETF,0.151,2.87,2.91,-1.59,-1.45,5.5,3y,5.5,26.55,2025-12-29T00:00:00.000Z
SCHQ,Schwab Long-Term U.S. Treasury ETF,0.314,1.36,1.2,-2.41,-1.36,13.76,3y,13.76,31.94,2025-12-29T00:00:00.000Z
SCHR,Schwab Intermediate-Term U.S. Treasury ETF,0.119,3.54,3.84,-0.75,0.12,5.37,3y,5.37,25.14,2025-12-29T00:00:00.000Z
SCHZ,Schwab U.S. Aggregate Bond ETF,0.085,3.21,3.4,-0.76,-0.17,6.02,3y,6.02,23.44,2025-12-29T00:00:00.000Z
SCMB,Schwab Municipal Bond ETF,0.117,-0.16,0.55,-0.39,0.51,4.28,3y,4.28,25.75,2025-12-29T00:00:00.000Z
SCUS,Schwab Ultra-Short Income ETF,0.06,0.4,0.44,-0.2,-0.16,1.37,1y,,25.19,2025-12-29T00:00:00.000Z
SCYB,Schwab High Yield Bond ETF,0.038,0.8,1.19,-0.56,-1.12,5.62,3y,5.62,26.43,2025-12-29T00:00:00.000Z
SEIX,Virtus Seix Senior Loan ETF,-0.107,-2.53,-2.3,-0.24,-1.12,3.51,3y,3.51,23.325,2025-12-29T00:00:00.000Z
SGOV,iShares 0-3 Month Treasury Bond ETF,0.02,0.02,0.11,-0.28,-0.34,1.32,3y,1.32,100.36,2025-12-29T00:00:00.000Z
SHM,SPDR Nuveen Bloomberg Short Term Municipal Bond ETF,-0.021,1.03,1.08,-0.25,-0.54,2.24,3y,2.24,47.92,2025-12-29T00:00:00.000Z
SHV,iShares Short Treasury Bond ETF,0,-0.02,0.08,-0.28,-0.33,1.32,3y,1.32,110.11,2025-12-29T00:00:00.000Z
SHY,iShares 1-3 Year Treasury Bond ETF,0.048,1.06,1.3,-0.3,-0.11,2.28,3y,2.28,82.83,2025-12-29T00:00:00.000Z
SHYD,VanEck Short High Yield Municipal Fund,-0.435,1.73,1.37,-0.09,-0.04,5.4,3y,5.4,22.9,2025-12-29T00:00:00.000Z
SHYG,iShares 0-5 Year High Yield Corporate Bond ETF,0,0.4,0.66,-0.46,-1.08,5.19,3y,5.19,42.87,2025-12-29T00:00:00.000Z
SHYL,Xtrackers Short Duration High Yield Bond ETF,0.045,0.27,0.68,-0.51,-1.07,5.37,3y,5.37,44.95,2025-12-29T00:00:00.000Z
SIHY,Harbor Scientific Alpha High-Yield ETF,-0.131,-0.22,0.22,-1.23,-1.66,6.61,3y,6.61,45.62,2025-12-29T00:00:00.000Z
SIXO,AllianzIM U.S. Large Cap 6 Month Buffer10 Apr/Oct ETF,-0.043,7.69,6.43,1.28,2.85,7.94,3y,7.94,34.86,2025-12-29T00:00:00.000Z
SJB,ProShares Short High Yield,0,-5.28,-5.39,-1.1,-0.72,6.38,3y,6.38,15.26,2025-12-29T00:00:00.000Z
SJNK,SPDR Bloomberg Short Term High Yield Bond ETF,0,0,0.24,-0.59,-1.25,5.3,3y,5.3,25.3,2025-12-29T00:00:00.000Z
SKOR,FlexShares Credit-Scored U.S. Bond Index Fund,0.061,3.12,3.32,-0.49,-0.08,4.25,3y,4.25,49.2,2025-12-29T00:00:00.000Z
SLQD,iShares 0-5 Year Investment Grade Corporate Bond ETF,0.059,1.95,2.13,-0.31,-0.12,2.46,3y,2.46,50.73,2025-12-29T00:00:00.000Z
SMB,VanEck Short Muni ETF,-0.23,1.52,1.52,-0.06,-0.29,2.44,3y,2.44,17.36,2025-12-29T00:00:00.000Z
SMBS,Schwab Mortgage-Backed Securities ETF,0.039,3.39,3.73,-0.58,0.23,5.13,1y,,25.75,2025-12-29T00:00:00.000Z
SMMU,PIMCO Short Term Municipal Bond Active ETF,0.04,1.44,1.28,0.06,0.02,1.9,3y,1.9,50.56,2025-12-29T00:00:00.000Z
SMTH,ALPS Smith Core Plus Bond ETF,0.134,2.57,2.75,-0.63,-0.02,4.59,1y,,26.135,2025-12-29T00:00:00.000Z
SPAB,SPDR Portfolio Aggregate Bond ETF,0.078,3.24,3.4,-0.88,-0.19,5.86,3y,5.86,25.82,2025-12-29T00:00:00.000Z
SPBO,SPDR Portfolio Corporate Bond ETF,0.068,2.83,2.72,-0.98,-0.64,6.68,3y,6.68,29.44,2025-12-29T00:00:00.000Z
SPHY,SPDR Portfolio High Yield Bond ETF,0.042,0.64,0.94,-0.59,-1.13,6,3y,6,23.68,2025-12-29T00:00:00.000Z
SPIB,SPDR Portfolio Intermediate Term Corporate Bond ETF,0.03,3.39,3.51,-0.5,-0.03,4.26,3y,4.26,33.87,2025-12-29T00:00:00.000Z
SPIP,SPDR Portfolio TIPS ETF,0.077,2.6,2.6,-1.33,-1.22,6.05,3y,6.05,26,2025-12-29T00:00:00.000Z
SPLB,SPDR Portfolio Long Term Corporate Bond ETF,0.176,2.34,1.74,-1.85,-1.73,11.81,3y,11.81,22.76,2025-12-29T00:00:00.000Z
SPMB,SPDR Portfolio Mortgage Backed Bond ETF,0.045,4.27,4.71,-0.84,0.04,6.96,3y,6.96,22.46,2025-12-29T00:00:00.000Z
SPSB,SPDR Portfolio Short Term Corporate Bond ETF,0,1.17,1.34,-0.33,-0.2,2.22,3y,2.22,30.2,2025-12-29T00:00:00.000Z
SPSK,SP Funds Dow Jones Global Sukuk ETF,-0.381,2.58,1.35,-1.64,-1.51,6.3,3y,6.3,18.28,2025-12-29T00:00:00.000Z
SPTI,SPDR Portfolio Intermediate Term Treasury ETF,0.069,3.58,3.92,-0.79,0.03,5.38,3y,5.38,28.9,2025-12-29T00:00:00.000Z
SPTL,SPDR Portfolio Long Term Treasury ETF,0.338,1.83,1.6,-2.41,-1.19,13.8,3y,13.8,26.68,2025-12-29T00:00:00.000Z
SPTS,SPDR Portfolio Short Term Treasury ETF,0.103,1.07,1.35,-0.27,-0.1,2.32,3y,2.32,29.28,2025-12-29T00:00:00.000Z
SRLN,SPDR Blackstone Senior Loan ETF,0.049,-1.25,-1.03,-0.48,-0.82,3.89,3y,3.89,41.23,2025-12-29T00:00:00.000Z
STIP,iShares 0-5 Year TIPS Bond ETF,0.039,1.74,1.99,-0.68,-0.9,2.58,3y,2.58,102.41,2025-12-29T00:00:00.000Z
STOT,SPDR DoubleLine Short Duration Total Return Tactical ETF,0.021,0.92,1.05,-0.52,-0.17,2.09,3y,2.09,47.27,2025-12-29T00:00:00.000Z
STPZ,PIMCO 1-5 Year U.S. TIPS Index Exchange-Traded Fund,0.093,2.85,3,-0.35,-0.59,2.93,3y,2.93,53.84,2025-12-29T00:00:00.000Z
SUB,iShares Short-Term National Muni Bond ETF,0.066,0.99,1.29,-0.06,-0.11,1.71,3y,1.71,106.63,2025-12-29T00:00:00.000Z
SUSB,iShares ESG Aware 1-5 Year USD Bond ETF,0.04,2.23,2.43,-0.32,-0.16,2.97,3y,2.97,25.25,2025-12-29T00:00:00.000Z
SUSC,iShares ESG Aware USD Corporate Bond ETF,0.043,3.24,3.24,-0.91,-0.51,6.6,3y,6.6,23.455,2025-12-29T00:00:00.000Z
SYFI,AB Short Duration High Yield ETF,0.108,1.06,0.92,0.17,-0.39,5.19,1y,,36.11,2025-12-29T00:00:00.000Z
TAFI,"AB Active ETFs, Inc. AB Tax-Aware Short Duration Municipal ETF",0.04,1.16,0.84,-0.04,-0.16,2.21,3y,2.21,25.27,2025-12-29T00:00:00.000Z
TAFM,AB Tax-Aware Intermediate Municipal ETF,0.067,1.03,0.97,-0.25,0.63,6.31,1y,,25.52,2025-12-29T00:00:00.000Z
TAGG,T. Rowe Price QM U.S. Bond ETF,0.116,2.96,3.44,-0.54,0.18,6.58,3y,6.58,43.135,2025-12-29T00:00:00.000Z
TAXF,American Century Diversified Municipal Bond ETF,0.079,0.24,0.76,-0.51,0.44,4.5,3y,4.5,50.44,2025-12-29T00:00:00.000Z
TBF,ProShares Short 20+ Year Treasury,-0.292,-2.89,-2.41,1.79,0.8,15.03,3y,15.03,23.87,2025-12-29T00:00:00.000Z
TBIL,US Treasury 3 Month Bill ETF,0.02,0.32,0.04,0.06,0.04,1.32,3y,1.32,50.02,2025-12-29T00:00:00.000Z
TBT,ProShares UltraShort 20+ Year Treasury,-0.611,-6.64,-5.61,4.24,1.64,29.98,3y,29.98,34.17,2025-12-29T00:00:00.000Z
TBUX,T. Rowe Price Ultra Short-Term Bond ETF,0.08,0.54,0.61,0.06,0.04,1.82,3y,1.82,49.84,2025-12-29T00:00:00.000Z
TCPB,Thrivent Core Plus Bond ETF,0.146,2.52,2.52,-0.74,-0.08,4.76,1y,,51.435,2025-12-29T00:00:00.000Z
TDTF,FlexShares iBoxx 5-Year Target Duration TIPS Index Fund,0.167,3.09,3.36,-1.19,-1.07,5.35,3y,5.35,24,2025-12-29T00:00:00.000Z
TDTT,FlexShares iBoxx 3-Year Target Duration TIPS Index Fund,0.042,1.78,2.04,-0.87,-1.11,3.56,3y,3.56,24.05,2025-12-29T00:00:00.000Z
TFI,SPDR Nuveen Bloomberg Municipal Bond ETF,0.066,0,0.4,-0.44,0.29,4.57,3y,4.57,45.7,2025-12-29T00:00:00.000Z
TFLO,iShares Treasury Floating Rate Bond ETF,0,-0.08,0.02,-0.3,-0.28,1.37,3y,1.37,50.44,2025-12-29T00:00:00.000Z
TFLR,T. Rowe Price Floating Rate ETF,-0.049,-0.76,-0.5,0.15,-0.17,4.35,3y,4.35,51.375,2025-12-29T00:00:00.000Z
TIP,iShares TIPS Bond ETF,0.091,3.22,3.29,-1.22,-0.99,5.57,3y,5.57,110.15,2025-12-29T00:00:00.000Z
TIPX,SPDR Bloomberg 1-10 Year TIPS ETF,0.052,3.19,3.52,-0.98,-0.88,4.27,3y,4.27,19.1,2025-12-29T00:00:00.000Z
TLH,iShares 10-20 Year Treasury Bond ETF,0.314,2.6,2.67,-2.06,-0.79,12.27,3y,12.27,102.31,2025-12-29T00:00:00.000Z
TLT,iShares 20+ Year Treasury Bond ETF,0.376,0.57,0.23,-2.84,-1.74,15.12,3y,15.12,88.07,2025-12-29T00:00:00.000Z
TMF,Direxion Daily 20+ Year Treasury Bull 3X Shares,0.998,-4.5,-5.71,-8.34,-5.16,44.44,3y,44.44,38.45,2025-12-29T00:00:00.000Z
TMV,Direxion Daily 20+ Year Treasury Bear 3X Shares,-0.989,-8.74,-7.45,7.49,3.71,44.88,3y,44.88,36.04,2025-12-29T00:00:00.000Z
TUSB,Thrivent Ultra Short Bond ETF,0.07,0.46,0.46,-0.07,-0.06,1.81,1y,,50.36,2025-12-29T00:00:00.000Z
TUSI,Touchstone Ultra Short Income Fund,0.039,0.43,0.08,0.39,0.39,1.79,3y,1.79,25.43,2025-12-29T00:00:00.000Z
TYA,Simplify Intermediate Term Treasury ETF,0.433,11.13,12.27,-2.61,0.47,19.76,3y,19.76,13.674,2025-12-29T00:00:00.000Z
TYD,Direxion Daily 7-10 Year Treasury Bull 3X Shares,0.429,9.56,10.27,-3.41,0.23,22.26,3y,22.26,25.78,2025-12-29T00:00:00.000Z
UBND,VictoryShares Core Plus Intermediate Bond Fund,0.159,2.92,3.28,-0.68,-0.14,5.51,3y,5.51,22.02,2025-12-29T00:00:00.000Z
UBT,ProShares Ultra 20+ Year Treasury,0.596,-0.65,-1.4,-5.59,-2.82,29.87,3y,29.87,16.89,2025-12-29T00:00:00.000Z
UCON,First Trust TCW Unconstrained Plus Bond ETF,0.119,2.23,2.65,-0.28,0,4.12,3y,4.12,25.2,2025-12-29T00:00:00.000Z
UITB,VictoryShares Core Intermediate Bond ETF,0.137,3.23,3.48,-0.8,-0.09,5.68,3y,5.68,47.475,2025-12-29T00:00:00.000Z
ULST,SPDR SSgA Ultra Short Term Bond ETF,0,0.25,0.35,-0.39,-0.44,1.66,3y,1.66,40.51,2025-12-29T00:00:00.000Z
USFR,WisdomTree Floating Rate Treasury Fund,0.02,-0.06,-0.32,0.06,0.08,1.4,3y,1.4,50.3,2025-12-29T00:00:00.000Z
USHY,iShares Broad USD High Yield Corporate Bond ETF,0.08,1.49,1.8,-0.52,-1.03,6.13,3y,6.13,37.41,2025-12-29T00:00:00.000Z
USIG,iShares Broad USD Investment Grade Corporate Bond ETF,0.077,3.32,3.26,-0.9,-0.52,6.31,3y,6.31,51.95,2025-12-29T00:00:00.000Z
USTB,VictoryShares Short-Term Bond ETF,0.098,1.34,1.54,-0.27,-0.26,2.45,3y,2.45,50.85,2025-12-29T00:00:00.000Z
UTEN,US Treasury 10 Year Note ETF,0.181,4.3,4.16,-0.94,0.4,7.93,3y,7.93,44.4,2025-12-29T00:00:00.000Z
UTWO,U.S. Treasury 2-Year Note ETF,0.031,1.33,1.24,0.05,0.3,2.38,3y,2.38,48.69,2025-12-29T00:00:00.000Z
UYLD,Angel Oak UltraShort Income Fund,0.029,0.59,0.2,0.08,-0.02,1.78,3y,1.78,51.345,2025-12-29T00:00:00.000Z
VCEB,Vanguard ESG U.S. Corporate Bond Fund,0.086,3.04,2.98,-0.91,-0.58,6.25,3y,6.25,63.855,2025-12-29T00:00:00.000Z
VCIT,Vanguard Intermediate-Term Corporate Bond Fund,0.107,4.7,4.64,-0.58,-0.06,6.2,3y,6.2,84.06,2025-12-29T00:00:00.000Z
VCLT,Vanguard Long-Term Corporate Bond Fund,0.131,2.22,1.72,-1.91,-1.76,11.86,3y,11.86,76.45,2025-12-29T00:00:00.000Z
VCRB,Vanguard Core Bond ETF,0.124,3.13,2.79,-1.03,-0.47,4.46,1y,,77.9572,2025-12-29T00:00:00.000Z
VCRPF,Vanguard USD Corporate Bond Fund,,,,,,,,,,2025-12-30T09:07:42.312Z
VCSH,Vanguard Short-Term Corporate Bond ETF,0.075,2.26,2.48,-0.36,-0.11,2.85,3y,2.85,79.79,2025-12-29T00:00:00.000Z
VGIT,Vanguard Intermediate-Term Treasury Fund,0.133,3.57,3.93,-0.76,0.08,5.36,3y,5.36,60.08,2025-12-29T00:00:00.000Z
VGLT,Vanguard Long-Term Treasury Fund,0.303,1.46,1.28,-2.5,-1.33,13.8,3y,13.8,56.22,2025-12-29T00:00:00.000Z
VGSH,Vanguard Short-Term Treasury Fund,0.034,0.98,1.24,-0.32,-0.14,2.29,3y,2.29,58.74,2025-12-29T00:00:00.000Z
VMBS,Vanguard Mortgage-Backed Securities Fund,0.042,4.13,4.38,-0.53,0.3,6.87,3y,6.87,47.15,2025-12-29T00:00:00.000Z
VNLA,Janus Henderson Short Duration Income ETF,0,0.43,0.57,-0.3,-0.3,1.63,3y,1.63,49.13,2025-12-29T00:00:00.000Z
VPLS,Vanguard Core-Plus Bond ETF,0.166,3.09,3.32,-1,-0.41,4.5,1y,,78.335,2025-12-29T00:00:00.000Z
VRIG,Invesco Variable Rate Investment Grade ETF,-0.02,-0.16,-0.02,0.02,0.02,2.05,3y,2.05,25.08,2025-12-29T00:00:00.000Z
VTC,Vanguard Total Corporate Bond Fund,0.081,2.92,2.86,-0.95,-0.62,6.54,3y,6.54,77.93,2025-12-29T00:00:00.000Z
VTEB,Vanguard Tax-Exempt Bond ETF,0.06,0.1,0.56,-0.57,0.4,4.22,3y,4.22,50.25,2025-12-29T00:00:00.000Z
VTES,Vanguard Short-Term Tax-Exempt Bond ETF,-0.02,1.08,1.35,-0.2,-0.46,1.89,3y,1.89,101.43,2025-12-29T00:00:00.000Z
VTIP,Vanguard Short-Term Inflation-Protected Securities Index Fund,0.04,2.08,2.34,-1.43,-2.29,2.97,3y,2.97,49.46,2025-12-29T00:00:00.000Z
VUSB,Vanguard Ultra-Short Bond ETF,0,0.42,0.57,-0.24,-0.27,1.56,3y,1.56,49.83,2025-12-29T00:00:00.000Z
VWOB,Vanguard Emerging Markets Government Bond Fund,0.133,6.84,6.59,-0.4,0.92,7.73,3y,7.73,67.65,2025-12-29T00:00:00.000Z
WFHY,WisdomTree Trust - WisdomTree U.S. High Yield Corporate Bond Fund,-0.543,2.66,2.3,0.04,0.12,8.37,3y,8.37,46.455,2025-12-26T00:00:00.000Z
WIP,SPDR FTSE International Government Inflation-Protected Bond ETF,-0.583,8.37,8.4,0.26,0.05,10.43,3y,10.43,39.23,2025-12-29T00:00:00.000Z
XBB,BondBloxx BB Rated USD High Yield Corporate Bond ETF,0,3.17,2.96,-0.01,0.01,5.9,3y,5.9,41.37,2025-12-29T00:00:00.000Z
XBIL,U.S. Treasury 6-Month Bill ETF,0,0.34,0.1,0.06,0.05,1.35,3y,1.35,50.21,2025-12-29T00:00:00.000Z
XCCC,BondBloxx CCC-Rated USD High Yield Corporate Bond ETF,0.013,-2.3,-2.31,0,-2.35,8.52,3y,8.52,38.365,2025-12-29T00:00:00.000Z
XEMD,BondBloxx JPM USD Emerging Markets 1-10 Year Bond ETF,0.165,7.06,6.67,0.34,2.31,6.28,3y,6.28,44.86,2025-12-29T00:00:00.000Z
XFIV,BondBloxx Bloomberg Five Year Target Duration US Treasury ETF,0.141,3.77,3.82,-0.48,0.38,5.55,3y,5.55,49.76,2025-12-29T00:00:00.000Z
XHLF,BondBloxx Bloomberg Six Month Target Duration US Treasury ETF,0.03,0.46,0.2,0.1,0,1.3,3y,1.3,50.41,2025-12-29T00:00:00.000Z
XMPT,VanEck CEF Municipal Income ETF,-0.138,0.28,1.4,-0.59,-0.46,8.64,3y,8.64,21.74,2025-12-29T00:00:00.000Z
XSVN,BondBloxx Bloomberg Seven Year Target Duration US Treasury ETF,0.206,4.54,4.33,-0.59,0.44,7.17,3y,7.17,48.4,2025-12-29T00:00:00.000Z
XTEN,BondBloxx Bloomberg Ten Year Target Duration US Treasury ETF,0.236,3.92,3.66,-1.27,-0.05,9.5,3y,9.5,46.64,2025-12-29T00:00:00.000Z
XTRE,BondBloxx Bloomberg Three Year Target Duration US Treasury ETF,0.076,2.51,2.54,-0.15,0.29,3.48,3y,3.48,49.965,2025-12-29T00:00:00.000Z
XTWO,BondBloxx Bloomberg Two Year Target Duration US Treasury ETF,0.071,1.14,1.05,-0.04,0.16,2.46,3y,2.46,49.63,2025-12-29T00:00:00.000Z
YEAR,AB Ultra Short Income ETF,0,0.6,0.29,0,0,1.79,3y,1.79,50.67,2025-12-29T00:00:00.000Z
YLD,Principal Active High Yield ETF,-0.758,-1.22,-2.29,-0.73,-2.27,6.27,3y,6.27,18.985,2025-12-29T00:00:00.000Z
ZNOV,INVESCO VICTORY SHORT-TERM BOND ETF,-0.064,6.19,5.97,0.39,1,3.67,1y,,26.695,2025-12-29T00:00:00.000Z
ZROZ,PIMCO 25+ Year Zero Coupon U.S. Treasury Index Exchange-Traded Fund,0.364,-3.63,-5.73,-4.23,-3.4,23.61,3y,23.61,66.14,2025-12-29T00:00:00.000Z