symbol,name,daily_change_pct,ytd_return_pct,one_year_return_pct,perf_1m_pct,perf_3m_pct,vol_pct,vol_window,vol_3y_pct,last_close,as_of
DFSI,Dimensional International Sustainability Core 1 ETF,0.701,3.19,31.4,4.46,8.02,13.94,3y,13.94,44.52,2026-01-22T00:00:00.000Z
DFSU,Dimensional US Sustainability Core 1 ETF,0.535,1.45,12.91,1.5,3.49,15.73,3y,15.73,44.17,2026-01-22T00:00:00.000Z
DFSV,Dimensional US Small Cap Value ETF,0.253,7.22,11.1,6.87,11.87,21.7,3y,21.7,35.62,2026-01-22T00:00:00.000Z
DFUS,Dimensional U.S. Equity Market ETF,0.548,1.24,14.34,1.55,3.08,15.25,3y,15.25,75.27,2026-01-22T00:00:00.000Z
DFUV,Dimensional US Marketwide Value ETF,0.328,3.99,13.72,5.31,9.13,14.99,3y,14.99,49,2026-01-22T00:00:00.000Z
DGRO,iShares Core Dividend Growth ETF,0.14,2.23,13.07,2.9,4.14,12.24,3y,12.24,71.36,2026-01-22T00:00:00.000Z
DGRS,WisdomTree U.S. SmallCap Quality Dividend Growth Fund,0.371,8.3,2.34,6.79,7.85,20.35,3y,20.35,54.14,2026-01-22T00:00:00.000Z
DGRW,WisdomTree U.S. Quality Dividend Growth Fund,0.276,1.15,9.14,1.54,1.75,12.7,3y,12.7,90.77,2026-01-22T00:00:00.000Z
DGS,WisdomTree Emerging Markets SmallCap Dividend Fund,1.063,5.46,24.29,6.61,7.36,13.67,3y,13.67,60.84,2026-01-22T00:00:00.000Z
DGT,SPDR Global Dow ETF,0.474,2.52,25.18,1.88,4.2,13.33,3y,13.33,171.67,2026-01-22T00:00:00.000Z
DHS,WisdomTree U.S. High Dividend Fund,-0.038,3.81,12.64,3.49,5.54,13.4,3y,13.4,106.31,2026-01-22T00:00:00.000Z
DIA,SPDR Dow Jones Industrial Average ETF Trust,0.589,2.08,12.18,2.61,5.22,13.31,3y,13.31,493.69,2026-01-22T00:00:00.000Z
DIG,ProShares Ultra Energy ETF,0.634,14.36,0.33,23.03,25.37,44.21,3y,44.21,42.85,2026-01-22T00:00:00.000Z
DIHP,Dimensional International High Profitability Portfolio,0.489,2.73,26.07,4.4,6.55,13.71,3y,13.71,32.88,2026-01-22T00:00:00.000Z
DISV,Dimensional International Small Cap Equity Fund,1.23,5.24,47.98,7.86,13.89,15.1,3y,15.1,40.34,2026-01-22T00:00:00.000Z
DIV,Global X SuperDividend U.S. ETF,-0.219,4.36,-2.31,4.72,6.12,13.5,3y,13.5,18.21,2026-01-22T00:00:00.000Z
DIVB,iShares Core Dividend ETF,0.441,2.21,10.79,2.63,4.5,13.68,3y,13.68,54.63,2026-01-22T00:00:00.000Z
DIVI,Franklin International Core Dividend Tilt Index ETF,0.672,2.64,29.96,4.74,7.01,14.47,3y,14.47,40.43,2026-01-22T00:00:00.000Z
DIVO,Amplify CWP Enhanced Dividend Income ETF,0.11,1.61,8.71,-0.35,1.34,10.93,3y,10.93,45.42,2026-01-22T00:00:00.000Z
DJD,Invesco Dow Jones Industrial Average Dividend ETF,0.426,2.9,12.55,2.94,5.61,12.28,3y,12.28,58.91,2026-01-22T00:00:00.000Z
DJIA,Global X Dow 30 Covered Call ETF,0.361,0.54,-2.8,-1.86,1.46,10.99,3y,10.99,22.21,2026-01-22T00:00:00.000Z
DJP,iPath Bloomberg Commodity Index Total Return ETN,0.123,8.31,20.28,9.65,13.52,14.62,3y,14.62,40.8,2026-01-22T00:00:00.000Z
DLN,WisdomTree U.S. LargeCap Dividend Fund,0.2,1.58,12.31,2.35,3.25,11.88,3y,11.88,89.98,2026-01-22T00:00:00.000Z
DLS,WisdomTree International SmallCap Dividend Fund,1.599,3.81,32.76,4.83,8.14,14.26,3y,14.26,84.49,2026-01-22T00:00:00.000Z
DMAX,iShares Large Cap Max Buffer December Fund,0.169,0.06,6.06,-0.95,0.52,3.86,1y,,26.695,2026-01-22T00:00:00.000Z
DMXF,iShares ESG Advanced MSCI EAFE Index Fund,0.577,2.75,16.7,3.89,0.99,15.57,3y,15.57,78.129,2026-01-22T00:00:00.000Z
DNL,WisdomTree Global ex-U.S. Quality Dividend Growth Fund,0.419,2.72,16.3,4.82,4.79,15.4,3y,15.4,43.1,2026-01-22T00:00:00.000Z
DOG,ProShares Short Dow30,-0.651,-1.93,-11,-3.29,-5.06,13.42,3y,13.42,22.9,2026-01-22T00:00:00.000Z
DOL,WisdomTree International LargeCap Dividend Fund,0.396,2.44,34.03,4.86,8.94,13.55,3y,13.55,68.37,2026-01-22T00:00:00.000Z
DON,WisdomTree U.S. MidCap Dividend Fund,-0.11,4.26,2.45,3.62,5.11,16.85,3y,16.85,54.32,2026-01-22T00:00:00.000Z
DOO,BRP Inc. Subordinate Voting Shares,1.485,12.17,99.6,12.31,62.05,39.44,3y,39.44,80.64,2026-01-22T00:00:00.000Z
DPST,Direxion Daily Regional Banks Bull 3X Shares,-0.527,21.21,-2.24,11.61,47.53,96.44,3y,96.44,124.66,2026-01-22T00:00:00.000Z
DRIP,Direxion Daily S&P Oil & Gas Exploration & Production Bear 2X Shares,0,-8.89,-14.61,-14.98,-17.55,56.36,3y,56.36,7.89,2026-01-22T00:00:00.000Z
DRIV,Global X Autonomous & Electric Vehicles ETF,1.074,9.97,39.33,12.31,14.87,24.19,3y,24.19,33.496,2026-01-22T00:00:00.000Z
DRN,Direxion Daily Real Estate Bull 3X Shares,-3.037,4.93,-15.34,7.71,-9.33,52.39,3y,52.39,8.94,2026-01-22T00:00:00.000Z
DRSK,Aptus Defined Risk ETF,0.035,-0.42,2.24,-1.46,-3.71,8.06,3y,8.06,28.3,2026-01-22T00:00:00.000Z
DRV,Direxion Daily Real Estate Bear 3X Shares,3.258,-5.58,-7.43,-8.78,6.64,52.58,3y,52.58,25.04,2026-01-22T00:00:00.000Z
DSI,iShares MSCI KLD 400 Social ETF,0.784,1.69,14.91,1.9,3.24,15.92,3y,15.92,131.09,2026-01-22T00:00:00.000Z
DSTL,Distillate U.S. Fundamental Stability & Value ETF,0.499,2.54,5.9,2.03,3.47,13.83,3y,13.83,60.45,2026-01-22T00:00:00.000Z
DTCR,Global X Data Center & Digital Infrastructure ETF,0.466,8.15,36.91,14.35,8.8,23.68,1y,,23.74,2026-01-22T00:00:00.000Z
DTD,WisdomTree U.S. Total Dividend Fund,0.138,1.88,11.15,2.51,3.58,12.33,3y,12.33,87.03,2026-01-22T00:00:00.000Z
DTH,WisdomTree International High Dividend Fund,0.761,2.02,37.03,3.35,8.99,13.99,3y,13.99,52.99,2026-01-22T00:00:00.000Z
DUHP,Dimensional US High Profitability ETF,0.523,0.89,10.34,0.84,1.03,13.77,3y,13.77,38.41,2026-01-22T00:00:00.000Z
DUSA,Davis Select U.S. Equity ETF,1.472,2.2,17.92,2.18,8.13,17.12,3y,17.12,52.38,2026-01-22T00:00:00.000Z
DUSL,Direxion Daily Industrials Bull 3X Shares,-1.802,13.53,22.37,18.81,6.41,48.16,3y,48.16,80.876,2026-01-22T00:00:00.000Z
DUST,Direxion Daily Gold Miners Index Bear 2X Shares,-7.429,-34.94,-91.25,-34.15,-57.14,66.72,3y,66.72,4.86,2026-01-22T00:00:00.000Z
DVY,iShares Select Dividend ETF,-0.168,4.27,9.24,4.82,5.22,14.77,3y,14.77,148.72,2026-01-22T00:00:00.000Z
DVYE,iShares Emerging Markets Dividend ETF,1.733,5.85,28.2,8.6,12.28,16.63,3y,16.63,33.46,2026-01-22T00:00:00.000Z
DWAS,Invesco Dorsey Wright SmallCap Momentum ETF,1.086,8.31,9.25,5.58,10.3,23.79,3y,23.79,104.24,2026-01-22T00:00:00.000Z
DWLD,Davis Select Worldwide ETF,0.558,-0.93,25.7,-0.68,4.93,18.21,3y,18.21,46.83,2026-01-22T00:00:00.000Z
DXD,ProShares UltraShort Dow30,-1.168,-3.95,-23.02,-5.53,-9.74,26.66,3y,26.66,19.46,2026-01-22T00:00:00.000Z
DXJ,WisdomTree Japan Hedged Equity Fund,0.402,6.69,41.7,6.99,16.41,19.98,3y,19.98,154.69,2026-01-22T00:00:00.000Z
DXJS,WisdomTree Japan Opportunities Fund,1.404,8.73,53.91,12.52,21.32,17.77,3y,17.77,51.2068,2026-01-21T00:00:00.000Z
DXUV,Dimensional US Vector Equity ETF,0.533,3.54,13.49,3.71,6.08,19.47,1y,,62.24,2026-01-22T00:00:00.000Z
DYNF,iShares U.S. Equity Factor Rotation Active ETF,0.53,-0.25,15.59,-0.03,2.17,15.88,3y,15.88,60.74,2026-01-22T00:00:00.000Z
EAGL,Eagle Capital Select Equity ETF,0.723,2.33,14.76,2.96,5.22,17.43,1y,,33.44,2026-01-22T00:00:00.000Z
ECH,iShares MSCI Chile ETF,2.168,14.39,75.86,17.48,37.85,22.6,3y,22.6,46.18,2026-01-22T00:00:00.000Z
EDC,Direxion Daily MSCI Emerging Markets Bull 3X Shares,2.197,12.78,122.21,28.21,26.17,48.67,3y,48.67,66.53,2026-01-22T00:00:00.000Z
EDIV,SPDR S&P Emerging Markets Dividend ETF,1.161,4.52,16.66,4.54,6.09,13.19,3y,13.19,40.96,2026-01-22T00:00:00.000Z
EDZ,Direxion Daily MSCI Emerging Markets Bear 3X Shares,-2.44,-12.28,-67.1,-23.78,-23.8,49.5,3y,49.5,28.79,2026-01-22T00:00:00.000Z
EELV,Invesco S&P Emerging Markets Low Volatility ETF,0.845,3.8,20.38,5.21,7.46,10.79,3y,10.79,28.65,2026-01-22T00:00:00.000Z
EEM,iShares MSCI Emerging Markets ETF,0.755,4.37,37.99,9.27,8.08,16.38,3y,16.38,58.7,2026-01-22T00:00:00.000Z
EEMA,iShares MSCI Emerging Markets Asia ETF,0.584,3.27,38,8.77,6.27,18.18,3y,18.18,99.98,2026-01-22T00:00:00.000Z
EEMS,iShares MSCI Emerging Markets Small-Cap ETF,1.161,3.47,22.85,6.45,3.78,14.26,3y,14.26,70.6,2026-01-22T00:00:00.000Z
EEMV,iShares MSCI Emerging Markets Minimum Volatility Factor ETF,0.586,3.26,14.97,4.99,3.18,10.23,3y,10.23,66.91,2026-01-22T00:00:00.000Z
EETH,ProShares Ether ETF,-2.808,-6.26,-43.34,-7.02,-40.71,78.57,1y,,36.69,2026-01-22T00:00:00.000Z
EFA,iShares MSCI EAFE ETF,0.394,2.45,26.92,4.15,5.11,14.57,3y,14.57,99.42,2026-01-22T00:00:00.000Z
EFAA,Invesco MSCI EAFE Income Advantage ETF,0.539,1.03,14.75,1.64,3.37,12.89,1y,,54.985,2026-01-22T00:00:00.000Z
EFAV,iShares MSCI EAFE Min Volatility Factor ETF,0.207,0.76,21.75,1.64,2.58,10.82,3y,10.82,87.32,2026-01-22T00:00:00.000Z
EFG,iShares MSCI EAFE Growth ETF,0.329,3.25,18.05,4.83,1.97,15.6,3y,15.6,118.91,2026-01-22T00:00:00.000Z
EFIV,SPDR S&P 500 ESG ETF,0.586,0.75,15.13,0.97,4.4,14.93,3y,14.93,66.89,2026-01-22T00:00:00.000Z
EFV,iShares MSCI EAFE Value ETF,0.451,1.9,35.71,3.8,8.04,14.59,3y,14.59,73.53,2026-01-22T00:00:00.000Z
EGGY,NestYield Dynamic Income ETF,0.818,1.69,-10.04,-1.22,-10.03,26.78,1y,,35.75,2026-01-22T00:00:00.000Z
EIDO,iShares MSCI Indonesia ETF,0.581,1.28,1.93,2.53,4.84,19.29,3y,19.29,19.05,2026-01-22T00:00:00.000Z
EIPI,FT Energy Income Partners Enhanced Income ETF,0.292,2.59,-1.01,5.64,4.99,14.94,1y,,20.6,2026-01-22T00:00:00.000Z
EIS,iShares MSCI Israel ETF,0.572,5.2,42.73,5.96,19.36,20.77,3y,20.77,117.82,2026-01-22T00:00:00.000Z
EMGF,iShares MSCI Emerging Markets Multifactor ETF,0.869,4.75,35.53,9.2,7.73,16.09,3y,16.09,62.115,2026-01-22T00:00:00.000Z
EMLP,First Trust North American Energy Infrastructure Fund,0.051,3.09,2.95,5.12,3.49,13.26,3y,13.26,39.41,2026-01-22T00:00:00.000Z
EMQQ,EMQQ The Emerging Markets Internet & Ecommerce ETF,1.534,-2.37,15.7,-2.63,-9.26,24.07,3y,24.07,40.38,2026-01-22T00:00:00.000Z
EMXC,iShares MSCI Emerging Markets ex China ETF,0.936,5.83,38.56,11.59,11.59,14.98,3y,14.98,78.76,2026-01-22T00:00:00.000Z
ENFR,Alerian Energy Infrastructure ETF,1.265,3.47,-3.84,6.63,7.4,16.53,3y,16.53,32.81,2026-01-22T00:00:00.000Z
ENTR,ERShares Private-Public Crossover ETF,1.446,-1.65,4.91,-3.2,-6.12,23.54,3y,23.54,19.64,2026-01-22T00:00:00.000Z
EPHE,iShares MSCI Philippines ETF,0.305,4.15,6.29,6.85,4.94,17.2,3y,17.2,26.35,2026-01-22T00:00:00.000Z
EPI,WisdomTree India Earnings Fund,0.589,-5.1,1.32,-3.5,-3.87,14.73,3y,14.73,44.43,2026-01-22T00:00:00.000Z
EPOL,iShares MSCI Poland ETF,3.071,2.79,63.06,7.13,12.57,26.77,3y,26.77,37.26,2026-01-22T00:00:00.000Z
EPP,iShares MSCI Pacific ex Japan ETF,1.1,2.4,16.48,4.55,1.75,16.7,3y,16.7,52.38,2026-01-22T00:00:00.000Z
EPS,WisdomTree U.S. LargeCap Fund,0.705,0.62,13.13,0.83,3.33,14.16,3y,14.16,71.42,2026-01-22T00:00:00.000Z
EPU,iShares MSCI Peru and Global Exposure ETF,1.364,18.55,111.07,21.07,40.51,21.19,3y,21.19,86.2,2026-01-22T00:00:00.000Z
EQAL,Invesco Russell 1000 Equal Weight ETF,0.435,4.26,9.67,4.34,5.75,15.58,3y,15.58,55.36,2026-01-22T00:00:00.000Z
EQL,Alps Equal Sector Weight ETF,0.188,2.64,10.37,3.06,3.55,12.75,3y,12.75,47.88,2026-01-22T00:00:00.000Z
EQWL,Invesco S&P 100 Equal Weight ETF,0.415,2.08,14.4,2.01,3.65,13.27,3y,13.27,120.89,2026-01-22T00:00:00.000Z
EQWM,Invesco S&P MidCap Quality ETF,1.738,4.82,6.73,5.08,4.94,19.08,3y,19.08,108.9,2026-01-21T00:00:00.000Z
ERX,Direxion Daily Energy Bull 2X Shares,0.94,14.39,1.09,23.63,26.16,44.28,3y,44.28,66.55,2026-01-22T00:00:00.000Z
ERY,Direxion Daily Energy Bear 2X Shares,-0.661,-13.42,-22.44,-20.65,-23.27,43.68,3y,43.68,16.52,2026-01-22T00:00:00.000Z
ESGD,iShares ESG Aware MSCI EAFE ETF,0.459,2.51,25.08,4.22,4.62,14.66,3y,14.66,98.51,2026-01-22T00:00:00.000Z
ESGE,iShares ESG Aware MSCI Emerging Markets ETF,0.746,4.01,38.76,8.64,7.46,16.63,3y,16.63,47.26,2026-01-22T00:00:00.000Z
ESGU,iShares ESG Aware MSCI USA ETF,0.69,0.72,13.07,0.98,2.27,15.3,3y,15.3,150.27,2026-01-22T00:00:00.000Z
ESGV,Vanguard ESG U.S. Stock ETF,0.737,0.57,12.96,0.69,1.92,16.11,3y,16.11,121.73,2026-01-22T00:00:00.000Z
ESML,iShares ESG Aware MSCI USA Small-Cap ETF,0.504,7.16,13.27,6.93,9.41,19.88,3y,19.88,49.86,2026-01-22T00:00:00.000Z
ESPO,VanEck Video Gaming and eSports ETF,0.407,-1.41,22.39,-1.82,-11.15,21.14,3y,21.14,103.54,2026-01-22T00:00:00.000Z
ETHD,ProShares UltraShort Ether ETF,6.158,8.04,-77.27,-1.19,29.3,151.25,1y,,48.1,2026-01-22T00:00:00.000Z
ETHT,ProShares Ultra Ether ETF,-6.175,-14.35,-65.56,-8.17,-55.84,150.63,1y,,35.4,2026-01-22T00:00:00.000Z
ETHU,2X Ether ETF,-6.117,-14.05,-64.59,-7.32,-55.12,150.83,1y,,51.88,2026-01-22T00:00:00.000Z
ETHV,VanEck Ethereum ETF,-2.937,-5.87,-11.46,-1.96,-26.61,74.13,1y,,42.97,2026-01-22T00:00:00.000Z
ETHW,Bitwise Ethereum ETF,-3.09,-5.95,-11.61,-2.1,-26.72,74.16,1y,,21.01,2026-01-22T00:00:00.000Z
ETU,Trex 2x Long Ether ETU ETF,-6.271,-13.47,-62.33,-7.25,-54.93,150.19,1y,,13.75,2026-01-22T00:00:00.000Z
EUAD,STOXX Europe Aerospace & Defense ETF,-2.059,5.78,76.65,8.8,3.52,28.89,1y,,46.13,2026-01-22T00:00:00.000Z
EUFN,iShares MSCI Europe Financials ETF,0.751,0.11,51.25,2.15,13.57,18.72,3y,18.72,37.57,2026-01-22T00:00:00.000Z
EUSA,iShares MSCI USA Equal Weighted ETF,0.178,2.83,7.48,3.07,3.27,14.84,3y,14.84,107.02,2026-01-22T00:00:00.000Z
EUSC,WisdomTree European Opportunities Fund,1.64,1.8,36.08,4.24,8.21,14.52,3y,14.52,52.8578,2026-01-21T00:00:00.000Z
EVTR,Eaton Vance Total Return Fund,0.058,0.29,3.28,-0.04,-0.92,4.01,1y,,51.6,2026-01-22T00:00:00.000Z
EWA,iShares MSCI Australia ETF,1.386,2.27,9.55,3.52,0,18.35,3y,18.35,27.07,2026-01-22T00:00:00.000Z
EWC,iShares MSCI Canada ETF,0.327,1.86,33.88,2.83,10.42,15.1,3y,15.1,55.2,2026-01-22T00:00:00.000Z
EWD,iShares MSCI Sweden ETF,0.427,4.31,28.93,6.57,6.59,20.37,3y,20.37,51.74,2026-01-22T00:00:00.000Z
EWG,iShares MSCI Germany ETF,0.654,1.27,26.84,2.38,3.38,16.94,3y,16.94,43.1,2026-01-22T00:00:00.000Z
EWH,iShares MSCI Hong Kong ETF,0.177,3.52,37.13,4.77,6.24,20.95,3y,20.95,22.64,2026-01-22T00:00:00.000Z
EWI,iShares MSCI Italy ETF,0.606,-0.71,44.63,0.98,8.11,18.08,3y,18.08,54.77,2026-01-22T00:00:00.000Z
EWJ,iShares MSCI Japan ETF,0.094,4.34,26.19,5.47,3.26,17.93,3y,17.93,84.86,2026-01-22T00:00:00.000Z
EWJV,iShares MSCI Japan Value ETF,0,4.86,33.8,5.82,6.27,18.28,3y,18.28,41.84,2026-01-22T00:00:00.000Z
EWL,iShares MSCI Switzerland ETF,0.165,0.41,25.32,1.71,6.09,14.23,3y,14.23,60.59,2026-01-22T00:00:00.000Z
EWM,iShares MSCI Malaysia ETF,0.602,3.68,19.4,4.52,10.45,13.38,3y,13.38,28.43,2026-01-22T00:00:00.000Z
EWMC,Invesco S&P MidCap 400 Equal Weight ETF,2.354,3.26,6.52,3.15,7.14,20.45,3y,20.45,124.56,2026-01-21T00:00:00.000Z
EWN,iShares MSCI Netherlands ETF,0.975,5.97,32.64,9.77,6.5,19.39,3y,19.39,62.14,2026-01-22T00:00:00.000Z
EWO,iShares MSCI Austria ETF,2.145,3.8,69.63,6.51,21.88,18.56,3y,18.56,37.15,2026-01-22T00:00:00.000Z
EWP,iShares MSCI Spain ETF,0.641,0.4,69.93,2.75,11.6,18.29,3y,18.29,54.92,2026-01-22T00:00:00.000Z
EWQ,iShares MSCI France ETF,0.244,-0.33,18.31,0.56,0.4,16.96,3y,16.96,45.16,2026-01-22T00:00:00.000Z
EWS,iShares MSCI Singapore ETF,0.609,1.15,25.93,4.23,-0.21,17.02,3y,17.02,28.07,2026-01-22T00:00:00.000Z
EWT,iShares MSCI Taiwan ETF,1.186,5.37,28.51,10.72,3.75,22.97,3y,22.97,68.25,2026-01-22T00:00:00.000Z
EWU,iShares MSCI United Kingdom ETF,-0.199,1.37,28.11,3.51,7.41,14.25,3y,14.25,45.07,2026-01-22T00:00:00.000Z
EWW,iShares MSCI Mexico ETF,0.518,8.74,56.61,10.02,16.41,23.07,3y,23.07,75.75,2026-01-22T00:00:00.000Z
EWX,SPDR S&P Emerging Markets Small Cap ETF,0.827,2.97,18.04,3.77,2.06,14.35,3y,14.35,68.31,2026-01-22T00:00:00.000Z
EWY,iShares MSCI South Korea ETF,0.285,13.47,108.32,26.99,30.86,24.57,3y,24.57,115.99,2026-01-22T00:00:00.000Z
EWZ,iShares MSCI Brazil ETF,2.656,11.65,50.8,15.34,20.07,24.07,3y,24.07,35.95,2026-01-22T00:00:00.000Z
EWZS,iShares MSCI Brazil Small-Cap ETF,2.559,10.91,47.4,13,8.09,28.52,3y,28.52,14.43,2026-01-22T00:00:00.000Z
EXI,iShares Global Industrials ETF,-0.224,5.04,25.63,6.47,7.09,15.16,3y,15.16,186.72,2026-01-22T00:00:00.000Z
EYLD,Cambria Emerging Shareholder Yield Fund,0.977,6.6,30.78,9.45,9.05,16.05,3y,16.05,41.34,2026-01-22T00:00:00.000Z
EZA,iShares MSCI South Africa ETF,2.775,8.88,73.5,11.78,19.42,26.07,3y,26.07,75.56,2026-01-22T00:00:00.000Z
EZBC,Franklin Bitcoin ETF,-0.882,-0.42,-16.06,1.49,-20.22,41.83,1y,,51.69,2026-01-22T00:00:00.000Z
EZET,Franklin Ethereum ETF,-3.05,-6,-11.67,-2.11,-26.74,74.28,1y,,22.25,2026-01-22T00:00:00.000Z
EZM,WisdomTree U.S. MidCap Fund,-0.142,4.5,7.91,3.74,7.07,19.43,3y,19.43,70.38,2026-01-22T00:00:00.000Z
EZU,iShares MSCI Eurozone ETF,0.579,1.58,31.95,3.53,5.8,16.58,3y,16.58,66.04,2026-01-22T00:00:00.000Z
FAD,First Trust Multi Cap Growth Fund,0.622,4.46,17.28,4.38,5.22,18.51,3y,18.51,171.35,2026-01-22T00:00:00.000Z
FAS,Direxion Daily Financial Bull 3x Shares,2.003,-6.96,-7.99,-6.31,-4.26,49.85,3y,49.85,157.85,2026-01-22T00:00:00.000Z
FAZ,Direxion Daily Financial Bear 3x Shares,-1.842,6.13,-26.76,4.54,-6.03,50.05,3y,50.05,40.5,2026-01-22T00:00:00.000Z
FBCG,Fidelity Blue Chip Growth Fund,0.794,-0.62,14.63,0,2,22.76,3y,22.76,54.61,2026-01-22T00:00:00.000Z
FBL,Graniteshares 2x Long Meta ETF,11.239,-1.96,-14.33,-6.77,-27.77,72.19,3y,72.19,30.98,2026-01-22T00:00:00.000Z
FBOT,Fidelity Disruptive Automation ETF,0.339,5.42,19.83,7.31,6.69,20.39,3y,20.39,35.54,2026-01-22T00:00:00.000Z
FBT,First Trust NYSE Arca Biotechnology Index Fund,1.172,6.8,24.47,4.04,17,19.76,3y,19.76,221.86,2026-01-22T00:00:00.000Z
FBTC,Fidelity Wise Origin Bitcoin Index Fund,-0.841,-0.46,-16.13,1.49,-20.22,41.78,1y,,77.83,2026-01-22T00:00:00.000Z
FBY,YieldMax META Option Income Strategy ETF,3.498,-1.94,-36.59,-4.03,-20.87,29.31,3y,29.31,12.13,2026-01-22T00:00:00.000Z
FCG,First Trust Natural Gas ETF,-0.205,2.18,-8.84,5.78,9.93,27.81,3y,27.81,24.35,2026-01-22T00:00:00.000Z
FCOM,Fidelity MSCI Communication Services Index ETF,1.889,0.44,21.64,1.21,3.57,18.62,3y,18.62,73.36,2026-01-22T00:00:00.000Z
FDCF,Fidelity Disruptive Communications ETF,1.848,-1.46,20.83,0.61,-1.89,20.45,3y,20.45,47.727,2026-01-22T00:00:00.000Z
FDD,First Trust STOXX European Select Dividend Index Fund,0.73,0.79,52.55,4.18,13.69,16.54,3y,16.54,17.94,2026-01-22T00:00:00.000Z
FDEC,FT Cboe Vest U.S. Equity Buffer ETF - December,0.32,0.59,13.16,0.75,3.95,9.83,3y,9.83,51.464,2026-01-22T00:00:00.000Z
FDEM,Fidelity Emerging Markets Multi-Asset Fund,0.489,3.89,27.87,8.2,7.88,14.54,3y,14.54,32.85,2026-01-22T00:00:00.000Z
FDEV,Fidelity International Multi-Asset Fund,0.196,2.58,27.43,3.56,8.1,12.43,3y,12.43,35.75,2026-01-22T00:00:00.000Z
FDG,American Century Focused Dynamic Growth ETF,1.064,0.82,18.36,1.26,3.23,21.28,3y,21.28,127.58,2026-01-22T00:00:00.000Z
FDIG,Fidelity Crypto Industry & Digital Payments ETF,-0.687,4.38,17.69,3.44,-22.32,58.7,3y,58.7,42.24,2026-01-22T00:00:00.000Z
FDIS,Fidelity MSCI Consumer Discretionary Index ETF,0.89,3.84,4.44,1.32,2.96,21.13,3y,21.13,105.48,2026-01-22T00:00:00.000Z
FDL,First Trust Morningstar Dividend Leaders Index Fund,0.108,3.89,12.27,5.54,7.67,13.82,3y,13.82,46.49,2026-01-22T00:00:00.000Z
FDLO,Fidelity Low Volatility Factor ETF,0.387,1.09,9.57,1.4,2.48,11.24,3y,11.24,67.46,2026-01-22T00:00:00.000Z
FDMO,Fidelity Momentum Factor ETF,0.429,2.3,18.97,2.77,4.29,17.63,3y,17.63,86.419,2026-01-22T00:00:00.000Z
FDN,First Trust Dow Jones Internet Index Fund,1.915,-1.4,4.04,-3.15,-7.94,22.28,3y,22.28,261.84,2026-01-22T00:00:00.000Z
FDRR,Fidelity Dividend ETF for Rising Rates,0.521,0,16.66,1.32,3.57,13.9,3y,13.9,61.318,2026-01-22T00:00:00.000Z
FDT,First Trust Developed Markets ex-US Fund,0.522,7.85,56.64,9.99,15.93,15.77,3y,15.77,86.73,2026-01-22T00:00:00.000Z
FDTX,Fidelity Disruptive Technology ETF,1.267,-0.26,10.85,0.5,-1.74,24.73,3y,24.73,40.761,2026-01-22T00:00:00.000Z
FDV,Federated Hermes U.S. Strategic Dividend ETF,-0.302,3.59,7.8,3.56,2.91,12.88,3y,12.88,29.71,2026-01-22T00:00:00.000Z
FDVV,Fidelity High Dividend ETF,0.245,0.25,11.57,1.51,2.27,13.02,3y,13.02,57.18,2026-01-22T00:00:00.000Z
FEGE,First Eagle Global Equity ETF,1.243,5.07,34.18,5.32,10.36,14.62,1y,,48.88,2026-01-22T00:00:00.000Z
FELC,Fidelity Enhanced Large Cap Core ETF,0.631,0.1,13.12,0.45,2.11,18.35,1y,,38.28,2026-01-22T00:00:00.000Z
FELG,Fidelity Enhanced Large Cap Growth ETF,0.789,-1.75,13.18,-2.06,-1.16,23.23,1y,,40.87,2026-01-22T00:00:00.000Z
FELV,Fidelity Enhanced Large Cap Value ETF,0.434,2.72,12.72,3.7,6.4,16.26,1y,,35.9,2026-01-22T00:00:00.000Z
FENI,Fidelity Enhanced International ETF,0.528,2.73,33.42,4.59,7.3,16.83,1y,,38.05,2026-01-22T00:00:00.000Z
FENY,Fidelity MSCI Energy Index ETF,0.185,7.19,4.27,11.79,12.91,22.46,3y,22.46,27.12,2026-01-22T00:00:00.000Z
FEOE,First Eagle Overseas Equity ETF,0.648,4.77,42.68,5.71,10.36,14.32,1y,,51.22,2026-01-22T00:00:00.000Z
FEP,First Trust Europe AlphaDEX Fund,0.771,3.35,50.25,5.84,11.53,16.85,3y,16.85,56.21,2026-01-22T00:00:00.000Z
FEPI,Rex FANG Innovation Premium Income ETF,0.894,-0.02,-10.33,-2.74,-6,23.21,1y,,45.16,2026-01-22T00:00:00.000Z
FESM,Fidelity Enhanced Small Cap ETF,1.033,7.88,20.55,7.04,10.35,22.75,1y,,41.06,2026-01-22T00:00:00.000Z
FETH,Fidelity Ethereum Fund,-3.047,-5.94,-11.68,-2.01,-26.72,74.26,1y,,29.27,2026-01-22T00:00:00.000Z
FEX,First Trust Large Cap Core Fund A,0.21,3.15,13.67,4.04,5.88,14.35,3y,14.35,123.8,2026-01-22T00:00:00.000Z
FEZ,SPDR Euro Stoxx 50 ETF,0.545,1.51,28.7,2.69,5.5,17.23,3y,17.23,66.36,2026-01-22T00:00:00.000Z
FFLC,Fidelity Large Cap Core Fund,0.648,1.1,13.8,2.41,3.96,15.66,3y,15.66,54.33,2026-01-22T00:00:00.000Z
FFLG,Fidelity Fund Large Cap Growth ETF,0.706,-0.37,15.32,0.33,1.63,21.73,3y,21.73,29.96,2026-01-22T00:00:00.000Z
FFSM,Fidelity Small-Mid Cap Opportunities ETF,0.061,6.1,15.23,5.96,12.33,18.96,3y,18.96,33.06,2026-01-22T00:00:00.000Z
FFTY,Innovator IBD 50 ETF,1.893,9.64,23.17,8.15,-0.75,27.56,3y,27.56,38.22,2026-01-22T00:00:00.000Z
FGD,First Trust Dow Jones Global Select Dividend Index Fund,0.258,1.6,36.96,3.11,7.75,13.38,3y,13.38,31.13,2026-01-22T00:00:00.000Z
FGDL,Franklin Responsibly Sourced Gold ETF,1.282,13.14,78.83,13.1,19.3,16.62,3y,16.62,65.59,2026-01-22T00:00:00.000Z
FGLD,Franklin Responsibly Sourced Gold ETF,1.888,11.71,77.91,11.87,14.46,16.65,3y,16.65,64.76,2026-01-21T00:00:00.000Z
FGRO,Fidelity Growth Opportunities ETF,0.95,-1.06,17.13,1.4,1.78,21.79,3y,21.79,29.75,2026-01-21T00:00:00.000Z
FHEQ,Fidelity Hedged Equity ETF,0.39,-0.06,10.63,-0.06,0.57,11.18,1y,,30.9,2026-01-22T00:00:00.000Z
FHLC,Fidelity MSCI Health Care Index ETF,0.171,2.04,12.18,2.51,9.03,13.71,3y,13.71,76.08,2026-01-22T00:00:00.000Z
FIAT,YieldMax Short COIN Option Income Strategy ETF,0.074,0.19,-64.64,0.49,5.94,59.5,1y,,26.91,2026-01-22T00:00:00.000Z
FIBR,iShares Systematic Bond ETF,0.012,0.17,2.97,0.26,-0.91,4.99,3y,4.99,89.89,2026-01-22T00:00:00.000Z
FIDI,Fidelity International High Dividend ETF,0.452,1.83,31.87,3.57,8.35,13.98,3y,13.98,26.66,2026-01-22T00:00:00.000Z
FIDU,Fidelity MSCI Industrials Index ETF,-0.234,6.15,18.91,7.92,7.98,16.79,3y,16.79,89.35,2026-01-22T00:00:00.000Z
FINX,GLOBAL X FINTECH ETF,1.468,-1.53,-10.79,-4.26,-15.39,26.15,3y,26.15,29.03,2026-01-22T00:00:00.000Z
FISR,SPDR SSGA Fixed Income Sector Rotation ETF,0.077,0.33,2.21,0.39,-1.5,6.34,3y,6.34,25.95,2026-01-22T00:00:00.000Z
FIVA,Fidelity International Value Factor ETF,0.898,3.78,43.55,6.26,14.12,14.5,3y,14.5,35.96,2026-01-22T00:00:00.000Z
FIVG,Defiance 5G Next Gen Connectivity ETF,0.59,0.41,34.34,4.02,1.34,23.65,3y,23.65,65.0339,2026-01-21T00:00:00.000Z
FIW,First Trust Water ETF,0.494,5.81,8.53,5.5,0.12,16.4,3y,16.4,115.84,2026-01-22T00:00:00.000Z
FJAN,FT Vest U.S. Equity Buffer ETF FJAN,0.366,0.75,12.46,1.42,3.55,9.36,3y,9.36,52.17,2026-01-22T00:00:00.000Z
FLBR,Franklin FTSE Brazil ETF,2.362,12.51,45.47,13.69,17.52,23.95,3y,23.95,21.67,2026-01-22T00:00:00.000Z
FLCA,Franklin FTSE Canada ETF,0.549,1.97,31.66,3,10.45,14.87,3y,14.87,49.45,2026-01-22T00:00:00.000Z
FLCH,Franklin FTSE China ETF,0.444,0.81,35.7,3.76,-0.64,26.98,3y,26.98,24.86,2026-01-22T00:00:00.000Z
FLGB,Franklin FTSE United Kingdom ETF,-0.26,1.59,27.37,3.59,7.13,14.41,3y,14.41,34.58,2026-01-22T00:00:00.000Z
FLIN,Franklin FTSE India ETF,0.461,-5.08,1.45,-4.29,-5.3,13.7,3y,13.7,37.02,2026-01-22T00:00:00.000Z
FLJP,Franklin FTSE Japan ETF,0.166,4.26,26.26,5.14,2.43,17.51,3y,17.51,36.21,2026-01-22T00:00:00.000Z
FLKR,Franklin FTSE South Korea ETF,0.264,13.47,99.11,25.99,27.9,24,3y,24,37.91,2026-01-22T00:00:00.000Z
FLMX,Franklin FTSE Mexico ETF,0.65,9.32,57.32,10.55,17.26,22.33,3y,22.33,37.19,2026-01-22T00:00:00.000Z
FLQG,Franklin LibertyQ Global Equity ETF,1.045,0.07,15.48,0.62,2.57,15.29,3y,15.29,59.97,2026-01-21T00:00:00.000Z
FLQL,Franklin U.S. Large Cap Multisector Fund,0.341,1.17,16.27,1.47,3.09,15,3y,15,70.54,2026-01-22T00:00:00.000Z
FLQM,Franklin U.S. Mid Cap Multifactor Index Fund,0.017,2.39,1.96,1.78,2.37,14.96,3y,14.96,57.87,2026-01-22T00:00:00.000Z
FLTW,Franklin FTSE Taiwan ETF,1.086,6.48,36.4,11.77,8.17,21.45,3y,21.45,66.1,2026-01-22T00:00:00.000Z
FMAT,Fidelity MSCI Materials Index ETF,0.909,8.99,15.15,10.83,13.42,17.45,3y,17.45,58.82,2026-01-22T00:00:00.000Z
FMDE,Fidelity Enhanced Mid Cap ETF,0.533,2.95,8.93,3.29,4.72,19.02,1y,,37.71,2026-01-22T00:00:00.000Z
FMIL,Fidelity New Millennium ETF,0.973,0.45,15.39,2.36,4.31,15.75,3y,15.75,53.98,2026-01-21T00:00:00.000Z
FNCL,Fidelity MSCI Financials Index ETF,0.706,-1.26,6.9,-0.93,3.15,17.71,3y,17.71,77.03,2026-01-22T00:00:00.000Z
FNDA,Schwab Fundamental U.S. Small Company ETF,0.088,7.48,10.36,6.84,9.93,19.93,3y,19.93,34.2,2026-01-22T00:00:00.000Z
FNDB,Schwab Fundamental U.S. Broad Market ETF,0.325,3.55,15.06,4.44,6.98,13.73,3y,13.73,27.74,2026-01-22T00:00:00.000Z
FNDC,Schwab Fundamental International Small Company Index ETF,1.009,4.67,35.47,6.33,6.64,14.14,3y,14.14,47.05,2026-01-22T00:00:00.000Z
FNDE,Schwab Fundamental Emerging Markets Large Company Index ETF,1.234,4.75,31.82,8.43,6.4,16.48,3y,16.48,38.57,2026-01-22T00:00:00.000Z
FNDF,Schwab Fundamental International Large Company Index ETF,0.358,3.92,39.28,6.74,9.36,14.4,3y,14.4,47.69,2026-01-22T00:00:00.000Z
FNDX,Schwab Fundamental U.S. Large Company Index ETF,0.425,3.32,15.29,4.3,6.82,13.56,3y,13.56,28.35,2026-01-22T00:00:00.000Z
FNGB,MicroSectors FANG+ 3X Leveraged ETNs,0.046,-10.53,-10.91,-13.12,-23.98,81.44,1y,,21.59,2026-01-21T00:00:00.000Z
FNGD,MicroSectors FANG+ Index -3X Inverse Leveraged Exchange Traded Note,-2.985,6.56,-53.68,12.93,21.62,80.41,3y,80.41,5.85,2026-01-22T00:00:00.000Z
FNGG,Direxion Daily NYSE FANG+ Bull 2X Shares,1.958,-4.74,0.64,-8.57,-23.82,52.7,3y,52.7,190.08,2026-01-22T00:00:00.000Z
FNGO,MicroSectors FANG+ Index 2X Leveraged ETNs,1.998,-4.69,11.96,-8.56,-16.31,52.95,3y,52.95,107.638,2026-01-22T00:00:00.000Z
